"","Search","Date","Title","Company","Location","Description","Link","Work Model","Job_Type","Program","R","Python","SQL","Tableau","PowerBI","Azure","Excel","Talend","SAS","Spark","Qualtrics","Domo","Salesforce","SAP","Hadoop","Qlik","Looker","Zoho","Stata","Snowflake","ID"
"40","data architect",2022-08-24,"Microsoft Azure DevOps SME","PRICE WATERHOUSE COOPERS","Hybrid remote in Salt Lake City, UT 84111","* A career in our Cloud and Network Architecture practice, within Cloud Computing and Networking services, will provide you with the opportunity to focus on the joint business relationship between PwC and Google, HP, Microsoft, Oracle, SAP, and other cloud based platforms that bring new and innovative services to some of the largest companies. We help our clients adopt the cloud to transform Information Technology, scale and streamline operations and create new cloud based businesses through our strong alliances. You’ll be at the forefront of helping organisations around the globe adopt innovative technology solutions that optimise business processes or enable scalable technology. Our team helps organisations transform their network architecture and infrastructure to fundamentally change the role of Information Technology from an custodial asset to an orchestrator of business services. As part of the team, you’ll focus on the architecture of data centres, including the design and implementation of network architecture and information storage to optimise innovation and programme delivery for our clients.*  To really stand out and make us fit for the future in a constantly changing world, each and every one of us at PwC needs to be a purpose-led and values-driven leader at every level. To help us achieve this we have the PwC Professional; our global leadership development framework. It gives us a single set of expectations across our lines, geographies and career paths, and provides transparency on the skills we need as individuals to be successful and progress in our careers, now and in the future.* *  As a Manager, you'll work as part of a team of problem solvers, helping to solve complex business issues from strategy to execution. PwC Professional skills and responsibilities for this management level include but are not limited to:* *  Develop new skills outside of comfort zone.*   Act to resolve issues which prevent the team working effectively.*   Coach others, recognise their strengths, and encourage them to take ownership of their personal development.*   Analyse complex ideas or proposals and build a range of meaningful recommendations.*   Use multiple sources of information including broader stakeholder views to develop solutions and recommendations.*   Address sub-standard work or work that does not meet firm's/client's expectations.*   Use data and insights to inform conclusions and support decision-making.*   Develop a point of view on key global trends, and how they impact clients.*   Manage a variety of viewpoints to build consensus and create positive outcomes for all parties.*   Simplify complex messages, highlighting and summarising key points.*   Uphold the firm's code of ethics and business conduct.* *  Job Requirements and Preferences:Basic Qualifications:Minimum Degree Required: Bachelor DegreeMinimum Years of Experience: 7 year(s)Required Knowledge and Skills:*  Demonstrates extensive-level, abilities success with managing the identification and addressing of client needs by:*  Developing and delivering DevOps solutions to clients as a trusted advisor;*   Analyzing, executing, and streamlining DevOps practices and facilitating development processes;*   Selecting a migration approach to move workloads to Azure or architecting greenfield implementations;*   Executing Architecture Design Sessions (ADS), Solution Alignment Workshops (SAW), or Proofs of Concept (POC) Workshops;*   Scripting in PowerShell, Terraform, JSON, Python, etc.;*   Understanding of API management with best practices;*   Demonstrating Source Code Management (Git), CI/CD pipelines, Git and branching workflows such as GitFlow, Feature Based, Trunk Based, etc., Powershell, Python, and bash/zsh; and,*   Demonstrating working knowledge with Azure DevOps, AI + machine learning, Azure Kubernetes, DevSecOps and Terraform.* *  Preferred Qualifications:Certification(s) Preferred:*  AZ-300/AZ 303 Microsoft Azure Architect Technologies*   AZ-301/AZ 304 Microsoft Azure Architect Design*   AZ 400 Designing and Implementing Microsoft DevOps Solutions* *  Preferred Knowledge/Skills:*  Demonstrates extensive abilities and/or a proven record of success as a team leader by:*  Working configuration Management Tool Experience (Chef, Puppet, Salt, etc.);*   Building impactful technical relationships with executives and technical leads within customer organizations;*   Establishing a DevOps channel across the organization;*   Driving onboarding plans in conjunction with customers;*   Building technical and business credibility with senior executives;*   Developing Azure technical/operational readiness plans and technical documentation; and,*   Orchestrating Tool Experience (Jenkins, GitLabs, etc.).*  At PwC, our work model includes three ways of working: virtual, in-person, and flex (a hybrid of in-person and virtual). Visit the following link to learn more: https://pwc.to/ways-we-work.*  PwC does not intend to hire experienced or entry level job seekers who will need, now or in the future, PwC sponsorship through the H-1B lottery, except as set forth within the following policy: https://pwc.to/H-1B-Lottery-Policy.*  All qualified applicants will receive consideration for employment at PwC without regard to race; creed; color; religion; national origin; sex; age; disability; sexual orientation; gender identity or expression; genetic predisposition or carrier status; veteran, marital, or citizenship status; or any other status protected by law. PwC is proud to be an affirmative action and equal opportunity employer.*  For positions based in San Francisco, consideration of qualified candidates with arrest and conviction records will be in a manner consistent with the San Francisco Fair Chance Ordinance.*  For positions in Colorado, visit the following link for information related to Colorado's Equal Pay for Equal Work Act: https://pwc.to/coloradoadvisorymanager.*","https://www.indeed.com/rc/clk?jk=6e3dc4a07b7a4f6f&fccid=5e964c4afc56b180&vjs=3","Hybrid","Part-time","MSIS",0,1,0,0,0,1,0,0,0,0,0,0,0,1,0,0,0,0,0,0,"20bf141e3f72fd3ed664bfeeb4801e56"
"41","business intelligence analyst",2022-08-24,"Sales and Operations Analyst","Primary Talent Partners","Lehi, UT 84043","Primary Talent Partners has a 4 month contract opening for a Sales and Operations Analyst with a multinational computer software company located in Lehi, UT.*Description: **** is looking to hire a full-time contractor to join the *** Customer Solutions team based in Noida-India. We are looking for a Business Graduate with a couple of years of experience as a service sales/business analyst with a knowledge of professional service sales & operations. As *** continues to expand our business & strengthen our leading position within the digital experience domain we are further building our service sales and operation capacity to support this expansion. Working within *** service business you will operate and refine service operational processes to drive increased efficiency & service sales. Increase service pipeline hygiene and greater insight into the service pipeline status. Efficiently operate key service business processes, providing increased visibility and insight into the professional services pipeline & service needs for the benefit of our customers & continued growth of the *** business.*What you’ll do: *· Identify & communicate relevant service needs*· Support sales teams & promote the value of services*· Report on status of service operations activity & service pipeline*· Build dashboards to provide insights into service program adoption & health*· Achieve service targets attach rates & bookings*· Establish KPIs & measure new and existing service & operational performance*· Operate key service processes within APAC region leading to increased service sales*· Identify & implement improvements within service sales & operations*· Capture and share feedback on services offerings & operations*· Manage service operations to ensure that the status & trend on key metrics are understood & regularly reported.*· Manage service sales governance leading to increased compliance and address operational gaps.*What you need to succeed: *· Experience working within a technology professional services business*· Experience working within service sales and/or sales operations roles*· Proficient working with salesforce CRM & Microsoft Excel reporting and working with sales pipeline data*· Experience collating, summarizing & presenting data from multiple sources*· Experience supporting, preparing and delivering enablement webinars*· Highly organized & efficient*· Strong time management skills*Self-motivated*#PTPStandard*Job Type: Contract*Pay: $30.00 - $35.00 per hour*Schedule:*Monday to Friday*Education:*Bachelor's (Required)*Experience:*analysis: 1 year (Required)* service sales/operations: 1 year (Preferred)* Salesforce: 1 year (Preferred)*Work Location: One location","https://www.indeed.com/pagead/clk?mo=r&ad=-6NYlbfkN0DOCvLQenlXS7fh3AEEtPwhntZQnPW7UfiJ0vyM-Z38ZvlXuLrJoooXVJlodcpC3T_MlO-9QNJf4Ad3B9uudOy_O5OPJN-R2quw1BDNbbcJ4icsgAYPectjkbumbZKJsTdl1QkL4CYq0uFUS6PoJtS8TKEEQMlL8dVj_LjDDJacyaEk8j5FZboMFFlmdT6ErAUG-KdphxaIPT2V9HdmZobp-msSy-ILVRMm_RtGD2NW8PmZd5NJly7BHkRoWqmG8EHtP-mYin3LuEXUoSHxhzsJD-SJkHOjyCvCeXZ7MTP2iNw4IX3n98w1CC1m-ttX0X7Qno2jrlbJWDje6B1En8D7tUvRninlCzqdyzMaXY_UCXJX80X7_0y69k964cZl8N3fpAPdLtCh4X4Xh14t3wDyItr2ngVL4NAMFJGAPPNRa_zR-ihRujqYKHnEuJt9nlzOg7IgOVIlSug0GjEud6fkbX-kdlICvbBEA0kLAz3qw9Y0WYmh67Np7Bcf_ggfhGEUatHJsX_BuQdDPcay23UG0D51O8sz1OP62HSpRAk3VA==&xkcb=SoAr-_M3an_pixgNPr0JbzkdCdPP&p=13&fvj=1&vjs=3","On-site","Full-time","MSIS",0,0,0,0,0,0,1,0,0,0,0,0,1,0,0,0,0,0,0,0,"c73867c1fe3278228455e2d9cddfae96"
"42","cybersecurity manager",2022-08-24,"Senior Product Manager - Identity and Authentication (Remote...","Progressive Leasing","Draper, UT","* Job Description: *  Progressive Leasing is a leading provider of in-store and e-commerce lease-to-own solutions. As an almost 20+ year old FinTech company that has gone from start-up to industry leader, we know how to innovate, simplify, and value all people. We are a company founded on our grit and we are constantly looking to the future. As an ever-evolving group of entrepreneurs and technologists, we strive to do the right thing period in all aspects of our work. We are a subsidiary of PROG Holdings (NYSE: PRG), an exciting FinTech holding company, with three business segments including Progressive, Vive Financial, and Four, a Buy Now Pay Later (BNPL) platform.* *  We are currently hiring a Senior Product Manager to help grow our company and ensure our mission is achieved!* *  This role is a work from home position and can be performed remotely anywhere in the continental US or in one of our corporate locations in Utah or Arizona.* *  Employee Value Proposition (EVP): PROG is dedicated to providing people with opportunity; opportunity for inclusive collaboration, opportunity for innovation, and opportunity for development.* *  WE ARE: Prog Tech embodies the modernity and transformational vision that is core to our business evolution. As passionate and hungry technical experts, we join together on the mission of progressing through technology. We believe in taking pride in our engineering, in the relentless pursuit of daily progress, and to bring others with you in your march to the future. We continuously experiment, fail fast, and constantly deliver.* *  YOU ARE: A highly skilled technical product manager with a background in managing exceptional customer experience products. You have a passion for utilizing data to solve problems, innovate and create products that delight our customers. You will have strong foundational product management skills and are a self starter. You are a strong communicator and are able to align your designer, engineering team and stakeholders to deliver solutions on time.* *  YOUR DAY-TO-DAY:*  Demonstrated ability to solve difficult problems by bringing innovative solutions *  Use sound judgement to assess risks and provide well-structured, data-informed, and written narratives*   Proven ability to engage with engineers, designers, peers and company leaders in a constructive and collaborative relationship*   Develop and maintain a product roadmap by meeting with internal and external stakeholders including retailers and consumers*   Lead cross functional initiatives to identify business problems, mitigate risk, and validate proposed solutions through customer and market research*   Define use cases, features, requirements and acceptance criteria that articulate desired product functionality*   Establish in partnership with dependent teams an iterative release schedule that delivers value and features to customers, on time and as promised*   Manage stakeholder expectations and communicate timelines, blockers, successes, and failures in a clear manner*   Analyze performance of product features*   Establish buy-in at all levels of the organization and maintain strong communication channels with various functional areas*  YOU’LL BRING:*  6+ years' of experience in software Product Management*   Experience in customer acquisition products*   Ability to move from high-level strategy to detailed execution*   Exceptional communication skills: listening, speaking, collaborating, and proven ability to write/present effectively to a variety of audiences*   High-integrity and ambition to relentlessly pursue the best possible product and service*   Demonstrated ability to self-motivate, self-direct, and be flexible within a fast-paced environment*   Passion and desire for innovating exciting new products*   Bachelor's degree or equivalent work experience*  YOU MIGHT ALSO HAVE:*  Customer journey experience*   Mobile & web based product experience*   Risk product experience*   Experience working in a FinTech*  WE OFFER:*  Competitive Compensation; Elibible for STI*   Full Health Benefits; Medical/Dental/Vision/Life Insurance + Paid Parental Leave*   Company Matched 401k*   Paid Time Off + Paid Holidays + Paid Volunteer Hours*   Employee Resource Groups (Black Inclusion Group, Women in Leadership, PRIDE, Adelante)*   Employee Stock Purchase Program*   Tuition Reimbursement*   Charitable Gift Matching*   Job required equipment and services*  Progressive Leasing welcomes and encourages diversity in the workplace. We do not discriminate in any aspect of employment on the basis of race, color, religion, national origin, ancestry, gender, sexual orientation, gender identity and/or expression, age, veteran status, disability, or any other characteristic protected by federal, state, or local employment discrimination laws where Progressive Leasing does business.*","https://www.indeed.com/rc/clk?jk=127814c9cbc77a28&fccid=ca6dcd2772155db0&vjs=3","Remote","Part-time","MSCM",1,0,0,0,0,0,0,0,0,0,0,0,0,0,0,0,0,0,0,0,"c4c2eea2d9565a277b52640e4a68da74"
"43","network security engineer",2022-08-24,"IT MSP Helpdesk Engineer - 2+ yrs Experience Preferred","Protek","Sandy, UT 84070","Who are we: Protek is a growing MSP (Managed Service Provider) whose goal is to provide a superior, security-focused and complete IT support experience while providing opportunities to improve and expand our employee's lives. We provide our employees with the most Advanced Tools in our industry to accomplish this.*Experience in the IT sector is important but our Core Values are fundamental in how we operate These Core Values include: Positive Attitude, Dependable & Driven. Culture and a good work/life balance is important to us. We believe in moving people to where their skill set helps them to succeed.*We also offer an amazing Benefits package to our employees. We are looking for our next Rockstar and that could be you!*Position Description: Working on the Service Desk Team, you will start with remote and onsite customer support. Most of this support will be over the phone.After training you will work on site to provide hardware installs and outstanding customer service. You will be working and resolving issues as they are assigned to you.*Position Responsibilities: *Provide excellent remote Network, Server and PC support.*Travel onsite to preform hardware installs and client facing troubleshooting.*Maintaining time records, ticket tracking and other customer documentation in real-time.*Interfacing with 3rd Party Support Vendors.*Work after-hours, weekends and on-call as needed in a rotation with the other team members.*Other duties may be assigned to meet business needs.*Position Qualifications: Aligns with our Core Values (see above)2+ years of experience supporting Desktops and ServersGood understanding of NetworkingPeople PersonForward/Client FacingPrevious MSP Experience and Certifications are a BIG plus!*Additional Experience from IT Support, IT Helpdesk, IT Desktop Support or as an IT Technician is a plus.*Job Type: Full-time*Pay: $40,000.00 - $55,000.00 per year*Benefits:*401(k)* Dental insurance* Health insurance* Paid time off* Vision insurance*Schedule:*8 hour shift* Monday to Friday* On call*Supplemental pay types:*Bonus pay*Experience:*Help desk: 1 year (Preferred)* Windows: 1 year (Preferred)* Business-to-Business Technical Support Occupations: 1 year (Preferred)*Work Location: One location","https://www.indeed.com/company/Protek/jobs/IT-Msp-Helpdesk-Engineer-1ec9a298a8ff1278?fccid=b1e547be3660106a&vjs=3","Remote","Full-time","MSCM",0,0,0,0,0,0,1,0,0,0,0,0,0,0,0,0,0,0,0,0,"68165236dc479dd38a8875c8511715df"
"44","cloud engineer",2022-08-24,"Senior Engineer - Process Control","Rio Tinto","Salt Lake City, UT 84101 (People's Freeway area)+1 location","* Senior Engineer - Process Control*  Key role in a diverse and global organization*   Drive Control system improvements in a large integrated site*   Excellent opportunity for career development of technical expertise*   Role-based in Salt Lake City Utah*  About the role*  We are looking for a Senior Engineer - Process Control to drive process control improvements and support operations throughout our fully integrated copper facilities in Salt Lake City Utah.*  We are an open, connected international team of technical specialists using some of the most exciting data and tools on the planet. We are the world leader in automation and smart mining. We have technical development programmes that are industry-leading and recognise the unique nature of your role. These provide opportunities to grow your career through a dedicated technical path while being rewarded for your unique skills.*  Reporting to the Principal Process Control Engineer, you will be expected to:*  Support improvement projects including drawing reviews, control narratives, and code review and testing*   Mentor other engineers within the process control group*   Identify opportunities for optimization within the control systems*   Coordinate with operations and maintenance to minimize downtime*   Act as a control system resource to the rest of the technical department, assisting with troubleshooting process issues*   Drive control system changes through management of change process*   Implement changes in control logic within DCS and PLC systems*   Manage plant historian including adding and modifying points as necessary*   Tune PID loops and recommend instrumentation changes or repairs to improve control performance*   Manage/Support advanced control systems and their interfaces with main control system*   Use the Management of Change (MOC) process when needed.*   Conduct regular safety interactions*  About you*  To be successfully considered for this role, you will have:*  Knowledge and understanding of Instrumentation, DCS and PLC control systems*   Excellent verbal and written communication skills*   7-10 years relevant Process Control experience.*   Experience with DeltaV system configuration*   PI system administration experience would be a plus*   Ability to work in a multi-functional team and deliver measurable outcomes.*   Excellent verbal, written, and interpersonal skills to effectively communicate with employees at all levels of the organization.*  What we offer*  We are committed to providing our employees with a generous benefits package. Berecognized for your contribution, your thinking, your hard work, and go homeknowing you’ve helped the world progress, we provide:*  A safety-focused and inclusive working environment*   Advantageous salary package with annual cash incentive awards (STIP) for eligible employees*   Access to top-tier family-friendly health programs including medical, prescription drug, dental, vision, life insurance coverage, and various voluntary benefits.*   Excellent retirement plan including up to 6% defined company contribution; Generous 401k matching program*   Generous Rio Tinto employee share program, which allows you to purchase Rio Tinto Company shares.*   Comprehensive leave policies which cover all moments that matter in life: PTO (paid time off), paid holidays, and paid bereavement leave.*   A favorable child-caregiver leave program (Up to 100% salary top-up)*   Discount programs for leisure purposes and access to Virgin Pulse with incentives supporting your wellbeing*   Ongoing Employee Assistance Program (EAP) for you and your family; to help in addressing educational opportunities, addiction treatment, depression, stress, domestic issues, financial management, and legal concerns.*   Our team and industry experts are here to support and work with you to explore your learning potential and career goals*  About Rio Tinto*  Every idea, every innovation, every little thing the world calls ‘progress’ begins with  a first step, and someone willing to take it: explorers, inventors, entrepreneurs. Pioneers.*  For nearly 150 years, Rio Tinto has been a company of pioneers – generations of people spanning the globe, all with the grit and vision to produce materials essential to human progress.*  Our iron ore has shaped skylines from Shanghai to Sydney. Our aluminium – the world’s first to be certified “responsible” – helps planes fly and makes cars lighter. Our copper helps wind turbines power cities and our boron helps feed the world, and explore the universe.  Our diamonds help us celebrate the best parts of life.*  Where you’ll be working*  Our Kennecott mine is a world-class, fully integrated copper mining operation, including a concentrator, smelter and refinery, located just outside Salt Lake City, Utah, in the United States. We produce copper, precious metals including gold and silver, molybdenum and sulfuric acid. Kennecott has been mining and processing minerals from the rich ore body of the Bingham Canyon Mine since 1903 and is one of the tops producing mines in the world, comprising approximately 11 percent of U.S. annual copper production.*  Every Voice Matters*  We are committed to an inclusive environment where people feel comfortable being themselves. We want our people to feel that all voices are heard, all cultures respected and that a variety of perspectives are not only welcome – they are essential to our success. We treat each other fairly and with dignity regardless of race, gender, nationality, ethnic origin, religion, age, sexual orientation, or anything else that makes us different.*  At Rio Tinto, we particularly welcome and encourage applications from Indigenous Peoples, women, the LGBTQ+ community, mature workers, people with disabilities, and people from different cultural backgrounds.*  Equal Opportunity Employer M/F/D/V*  Rio Tinto participates in E-Verify to confirm work authorization. Please visit http://www.uscis.gov/ for more information.*","https://www.indeed.com/rc/clk?jk=5ddcb6332fa142c4&fccid=b1e4a7661b111d01&vjs=3","On-site","Part-time","MSIS",0,0,0,0,0,0,1,0,0,0,0,0,0,0,0,0,0,0,0,0,"1be4bfa7e474a4fe88f9a6c30dbffb6d"
