"","Search","Date","Title","Company","Location","Description","Link","Work Model","Job_Type","Program","R","Python","SQL","Tableau","PowerBI","Azure","Excel","Talend","SAS","Spark","Qualtrics","Domo","Salesforce","SAP","Hadoop","Qlik","Looker","Zoho","Stata","Snowflake","ID"
"32","business intelligence analyst",2022-05-01,"PwC Technology - Salesforce Functional Analyst","PRICE WATERHOUSE COOPERS","Remote in Salt Lake City, UT 84111","A career in Information Technology, within Internal Firm Services, will provide you with the opportunity to support our core business functions by deploying applications that enable our people to work more efficiently and deliver the highest levels of service to our clients. You’ll focus on managing the design and implementation of technology infrastructure within PwC, developing and enhancing both client and internal facing applications within PwC, and providing technology tools that help create a competitive advantage for the Firm to drive strategic business growth. Our Business Analysis - Practice Support team oversees Information Technology project lifecycles to help align our Information Technology solutions with our business needs by identifying and addressing gaps. As a part of the team, you’ll help optimise opportunity cost, document the right requirements to create solutions that meet user needs, improve efficiency by reducing rework, and shortening project timelines.*To really stand out and make us fit for the future in a constantly changing world, each and every one of us at PwC needs to be a purpose-led and values-driven leader at every level. To help us achieve this we have the PwC Professional; our global leadership development framework. It gives us a single set of expectations across our lines, geographies and career paths, and provides transparency on the skills we need as individuals to be successful and progress in our careers, now and in the future.*As a Senior Manager, you'll work as part of a team of problem solvers, helping to solve complex business issues from strategy to execution. PwC Professional skills and responsibilities for this management level include but are not limited to:*Encourage everyone to have a voice and invite opinion from all, including quieter members of the team.*Deal effectively with ambiguous and unstructured problems and situations.*Initiate open and candid coaching conversations at all levels.*Move easily between big picture thinking and managing relevant detail.*Anticipate stakeholder needs, and develop and discuss potential solutions, even before the stakeholder realises they are required.*Contribute technical knowledge in area of specialism.*Contribute to an environment where people and technology thrive together to accomplish more than they could apart.*Navigate the complexities of cross-border and/or diverse teams and engagements.*Initiate and lead open conversations with teams, clients and stakeholders to build trust.*Uphold the firm's code of ethics and business conduct.*Business Analysts apply analytical skills working with business and product owners to develop requirements and user stories stemming from product roadmaps. Analysts add value to the delivery team by working with the business and product owner to create clarity around business objectives through the development of and refinement of user stories. Our Business Analysts solve business problems working with delivery teams using Agile and scrum methodologies.*Job Requirements and Preferences:Basic Qualifications:Minimum Degree Required:*High School DiplomaMinimum Years of Experience:*6 year(s) of progressive roles managing IT system/software development and project management processesPreferred Qualifications:Degree Preferred:*Bachelor DegreePreferred Fields of Study:*Information Technology, Computer Systems Analysis, Management Information SystemsCertification(s) Preferred:*IIBA*Preferred Knowledge/Skills:*Demonstrates extensive knowledge of, and/or proven record of success in, roles as a Business Analyst working on software development projects, preferably for a global network of professional services firms, including the following areas:*Understanding of requirements from the business or stakeholder’s perspective and translating the requirements into the appropriate deliverables in an Agile/Scrum delivery model;*Understanding of the SDLC activities expected to deliver custom developed and packaged applications and Agile Requirements Methods; and,*Understanding of all phases of applications systems analysis and the SDLC development methodology and Business Process Modeling.*Demonstrates extensive ability, and/or proven record of success, in roles considering the business implications of applying technology to the current business environment and preparing requirements from which applications can be developed including in the following areas:*Analyzing business and user needs, establishing clear business value objectives, documenting requirements, and revising existing system logic or business process difficulties to select, build or modify large, complex or mission critical information systems to achieve business value;*Performing Senior Business Analyst responsibilities working on large and complex software development, infrastructure, SaaS and/or Cloud solutions;*Applying analytical skills to evaluate and document accurate business requirements and present these requirements in a manner that is concise, measurable and flexible enough to meet project and stakeholder needs;*Managing the quality and acceptance of vendor analysis and testing of SOW deliverables in a project setting;*Developing and guiding the documentation of requirements and test cases so that the requirements and test cases are unambiguous, aligned, consistent and not in contradiction with each other;*Working collaboratively within a delivery team at all levels including stakeholder management, with considerate ability to take ownership of tasks and complete them with minimal direct supervision; and,*Developing deep business and application domain knowledge for an assigned business portfolio and/ or LoS to aid in critically evaluating the balance of both business needs and user requests.*At PwC, our work model includes three ways of working: virtual, in-person, and flex (a hybrid of in-person and virtual). Visit the following link to learn more: https://pwc.to/ways-we-work.*PwC does not intend to hire experienced or entry level job seekers who will need, now or in the future, PwC sponsorship through the H-1B lottery, except as set forth within the following policy: https://pwc.to/H-1B-Lottery-Policy.*All qualified applicants will receive consideration for employment at PwC without regard to race; creed; color; religion; national origin; sex; age; disability; sexual orientation; gender identity or expression; genetic predisposition or carrier status; veteran, marital, or citizenship status; or any other status protected by law. PwC is proud to be an affirmative action and equal opportunity employer.*For positions based in San Francisco, consideration of qualified candidates with arrest and conviction records will be in a manner consistent with the San Francisco Fair Chance Ordinance.*For positions in Colorado, visit the following link for information related to Colorado's Equal Pay for Equal Work Act: https://pwc.to/coloradoifsseniormanager.*#LI-Remote","https://www.indeed.com/rc/clk?jk=9af8907e45a30dc7&fccid=5e964c4afc56b180&vjs=3","Hybrid","Part-time","MSIS",0,0,0,0,0,0,0,0,0,0,0,0,0,0,0,0,0,0,0,0,"ae6a39c478acef0cebe03c13c01e31c6"
"33","security consultant",2022-05-01,"Security Officer","Professional Security Consultants","Murray, UT 84107","* Professional Security Consultants (PSC) is conducting immediate interviews to fill open Full-time Security Officer positions at Fashion Place Mall in Murray UT. Candidates must be available to work weekends.* If interested, please apply online at pscsite.com, or apply in person at the following location:* Fashion Place Mall – 6191 S. State Street Murray, UT. 84107* JOB SUMMARY: * · Provide Superior Customer Service; A “People Person”, enthusiastic and friendly* · Watches for irregularities, such as security breaches, facility and safety hazards, and emergency situations; contacts emergency responders, such as police, fire, and/or ambulance personnel as required.* · Remains alert for the presence of unauthorized persons and/or security code violators; approaches suspicious person and/or notifies police as appropriate; may confront and detain violators, as required, until police arrive.* · Prepares routine, standardized reports.* · May provide specialized security in complex operational areas, requiring specific knowledge of the operating environment.* · Performs miscellaneous job-related duties as assigned.* JOB SKILLS AND RESPONSIBILITIES: * · Ability to communicate effectively with others both orally and in writing.* · Basic knowledge of computers.* · Ability to walk and climb stairs.* · Ability to see and hear accurately in both day and nighttime conditions.* · Ability to comprehend numerous policies, procedures, concepts and to be able to respond using discretion and interpretive judgment based on general and specific policies.* · Ability to retain knowledge, information, and directions on an ongoing basis and communicate effectively with others.* · Ability to maintain accurate records.* · Ability to react appropriately in emergency situations.* · Knowledge of cardiopulmonary resuscitation and first aid (Training Provided if needed)* · Knowledge of the geography of the site to which assigned.* · Skills in operating portable radio devices and phones.* JOB REQUIREMENTS: * · High School Diploma or equivalent required.* · Must be a minimum of 18 years of age.* · He/she must be customer service oriented, friendly, a “people person”.* · The successful candidate will pay close attention to detail.* · He/she must embody company values as a highly visible representative of the branch and set high standards for him/her and others.* · Remain free from illegal drug use.* Professional Security Consultants* Job Types: Full-time, Part-time* Pay: $14.00 per hour* Benefits:* Dental insurance*  Health insurance*  Vision insurance* Schedule:* 8 hour shift*  Holidays*  Night shift*  Weekend availability* Work Location: One location*","https://www.indeed.com/pagead/clk?mo=r&ad=-6NYlbfkN0A78UTtpxQC7aWAepHzNyFcc8DXRFktpS6pggetltgrAa6hfoLajk0erLd3Z2oYCf2TDlqXXcrFI11hSvjIhLKnSUYd3kcFSRUX6ujD1zp_NgC83HIlNNZ0KUn293HZcX5VGw18sHyjNdndxxA6X3WyiJP97DypJPvW9kHHs8GR_12UOyQx9LBh-EopAt_psTqxkZWNqyh6QwTuUC-0s0tQzjjVUq4mVqto-DoWu1_DbISxyX5pyCgetbCUg6JHPdmQtI4elNrn24vR6vKW-0297H5fzYCSymoGJLR9h33YFAu2iZPoEEyqnU1yfYaE4G1v71cnRDG4Arm_SxCAwGJscGHsH93_W7W_D2nQ_E2jNP7oHVqhXBQJys5SAW0n1Yr4W6YjNyHmINA0QInZJlDn3AsQJXRT0R-tzVruqh0O939VL2sgwMBtB6O9jQIEmiFeRAYj-IGDVIROHwWBX7qO12M2F2DKQ6OU2AhN8Mr0dXp2Kj1IKOnbftEiH2zY686dqpTx7cmWdw==&p=0&fvj=1&vjs=3","On-site","Full-time","MSCM",0,0,0,0,0,0,0,0,0,0,0,0,0,0,0,0,0,0,0,0,"8a7a6ccec231b212ad04cf8e929acda6"
"34","security manager",2022-05-01,"Security Manager","Purple Mattress","Grantsville, UT","* *  *   Purple is a digitally-native vertical brand with a mission to help people feel and live better through innovative comfort solutions. To us, comfort means more than great products, it means empowering every employee to feel comfortable being themselves. We believe your career at Purple will be a one-of-a-kind “Career in Comfort” because our workforce is one-of-a-kind. We are committed to a culture of collaboration where every voice is heard and understood. As an innovation company at our core, we believe a diversity workforce brings better insights, solutions and products and serves as the backbone to bettering our company. Join with us as we add to our team of exceptional individuals who will help us take over the world — one mattress at a time.*  *  *  *    Job Summary*   The Security & Loss Prevention Manager will organize and oversee all security operations of the company. Security personnel will be under their command while they develop and implement policies and procedures to maintain security standards.*   This person will demonstrate excellent surveillance and emergency response skills. They will need a strong commitment to security rules and knowledge of all hazards and threats to safety. Since they will have several people under their responsibility, they must also exhibit leadership skills. The goal is to create and preserve an environment where employees, visitors, and property are safe and well-protected.*   For this position, you will need to be able to pass an extensive background check.*  *  *    Job Description*  *  *  *   *    *      ESSENTIAL DUTIES AND RESPONSIBILITIES*    *   *   *    *      *        Develop and implement security policies, protocols, and procedures.*      *     *      *        Control budgets for security operations and monitor expenses.*      *     *      *        Recruit, train and supervise security officers across Purple’s multiple locations.*      *     *      *        Attend meetings with other managers to determine operational needs.*      *     *      *        Plan and coordinate security operations for specific events.*      *     *      *        Coordinate staff when responding to emergencies and alarms.*      *     *      *        Review reports on incidents and breaches.*      *     *      *        Investigate and resolve issues.*      *     *      *        Create reports for management on the security status.*      *     *      *        Analyze data to form proposals for improvements (e.g. implementation of new technology).*      *    *  *  *  *   *    *      EXPERIENCE REQUIREMENTS*    *   *   *    *      *        15 + years of Law Enforcement experience*      *     *      *        Prior corporate security experience*      *     *      *        Prior Investigative experience*      *     *      *        Prior Leadership experience*      *     *      *        Prior Training experience*      *     *      *        Strong computer skills: word, excel, and PowerPoint*      *     *      *        Strong attention to detail*      *     *      *        Prior experience working with surveillance systems is preferred.*      *     *      *        Understanding of budgeting and statistical data analysis*      *    *  *  *  *    BENEFITS AND PERKS*  *  *    *      Medical, Dental, Vision*    *   *    *      401(k) Match*    *   *    *      Generous PTO*    *   *    *      Market Money*    *   *    *      Earn a Mattress*    *   *    *      Purple Swag*    *   *    *      Amazing Purple Products*    *  *  *    WHY WORK AT PURPLE?*  *  *    *      Make your mark: We value innovative thinking. At Purple, you will be empowered to bring your ideas to life as we work together to improve people’s lives through comfort.*    *   *    *      Gain unique experience: Be a part of one of the fastest growing companies in Utah! The contributions you make will matter at Purple as the company continues to grow with you.*    *   *    *      Awesome culture: Join the tight-knit team at Purple and you can enjoy working alongside industry experts, making close friends, and annual employee appreciation events.*    *  *  *    Purple provides equal employment opportunities to all employees and applicants for employment and prohibits discrimination and harassment of any type without regard to race, color, religion, age, sex, national origin, disability status, genetics, protected veteran status, sexual orientation, gender identity or expression, or any other characteristic protected by federal, state or local laws.*  *  *  *    This policy applies to all terms and conditions of employment.*  * * *","https://www.indeed.com/rc/clk?jk=fb180f749660f3ed&fccid=737af9f566a4bb6e&vjs=3","On-site","Part-time","MSCM",0,0,0,0,0,0,1,0,0,0,0,0,0,0,0,0,0,0,0,0,"00cfdca6af336fa59b88e1d04cbf1931"
"35","cloud engineer",2022-05-01,"Senior Frontend Engineer","Recruiting From Scratch","Remote in Salt Lake City, UT 84103+1 location","* *  *   *    Who is Recruiting from Scratch:*   *   *     Recruiting from Scratch is a premier talent firm that focuses on placing the best product managers, software, and hardware talent at innovative companies. Our team is 100% remote and we work with teams across the United States to help them hire. We work with companies funded by the best investors including Sequoia Capital, Lightspeed Ventures, Tiger Global Management, A16Z, Accel, DFJ, and more. *   *   *   *    About Our Client: *   *   *    Our client is building an on-ramp to homeownership – one that's more flexible, more affordable, and an all-around better fit for today’s American family and it’s working. *    They’re looking to hire a senior engineering manager to join their rapidly scaling company. In this role, you'll oversee one of the engineering domains (operations, channel, consumer, capital) managing and executing on the roadmap, hiring and scaling the team, and becoming a real-estate tech expert. *    Some of the current products being developed include: *    *     Offers - streamlining the process to price and extend an offer on a home for a customer *      Inspections - automating (logistically) the collection, negotiation, and remediation of issues arising from a home inspection. *      Closings - writing software to automate and manage the home closing process to ensure timely closes*     *    Responsibilities: *    Be opinionated, open-minded, and respectful *     Guide the team to make practical and intelligent decisions *     Work across our stack of React, NodeJS (ES6), Postgres, RabbitMQ *     Partner with product, design and ops to design and build a simple and scalable product *     Become a domain expert in real-estate *    Work Experience: *    You have multiple years of software development experience *     You are comfortable writing new components and modifying existing ones *     You have experience and an understanding of the entire stack (front-end to database) *     You demonstrate a desire for readable, testable, and performant code *     You have empathy for your peers and our customers *    Perks: *    Competitive salary + equity *     Full benefits (medical, dental, vision, 401k, commuter) *     Diverse, smart, and witty co-workers *     They are a remote friendly company and all jobs are open to be remote if you choose not to be based in one of their HQ locations of SF or Denver *    *  *  *  *   *    Base Salary Range: $180,000 to $220,000*   *  * *","https://www.indeed.com/rc/clk?jk=726652e5f97ae3d8&fccid=09e02654c2f26bbd&vjs=3","Remote","Part-time","MSIS",0,0,0,0,0,0,0,0,0,0,0,0,0,0,0,0,0,0,0,0,"5020fdc5b66fdcf87445701b0f77597c"
"36","security consultant",2022-05-01,"EnerBank Systems Support Analyst III","Regions","Salt Lake City, UT 84106","* Thank you for your interest in a career at Regions. At Regions, we believe associates deserve more than just a job. We believe in offering performance-driven individuals a place where they can build a career --- a place to expect more opportunities. If you are focused on results, dedicated to quality, strength and integrity, and possess the drive to succeed, then we are your employer of choice. *  Regions is dedicated to taking appropriate steps to safeguard and protect private and personally identifiable information you submit. The information that you submit will be collected and reviewed by associates, consultants, and vendors of Regions in order to evaluate your qualifications and experience for job opportunities and will not be used for marketing purposes, sold, or shared outside of Regions unless required by law. Such information will be stored in accordance with regulatory requirements and in conjunction with Regions’ Retention Schedule for a minimum of three years. You may review, modify, or update your information by visiting and logging into the careers section of the system. * Job Description:*  At EnerBank, the Systems Support Analyst is responsible for the daily administrative support of desktop and telecommunication tools for internal users. *  EnerBank USA, a division of Regions Bank, engages in strategic partnerships with home-improvement manufacturers, distributors, franchisors, trade groups, and other organizations (with networks of home improvement contractors) to develop customized white-label loan programs to help them increase their sales as well as attract and retain top dealers. *  Primary Responsibilities * Responds to internal users’ IT requests quickly, efficiently and courteously * Administrates and maintains software and systems as assigned * Prepares and maintains the required procedural controls for audit for the IT department * Manages the relationship with required vendors * Works the IT ticketing queue, responding to and tracking user and system issues * Responds to internal requests related to processing issues, system capabilities and enhancements, and other special requests * Manages the daily functions of the systems, including user security maintenance, system performance monitoring, system access, or processing problems coordination and resolution * Communicates system capabilities and outages to appropriate personnel * Deploys, maintains, and supports Desktop and Telephony hardware and software * Performs system inventory, audits, and maintains procedural controls on IT Devices and software * Develops tools and procedures aimed at making system maintenance more effective and efficient * Assists with product evaluation including technical and budgetary analysis for new and existing products * Accumulates and prepares system data for management and audit reporting * Provide guidance to associates with less experience *  This position is exempt from timekeeping requirements under the Fair Labor Standards Act and is not eligible for overtime pay. *  Requirements * Bachelor’s degree in Computer Science, Information Technology, or related field * Five (5) years of system support or related experience * Experience with Exchange, Windows, MS Office, VOIP telephone, PC desktop hardware and remote user support *  Preferences * Experience with VM Horizon View, LAN/WAN management, and ShoreTel * Experience in banking or other heavily regulated industry *  Skills and Competencies * Ability to learn additional systems as needed * Ability to work independently and as part of a team * Demonstrated leadership capabilities * Excellent analytical problem-solving skills * Excellent customer service skills * Excellent written and verbal communication skills * In-depth knowledge of endpoints to include desktop, virtual desktop, telephony, ad endpoint software/tools *  Position Type Full time *  Benefits Information * Regions offers a benefits package that is flexible, comprehensive and recognizes that ""one size does not fit all"" for associates. Listed below is a synopsis of the benefits offered by Regions for informational purposes, which is not intended to be a complete summary of plan terms and conditions. * Paid Vacation/Sick Time * 401K with Company Match * Medical, Dental and Vision Benefits * Disability Benefits * Health Savings Account * Flexible Spending Account * Life Insurance * Parental Leave * Employee Assistance Program * Associate Volunteer Program *  Please note, benefits and plans may be changed, amended, or terminated with respect to all or any class of associate at any time. To learn more about Regions’ benefits, please click or copy the link below to your browser. *  https://www.regions.com/welcometour/benefits.rf *  Location Details Enerbank Salt Lake City * Location: Salt Lake City, Utah *  Bring Your Whole Self to Work *  We have a passion for creating an inclusive environment that promotes and values diversity of race, color, national origin, religion, age, sexual orientation, gender identity, disability, veteran status, genetic information, sex, pregnancy, and many other primary and secondary dimensions that make each of us unique as individuals and provide valuable perspective that makes us a better company and employer. More importantly, we recognize that creating a workplace where everyone, regardless of background, can do their best work is the right thing to do. * OFCCP Disclosure: Equal Opportunity Employer/Disabled/Veterans*","https://www.indeed.com/rc/clk?jk=10386093f052bd53&fccid=14b6efc0812e707a&vjs=3","Remote","Part-time","MSCM",0,0,0,0,0,0,1,0,0,0,0,0,0,0,0,0,0,0,0,0,"4ecee9939d897c8b51af7071b37f9a2d"
