"","Search","Date","Title","Company","Location","Description","Link","Work Model","Job_Type","Program","R","Python","SQL","Tableau","PowerBI","Azure","Excel","Talend","SAS","Spark","Qualtrics","Domo","Salesforce","SAP","Hadoop","Qlik","Looker","Zoho","Stata","Snowflake","ID"
"12","cloud engineer",2022-07-23,"Sr. Java Engineer - Hybrid Schedule","Capstone Consulting Inc.","West Valley City, UT 84120","**NO C2C accepted** *As a Sr. Software Engineer you will own the technical design for projects of moderate complexity, understand the trade-offs required in creating good software, effectively troubleshoot and debug software, and create solutions to complex tasks despite possible roadblocks. You will also participate in the initial creation and continual improvement of the team development, processes, and standards. As you develop in this position, you will be tasked with breaking large projects down into tasks and subtasks and delegating within your team. Your role will also provide mentorship to other software engineers via code reviews, code pairing, and leadership.*Join a company who has been named one of Utah’s Best Companies to Work For by Utah Business Magazine. A company who values community, people, health, and excellence! This position includes an EXTENSIVE benefits package including generous PTO and parental leave.*Additional Essential Functions: *In depth knowledge of systems that effectively and quickly debug moderately complex tasks throughout the codebase*Support their ideas with metrics and make data-centric decisions*Understands the business and how their code supports it*Work well with QA and can identify the risk associated with software and communicate it to the appropriate parties*Responsible for projects that encompass more than your own development*Qualifications/Knowledge, Skills, and Abilities Requirements: *5+ years of Sr. Software Engineer experience*1-3 years experience with Angular JS*Java and Spring; JavaScript; HTML / CSS / JSON; SQL / ORM*Bachelor’s degree in computer science preferred*Polyglot preferred*Understanding of responsive design preferred*Job Type: Full-time*Pay: $115,000.00 - $120,000.00 per year*Benefits:*401(k)* 401(k) matching* Dental insurance* Employee discount* Health insurance* Life insurance* Paid time off* Parental leave* Retirement plan* Tuition reimbursement* Vision insurance*Schedule:*Monday to Friday*Ability to commute/relocate:*West Valley City, UT 84120: Reliably commute or planning to relocate before starting work (Required)*Experience:*REST: 3 years (Required)* Java: 5 years (Required)* Spring: 3 years (Required)* JavaScript: 3 years (Required)* Angular JS: 1 year (Required)*Work Location: One location","https://www.indeed.com/pagead/clk?mo=r&ad=-6NYlbfkN0B96V2X-ktcizmBETSpagECMuEmqz18d3bUfhM7kAXLffEXIEXFlRom-NCYkHAu_Uo3cwKW-TTHvMfXQOZ8hDwoiVh-8OaQW588jDt6TIFvDlyyGedTY7rCx7G1CoZMnUJ6fM9DCUqcG2o6XpR0zul9e8bqSPOgJmmX2eotQPRgIKAtm7ZTj3IdlLHkgA7UiK-lR_jHUKDU2yjoT_IAYi6cUgPn7R3zBm3HEupCg9YJEkfWBcyzZnELKD7O_tfk2DTKguhI_oc_8u1YGv4f-Bee15Hynz6KzRoSKgLc1K1_HJAENz6rg20F29jKTUHmvcy1ieugyt3IXlusckvIpAxFN5Ft11xo6m00Rs5Y_W-8YtuC2N1hElZbL1Lp8tIlsV5Ll6AS34Oj5sMJwK4DJGah5sJ0q4NNYIxz1IiIASIorYaYAUvL2PMJSY_YU2GUl7o-yxmqNSNOG4DX8pvmlKw98Eint1X7VQYFUhLZbPMNRZGUwxZH_R62h0qbxhzOk7Kyxu1Uv4qQbw==&xkcb=SoDr-_M3bVWMIcAEUr0LbzkdCdPP&p=0&fvj=1&vjs=3","Hybrid","Full-time","MSIS",0,0,1,0,0,0,1,0,0,0,0,0,0,0,0,0,0,0,0,0,"dd5ab371fb3734cb30bc77cca5e6c893"
"13","cybersecurity analyst",2022-07-23,"Analyst II, Technology Risk & Cybersecurity","CardWorks","South Jordan, UT 84095","Merrick Bank employees share in our mission to delight our customers and empower underserved consumers to achieve their credit goals. In return, we delight our associates; ensuring they are noticed, heard, appreciated and understand the importance of their role(s). For over 20 years, our Guiding Principles of; doing the right thing, putting the customer first, and Earn, Learn, Have Fun (aka E.L.F.), have defined who we are as an Employer of Choice. Give Yourself Credit, Work at Merrick! * The SOC (“Security Operations Center”) Analyst II is to take lead on resolution or escalation of cases. These cases are logs or events that have transpired and need to be vetted to determine if a security event is occurring. The Analyst will then need to work closely with other members of the SOC to escalate cases. The Analyst will also determine if alarms and events are being reported properly to Tier I analysts. They implement, operate, monitor, and improve information security processes and systems that protect the Bank’s data, customers, and computer systems from business disruption, data/identity compromise, cyber fraud, and regulatory criticism. * This role focuses on security monitoring and response capabilities, verifying appropriate security event alerting is in-place, and is an analyst for our SIEM platform. They will also identify and help assess risk of issues and activities that may be indicators of vulnerability or control failures. *Essential Functions:*Key Monitoring & Response responsibilities include:*Security monitoring and response functions. * Identify, investigate, report, mitigate, and respond to cases and escalate if a security event. * Develop and tune log monitoring and alerting required for security incident response and regulatory expectations. * Engineering and operations of LogRythm SIEM platform. * Each Analyst is also responsible to be familiar with other security functions as assigned: *Security Control Engineering and Operations - Enable and protect business services with appropriate access, endpoint, network, data storage, and data loss prevention controls, including vulnerability and controls testing. * Security Risk & Program Management - Assess and advise technology and business groups by identifying, prioritizing, managing, and reporting security risk. * Application and Development Security - Define and participate in secure systems development lifecycle practices, including regular ongoing testing and evaluation of hosted systems and cloud infrastructure. *Compliance with Laws & Regulations:*Responsible for complying with all of the Bank’s internal control policies and procedures. * Responsible for understanding and complying with all laws and regulations to which the Bank is subject. * Responsible for communicating problems in operations, noncompliance with the code of conduct, noncompliance with laws and regulations, policy violations, or illegal acts. *Education and Experience:*Four (4) years of work experience in security monitoring and incident response, cybersecurity engineering, and network/systems administration required. * Bachelor’s degree in computer or cybersecurity-related studies, or equivalent broad experience required, four (4) years of related and equivalent experience accepted in lieu of education requirement. * GIAC, ISC2, or other recognized certifications are also desirable *Summary of Qualifications:*Experience as a security or IT system administrator preferred, including day-to-day operations, troubleshooting, access administration, updating/patching is preferred. * Familiarity highly-regulated industries, and specifically the banking industry (including FDIC regulations) is preferred. * Security project or team experience, preferably with experience in SOC functions. * Demonstrated history and ongoing effective performance with advanced security event monitoring, investigation, & response capabilities * Demonstrated ability in engineering, tuning, and operating a SIEM * Demonstrated skills with security concepts, defense-in-depth strategies, security tools, and protocols * Demonstrated ability to effectively communicate security issues/risks to people with technical and non-technical backgrounds * Outstanding troubleshooting and problem-solving skills * Demonstrated ability to troubleshoot complex security, hardware, and network systems * “White-hat” mentality, with a healthy sense of paranoia (security awareness and risk) * Positive, inquisitive, can-do attitude * Self-starter, requires minimal oversight to perform as expected, work well independently and as part of a team * Comfortably perform well under pressure, deliver to commitments on tight deadlines * Meticulous attention to detail * Passion for cybersecurity and technology trends, news, and hacking techniques * Who is Merrick Bank? Founded over 20 years ago, Merrick Bank is a FDIC-insured Utah Industrial Loan Bank that originates loans with the benefit of low-cost deposit funding. Merrick Bank had $4.5 billion in assets and $3.1 billion in deposits as of March 31, 2021. Merrick Bank operates four main business lines: Credit Cards, Recreation Lending, Personal Loans and Merchant Acquiring. * Our Valued Employees are provided generous benefits, including: *Competitive Pay * Benefits Package -Medical, Dental and Vision (plus much more) * 401(k) Plan with Company Match * Short & Long Term Disability * Group Life and AD&D Insurance * Paid Vacation, Holidays, and Personal Days * Employee Events, including Employee Appreciation Day, Holiday Party, etc. * Tuition Reimbursement Program * Candidates must have unrestricted authority to work in the United States without sponsorship. * Merrick Bank is an equal opportunity employer. We evaluate qualified applicants without regard to race, color, religion, sex, national origin, disability, veteran status, and other legally protected characteristic. *Merrick Bank will do a thorough background check for all hires. The EEOC Law poster is available here: http://www1.eeoc.gov/employers/poster.cfm Please go to our website www.merrickbank.com to apply and learn more about our company.","https://www.indeed.com/rc/clk?jk=c35a3069a12de6c3&fccid=4aeffbd8cbc7ce30&vjs=3","On-site","Part-time","MSCM",0,0,0,0,0,0,0,0,0,0,0,0,0,0,0,0,0,0,0,0,"944c3f2dd780edcf8f091bb58a3d1703"
"14","data integration engineer",2022-07-23,"Lead Android Mobile Engineer","Cricut","South Jordan, UT","* Company Description*  Cricut® makes smart cutting machines that work with an easy-to-use app, an ever-growing collection of materials, and crafting essentials to help you design and personalize almost anything — custom cards, unique apparel, everyday items, and so much more.*  Let’s make.*  Overview*  We believe everyone is born creative. We’re a diverse tapestry of thinkers, dreamers, givers, DIYers, handi-workers, artisans, and forever and always architects of things.*  At Cricut, we place the power of handmade into the hands of all. We give you beautiful, easy-to-master tools so you can make something unique, remarkable, perfect. We surround you with ideas, community, inspiration, and encouragement to take your creativity further than you ever imagined. And as a community, we celebrate the exhilarating act of making every single day.*  So, make that handcrafted card that feels like a hug. Design a shirt for fun, for family, or for a full-blown business. Craft with a passion or for a purpose. Make something big and bold, itsy-bitsy, amazingly ambitious, or just plain silly. Whatever you make, just make your heart out. Because here’s the remarkable truth: When we all make together, we make all things possible.*  Let’s make* ** Job Description*  Cricut is looking for a talented Lead Android Mobile Engineer to help us take our Android native apps to the next level. The position demands a candidate capable of doing high-quality work against technical and schedule challenges, while following strong software design and process principles. This is a great opportunity to play a key role in a dynamic team, working on cutting edge mobile technology. You are a driver of change and you have yet to meet a technological challenge you cannot resolve. You are dedicated to developing clean code that will help shape the Android mobile software which thrills our users.* *  Responsibilities*  Hands-on role where you will be working alongside the team*   Lead technical architecture, coding standards, and other team processes and policies*   Work with PM and UX on story refinement, articulate engineering concerns, and guide technical direction*   Work with cross functional teams on quarterly planning and plan work for the team*   Apply software engineering design patterns to develop well-structured, modular, performant application code*   Run Scrum ceremonies*   Work collaboratively with product manager to drive features and maintain the backlog*   Serve as a technical mentor and know how to delegate tasks to the team*   Perform code reviews, write unit and UI tests, and contribute to architectural planning and refactoring*   Collaborate with API teams on API design*   Drive software releases includes releasing apps to Google Play*  Eligibility*  B.S. or M.S. in Computer Science, Software Engineering, or comparable field with 5+ years relevant experience*  ** Qualifications*  Extensive experience developing Android mobile native applications in Kotlin/Java (Android 9.0 and above)*   Solid knowledge of Android UI design principles, best practices, and development life cycle*   Experience with at least one of these design architectures: MVVM, MVC, VIPER, Clean Architecture*   Expert in UI layouts and creating adaptive layouts for various hardware configurations*   Experience consuming RESTful JSON/XML web services, Open API standard (Swagger)*   Experience in testing high volume applications: unit test, integration test, Espresso Test, performance test*   Experience in dependency injection framework (e.g., Dagger, Hilt)*   Experience with Git and GitFlow*   Experience with Scrum/Agile methodologies*   Experience in mentoring junior members*   Experience in project management*   A solid grasp of fundamental algorithms, data structures, and design patterns*   Ability to prototype new features and redesign existing ones*   Excellent problem solving, debugging skills, critical thinking, and communication skills*   Ability to effectively articulate technical challenges and solutions*   Aptitude and desire to independently learn new technologies*   Working knowledge of Internationalization*  Preferred Skills*  Experience in working with offshore contractors*   Experience in continuous integration and delivery (e.g., Bitrise, GitHub Actions)*   Experience in animation and graphics*   Experience with Jetpack Navigation*   Experience with Android performance profiling tools and optimization techniques*   Experience with Google Firebase Analytics and Crashlytics*   Advanced Gradle experience*   Familiar with Jetpack Compose*  Additional Information*  Please attach your resume including links to your portfolio where applicable. If you want to show your super powers in other ways – include that information too. You can be sure that Cricut® is an employer who values individuality, equality and diversity, so tell us what you’re all about. If you are a Maker or a DIY enthusiast, whether you think you are a good one or not, we would love to hear about it when you send us your information!*  At Cricut®, we celebrate inclusion and diversity. Cricut is an equal opportunity employer and makes employment decisions based on merit. Cricut prohibits discrimination based on race, color, religion, sex, sexual identity, gender identity, marital status, veteran status, nationality, citizenship, age, disability, medical condition, pregnancy, or any other unlawful consideration. All your information will be kept confidential according to EEO guidelines. Cricut participates in E-Verify.*","https://www.indeed.com/rc/clk?jk=9bbdd5221820e819&fccid=52f763e4fcdaf1bd&vjs=3","On-site","Part-time","MSIS",0,0,0,0,0,0,1,0,0,0,0,0,0,0,0,0,0,0,0,0,"78eff1e5585a0b5a526aec1181159516"
"15","cybersecurity analyst",2022-07-23,"Cybersecurity Ransomware Readiness Reporting Analyst","Deloitte","Hybrid remote in Salt Lake City, UT 84111","* Do you thrive on developing creative and innovative insights to solve complex challenges? Want to work on next-generation, cutting-edge products and services that deliver outstanding value and that are global in vision and scope? Work with other experts in your field? Work for a world-class organization that provides an exceptional career experience with an inclusive and collaborative culture?*  Want to make an impact that matters? Consider Deloitte Global.*  Work you'll do:*  You will play a key role in ensuring consistent implementation of security controls and design principles are used across Deloitte globally, help understand where our data resides, and how it is protected. This is an individual contributor role within Deloitte Global (DTTL) which supports Deloitte by developing and driving global strategies, creating innovative solutions to transform businesses, and ensuring a consistent experience across our geographies. In this role you will not serve clients directly-instead, you will work with our 7,000+ professionals in 30+ countries, Responsibilities include:* Work with Cybersecurity, Global DTTL Infrastructure teams, and Deloitte member firms.*  Provide architectural guidance in the delivery of complex reports and dashboards.*  Proactively keep management informed of timeline risks, data risks, and changes in scope.*  Participate in global working groups related to ransomware protections and associated KPIs. * What you'll be part of - our Deloitte Global Culture:*  At Deloitte, we expect results. Incredible-tangible-results. And Deloitte Global professionals play a unique role in delivering those results. We reach across disciplines and borders to serve our global organization. We are the engine of Deloitte. We develop and implement global strategies and provide programs and services that unite our network. * In Deloitte Global, everyone has opportunities. We see the importance of your perspective and your ability to create value. We want you to fit in-with an inclusive culture, focus on work-life fit and well-being, and a supportive, connected environment; but we also want you to stand out-with opportunities to have a strategic impact, innovate, and take the risks necessary to make your mark. What you'll be part of-our Deloitte Global culture:*  At Deloitte, we expect results. Incredible-tangible-results. And Deloitte Global professionals play a unique role in delivering those results. We reach across disciplines and borders to serve our global organization. We are the engine of Deloitte. We develop and implement global strategies and provide programs and services that unite our network.*  In Deloitte Global, everyone has opportunities. We see the importance of your perspective and your ability to create value. We want you to fit in-with an inclusive culture, focus on work-life fit and well-being, and a supportive, connected environment; but we also want you to stand out-with opportunities to have a strategic impact, innovate, and take the risks necessary to make your mark.*  Who you'll work with:* *   Deloitte Technology works at the forefront of technology development and processes to support and protect Deloitte around the world. In this truly global environment, we operate not in ""what is"" but rather ""what can be"" to help Deloitte deliver and connect with its clients, its communities, and one another in ways not previously conceived. * Bachelor's degree or equivalent experience: degree in computer sciences, engineering, a technology-related field, or equivalent education-related experience preferred*  Demonstrated ability to work with a wide variety of teams and cultures to develop consensus recommendations*   Business acumen skills including strategic thinking, building internal and external relationships, leading teams and influencing people, and understanding financial and business performance.*   Experience presenting to business and technical leaders at all levels of the organization*   General security architecture knowledge*   Advanced skills specifically in the PowerBI application space, PowerBI which includes, PowerBI Premium, PowerBI Embedded, and PowerBI Desktop, particularly in the Microsoft Azure environment, to deliver enterprise level reporting consistent with industry best practices *  * How you'll grow:*  Deloitte Global inspires leaders at every level. We believe in investing in you, helping you embrace leadership opportunities at every step of your career, and helping you identify and hone your unique strengths. We encourage you to grow by providing formal and informal development programs, coaching and mentoring, and on-the-job challenges. We want you to ask questions, take chances, and explore the possible. * Benefits you'll receive:*  Deloitte's Total Rewards program reflects our continued commitment to lead from the front in everything we do-that's why we take pride in offering a comprehensive variety of programs and resources to support your health and well-being needs. We provide the benefits, competitive compensation, and recognition to help sustain your efforts in making an impact that matters. * Corporate citizenship:*  Deloitte is led by a purpose: to make an impact that matters. This purpose defines who we are and extends to relationships with our clients, our people, and our communities. We believe that business has the power to inspire and transform. We focus on education, giving, skill-based volunteerism, and leadership to help drive positive social impact in our communities. #LI-Hybrid Hybrid work, remote may be an option*","https://www.indeed.com/rc/clk?jk=97a37203ef130dac&fccid=9e215d88a6b33622&vjs=3","Hybrid","Part-time","MSCM",0,0,0,0,1,1,0,0,0,0,0,0,0,0,0,0,0,0,0,0,"48d63aaf294d80c19daecb96fe2901c3"
