"","Search","Date","Title","Company","Location","Description","Link","Work Model","Job_Type","Program","R","Python","SQL","Tableau","PowerBI","Azure","Excel","Talend","SAS","Spark","Qualtrics","Domo","Salesforce","SAP","Hadoop","Qlik","Looker","Zoho","Stata","Snowflake","ID"
"26","security systems engineer",2022-07-23,"Staff Cybersecurity Systems Engineer","Goldbelt, Inc.","Roy, UT 84067","Summary:*In this role, the Cybersecurity Systems Engineer (SE) architect’s system security requirements and the security layout/architecture to facilitate design, collaborating with engineers across disciplines throughout development. Additionally, the Cyber SE determines required security tools and functionality necessary to support requirements. The Cyber SE team is responsible for the security governance, risk management, and compliance of a system while it is being engineered for our customers.*Essential Job Functions:*Work within the Cybersecurity Engineering Group to provide technical decisions and guidance to enable timely, high quality product deliveries and flight test events that meet mission requirements.* Partner and collaborate with other program systems engineers across Integrated Product Teams to accomplish program requirements and meet mission objectives.* As a member of a team of specialized NGMS cybersecurity engineers, support the development and enhancement of Launch and Missile Defense systems.* Participate as part of an extended team of US government, and supplier cybersecurity practitioners across multiple program locations.* Ensure weapon system compliance with all contractually obligated cybersecurity standards and guidance, including but not limited to CNSSI 1253, DoD 8140, DoD 8510, and AFI 17-101.* Propose and design systems architecture changes with traceability to requirements.* Provide Cyber implementation guidance and oversight across technical teams.* Develop and document technical standard engineering processes and procedures as needed.* Participate in team reviews of technical requirements, design and implementation plans prior to deployment of computer systems, digital communications systems, networking devices, computer architectures, and computer security penetration tools and techniques.* Participate in cybersecurity assessment activities and review cybersecurity assessment methods, plans, procedures, and reports.* Provide input to program milestones and metrics, adhering to cybersecurity-relevant plans and schedules.* Identify problems and research technical solutions to resolve these problems.* Apply analytical and evaluative methods and techniques to issues or studies concerning the efficiency and effectiveness of Cyber Security implementation.* Solve complex problems across disciplines in an Agile, DevSecOps environment.*Necessary Skills and Knowledge:*Excellent communication (written and oral), negotiation, coordination and interpersonal skills. Proven collaboration with program managers and customer representatives to meet program objectives.* Ability to calmly negotiate challenging program requirements, strategies, and conflicting constraints among a large and diverse group of program stakeholders.* Knowledge of Cyber Security Engineering practices, network technologies, DoD system development life cycles and methodologies, and insight into information technology infrastructure management/monitoring and applications.*Minimum Qualifications:*Bachelor’s Degree in Cybersecurity, Software, or related STEM degree field and 14 years of related experience; 12 years of related experience with a Master’s degree; 9 years of related experience with a PhD; an additional 4 years of related experience may be considered in lieu of degree.* Certifications: Current CISSP or equivalent certification or greater; Ability to obtain, within 6 months or less of hire, DoD 8570 / AFMAN 17-1303 qualification at IASAE 3 level.* Clearance: Active Department of Defense (DoD) Top Secret Security Clearance and ability to obtain SCI and SAP accesses.*Preferred Qualifications:*IASAE level 3 certified (ISSEP, ISSAP, or CCSP).* Top Secret/SCI Security Clearance with additional preference for SAP briefing on the Sentinel program.* Software Assurance experience.* Experience with Systems Security Engineering as defined in NIST SP 800-160.* Expertise with Model-Based System Engineering (MBSE) and related tools such as DOORS and Cameo.* Expertise with containerized software systems in accordance with DoD DevSecOps Reference Design.* Experience innovating in Cybersecurity Accreditation processes and procedures in a multi-certification (Cyber, Nuclear Surety, etc.) context as part of a Digital Engineering Environment.* Experience authoring and maintaining critical program documents such as Cybersecurity Strategies, System Security Plans, Continuous Monitoring Plans, Security Assessment Plans, etc.* Experience in a Systems Engineering role with responsibilities in the planning, designing, implementation, testing, and delivery of a system with Cyber/Information Assurance requirements.* Experience managing and directing efforts following an Agile and DevSecOps process model. Proven success analyzing, estimating, and implementing solutions to complex problems spanning multiple engineering disciplines*Job Type: Full-time*Benefits:*401(k)* Dental insurance* Health insurance* Paid time off* Vision insurance*Schedule:*8 hour shift*Ability to commute/relocate:*Roy, UT 84067: Reliably commute or planning to relocate before starting work (Required)*Education:*Bachelor's (Preferred)*Experience:*Cybersecurity: 10 years (Preferred)*License/Certification:*CISSP (Preferred)*Security clearance:*Secret (Preferred)*Work Location: One location","https://www.indeed.com/company/Goldbelt,-Inc./jobs/Staff-Cybersecurity-System-Engineer-4c3b9e92d6eb3e68?fccid=f7f5ab591aa9143d&vjs=3","On-site","Full-time","MSCM",0,0,0,0,0,0,1,0,0,0,0,0,0,1,0,0,0,0,0,0,"f6ea01fc87a9b943de3c6d3bb2c491bd"
"27","network security engineer",2022-07-23,"DevSecOps Engineer","Goldbelt, Inc.","Roy, UT 84067","Summary:*The selected DevSecOps Engineer / Principal DevSecOps Engineer will provide support for the Command and Control, Battle Management, and Communications (C2BMC) program. The selected candidate will support the C2BMC DevSecOps team to develop and deploy Infrastructure as a Service and Platform as a Service capability. The selected candidate will assist in the system administration of multiple environments, software deployment, troubleshooting, and automation in a DevSecOps environment for a critical customer program. This requisition may be filled at either a DevSecOps Engineer or a Principal DevSecOps Engineer level.*Essential Job Functions: *Work on systems administration related issues with hardware and software for different network environments.* Support deployment of custom software solutions integrating COTS, GOTS, and developed software.* Propose system administration process improvement to reduce overall maintenance requirements by working with the design team and manufacturers.* Determine systems requirements, input/output processes, and working parameters for hardware/software compatibility and maintenance of system configuration.* Identify, analyze, and resolve program support deficiencies. Develop and recommend corrective actions.* May provide technical guidance for database administrators and software developers.* The selected candidate should thrive in a fast-paced work environment with high expectations, significantly diverse assignments, collaborative/team settings across all levels.*Necessary Skills & Knowledge: *Knowledge of DevSecOps principals.* Experience with Linux and/or Windows System Administration.* Experience and scripting skills in languages such as bash or PowerShell.* Experience with automation.* CompTIA Security+ (or equivalent) DoD 8570.01M IAT Level II – Certification.*Minimum Qualifications: *Bachelor’s Degree in a STEM (Science, Technology, Engineering or Mathematics) discipline preferred from an accredited university and 2 years of related experience, or a Master's Degree and 0 years of related experience.* A current active in-scope U.S. Government DoD Secret security clearance is required to start.*Preferred Qualifications: *Bachelor’s Degree in a STEM (Science, Technology, Engineering or Mathematics) discipline preferred from an accredited university and 5 years of related experience, or a Master's Degree and 3 years of related experience, or 0 years of experience with a PhD.*Job Type: Full-time*Benefits:*401(k)* Dental insurance* Health insurance* Paid time off* Vision insurance*Schedule:*8 hour shift*Ability to commute/relocate:*Roy, UT 84067: Reliably commute or planning to relocate before starting work (Required)*Education:*Bachelor's (Preferred)*Experience:*System administration: 3 years (Preferred)*License/Certification:*CompTIA Security+ (Preferred)*Security clearance:*Secret (Preferred)*Work Location: One location","https://www.indeed.com/company/Goldbelt,-Inc./jobs/Devsecop-Engineer-27e32218b228649e?fccid=f7f5ab591aa9143d&vjs=3","On-site","Full-time","MSCM",0,0,0,0,0,0,0,0,0,0,0,0,0,0,0,0,0,0,0,0,"a45f1d1d7dce31605d3700553d70028f"
"28","data scientist",2022-07-23,"Associate Data Scientist","InMoment","South Jordan, UT","* ASSOCIATE DATA SCIENTIST* *  YOUR OPPORTUNITY *  You could be our next Associate Data Scientist! We are looking for a top-notch solution designer to support our product, sales, leadership and marketing teams with insights gained from analyzing company data. If you are adept at using large data sets to find opportunities for product and process optimization and using models to test the effectiveness of different courses of action, you have come to the right place. *  You have strong experience using a variety of data mining/data analysis methods, using a variety of data tools, building and implementing models, using/creating algorithms and creating/running simulations. You have a proven ability to drive business results with your data-based insights and are comfortable working with a wide range of stakeholders and functional teams. You are passionate about discovering solutions hidden in large data sets and working with stakeholders to improve business outcomes.* *  WHO WE ARE *  At InMoment, we have a saying: #OwnTheMomentsThatMatter. And we live it! As a team, we recognize that every moment offers a new opportunity to make an impact and leave our mark. We take deliberate action to make the lives of our families, teammates, clients, and community better within every interaction. *  We are dedicated to our game-changing mission of Experience Improvement (XI), helping our clients improve experiences at the intersection of value—where customer, employee, and business needs come together. We consistently challenge the status quo in the customer experience (CX), employee experience (EX), market research (MX), and product experience (PX) industries with our hyper-modern technology platform, decades of domain authority, and global teams of experts. And we have more innovation in store! *  Are you ready to #OwnTheMomentsThatMatter with us?* *  WHO YOU ARE * Autonomy - We trust our employees and offer an extremely flexible work schedule *  Unlimited PTO - We encourage all employees to recharge! *  Medical with HSA (which includes generous employer match & contribution) and FSA options *  1-3 + years of experience with Tableau or similar BI tools. *  Proven experience delivering Business Intelligence solutions. *  Experience with Tableau, Dashboard design and delivery *  Strong understanding of SQL *  Understanding of Programming languages like Python and R *  Excellent problem solving, design, debugging, and testing skills *  Ability to work with multiple different personality types while managing workload within a fast paced, energetic and dynamic workplace. *  Experience using statistical computer languages (R, Python, SLQ etc.) to manipulate data and draw insights from large data sets. *  Knowledge of advanced statistical techniques and concepts (regression, properties of distributions, statistical tests and proper usage etc.) and experience with applications. *  Experience working with and creating data architectures *  Experience using design, development, testing and deployment of Tableau Dashboards*  * WHAT YOU’LL DO * Build Tableau-based solutions with advanced tableau functions (parameters, actions, tooltip, modification, API, etc.) to create analytical dashboards with end user functionality in mind. *  Work with a diverse group of stakeholders and team members performing high level and detailed analysis, defining and writing programs using Tableau and leveraging the API. *  Perform system integration and deployment activities. *  Prepare support documentation and document program and system functions. *  Structure ambiguous business problems and recommend visualization solutions. *  Develop a strong understanding of business requirements; working with business users / business analysts to define technical and process requirements.*  *  WHAT YOU’LL GAIN * Autonomy - We trust our employees and offer an extremely flexible work schedule *  Unlimited PTO - We encourage all employees to recharge! *  Medical with HSA (which includes generous employer match & contribution) and FSA options *  Dental and vision insurance *  401(k) with a generous company match, access to a personal financial planner, and both legal and life insurance *  Generous Parental leave program *  Legal, ID theft, and employer-paid disability and life insurance *  Access to wellbeing initiatives and offerings such as our Employee Assistance Program *  Fun, innovative, collaborative, supportive working environment *  Inclusion and Diversity teams - Women of InMoment and InMovement *  Employee rewards and referral programs with generous payouts *  An opportunity to truly ‘Leave your Mark’ in a global organization. Come join our team!*  *  KEY RELATIONSHIPS *  Reports to Team Lead, Solution Design* *  At InMoment, inclusion and diversity are at the core of who we are. InMoment prides itself on an inclusive culture that promotes, encourages, and supports the diverse voices of our employees and clients. We strive to create workplaces that reflect the communities we serve and believe that different perspectives, interests, and backgrounds foster a stronger and more creative work environment.**","https://www.indeed.com/rc/clk?jk=b2498f8cab5f29ca&fccid=4b860103c428d706&vjs=3","On-site","Part-time","MSBA",1,1,1,1,0,0,1,0,0,0,0,0,0,0,0,0,0,0,0,0,"d287ef831b67b22140a57b37f2d1294b"
"29","data architect",2022-07-23,"Client Systems Administrator","Innovative Systems Architect Corp","Hill AFB, UT 84056","We are looking for a customer service oriented PC administrator to provide technical support to users in an efficient and accurate manner. You will be considered as the firm’s front line PC support and you will solve basic computer hardware and software technical problems and provide support for all assigned areas. The goal is to make sure that customer value is maintained to the standards set forth by the company.*Responsibilities*Provide first level contact and convey resolutions to customer issues* Properly escalate unresolved queries to the next level of support* Track, route and redirect problems to correct resources* Update customer data and produce activity reports* Walk customers through problem solving process* Follow up with customers, provide feedback and see problems through to resolution* Utilise excellent customer service skills and exceed customers’ expectations* Ensure proper recording, documentation and closure* Recommended procedure modifications or improvements* Preserve and grow your knowledge of help desk procedures, products and services*Skills*Knowledge of Microsoft Windows Operating Systems* Knowledge of PC hardware and mobile devices* Installation and maintenance of personal computer hardware* Basic Information Technology terminology such as IP addresses* Ability to provide customer service in person, via remote control technologies and over the telephone* Ability to troubleshoot personal computer hardware and software and provide repair* Ability to troubleshoot local/network printers/root cause analysis* Ability to troubleshoot end user network access* PC and Peripheral Deployment and Imaging* Ability to work independently with occasional supervision* Must be able to obtain Security+ or equivalent certification within 3 months of hire*Job Type: Full-time*Pay: $40,000.00 - $60,000.00 per year*Benefits:*Dental insurance* Health insurance* Health savings account* Life insurance* Paid time off* Professional development assistance* Retirement plan* Tuition reimbursement*Schedule:*Monday to Friday*Ability to commute/relocate:*Hill AFB, UT 84056: Reliably commute or planning to relocate before starting work (Preferred)*Education:*High school or equivalent (Preferred)*Experience:*PC and Peripheral Deployment and Imaging: 2 years (Required)* Windows and Software Troubleshooting: 2 years (Required)* LAN and Printer Troubleshooting: 2 years (Required)* Installation and maintenance of PC hardware: 2 years (Required)*License/Certification:*CompTIA Security+ (Preferred)* US Citizenship (Required)*Security clearance:*Secret (Preferred)*Work Location: One location","https://www.indeed.com/pagead/clk?mo=r&ad=-6NYlbfkN0A1UlZP-phbz9O1uVotk2G0-E0wIlzvRURGVHglK_NyXs8RfhIjXrmY28GFRgsWTsEeNGkOeQS0awYi4UT5x8SDBlDMXaFU1l_hCV9K-_nTztcU__9NXlsPdZiElvUhm6JCc85_NwlVwGLIcfd5piAbiIg6nq5a53RqIhYjLF5uRf1Vg8cignOvi6Nm-16DYxckrjrNavi5-V-iWpbj1rYGFx29h_msvWhUACAPlyia25cZ_6Q0Q_nwaRuyWYmLaXW4M6n8w0IPTtd8-HmwucYpCFN6i15e_sK2e_IsDpM0IoxcYiO08g4wnQUYMRXdLt7FWdUWYw1p9tLc5lJsoskTUy46gJ4H-QzNVEFhn74DQ3In4lusPZ2MNKFseUlsnU_fD6pt-9wBBmCJWonCBrev9hcEirx_jngRqsF0VDsLHGS2WnEVnUCu0emUAAFXzrJPyWbEYFmF0jp0J25XHsSNpLIJZ_Sf7HlKzR-CowgRS7H58tJJu-qttSwpHHERswYgLTJvNZwiHg==&xkcb=SoAG-_M3bVWPFPzdTB0LbzkdCdPP&p=2&fvj=1&vjs=3","Remote","Full-time","MSIS",0,0,0,0,0,0,1,0,0,0,0,0,0,0,0,0,0,0,0,0,"35fd377ca2493912f7871a94350e85a3"
"30","data architect",2022-07-23,"Senior Business Analyst - Digital Products","Intermountain Healthcare","Salt Lake City, UT","* Job Description: This position reports to the Business Analyst Manager. The incumbent generally works on highly-complex projects involving multiple teams, systems, and applications. This position typically designs and develops approaches that are implemented by others. The incumbent works on multiple, simultaneous and detailed projects with minimal oversight and direction. * * The Senior Business Analyst is responsible for providing business and technical consultation, analysis, and functional documentation required for the successful design and implementation of enterprise-scale digital products, including web and mobile sites and applications, and the back-end databases, applications, systems, and services that support them. The incumbent plays a critical role leading and supporting multi- disciplinary project teams through the project management life cycle from strategy, conceptualization, documentation, design, development, testing, deployment, training, support, and qualitative and quantitative assessment for improvement. The incumbent is an expert in best practices for web and mobile usability, content management systems, information architecture, requirements documentation, project management, software testing and quality assurance, and consults on these subjects to business and technical stakeholders at all levels within the organization and with outside contractors, agencies, and partners.* Minimum Qualifications  Bachelor's degree in a business, web development, digital marketing, computer science. Education must be obtained from an accredited institution. Degree will be verified.  - or -  six years of equivalent information technology, clinical, or healthcare insurance experience.  - and -  Experience providing business analyst support in a web or mobile software development environment.  - and -  Skilled in gathering business input and writing business requirements documentation with business implementation.  - and -  Experience with contemporary requirements gathering data, analyzing data, specifying data, validating data, and knowledge of data management practices.  - and -  Experience with system thinking skills to identify the interactions and relationships between the people, processes, and technology involved in an environment.  - and -  Experience applying web usability best practices, web usability research, data analysis, and quality improvement principles.  - and -  Experience optimizing content for digital properties.  - and -  Excellent verbal and written communication skills and experience articulating web concepts to technical as well as non-technical staff.  - and -  Experience using word processing, spreadsheets, and presentation software.  - and -  Strong project management and organizational skills, including managing multiple projects and tight timelines.  - and -  Experience working collaboratively within a team as well as all levels of marketing, web content, and outside software development teams.  - and -  Experience building consensus and working effectively within a cross-functional team.  - and -  Experience providing business analyst support in a web or mobile software development environment.  - and -  Experience effectively prioritizing and executing tasks in a high-pressure environment to deliver results on time.  - and -  Experience using web content management systems and formal QA for software applications.  - and -  Experience using web analytics tools such as Google Analytics and Usertesting.com.  - and -  Experience coding basic HTML.  - and -  Experience applying web usability best practices, web usability research, data analysis, and quality improvement principles.  - and -  Experience with business and technical writing, developing and giving presentations, and communicating business and technical requirements.  - and -  Experience effectively managing stakeholder expectations, eliciting stakeholder requirements, and articulating complex ideas simply to an executive level audience.  - and -  Experience translating business requirements into functional specifications and prototypes that meet project goals for UX designers, software developers, data architects, QA testers, usability evaluators, and other technical stakeholders.  - and -  Experience analyzing content requests, determining priority, and creating an implementation plan based on stakeholder/user needs, content strategy, and best practices.* Preferred Qualifications  Experience working with CMS platforms (e.g. Sitecore) and work management software (e.g. JIRA, Workfront).  - and -  Experience in a product management related position with a track record of successful execution.  - and -  Experience managing stakeholder expectations in an everchanging environment.  - and -  Experience developing digital consumer journeys, conducting consumer research, and interviewing a variety of stakeholders across an organization.  - and -  Experience consistently delivering an extraordinary customer experience when interacting with peers, end-users, and others.  - and -  Experience in a technical role requiring a keen attention to detail, and clear and concise communication skills.  - and -  Experience with business and technical writing, developing and giving presentations, developing training materials, providing training, and communicating business and technical requirements.  - and -  Experience effectively prioritizing and executing tasks in a high-pressure environment and delivering results on time.  - and -  Experience on a scrum agile product development team.  - and -  Experience in a healthcare environment.  - and -  Experience consistently delivering an extraordinary customer experience when interacting with peers, end-users and others.  - and -  Experience in a technical or healthcare environment role requiring a keen attention to detail and clear and concise written and verbal communication skills.  - and -  Experience with project management principles and managing multiple projects, tasks, and priorities.  - and -  Experience with Sitecore technologies.* * Physical Requirements: * Interact with others requiring the employee to communicate information.  - and -  Operate computers, telephones, office equipment, and manipulate paper requiring the ability to move fingers and hands.  - and -  See and read computer monitors and documents.  - and -  Remain sitting or standing for long periods of time to perform work on a computer, telephone, or other equipment. * * Location: Key Bank Tower * * Work City: Salt Lake City * * Work State: Utah * * Scheduled Weekly Hours: 40 * * The hourly range for this position is listed below. Actual hourly rate dependent upon experience. $38.41 - $60.46 * * For a description of Intermountain's employment benefits, click * HERE.**","https://www.indeed.com/rc/clk?jk=dc9206c54d54e844&fccid=d06afa4992ee7ab3&vjs=3","On-site","Part-time","MSIS",0,0,0,0,0,0,1,0,0,0,0,0,0,0,0,0,0,0,0,0,"7ee71e41f8b660c4961a927c5aede30d"
