"","Search","Date","Title","Company","Location","Description","Link","Work Model","Job_Type","Program","R","Python","SQL","Tableau","PowerBI","Azure","Excel","Talend","SAS","Spark","Qualtrics","Domo","Salesforce","SAP","Hadoop","Qlik","Looker","Zoho","Stata","Snowflake","ID"
"25","security auditor",2022-08-24,"Compliance/Audit Specialist","InMoment","South Jordan, UT 84095","* COMPLIANCE/AUDIT SPECIALIST* *  YOUR OPPORTUNITY* *  The Compliance Audit Specialist will be primarily responsible for helping our SOC 2 and ISO certification teams in their ongoing audit activities. This requires interfacing with various employees in virtually all of the company organizations to gather periodic evidence (screen shots, emails, policies) to ensure that the company is maintaining its security, data privacy and systems access controls.* *  KEY RESPONSIBILITIES * Manage internal and external compliance requests *  Drive ongoing compliance initiatives *  Interface with external auditors *  Create and review policy *  Perform vendor risk reviews *  Take customer calls and respond to Data Security, Privacy and ITSec professionals within those customers*  *  WHO WE ARE *  At InMoment, we have a saying: #OwnTheMomentsThatMatter. And we live it! As a team, we recognize that every moment offers a new opportunity to make an impact and leave our mark. We take deliberate action to make the lives of our families, teammates, clients, and community better within every interaction.* *  We are dedicated to our game-changing mission of Experience Improvement (XI), helping our clients improve experiences at the intersection of value—where customer, employee, and business needs come together. We consistently challenge the status quo in the customer experience (CX), employee experience (EX), market research (MX), and product experience (PX) industries with our hyper-modern technology platform, decades of domain authority, and global teams of experts. And we have more innovation in store!* *  Are you ready to #OwnTheMomentsThatMatter with us?* *  WHO YOU ARE* *  Bachelor’s degree in Journalism, English, Business, IT, or a related communicative field preferred. *  Capable of learning new technologies and adapting in a fast paced environment. *  Coordinate project management deadlines and team commitments to assist in prioritizing tasks. *  Assist the team in meeting multiple due-dates. *  Daily management of the backlog board. *  Lead discussions with cross-function BU leaders to assist in prioritizing tasks. *  Participate and assist Compliance Manager and Security Teams in handling real-time discussions with customers. *  Proven ability to learn technical subject matter. *  Assist Compliance and Security Teams to implement and manage compliance programs (e.g. ISO 27001 and ISO 27701, SOC 2, HIPAA, HITRUST and FedRAMP). *  Excellent writing, proofreading and editing skills and keen attention to detail. *  Ability to be flexible and to adapt to changing responsibilities, situations, tools, and requirements. *  Review contracts for compliance with InMoment security, business continuity and disaster recovery requirements and recommend appropriate language as necessary. *  Exceptional communication and teamwork skills. *  Demonstrated expertise in Microsoft Office Applications (Word, Excel, PowerPoint) and Google Docs the ability to learn new software applications. *  Preference for proficiency in JIRA or other task-based ticketing systems. *  Exceptional interpersonal and decision-making skills *  Understands deadlines and goals and can operate with a sense of urgency without sacrificing quality*  *  WHAT YOU’LL DO* *  You live and breathe customer service and demonstrate a customer-first attitude at all times *  Communicates, if not over-communicates, effectively and effortlessly with internal and external stakeholders *  Exhibits a high level of personal accountability, strong work ethic, integrity, and proven organizational skills with attention to detail *  Loves working in a super collaborative, high-tech, fast-paced environment and doesn’t mind getting their hands dirty - working shoulder to shoulder across teams to help InMoment’s growth trajectory *  Technology driven with savvy technical skills *  Quickly develop company-specific expertise and remain abreast of market changes, customer trends, and competitors’ best practices *  Inspirational team player, colleague, and culture champion within InMoment *  Collaborative facilitator who develops relationships and loyalty with his/her colleagues at all levels of the company*  *  WHAT YOU’LL GAIN*  * Autonomy - We trust our employees and offer an extremely flexible work schedule *  Automatic day off for your birthday, we want to celebrate you and the moments that matter *  Unlimited PTO - We encourage all employees to recharge! *  Medical with HSA (which includes generous employer match & contribution) and FSA options *  Dental and vision insurance *  401(k) with a generous company match, access to a personal financial planner, and both legal and life insurance *  Generous Parental leave program *  Legal, ID theft, and employer-paid disability and life insurance *  Access to wellbeing initiatives and offerings such as our Employee Assistance Program which includes counseling sessions, phone, and online support on matters such as Family, Health, Money, and Work for you and your family members. *  Fun, innovative, collaborative, supportive working environment *  Inclusion and Diversity teams - Women of InMoment and InMovement *  Employee rewards and referral programs with generous payouts *  An opportunity to truly ‘Leave your Mark’ in a global organization. Come join our team!*  *  KEY RELATIONSHIPS *  Reports to the Director of Compliance* *  LOCATION *  South Jordan, Utah / In-office* *  At InMoment, inclusion, and diversity are at the core of who we are. InMoment prides itself on an inclusive culture that promotes, encourages, and supports the diverse voices of our employees and clients. We strive to create workplaces that reflect the communities we serve and believe that different perspectives, interests, and backgrounds foster a stronger and more creative work environment.*","https://www.indeed.com/rc/clk?jk=dadca495a4ff7ec9&fccid=4b860103c428d706&vjs=3","On-site","Part-time","MSCM",1,0,0,0,0,0,1,0,1,0,0,0,0,0,0,0,0,0,0,0,"f2c0363c3928399663de94597d8297a0"
"26","data architect",2022-08-24,"NetSuite System Junior Administrator","Interiorworx, LLC","Salt Lake City, UT 84104 (Downtown area)","InteriorWorx, a provider of complete interior finish solutions for commercial and residential builders, architects, designers, and homeowners, is raising the bar for the building industry. Due to our commitment to be the best in the industry, we are growing. Due to this growth, we are looking for a NetSuite System Junior Administrator who has a passion for helping organizations solve problems utilizing technology.*Description*Qualified candidates will have meaningful and relevant experience with Operational processes and ERP systems. They should be an excellent communicator in both technical and non-technical contexts. They must have a track record of working to deadlines and prioritizing competing demands.*Duties:*Troubleshoot errors and maintain data integrity in NetSuite* Develop reports and searches and maintain current ones* Import and mass update data in NetSuite* Help to create documentation on all processes and training* Create customs records, forms and fields* Develop and maintain workflows and processes in NetSuite to help streamline the business* Assist in the setup and configuration of modules* Work with internal clients to understand issues and concerns* Help manage projects while serving as an individual contributor* Determine best solution that leverage core functionality first, customization second and custom development last.*Requirements:*Understanding of general business processes* Strong organizational skills, ability to prioritize several tasks concurrently* Experience reporting and analyzing data* Ability to work under pressure, meet deadlines, and work on multiple projects simultaneously* Must be a team player and be able to effectively interact with staff at all levels of the firm* Strong conceptual, analytical, and problem-solving skills* Excellent team skills and customer relationship management skills* Solid understanding of business and information technology processes* Strong verbal and written communication skills, with an ability to express complex technical concepts in business terms* Strong Excel skills*Preferred Skills/Education:*Minimum 1 years’ experience working with NetSuite as an administrator* Preference given to those who have a bachelor’s degree in an IT related field or are working towards degree*Job Type: Full-time*Benefits:*401(k)* Dental insurance* Health insurance* Paid time off* Referral program* Vision insurance*Schedule:*8 hour shift* Day shift*Ability to commute/relocate:*Salt Lake City, UT 84104: Reliably commute or planning to relocate before starting work (Required)*Experience:*VMWare: 1 year (Preferred)* Linux: 1 year (Preferred)*Work Location: One location","https://www.indeed.com/company/Interiorworx,-LLC/jobs/Netsuite-System-Junior-Administrator-3b1f56a6f86ddd76?fccid=dca417c3522bc251&vjs=3","On-site","Full-time","MSIS",0,0,0,0,0,0,1,0,0,0,0,0,0,0,0,0,0,0,0,0,"c2e614614961c8fa0e6fb27ccbef9e70"
"27","security compliance analyst",2022-08-24,"Sr Specialist, Contracts Analyst","L3Harris Technologies","Remote in Salt Lake City, UT 84116","* Description: * Job Title: Sr Specialist, Contracts *  Job ID: CS20221608-88823 *  Job Location: Salt Lake City, UT or Remote *  This position is responsible for conducting proposal preparation, pre-contract data collection, and administering, extending, negotiating and terminating standard and nonstandard government contracts. *  Essential Functions: * Review contractual documents to ensure adherence to company policy, government specifications and requirements, and conformance to master agreements *  Examine estimates of material, equipment services, production costs, performance requirements, and delivery schedules to ensure accuracy and completeness *  Conduct proposal preparation, contract negotiation, contract administration, and customer contact activities to provide for proper contract acquisition and fulfillment in accordance with company policies, legal requirements, and customer specifications *  Initiate documentation to authorize work in accordance with contractual specifications *  Prepare bids; processes specifications, progress, and other reports; advises management of contractual rights and obligations; compiles and analyzes data; and maintains historical information *  Require little to no supervision in executing key contracting activities *  Respond to inquiries regarding contract obligations and revisions *  Lead and organizes negotiation teams *  Provide interpretation and guidance to program team as needed. Critical part of the negotiating and/or executing team *  Work complex situations with the program office. Understand the business and the execution of the business to address complex issues and concerns *  May help mentor junior level contract administrators *  Central point of contact to customers * Basic Qualifications: * Bachelor’s Degree and minimum 6 years of prior relevant experience, or, Graduate Degree and a minimum of 4 years of prior related experience *  Must be eligible to obtain and maintain a Department of Defense Secret security clearance * Preferred Qualifications: * In-depth knowledge of FAR and DFARS required and functional knowledge of Peoplesoft/SAP/other ERP systems input and report generation *  Experience with ITAR is preferred *  Must have experience with reviewing RFPs, preparing proposals, negotiation, definitization and administration of DoD and Commercial contracts *  Must have experience with risk assessment of proposals/contract terms and conditions and strategies to minimize potential risks to the business *  Ability to effectively interface at all levels of company management *  Ability to effectively interface with Government and other customer organizations *  Able to travel as required. Anticipated 10 – 25% of time *  Able to work any shift, weekends, and overtime as required *  Excellent communications skills. Effectively communicate via formal letters complicated and sensitive subjects, possess proper email skills, and possess excellent verbal communication skills *  Detailed oriented *  Experience and be able to manage complex projects or processes *  Ability to lead a team in gathering comprehensive data from multiple disciplines and lead a team to address complex issues and concerns. *  Experience in problem solving through creative solutions drawing from prior experience. * In compliance with Colorado’s Equal Pay for Equal Work Act, the salary range for this role in Colorado is $67,000 - $118,500. This is not a guarantee of compensation or salary, as final offer amount may vary based on factors including but not limited to experience and geographic location. L3Harris also offers a variety of benefits including: health and disability insurance, 401(k) match, flexible spending accounts, EAP, education assistance, parental leave, paid time off, and company-paid holidays. The specific programs and options available to an employee may vary depending on date of hire, schedule type, and the applicability of collective bargaining agreements.* *  #LI-Remote*","https://www.indeed.com/rc/clk?jk=9b4dfaa38037d7ab&fccid=6c6be4ac01722b08&vjs=3","Remote","Part-time","MSCM",1,0,0,0,0,0,1,0,0,0,0,0,0,1,0,0,0,0,0,0,"2843effa846d2e2904df0164bd9a1ef8"
"28","network security engineer",2022-08-24,"Senior IT Engineer","Les Olson Company","Salt Lake City, UT 84115","* Les Olson Company is one of the fastest-growing and most capable technology service providers in the West. We're looking for an experienced IT Engineer to join our team. Les Olson Company does IT the LOC Way: with talent, passion, and compassion, driving our continual growth and strong position in the market through superior service. If that sounds like the sort of team you'd like to join, read on!*  What makes Les Olson different?*  Unlike most technology companies, Les Olson has been in business for over 65 years. We're a family-owned company and remain family-operated to this day. The company began at the Olson family dinner table and has since grown to over 300 employees spread across nine locations in two states. * We take great pride not only in offering attentive and effective service to our customers, but in providing our team members with an environment that enables growth and development, both professionally and personally. We invest in our team, working with each employee to design a fulfilling career path that grows and evolves as they do. * ""Work/life balance"" isn't just a meaningless buzzword at Les Olson. We are protective of our employees' personal time and make sure they have the resources they need to care for themselves and their families.*  We offer: * Paid Time Off *  Sick Days *  Paid Holidays*   401k match + Pension *  Full Medical, Dental & Vision + HSA*   Mental health care coverage*   Life Insurance *  Local Volunteer Opportunities*  Who We Are Looking For*  5 or more years of broad-ranging IT work experience, ideally in System Administration*   Experience with a Managed Service Provider (MSP) is not required, but is a big plus*   Team-oriented, strong communicator*   Excellent customer-facing interaction*   Technical certifications in Windows Server environments*   Technical certification in VMware.*   Technical certification(s) in HP, Dell, EMC or other storage hardware*   Technical certifications in networking such as Cisco*   Knowledge of Unix system administration*   Excellent knowledge and hands-on experience with Windows Server and Active Directory.*   Excellent knowledge and hands-on experience configuring, maintaining and leveraging SAN and NAS hardware.*   Excellent knowledge and hands-on experience implementing, troubleshooting and tuning virtual servers.*   Excellent knowledge and hands-on experience implementing, troubleshooting and configuring VMware*   Experience in Microsoft O365 products cloud on hybrid migrations*   Experience with Project Management, application design and integration, and cloud computing (specifically Microsoft Azure)*   Expertise in creating, analyzing, and repairing large-scale distributed systems*   Strong working knowledge of switching and routing technologies*   Strong working knowledge of Microsoft O365 and Azure*   Valid Driver's License*  Primary Responsibilities*  Maintain essential IT operations, including operating systems, security tools, applications, servers, email systems, laptops, desktops, software, and hardware*   Maintain internal infrastructure requirements including, laptop and desktop computers, servers, routers, switches, firewalls, printers, phones, security updates*   Support internet, intranet, LANs, WANs, and network segments*   Own projects, solutions, and key responsibilities within a larger business initiative*   Develop and demonstrate expertise in a variety of client industry concepts, practices, and procedures*   Handle business-critical IT tasks and systems that provide commercial advantage in a global marketplace*   Enable faster and smarter business processes and implement analytics for meaningful insights*   Nurture dependable IT infrastructure and networking that is always up and running*   Partner with internal and external partners to communicate project status, activities, and achievements*   Install and maintain network hardware and software*   Interact with the help desk and other teams to assist in troubleshooting, identify root cause, and provide technical support when needed*   Perform routine/scheduled audits of the systems, including all backups*  Job Type: Full-Time, M-F 8am 5pm, bonus offered for participating in on-call rotation*  Check out our website: www.lesolson.com*","https://www.indeed.com/rc/clk?jk=6233fcbc9f52874f&fccid=3f80184b2e2c87cb&vjs=3","Hybrid","Full-time","MSCM",0,0,0,0,0,1,1,0,0,0,0,0,0,0,0,0,0,0,0,0,"fd52377718069e335e6749098e423505"
"29","network security engineer",2022-08-24,"Software Engineer","LiveView Technologies","Lindon, UT 84042","* TITLE: Software Engineer *  Why LVT: *  LVT (LiveView Technologies) is making the world a safer place and we need your help! Based in Utah, LVT is the world's leader for physical security platforms and data. With our systems in every state and working with Fortune 500 enterprise companies, we're positioned for massive growth in the years to come. While we were founded nearly 20 years ago, we are still innovative and consistently scaling. If you are looking for a market leading organization with untapped potential, look no further than LVT!* *  So about that scalability - we’ve been very intentional about our growth and profitability, which has driven our massive growth trajectory. To keep up with the explosive demand, we need self-motivated, innovative go-getters at every level. At LVT, we provide a fulfilling career that allows you to live your best life at work and at home. We provide the culture to work smart and have fun, while giving you the flexibility needed for yourself and your loved ones.* *  If you are looking for an opportunity with leadership, ownership, accountability, and you're excited about contributing to a high-growth company with a strong foundation where you can make an immediate impact, read on!* *  Role Description *  You will play an important role in our organization, while working on a Scrum Development Team. You will write Java services that will execute in a cloud environment. These services will perform many functions of our product, and they will also interact with remote IoT devices on the edge. *  You will have the opportunity to collaborate with other talented engineers. As part of a broader team, your recommendations for technical solutions and software design decisions will have great value. You will interface with the web developers and the edge device developers. You will provide input to IoT software engineers on communication interfaces, protocols, and security.* *  Responsibilities *  Design, modify, and implement software to meet functional requirements Enhance software to improve fault-tolerance, efficiency, and robustness Diagnose and debug software deficiencies Maintain software efficiently through solid knowledge of software lifecycles Document designs through functional block diagrams, data/logic flow charts, etc. Participate in design reviews, code reviews, and mob-programming sessions Help establish requirements for new software releases and hardware designs Help to define and develop cutting-edge video and security solutions* *  Required Skills & Qualifications *  Education: Bachelor’s degree in Computer Science, Electronic Engineering, IT or equivalent technical training/experience Programming Languages (2 or more): Ruby, Java, Python, Go Operating Systems: Linux Minimum three (3) years experience developing software for commercial products At least one (1) years of agile development, with ability to work in rapid development cycles Experience with TCP/IP and UDP programming, and Network Sockets Experience with a source control system such as Git Ability to collaborate with other engineers on system performance tuning and optimization Ability to accurately estimate software tasks and work within a schedule Extensive software debugging skills Have a team player attitude and do what it takes to get the job done Have excellent written and verbal communication skills* *  Desired Qualifications: Experience with event-sourced architecture  Knowledge of video streaming technology, players, encoders, relays, etc. Experience and understanding of internet security best practices Familiar with Amazon Web Services* *  Benefits *  Flexible Time Off, Paid Holidays, 401(K), Equity, Health, Vision, Dental, Voluntary Life Insurance, Wellness Program and best of all working with awesome people - ask about that when you speak with us!* *  HR Policy *  We’re an equal opportunity employer. All applicants will be considered for employment without attention to race, color, religion, sex, sexual orientation, gender identity, national origin, veteran or disability status. All Candidates must pass a drug screening and background check upon employment. Must be authorized to work in the U.S.*","https://www.indeed.com/rc/clk?jk=c1355cdf3fb267f2&fccid=811b38d5f4770294&vjs=3","Remote","Part-time","MSCM",1,1,0,0,0,0,1,0,0,0,0,0,0,0,0,0,0,0,0,0,"c0ebaa76c2fbfe18bb644e8e565103e7"
