"","Search","Date","Title","Company","Location","Description","Link","Work Model","Job_Type","Program","R","Python","SQL","Tableau","PowerBI","Azure","Excel","Talend","SAS","Spark","Qualtrics","Domo","Salesforce","SAP","Hadoop","Qlik","Looker","Zoho","Stata","Snowflake","ID"
"5","network security engineer",2022-05-23,"Network Engineer","Guidehouse","Syracuse, UT 84075+3 locations","Overview*Guidehouse is a leading global provider of consulting services to the public and commercial markets with broad capabilities in management, technology, and risk consulting. We help clients address their toughest challenges and navigate significant regulatory pressures with a focus on transformational change, business resiliency, and technology-driven innovation. Across a range of advisory, consulting, outsourcing, and digital services, we create scalable, innovative solutions that prepare our clients for future growth and success. The company has more than 10,000 professionals in over 50 locations globally. Guidehouse is a Veritas Capital portfolio company, led by seasoned professionals with proven and diverse expertise in traditional and emerging technologies, markets, and agenda-setting issues driving national and global economies. For more information, please visit: www.guidehouse.com.Responsibilities*This position is for the AFNWC ICBM Directorate ISC 2.0 project.Develops and maintains data networking and telecommunications systems*Analyzes network characteristics (e.g., traffic, connect time, transmission speeds, packet sizes, and throughput), troubleshoots problems and recommends procurement, removals, and modifications to network componentsWorks with network topologies and site configurationsImplements plans to install, transition, convert and cutover network components and capabilitiesMonitors operations of telecomm systems and services of vendorsCoordinates requirements with users and suppliersPerforms network administration, provides technical assistance in the integration and test of computer integrated networksMay require direct supervisionQualifications*Require:Minimum SECRET security clearance.* BS Degree in Electrical, Computer or Software Engineering + 6 yrs of related experience OR BS Degree in an engineering discipline AND MS Degree in Electrical, Computer or Software Engineering + 4 yrs of related experience OR BS and/or MS in engineering discipline AND PhD Degree in Electrical, Computer or Software Engineering + 2 yrs experienceSystems Engineering Experience*Experience with network monitoring tools such as: Cisco Prime, Juniper Junos, SolarWinds Orion, etc.Advanced proficiency with MS Office suite*Extensive knowledge using industry standard network engineering principlesAbility to analyze and report on data collected from issue resolution/ network performance metricsAble to keep pace with vendor software/ hardware enhancements and provide recommendations for tech refreshAbility to develop technical solutions to complex problemsHighly motivated, self-starter and team player with a high energy level and willingness to aggressively take on responsibilityExcellent customer service skillsDemonstrated ability to approach job responsibilities with a focus on process improvementAble to work and effectively communicate with and present ideas, to all levels of mgmt, through written and verbal meansUnconditional integrity and commitment to achieving goalsICBMs, acquisition and/or sustainment experience preferredJourneyman skill set includes ability to perform all stated/implied duties within this tier and those reasonably derived from preceding tierAdditional Requirements*DESIRED:*ICBM experience desired*TS clearance desired*Contractor shall obtain and maintain certificaitons as required by current versions of AFMAN 17-1303, DoDi 8570.01-M and other applicable lasw and regulations.*Professional Engineering License Desired*Systems Engineering Certification desireable*Additional specialty certification related to firewall, wireless, security or mgmt*Advanced knowledge of monitoring tools, ticketing systems, and Office suiteDisclaimer*About Guidehouse*Guidehouse is an Equal Employment Opportunity / Affirmative Action employer. All qualified applicants will receive consideration for employment without regard to race, color, national origin, ancestry, citizenship status, military status, protected veteran status, religion, creed, physical or mental disability, medical condition, marital status, sex, sexual orientation, gender, gender identity or expression, age, genetic information, or any other basis protected by law, ordinance, or regulation.*Guidehouse will consider for employment qualified applicants with criminal histories in a manner consistent with the requirements of applicable law or ordinance including the Fair Chance Ordinance of Los Angeles and San Francisco.*If you have visited our website for information about employment opportunities, or to apply for a position, and you require an accommodation, please contact Guidehouse Recruiting at 1-571-633-1711 or via email at RecruitingAccommodation@guidehouse.com. All information you provide will be kept confidential and will be used only to the extent required to provide needed reasonable accommodation.*Guidehouse does not accept unsolicited resumes through or from search firms or staffing agencies. All unsolicited resumes will be considered the property of Guidehouse and Guidehouse will not be obligated to pay a placement fee.*Rewards and Benefits*Guidehouse offers a comprehensive, total rewards package that includes competitive compensation and a flexible benefits package that reflects our commitment to creating a diverse and supportive workplace.*Benefits include:*Medical, Rx, Dental & Vision Insurance*Personal and Family Sick Time & Company Paid Holidays*Position may be eligible for a discretionary variable incentive bonus*Parental Leave and Adoption Assistance*401(k) Retirement Plan*Basic Life & Supplemental Life*Health Savings Account, Dental/Vision & Dependent Care Flexible Spending Accounts*Short-Term & Long-Term Disability*Tuition Reimbursement, Personal Development & Learning Opportunities*Skills Development & Certifications*Employee Referral Program*Corporate Sponsored Events & Community Outreach*Emergency Back-Up Childcare Program","https://www.indeed.com/pagead/clk?mo=r&ad=-6NYlbfkN0DOpfXD7aCvxSiR73RUZjyy6OuclKM9Xpb799vH3iY_yIwO4XWkzYByfUjHp5qaKjU5dYOxyGmX4Ntb6H3eqg2tybWV62oOZxEPqcl7nsLDJ8Qi-syXOGTkHkEGcsHUrv28l0HNZcfpUJQzyElYbNTKWcSSoQZSBgpbNFoQ_0my1nndI_xT__Isy4h6fxwK-TdwhnfZ0TuS6n5dunXkLJ1LXXaocnMOTb09MMPI-oSgFejW7dC2bUqfaUrwyYr2M3qjL1Dm0dkL9NOfiusIGg6dW6mQeHrnlIMHrO7S3upO75_46ii6v5o-vttYgab1NLuVQV6kSniwcvo0zhThHGxF6vObEPWEXREpjgzF18AGZJfOot6aglft-uLUDv0mikGQAlBSDap-JRveJpTTT3coOeFZXnuxkhJEF_a4EJnhBu8hCWyse1ZcOi5UwoDbdijCISHsKmxtbA==&p=0&fvj=0&vjs=3","On-site","Part-time","MSCM",1,0,0,0,0,0,1,0,0,0,0,0,0,0,0,0,0,0,0,0,"741705fcad63399dfd36a06d035aec6f"
"6","cloud engineer",2022-05-23,"Senior Nuclear Hardness Engineer","Guidehouse","Salt Lake City, UT 84116+4 locations","Overview*Guidehouse is a leading global provider of consulting services to the public and commercial markets with broad capabilities in management, technology, and risk consulting. We help clients address their toughest challenges and navigate significant regulatory pressures with a focus on transformational change, business resiliency, and technology-driven innovation. Across a range of advisory, consulting, outsourcing, and digital services, we create scalable, innovative solutions that prepare our clients for future growth and success. The company has more than 10,000 professionals in over 50 locations globally. Guidehouse is a Veritas Capital portfolio company, led by seasoned professionals with proven and diverse expertise in traditional and emerging technologies, markets, and agenda-setting issues driving national and global economies. For more information, please visit: www.guidehouse.com.Responsibilities*This position is for the AFNWC ICBM Directorate ISC 2.0 project.*Assists the Principal Nuclear Hardness Engineer*Performs hardness assessments at the system and subsystem-levels*Evaluates proposals and/or recommended changes to the weapon system for hardness.*Evaluates the adequacy of test planning, surveillance testing, hardness evaluation (including the effects of configuration changes), and FDE at the system and subsystem-levels.*Performs studies and validates subsystem inspections and tests to provide assurance that survivability values for configured modification/substitution items (including developmental test and evaluation of responses to nuclear and conventional environments) are sufficient to prevent degradation of hardness.*Reviews actions recommended by subsystem contractors as required to prevent degradation to hardness.*Provides recommendations to maintain nuclear hardness, Key Performance Parameters for subsystem modifications, and weapon system capabilities.*Supports EMI/EMC activities as needed and/or dictated by the Principal Nuclear Hardness Engineer.Qualifications*Minimum SECRET security clearance.*There is a position: Principal level with educational and experience requirements as follows:*Journeyman: BA or BS degree in STEM-related field + 4 years of experience OR MS degree + 2 years of experience OR PHD + 1 year of experience***This position is intended for individuals with prior education/experience in the fields of electrical, mechanical, computer, software or nuclear engineering as well as advanced electronics.*DESIRED:*ICBM experience desired*TS clearance desired*Acquisition knowledge/background preferredAdditional Requirements*The successful candidate must not be subject to employment restrictions from a former employer (such as a non-compete) that would prevent the candidate from performing the job responsibilities as described.Disclaimer*About Guidehouse*Guidehouse is an Equal Employment Opportunity / Affirmative Action employer. All qualified applicants will receive consideration for employment without regard to race, color, national origin, ancestry, citizenship status, military status, protected veteran status, religion, creed, physical or mental disability, medical condition, marital status, sex, sexual orientation, gender, gender identity or expression, age, genetic information, or any other basis protected by law, ordinance, or regulation.*Guidehouse will consider for employment qualified applicants with criminal histories in a manner consistent with the requirements of applicable law or ordinance including the Fair Chance Ordinance of Los Angeles and San Francisco.*If you have visited our website for information about employment opportunities, or to apply for a position, and you require an accommodation, please contact Guidehouse Recruiting at 1-571-633-1711 or via email at RecruitingAccommodation@guidehouse.com. All information you provide will be kept confidential and will be used only to the extent required to provide needed reasonable accommodation.*Guidehouse does not accept unsolicited resumes through or from search firms or staffing agencies. All unsolicited resumes will be considered the property of Guidehouse and Guidehouse will not be obligated to pay a placement fee.*Rewards and Benefits*Guidehouse offers a comprehensive, total rewards package that includes competitive compensation and a flexible benefits package that reflects our commitment to creating a diverse and supportive workplace.*Benefits include:*Medical, Rx, Dental & Vision Insurance*Personal and Family Sick Time & Company Paid Holidays*Parental Leave and Adoption Assistance*401(k) Retirement Plan*Basic Life & Supplemental Life*Health Savings Account, Dental/Vision & Dependent Care Flexible Spending Accounts*Short-Term & Long-Term Disability*Tuition Reimbursement, Personal Development & Learning Opportunities*Skills Development & Certifications*Employee Referral Program*Corporate Sponsored Events & Community Outreach*Emergency Back-Up Childcare Program*Position may be eligible for a discretionary variable incentive bonus","https://www.indeed.com/pagead/clk?mo=r&ad=-6NYlbfkN0DOpfXD7aCvxSiR73RUZjyy6OuclKM9Xpb799vH3iY_yIwO4XWkzYByfUjHp5qaKjU5dYOxyGmX4CyPSJ0Pcv6spzwKslOf9PaSfCp6MjSJ-XU0sLbQzPh64EQhTD2wsJhQVD54GZumu1L1lJq1ZdOfj3wsC3JYuDU8LhlDZSRd8XKHzlpBZJTQQ8y8f6Kjnxc0XogMMofSMUXsz2JOz6cyJ3dL8hDyHMzatUSgwPyBPaftHFj797G-dQKgd0OxilfzYqwUPmAMdAPgCH1Zt5cYTROYyIq_xACs5LP5I_B1zPE5Ij-ydzNag1V2QF8ZaTrViCQuxaW2dk_jt2tvtmhpBKO6ajVpzCfjIDUl4QiZ8X22jU-44ZslqhUeXHGvpbUhrXOcl3O1-oXh6TxjP6UGVoUe9obz5hukDps7n1-Kanc0hRJsKBak&p=5&fvj=0&vjs=3","On-site","Part-time","MSIS",1,0,0,0,0,0,0,0,0,0,0,0,0,0,0,0,0,0,0,0,"49b5b27e2aa766b6c7c0e4588b91e0e0"
"7","cloud engineer",2022-05-23,"Senior Production Engineer","Guidehouse","Salt Lake City, UT 84103 (Greater Avenues area)+6 locations","Overview*Guidehouse is a leading global provider of consulting services to the public and commercial markets with broad capabilities in management, technology, and risk consulting. We help clients address their toughest challenges and navigate significant regulatory pressures with a focus on transformational change, business resiliency, and technology-driven innovation. Across a range of advisory, consulting, outsourcing, and digital services, we create scalable, innovative solutions that prepare our clients for future growth and success. The company has more than 10,000 professionals in over 50 locations globally. Guidehouse is a Veritas Capital portfolio company, led by seasoned professionals with proven and diverse expertise in traditional and emerging technologies, markets, and agenda-setting issues driving national and global economies. For more information, please visit: www.guidehouse.com.Responsibilities*This position is for the AFNWC ICBM Directorate ISC 2.0 project.Senior level production-engineering services AND technical leadership of engineering teamPerforms a variety of engineering analysis tasks which are broad in nature and are concerned with the design and implementation, including personnel, hardware, software and support facilities and/or equipmentPerforms with some latitude for un-reviewed actions and decisionsPlans and performs analysis of engineering research, design development, and other assignments in conformance with design, engineering and customer specificationsResponsible for the technical/analysis/engineering part of a major project with complexity and importanceCoordinates the activities of Technicians assigned to specific analysis/engineering projectsMay perform other duties as assignedQualifications*Minimum SECRET security clearance.Required:BS Degree in any engineering discipline + 10 years of related engineering experience ORBS Degree in any engineering discipline AND MS Degree in any engineering discipline + 7 years of related engineering experience ORBS and/or MS Degree in an engineering discipline AND PhD Degree in any engineering discipline + 4 years of related engineering experienceSystems Engineering Experience and/or Certification*Professional Engineering License desired3+ yrs of progressive responsibility in providing technical leadershipSenior skill set includes ability to perform all stated/implied duties within this tier and those reasonably derived from preceding tier*Desired:*ICBM experience desired*TS clearance desired*Contractor shall obtain and maintain certificaitons as required by current versions of AFMAN 17-1303, DoDi 8570.01-M and other applicable lasw and regulations.Additional Requirements*The successful candidate must not be subject to employment restrictions from a former employer (such as a non-compete) that would prevent the candidate from performing the job responsibilities as described.*Due to our contractual requirements and an Executive Order from the White House, every federal government employee and onsite federal contractor will be asked to attest to their vaccination status. In the interest of health and safety during the continued unprecedented COVID-19 pandemic, anyone who does not attest to being fully vaccinated will be required to follow CDC guidelines which may include (subject to specific contractual requirements): wearing a mask on the job no matter their geographic location, physically distancing from all other employees and visitors, complying to any screening testing requirements. This requirement will apply to Guidehouse employees who work onsite for the federal government.*Due to our contractual requirements, to be eligible for this role, you must be fully COVID-19 vaccinated at time of hireDisclaimer*About Guidehouse*Guidehouse is an Equal Employment Opportunity / Affirmative Action employer. All qualified applicants will receive consideration for employment without regard to race, color, national origin, ancestry, citizenship status, military status, protected veteran status, religion, creed, physical or mental disability, medical condition, marital status, sex, sexual orientation, gender, gender identity or expression, age, genetic information, or any other basis protected by law, ordinance, or regulation.*Guidehouse will consider for employment qualified applicants with criminal histories in a manner consistent with the requirements of applicable law or ordinance including the Fair Chance Ordinance of Los Angeles and San Francisco.*If you have visited our website for information about employment opportunities, or to apply for a position, and you require an accommodation, please contact Guidehouse Recruiting at 1-571-633-1711 or via email at RecruitingAccommodation@guidehouse.com. All information you provide will be kept confidential and will be used only to the extent required to provide needed reasonable accommodation.*Guidehouse does not accept unsolicited resumes through or from search firms or staffing agencies. All unsolicited resumes will be considered the property of Guidehouse and Guidehouse will not be obligated to pay a placement fee.*Rewards and Benefits*Guidehouse offers a comprehensive, total rewards package that includes competitive compensation and a flexible benefits package that reflects our commitment to creating a diverse and supportive workplace.*Benefits include:*Medical, Rx, Dental & Vision Insurance*Personal and Family Sick Time & Company Paid Holidays*Position may be eligible for a discretionary variable incentive bonus*Parental Leave and Adoption Assistance*401(k) Retirement Plan*Basic Life & Supplemental Life*Health Savings Account, Dental/Vision & Dependent Care Flexible Spending Accounts*Short-Term & Long-Term Disability*Tuition Reimbursement, Personal Development & Learning Opportunities*Skills Development & Certifications*Employee Referral Program*Corporate Sponsored Events & Community Outreach*Emergency Back-Up Childcare Program","https://www.indeed.com/pagead/clk?mo=r&ad=-6NYlbfkN0DOpfXD7aCvxSiR73RUZjyy6OuclKM9Xpb799vH3iY_yIwO4XWkzYByfUjHp5qaKjU5dYOxyGmX4DU3O2fF0UhRFhdefUlKOCb125DBCg5OQNp5uXP_8PhQGbgi4wG1StpbH11dbaKBzSFXC1x6wjTFTsH6d3AIeqUsI-Omo0TmO2y6V3Wu3HjzK4BsrBMHBW60JzX1lSWqRCzEuKtqaJaT_fefRKwlP9FA7N59STtmy0bLHIw8Vc7nfwOr8NRI2gH7NEMnEeQJbpM8yneT-X19LVOyNdTNRoAi0jFsgQXy0k-D8-HiTAiEnB7cC0E7FHB6tsKvH26C4iA933y48XAaVYT41a8LBIW89ASQob9kdZf1n2tKxSk0qwMXYZlJZfafWUBUVg-T_7upPkubotleRfMlmr9LKDLfqQ3v5mSTlp3sJg7AyMRZ&p=10&fvj=0&vjs=3","On-site","Part-time","MSIS",0,0,0,0,0,0,0,0,0,0,0,0,0,0,0,0,0,0,0,0,"40af6be339fe93d86703a28fc0496377"
"8","cloud engineer",2022-05-23,"Senior Systems Engineer","Guidehouse","Syracuse, UT 84075+4 locations","Overview*Guidehouse is a leading global provider of consulting services to the public and commercial markets with broad capabilities in management, technology, and risk consulting. We help clients address their toughest challenges and navigate significant regulatory pressures with a focus on transformational change, business resiliency, and technology-driven innovation. Across a range of advisory, consulting, outsourcing, and digital services, we create scalable, innovative solutions that prepare our clients for future growth and success. The company has more than 10,000 professionals in over 50 locations globally. Guidehouse is a Veritas Capital portfolio company, led by seasoned professionals with proven and diverse expertise in traditional and emerging technologies, markets, and agenda-setting issues driving national and global economies. For more information, please visit: www.guidehouse.com.Responsibilities*This position is for the AFNWC ICBM Directorate ISC 2.0 project.*Systems Engineering Experience and/or Certification*progressive responsibility in providing technical leadership*Able to create unified user experiences throughout a given application*Experienced with developing and orchestrating usability studies and addressing issues that are discovered*Provide technical direction for development, engineering, interfacing, integration and testing of complex hardware/software systems, including requirements elicitation and analysis & functional allocation*Conduct system requirements reviews*Develop concepts of operation & interface standards*Develop system architectures*Perform technical and nontechnical assessment & mgmt*End-to-end flow analysis*Generating and reviewing designs for technical accuracy, completeness and appropriateness*Skill set includes ability to perform all stated/implied duties within the level/ tier and those reasonably derived from preceding tiers*Provide positions level of systems-engineering services AND*Depending on level - Technical leadership of engineering teamQualifications*Minimum SECRET security clearance.*Senior: BS Degree in any engineering discipline + 10 yrs of engineering experience OR MS Degree in any engineering discipline + 7 yrs engineering experience OR PhD Degree in any engineering discipline +4 yrs related engineering experience*DESIRED:*Relevant core and advanced certifications as established/required per local, national and international industry standards or as necessitated by performance expectations associated with level of appointment*> ICBM experience preferred*> TS clearance desired*Professional Engineering License desired*Systems Engineering Certification desiredAdditional Requirements*The successful candidate must not be subject to employment restrictions from a former employer (such as a non-compete) that would prevent the candidate from performing the job responsibilities as described.Disclaimer*About Guidehouse*Guidehouse is an Equal Employment Opportunity / Affirmative Action employer. All qualified applicants will receive consideration for employment without regard to race, color, national origin, ancestry, citizenship status, military status, protected veteran status, religion, creed, physical or mental disability, medical condition, marital status, sex, sexual orientation, gender, gender identity or expression, age, genetic information, or any other basis protected by law, ordinance, or regulation.*Guidehouse will consider for employment qualified applicants with criminal histories in a manner consistent with the requirements of applicable law or ordinance including the Fair Chance Ordinance of Los Angeles and San Francisco.*If you have visited our website for information about employment opportunities, or to apply for a position, and you require an accommodation, please contact Guidehouse Recruiting at 1-571-633-1711 or via email at RecruitingAccommodation@guidehouse.com. All information you provide will be kept confidential and will be used only to the extent required to provide needed reasonable accommodation.*Guidehouse does not accept unsolicited resumes through or from search firms or staffing agencies. All unsolicited resumes will be considered the property of Guidehouse and Guidehouse will not be obligated to pay a placement fee.*Rewards and Benefits*Guidehouse offers a comprehensive, total rewards package that includes competitive compensation and a flexible benefits package that reflects our commitment to creating a diverse and supportive workplace.*Benefits include:*Medical, Rx, Dental & Vision Insurance*Personal and Family Sick Time & Company Paid Holidays*Position may be eligible for a discretionary variable incentive bonus*Parental Leave and Adoption Assistance*401(k) Retirement Plan*Basic Life & Supplemental Life*Health Savings Account, Dental/Vision & Dependent Care Flexible Spending Accounts*Short-Term & Long-Term Disability*Tuition Reimbursement, Personal Development & Learning Opportunities*Skills Development & Certifications*Employee Referral Program*Corporate Sponsored Events & Community Outreach*Emergency Back-Up Childcare Program","https://www.indeed.com/pagead/clk?mo=r&ad=-6NYlbfkN0DOpfXD7aCvxSiR73RUZjyy6OuclKM9Xpb799vH3iY_yIwO4XWkzYByfUjHp5qaKjU5dYOxyGmX4OrpnBw0ihhh3KeOiweO0SLiWWQYgyuxsOhGLctZEOaxUfvTA9q0Y8NJVgPvRYp9G3cPAfzVSFfa10siZO3NxisuckhXHUX-_yoOPG8uiOWvP0DOVp3gq4FY3lttZzAuT_ifOLPvy7e9ickVwFFQux4ylM-dW7BAfC7DNeHYPY0RbAbndr-FvQOT49-liXSfovWaAoPXrQptG8CmPu0IHOug-tGGGMSfOrSsrv0CLePKLeUlvXWUxpn4Ev8fRxG7sQlh9rCKgkKfNsk581ExOivfldIefMW3BrL51v2JypvjUbUuRuECmsNY92l5FDTKF__kbLsWNfdNOoNdVqfmkFCFoO2HJYtJHVASHgu6RqbK&p=12&fvj=0&vjs=3","On-site","Part-time","MSIS",1,0,0,0,0,0,0,0,0,0,0,0,0,0,0,0,0,0,0,0,"0c20a03c5e402553d9e290d9f64ba8ea"
