"","Search","Date","Title","Company","Location","Description","Link","Work Model","Job_Type","Program","R","Python","SQL","Tableau","PowerBI","Azure","Excel","Talend","SAS","Spark","Qualtrics","Domo","Salesforce","SAP","Hadoop","Qlik","Looker","Zoho","Stata","Snowflake","ID"
"48","security manager",2022-07-23,"University Event & Experience Manager","ROCKY MTN UNIVERSITY OF HEALTH","Provo, UT 84606","* REPORTING RELATIONSHIPS*  Position Reports to: Sr. Director of University Marketing & Communications (UMC)*  Positions Supervised: None*  COMPENSATION*  Commensurate with experience*  POSITION PURPOSE*  The University Events & Experience Manager is responsible for enhancing and elevating the RMU experience for students, employees, alumni, community members, and VIPs through special events, sponsorships, the university store, and through other events and experiences that support RMU’s mission, vision, and strategic plan. This individual will direct and manage the planning, coordinating, and implementation of university events and sponsorships throughout the year while expanding current event strategies and assessment metrics to meet the highest level of consistent excellence, service, and professional standards. This position will also manage the day-to-day responsibilities of the University Store.* *  ESSENTIAL FUNCTIONS AND RESPONSIBILITIES*  Planning Annual and Special Events*    Presidential Events*     Founders Day*     White Coat Ceremonies*     Award Banquets*     Commencement*     Convocations*     Residential New Student Orientation*     Clinical Send-Off Celebrations*     Fundraising Gala*     Community Engagement Events*     Other events as assigned*   * *  Event Logistics, Coordination and Collaboration*    Plan, lead, and produce events held on behalf of the University meeting the highest level of consistent excellence, service, and professional standards*     Oversee all aspects of Presidential level events including breakfasts, lunches, dinners, receptions, and any other related event programming*     Manage, direct, collaborate, and communicate with university executive leadership team, academic leadership teams, employees, volunteers, vendors, and special guests during the entire event planning process*     Administer, develop, and implement annual event budgets, negotiate contracts with vendors, and oversee major purchasing and contracts for events*     Track event and team KPIs*     Direct and plan all event logistics, which include but are not limited to timelines, assigned tasks/expectations, track expenditures and expense reporting, apparel/gift purchasing, award(s) purchases, programs (content collection/design/printing), creation of event day signage, venue reservations/walkthroughs/AV checks/set-up, catering, guest list and VIP lists, transportation of equipment/supplies, scheduling photographer and/or videographer.*     Correspond and interact with personnel from attending/participating organizations*     Create and maintain database of external vendor information on venues, catering, photography, apparel, etc.*     Manage event reports and materials in support of events*     Collaborate with UMC team to create event marketing plan and materials*     Manage event invitation lists and guest communications*     Develop and direct the promotion and awareness of events*     Direct and assist on-site events with set-up, event management duties, and tear-down*     Coordinate with campus departments, including IT and A/V teams, to successfully execute virtual events*     Input events into university-wide calendar*     Other duties as assigned*   * *  University Experience*    Create and manage experiences that build brand loyalty and affinity with RMU students, alumni, employees, community members, and key constituents*     Identify and evaluate new opportunities to elevate the RMU experience*     Develop and implement a positive customer experience strategic plan*     Collaborate with University Marketing & Communication team members to build a positive brand image and increase brand awareness*     Secure feedback from students, alumni, employees, and key campus stakeholders on the RMU experience*     Other duties as assigned*   * *  Sponsorships*    Maintain annual sponsorship relationships and pay dues/fees*     Research and secure new community sponsorship opportunities that advance the University’s mission, vision, and community engagement strategies*     Coordinate sponsorships and activities related to those sponsorships*     Measure impact and effectiveness of sponsorships*     Other duties as assigned*   * *  University Store*    Manage day-to-day operations of the store*     Order new items to sell and restock current inventory*     Manage monthly inventory check*     Collaborate with UMC Marketing Coordinator to ensure the RMU online store website is current, user friendly, and provides a great customer experience*     Fulfill all online store orders*     Collaborate with Operations and Front Desk Receptionist to fulfill in-store purchases*     Other duties as assigned*   * * PERFORMANCE MEASUREMENTS*  Six-Month Performance Evaluation*   Annual Performance Evaluation* *  POSITION COMPETENCIES*  Ability to Listen to Customers*   Adaptability*   Creativity*   Communication*   Development of Self*   Job Knowledge/Skill Application*   Champions Innovation*   Drives for Results*   Collaboration*   Integrity*   Critical Thinking*   Initiative*   Student/Customer-Centeredness*   Develops & Inspires Others*   Develops Strategic Perspective*   Financial Accountability* * WORKING QUALIFICATIONS/REQUIREMENTS/CONDITIONS* *  *    Education/Certification:*    Bachelor’s degree from an accredited college or university (Master’s degree preferred) in a directly related field with three years’ experience related to the Summary of Duties or combination of education and/or experience totaling five to six years.*  *  *    Required Knowledge:*    Must possess strong computer skills and software, including but not limited to Google Suite, Microsoft Office, and Adobe Products*     Knowledge of proper grammatical and editing skills*     Strategic planner*     Knowledge of maintaining and tracking budgets and store inventory*     Knowledge of office productivity software.*     Knowledge of event features, including planning, marketing, and production from inception to post-event assessment.*     Knowledge of fundraising and donor stewardship procedures, techniques, and best practices.*   *  *    Experience Required:*    Experience working on high-profile events for a university or within a C-suite environment.*     Experience working with high level donors, key stakeholders, and institution leadership.*     Proven ability to lead and manage multiple tasks, handle concurrent projects with accuracy, diplomacy and discretion as a team leader and a team member.*     Experience in academic or professional setting preferred*     3-5+ years’ experience in event planning or project management*     Experience in volunteer management.*     Experience with and knowledge of event physical layout, invitation list development, RSVP tracking, seating management, program development and scheduling, ticketing, catering, audiovisual services, special needs, event or speaker security.*     Experience managing budgets and vendor contracts.*     Strong writing and editorial skills.*     Demonstrated human relations and communication skills; a commitment to providing excellent customer service in a fast-paced environment*   *  *    Preferred Experience:*    Experience and knowledge of marketing and public relations best practices*     Experience and knowledge of social media platforms, trends, and strategies*     Basic skills in graphic design*   *  *    Skills/Abilities:*    Exceptional verbal and interpersonal communication skills.*     Excellent organizational skills and the ability to pay attention to details.*     Proficient in Google Suite and Microsoft Office*     Excellent project management skills*     Strong time management, organizational, prioritization, and creativity skills*     Ability to create and foster professional relationships internally and externally*     Ability to work collaboratively and independently*     Tech savvy*     Strong conflict resolution skills*     Familiarity with contractual agreements pertaining to event planning and sponsorships*     Ability to maintain professional demeanor while working under deadlines and multiple projects/events at once*     Flexibility to work some evenings and weekends when required*     Able to lift up to 30 pounds*     Possess a valid driver’s license*     Ability to work longer hours as occasionally needed*   *  *    Travel*    Some travel will be required during regular business hours, evenings, and weekends*   * * *  PHYSICAL ACTIVITIES AND REQUIREMENTS OF THIS POSITION* *  *    Finger dexterity:*    Using primarily just the fingers to make small movements such as typing, picking up small objects, or pinching fingers together*  *  *    Talking:*    Especially where one must convey detailed or important instructions or ideas accurately, loudly, or quickly*  *  *    Average Hearing:*    Able to hear average or normal conversations and receive ordinary information*  *  *    Average Visual Abilities:*    Average, ordinary visual acuity necessary to prepare or inspect documents or products, or operate machinery*  *  *    Physical Strength:*    Sedentary work. Sitting most of the time. Exerts up to 10 lbs. of force occasionally (Almost all office jobs)*  * * *  WORKING CONDITIONS* *   None:*   No hazardous or significantly unpleasant conditions (Such as in a typical office)* * *  MENTAL ACTIVITIES AND REQUIREMENTS OF THIS POSITION* *  *    Reasoning Ability:*   *     Ability to deal with a variety of variables under only limited standardization*     Able to interpret various instructions*   *  *  *    Mathematics Ability:*    Ability to perform basic math skills, use decimals to compute ratios and percentages, and draw and interpret graphs*  *  *    Language Ability:*   *     Ability to read a variety of books, magazines, instruction manuals, atlases, and encyclopedias; Ability to prepare memos, reports, and essays using proper punctuation, spelling, and grammar*     Ability to communicate distinctly with appropriate pauses and emphasis; correct pronunciation (or sign equivalent); and variation in word order using present, perfect, and future tenses*   *  * * *  INTENT AND FUNCTION OF JOB DESCRIPTIONS*  Job descriptions assist organizations in ensuring that the hiring process is fairly administered and that qualified employees are selected. They are also essential to an effective appraisal system and related promotion, transfer, layoff, and termination decisions. Well-constructed job descriptions are an integral part of any effective compensation system.*  All descriptions have been reviewed to ensure that only essential functions and basic duties have been included. Peripheral tasks, only incidentally related to each position, have been excluded. Requirements, skills, and abilities included have been determined to be the minimal standards required to successfully perform the positions. In no instance, however, should the duties, responsibilities, and requirements delineated be interpreted as all-inclusive. Additional functions and requirements may be assigned by supervisors as deemed appropriate.*  In accordance with the Americans with Disabilities Act, it is possible that requirements may be modified to reasonably accommodate disabled individuals. However, no accommodations will be made which may pose serious health or safety risks to the employee or others or which impose undue hardships on the organization.*  Job descriptions are not intended as and do not create employment contracts. RMUoHP maintains its status as an at-will employer. Employees can be terminated for any reason not prohibited by law.*  Rocky Mountain University is an Equal Opportunity Employer.*","https://www.indeed.com/rc/clk?jk=23a095321013c440&fccid=dd616958bd9ddc12&vjs=3","On-site","Part-time","MSCM",0,0,0,0,0,0,1,0,0,0,0,0,0,0,0,0,0,0,0,0,"40f75684e63c51b4e165994b91606281"
"49","data architect",2022-07-23,"GCP Cloud Architect","Softvision - North America","Remote in Salt Lake City, UT 84101","* About Cognizant Softvision*  Cognizant Softvision is a leading software product engineering company, creating impactful end-to-end digital products and solutions that connect brands with customers. Delivering sustainable innovation, agility and a connection that inspires engagement and business transformation, we’ve worked with some of the world’s largest leading brands.*  Cognizant Softvision has more than 5,000 product, design and engineering professionals across a network of global studios in 9 countries and five continents. Learn how Cognizant Softvision designs experiences and engineers outcomes that result in memorable interactions at www.cognizantsoftvision.com or follow us @WeAreSoftvision.* *  Join a fast-paced development team that offers tons of opportunities for working on complex, exciting projects in the cloud space.*  As a Google Cloud Architect at Softvision, you'll participate with cloud vendors in training and in early previews of new features. Plus, you'll collaborate with leaders in the field, deepening your skillset and knowledge-sharing with our community of technical experts.*  This role requires, background in developing software applications, and a current strong knowledge of designing, building, and advising clients on the implementation of an GCP cloud ecosystem. All aspects of the cloud native application capabilities (including the skills to develop apps in containers and Kubernetes), configuration of optimized landscape to manage legacy and modern deployments. Experience in building DevOps pipelines for the enterprise (100’s of developers and actors), and significant experience in data center migrations to GCP.*  We are looking for an exceptional Cloud-Native Google Cloud Architect to work with our cross-functional team, and join our world-class community of talented experts.*  Must have capabilities:*  Highly adept at brainstorming, building trust, listening, and presenting ideas to POs/Managers and senior-level executives *  Self-starter who is comfortable with ambiguity – needs to be someone who is creative & likes to do exploratory work; should be comfortable presenting ideas that may or may not be adapted, working in a bit of a vacuum, etc *  Extensive GCP public cloud experience. *  Know how to set up, and configure build servers (Azure DevOps, Bitbucket Pipelines, Jenkins, etc.) *  Knowledge around how to deploy apps based on their language and type *  Understanding of the entire CI/CD/CD process, ability to design new CI/CD pipeline architecture, process, and mentor clients *  Understanding of various deployment models and techniques *  Understanding of monitoring, alerting, and automated response *  Experience architecting and building containerization platforms; Docker, Kubernetes (preferably EKS or AKS) *  Working knowledge on setting up automated testing *  Familiar with 12-Factor and SOLID Application Architecture principles and Microservices *  Prior experience in a hands-on .development (Java or .Net) capacity *  Must currently reside in the continental USA and be authorized to work for any employer *  Implement and monitor an GCP cloud infrastructure *  Implement management and security solutions *  Implement and manage data platforms (PaaS) *  Design monitoring *  Design identity and security *  Design data storage *  Design business continuity *  Design infrastructure *  Develop an instrumentation strategy* *  We are a thriving Community of top technology talent that is globally connected. We Engage, Make, Run and Evolve the technology that makes many brands that you know and love. So let’s take this journey together. No matter where you are on your digital career roadmap, we can help you grow and have fun doing it.*  Cognizant Softvision is an Equal Opportunity Employer. No 3rd Party Agency Candidates.*  This is a remote position.*","https://www.indeed.com/rc/clk?jk=3feaf41eb611b506&fccid=fdecc94562ee0d71&vjs=3","Remote","Part-time","MSIS",0,0,0,0,0,1,0,0,0,0,0,0,0,0,0,0,0,0,0,0,"5e0092338e5d3fa4fd0a4afcf1a78cb3"
"50","cybersecurity manager",2022-07-23,"Agency Information Privacy Manager","State of Utah","Salt Lake City, UT 84129","JOB *Agency Information Privacy ManagerOpen until FilledDo you have experience providing strategic-level guidance on understanding how data collection and usage, and the associated risks, all factor into an organization's data-to day business operations? Do you have experience interpreting a range of legal, regulatory, contractual, and other factors that impact data and information and the organization's risk management strategy? The Utah Department of Health and Human Services (DHHS) seek you as the Agency’s Information Privacy Manager. You will act in close coordination with DHHS programs to manage and implement the information privacy and security programs.In this position, you will represent and promote information privacy and its applicability to security in discussions with leadership and key stakeholders, including executive leadership, regulators, provider communities, technical partners and vendors.You must have strong leadership, communication, interpersonal relationship skills, good risk acumen, practical experience working with information privacy laws (such as PCI-DSS, HIPAA, FERPA, Part 2, IRS 1075, FIPS, and data breach reporting laws), the relationship with security requirements applicable to DHHS and, understanding of generally accepted information privacy and security principles and accepted industry practice, and designing and implementing information privacy, security and compliance programs for a large organization.Principle Duties: Develop and maintain a consolidated DHHS information privacy and compliance program to manage risk across the agency.Develop and maintain information privacy policies, procedures, and control techniques to address applicable DHHS-wide requirements.Develop strategies for the continuous improvement of the department’s privacy and security posture and support enabling technologies and programs to achieve desired agency outcomes.Manage incident response activities, documentation, and regulatory reporting. Accurately reporting to the Information Privacy and Security (IPS) Director who will inform the Executive Leadership Team on privacy incidents within DHHS.Work directly with the IPS Director and IT partners to define and measure the execution of the privacy and security programs and facilitate reporting to all stakeholders.Assess business operations and opportunities against information privacy risks that may potentially compromise DHHS and communicate risks to all stakeholders.Lead multiple teams responsible for the information security and privacy strategy, governance, risk assessment, compliance, and awareness/engagement functions.Implement strategies to attract, develop and retain exceptional, diverse information privacy and security talent.Foster collaborative working relationships with information privacy and security stakeholders across the Departments (IT, data managers, operations, purchasing, finance, legal, risk management, and internal audit).Oversee management of information security and privacy tools, contracts, budgets, documentation, standards, and processes to ensure an operating environment that is sound, sustainable, and compliant with department policies and requirements.The Ideal Candidate: Has experience providing written deliverables, giving oral presentations, and the ability to facilitate crucial conversations at all levels of the organization and with many different stakeholders.Has at least 7 years of enterprise information privacy/security management experienceHas at least 5 years of experience managing regulatory compliance programs (HIPAA, CJIS, PCI, etc).Has broad, current knowledge of cybersecurity and privacy domains, technologies, and vendor capabilities.Has obtained a Bachelor’s degree or higher in a field with application to information technology, computer science, and/or privacy and security.PreferenceMay be given to current DHHS employees.Why You Should Join Our TeamBecome an integral part of the Utah Department of Human Services. Experience a sense of achievement for a job well done and enjoy work life balance! We offer great health benefits and retirement plans, generous paid time off, and a balanced work schedule to afford quality time spent with your family. Click to see what makes working for the State of Utah awesome: Compensation & Benefits.The AgencyContribute to our communities and proactively support the Department of Health and Human Services by helping us keep children safe and strengthen families. Click here to view our website.Supplemental InformationRisks found in the typical office setting, which is adequately lighted, heated and ventilated, e.g., safe use of office equipment, avoiding trips and falls, observing fire regulations, etc.Typically, the employee may sit comfortably to perform the work; however, there may be some walking; standing; bending; carrying light items; driving an automobile, etc. Special physical demands are not required to perform the work.","https://www.indeed.com/rc/clk?jk=97a4ebf7df9313e4&fccid=a9dfcf89bb8a97bb&vjs=3","On-site","Part-time","MSCM",0,0,0,0,0,0,0,0,0,0,0,0,0,0,0,0,0,0,0,0,"8bfade587ff3b3b9c41190cb2ef9b952"
