"","Search","Date","Title","Company","Location","Description","Link","Work Model","Job_Type","Program","R","Python","SQL","Tableau","PowerBI","Azure","Excel","Talend","SAS","Spark","Qualtrics","Domo","Salesforce","SAP","Hadoop","Qlik","Looker","Zoho","Stata","Snowflake","ID"
"1","chief information security officer",2022-08-24,"3M HIS Senior Security Risk Assessor","3M","Salt Lake City, UT 84123","** *  Job Description:* * * *   3M HIS Senior Risk Assessor* * * *   Collaborate with Innovative 3Mers Around the World* * *   Choosing where to start and grow your career has a major impact on your professional and personal life, so it’s equally important you know that the company that you choose to work at, and its leaders, will support and guide you. With a diversity of people, global locations, technologies and products, 3M is a place where you can collaborate with 96,000 other curious, creative 3Mers.* * * *   “For more than 30 years at 3M, I’ve seen firsthand how it’s a place where curious, creative and collaborative people thrive and build a rewarding career. As a leader in this company, my goal is to ensure each 3Mer sees and feels the positive impact we’re making around the world” – Mike Roman, chief executive officer and chairman of the board at 3M* * * *   This position provides an opportunity to transition from other private, public, government or military environments to a 3M career.* * * *   The Impact You’ll Make in this Role* * *   As a Sr. Security Risk Assessor you will support the various Risk Assessment activities for the Business, forming partnerships with IT groups, business groups, project teams to perform certification compliance assessments and evidence submission for implemented systems including applications, infrastructure, and databases, on-premise and in the Cloud.* * * *   Primary Responsibilities include but are not limited to the following:* *  Manage multiple concurrent Risk Assessments against 3M Systems and Products, coordinating with: Architecture, Vulnerability Management, Third Party Risk, Cloud Operations, Product and Business Teams.*   Perform security risk analysis and compliance assessments as necessary in accordance with industry ""best practice"" to deliver comprehensive, contextualized, actionable information.*   Working with the business and product teams to capture risk, compensating controls, and advise on remediation plans.*   Affirm and advance various stakeholder's understanding of, and their responsibilities with respect to, the Security Frameworks and regulatory compliance.*   Contribute ""best practices"" in terms of findings, checklists, templates, testing methods, and techniques to support and advance a ""best of breed"" Security Assessment program.*   Provide periodic, dynamic updates on security assessment analysis and security posture with an emphasis on deliverables.*   Promote information security as an enabler of the organization's core business processes.*   Uphold the maxim of “Accuracy, Consistency, and Alignment” for all deliverables.*   Maintains a strong process owner focus and developing productive working relationships. Build an extensive network of positive relationships throughout 3M and its technology organizations to be leveraged to accomplish the broad requirements of this position.*   Ability to work independently, with limited required direction and guidance.*   Possesses excellent verbal and written communication skills and strong analytical abilities.*   Actively participates in relevant corporate programs/initiatives, complies with professional and quality standards complies with corporate policies and procedures, and acts in a manner consistent with 3M’s values and ethical standards.* * *   Your Skills and Expertise* * *   To set you up for success in this role from day one, 3M requires (at a minimum) the following qualifications:* *  Bachelor’s Degree or higher (completed and verified prior to start) from an accredited institution* *   OR* *  High School Diploma/GED (completed and verified prior to start) and twelve (12) years of Information Security or Application Security experience* *  Five (5) years of experience with application security*   Five (5) years of experience in risk management*   Ability to understand complex enterprise applications and identify risks associated with authentication, data management, and other key integrations* * *   Preferred Qualifications:* *  An advanced certification such as in Risk (CRISC), Security (CISSP, CISM) or Audit (CISA).*   Experience with Cloud Architecture and Cloud Security Controls* * *   Location: Remote* * *   Travel: May include up to 10% travel* * *   Relocation Assistance: May be authorized* * * *   Must be legally authorized to work in country of employment without sponsorship for employment visa status (e.g., H1B status).* * * *   Supporting Your Well-being* * *   3M offers many programs to help you live your best life – both physically and financially. To ensure competitive pay and benefits, 3M regularly benchmarks with other companies that are comparable in size and scope.* * * *   Resources for You* * *   For more details on what happens before, during and after the interview process, check out the Insights for Candidates page at 3M.com/careers.* *  Learn more about 3M’s creative solutions to the world’s problems at www.3M.com or on Twitter @3M.*  Responsibilities of this position include that corporate policies, procedures and security standards are complied with while performing assigned duties.*  Our approach to flexibility is called Work Your Way, which puts employees first and drives well-being in ways that enable 3M’s business and performance goals. You have flexibility in where and when work gets done. It all depends on where and when you can do your best work.*  Pay & Benefits Overview: https://www.3m.com/3M/en_US/careers-us/working-at-3m/benefits/*  3M is an equal opportunity employer. 3M will not discriminate against any applicant for employment on the basis of race, color, religion, sex, sexual orientation, gender identity, national origin, age, disability, or veteran status.* * *   Please note: your application may not be considered if you do not provide your education and work history, either by: 1) uploading a resume, or 2) entering the information into the application fields directly.* * * *   3M Global Terms of Use and Privacy Statement* * *   Carefully read these Terms of Use before using this website. Your access to and use of this website and application for a job at 3M are conditioned on your acceptance and compliance with these terms.* **","https://www.indeed.com/rc/clk?jk=d1f51dbb3f04b3ca&fccid=595d42593839d3a2&vjs=3","Remote","Part-time","MSCM",0,0,0,0,0,0,1,0,0,0,0,0,0,0,0,0,0,0,0,0,"c96dd9053e6c3a0ef3dd4ebcb138fc39"
"2","business intelligence analyst",2022-08-24,"Resource Analyst","Airport Terminal Services Inc","Salt Lake City, UT 84122 (Westpointe area)","* *  *   *    SUMMARY: The position owns the demand and labor planning for our Canada airport operations. This includes taking airline flight schedules and developing the staffing needs based on demand and budgetary requirements. Creating, editing, and planning specific employee schedules for our larger Canadian operations, such as Vancouver and Calgary. Creating staffing and labor demand based upon specific customer pro formas using established staffing requirements, such as hours per flight or minimal staffing requirements. The role will involve summarizing and communicating business analytics for labor and how it is tied to the operational and financial effectiveness of the business. In addition, this position will be responsible for contributing to and utilizing standardized dashboards; financial models, performance metrics, and executive-level reporting packages. The position will also analyze, report, and make appropriate recommendations that will positively impact business performance. This position will report directly to the Director of BI Systems.*    *     ESSENTIAL DUTIES AND RESPONSIBILITIES*     Interpret airline flight schedules via Sabre StaffPlanner and Sabre RosterMaker*      Use Sabre products to develop a working labor plan that meets service, safety requirements, and stays in line with budget requirements*      Ensure key labor metrics are met (Cost of Labor %, average hours per flight, non-billable overtime, etc)*      Transition approved labor plan into a working employee schedule, ensuring accuracy to key metrics established*      Prepares and analyze routine labor reports utilizing company systems such as Power BI, Kepion, NOVAtime, and ADP to balance against authorized hours and dollars for Canada operations*      Present and communicate findings and works with the Business Unit Leader, Executive Leadership Team, Customers, or other stakeholders to identify and implement strategies that will address tactical and strategic goals*      Weekly analysis of Actual financials and operations stats compared to Target and Budget: special focus on Labor % of Sales, HPF, Revenue, Net Income, Variables/Fixed expenses, etc*    *     MINIMUM REQUIREMENTS*     Must be at least 18 years of age*      Bachelor’s Degree in computer science, mathematics, operations, management, or a related field/equivalent experience*      Strong computer and math skills required*      Must have analytical background and passion for analysis*      Must pass a drug test and background check*    *     BACKGROUND QUALIFICATIONS*     A minimum of 3 years’ experience and success in Analysis and Reporting*      Experience in and understanding of a wide variety of analytical processes (governance, measurement, etc.)*      Excellent written and verbal communication skills*      Excellent presentation skills*      Experience managing projects and teams*      Proven ability to complete projects and achieve results in an ambiguous work environment*      Proven skills to work effectively across internal functional areas in ambiguous situations*    *     LOCATION/SPECIFIC WORKING HOURS*     Location: Vancouver, British Columbia, remote*      Must be able to work extended hours on short notice*      Some travel may be required*    *     M/F Disabled and Vet EEO/AA Employer*   *  * **","https://www.indeed.com/rc/clk?jk=7f255ef06f7f698b&fccid=73a6babd0683ab80&vjs=3","Remote","Part-time","MSIS",0,0,0,0,0,0,1,0,0,0,0,0,0,0,0,0,0,0,0,0,"fefa9271b2ef405c85f9d60d7bdd7640"
"3","security manager",2022-08-24,"Security Site Supervisor - EMT","Allied Universal","Salt Lake City, UT 84111 (Central City area)","* *  Allied Universal®, North America’s leading security and facility services company, provides rewarding careers that give you a sense of purpose. While working in a dynamic, diverse and inclusive workplace, you will be part of a team that fuels a culture that will reflect in our communities and customers we serve. We offer medical, dental and vision coverage, life insurance, 401K, employee assistance programs, company discounts, perks and more for all full-time positions!* * *   Now Hiring Professional Security Guard* * *   $21.50/Hr* * *   Great Benefits* * *   Uniforms Provided* * *   Weekly Pay* * *   Daily Pay Option* * *   EMT License Required* *  * * *  APPLY NOW!* *  * * Allied Universal Services is seeking the position of a Security Site Supervisor.*  * The Security Site Supervisor will supervise and coordinate the delivery of quality services to an assigned customer. The Security Site Supervisor will act as a liaison between customers, Operation Managers and security officers. They will supervise site staff and provide coaching, recognition and discipline within approved empowerment range.*  * QUALIFICATIONS/REQUIREMENTS:*  Be at least 21 years of age with high school diploma or equivalent*   Possess effective written and oral communication and interpersonal skills with ability to deal with all levels of personnel and the general public in a professional and effective manner*  *   *     Licensing requirements are subject to state and/or local laws and regulations and may be required prior to employment.*   *   As a condition of employment, employee must successfully complete a background investigation and a drug screen in accordance with all federal, state, and local laws*   Display exceptional customer service and communication skills*   Have intermediate computer skills to operate innovative, wireless technology at client specific sites*   Ability to handle crisis situations at the client site, calmly and efficiently*   Capably utilize scheduling and billing software to produce reports (such as Scheduling Activity, Training Detail reports, etc.) that require interpretation and action for effective business management*   Enforce Contract Standards*   Administers site safety programs outlining site-specific hazards for security officers including vehicle / driving safety as appropriate to corporate procedures*   Prepared to participate in unemployment hearings*   Enforces Allied Universal’s policies as outlined in the handbooks and executive memos *  Able to:*    Work in various environments such as cold weather, rain/snow or heat*     Occasionally lift or carry up to 40 pounds*     Climb stairs, ramps, or ladders occasionally during shift*     Stand or walk on various surfaces for long periods of time*   * *   Allied Universal® is an Equal Opportunity Employer. All qualified applicants will receive consideration for employment without regard to race/ethnicity, age, color, religion, sex, sexual orientation, gender identity, national origin, genetic information, disability, protected veteran status or relationship/association with a protected veteran, or any other basis or characteristic protected by law. For more information: www.aus.com* *  * * *  If you have any questions regarding Equal Employment Opportunity, Affirmative Action, Diversity and Inclusion, have difficulty using the online system and require an alternate method to apply, or require an accommodation at any time during the recruitment and/or employment process, please contact our local Human Resources department. To find an office near you, please visit: www.aus.com/offices.* *","https://www.indeed.com/pagead/clk?mo=r&ad=-6NYlbfkN0Bkl6eMu1FM1r07QHNveSMIb5NS-ooqLFrV5tiSRjmHVl6py5KZ0S4DryhV055PNS-g15zk8dO8HUYsoKJbfCd0lzG9KSPXM1pP5TI6bKEIdV_JwAjrhMqj71ghtlOWmpKzgcJLMKimS8Ldz8kNivl7NMMBX0sd7nwozMUipFC3MeALPWFhYMaFJxqBhB3Xs8lYxoKuReq7w3Uuih7VtJHkOvGZqBG6NkMYw1x7MNpOr0cj2E7fGO5WVo4sR24ULXNPVgPaJHOeg4KLGI68xOT6kY4WwCHQaya7baZ7aBAx0H_qcjs_ukkOd4ZelerijWa2FvXN2CYCigpTBpZD9pwruAAjkecTypsfTTLyzIYW9T4C6gfMm6NGNuN44ZAxMwlEWu_pY6MQh5MovXPixRIl09MOSZNmf790FSXo2apCl179CyQw9bfOIF8W3iVdOis=&xkcb=SoCS-_M3an_Z29Qk7Z0KbzkdCdPP&p=1&fvj=0&vjs=3","On-site","Full-time","MSCM",0,0,0,0,0,0,0,0,0,0,0,0,0,0,0,0,0,0,0,0,"6b2e22a28cb52071ac6b79f654d94ed5"
"4","cybersecurity consultant",2022-08-24,"Cybersecurity Consultant","AT&T","Salt Lake City, UT","* *  Consultant Professional Services 3 ATC*   The Governance, Risk and Compliance Security services of AT&T Consulting Solutions is looking for qualified persons to join its team of world-class security and information risk management professionals. This position will be focused on providing guidance around security and privacy regulatory and industry standard requirements to our portfolio of Fortune 500 clients, conducting security risk assessments, and working with the practice leadership to keep abreast of developments in the information security space from both a strategic and technical perspective.*   Key job responsibilities will include:*  Conduct information security assessments using industry accepted best practices and approaches to support enterprise business goals and objectives*   Evaluate information security risk in context of business environment and industry requirements*   Consult with clients on information security best practices and provide guidance on cost-effective strategies for implementation of security*   Follow standard methodologies and develop new and innovative processes for delivering information security solutions*   Focus on results and ability to work within tight timelines*   Demonstrated ability to learn and apply critical thinking to a variety of situations*   Design deliverable content to precisely reflect the engagement contract and client needs*   Work with clients to help them understand where improvements could be made, and propose scenarios and solutions to address these areas of improvement*   Build and nurture positive working relationships with clients with the intention to exceed client expectations*  * * *   Required Qualifications*  BA/BS in information technology, business administration, or related field preferred*   5-8 years of experience in information risk management, security governance, program development, regulatory and controls experience*   CISSP certification*   CISM, CCSP, CIPP, CISA certification a plus*   Solid understanding of the evolving security and privacy controls environment, regulatory landscape and risk management techniques, principles and practices*   Experience performing risk and compliance assessments and in-depth knowledge of industry standards and regulatory requirements (e.g., HIPAA, HITRUST, HITECH, PCI DSS, FISMA, NIST, ISO 2700X, COBIT, FFIEC, NERC CIP, etc.)*   Experience and firm understanding of the development and implementation of information security policies, standards and related procedures*   Ability to provide risk-based recommendations based upon the size and complexity of the client’s organization*   Ability to educate clients of the risk implications associated with a particular business decision, and communicate the likelihood and impact of those decisions so clients can fully quantify those risks*   Ability to translate complex technical information across all levels of the organization*   Strong facilitation skills and a clear ability to build strong relationships with business stakeholders at all levels, including executive managers and vendors*   Demonstrated ability to work effectively with a team, delivering high performance and customer satisfaction in a global, matrix-management environment*   Strong business acumen and process-oriented thinking*   Excellent presentation and issue resolution skills*   Written communication skills for use in preparing formal documentation including deliverables, Statements of Work, proposals, white papers, and case studies*   Verbal skills that include the ability to clearly articulate thoughts, be persuasive and to deliver presentation and training to all levels of management*   Ability to interface with C-levels, as well as tactical implementers*   Able to manage projects from inception to successful implementation*   Strong investigative and analysis skills with the ability to handle confidential information*   Ability to travel (~25% of time)*   Keeps informed of advances in information security; self-motivator*   Additional Qualifications*  Consulting experience required*   Privacy experience a plus*   Understanding of cloud technologies and security is a plus*   Understanding of available security tools and technologies*   PCI DSS QSA a plus*  *","https://www.indeed.com/rc/clk?jk=1f07b35bc71abde8&fccid=25b5166547bbf543&vjs=3","On-site","Part-time","MSCM",0,0,0,0,0,0,1,0,0,0,0,0,0,0,0,0,0,0,0,0,"3f79b7142fa7c12dd394996aecb19373"
