"","Search","Date","Title","Company","Location","Description","Link","Work Model","Job_Type","Program","R","Python","SQL","Tableau","PowerBI","Azure","Excel","Talend","SAS","Spark","Qualtrics","Domo","Salesforce","SAP","Hadoop","Qlik","Looker","Zoho","Stata","Snowflake","ID"
"15","business intelligence analyst",2022-04-30,"Quality Data Analyst","Cornerstone Building Brands","Salt Lake City, UT","* Cornerstone Building Brands is deeply committed to building a workplace and global community where inclusion is not only valued, but prioritized, providing an environment of mutual respect where equal employment opportunities are available to all applicants and team members. * Summary:*  The Quality Data Analyst is responsible for managing and supporting Quality and Manufacturing initiatives throughout all Cornerstone Building Brands business segments. The Quality Data Analyst is expected to work with and learn from Business Leaders how to manage data and facilitate reporting that will support events focused on process improvement. The Quality Data Analysist is responsible for data collection and analytics supporting the Quality and Manufacturing organization. All activities performed by the Quality Analyst are in support of fostering a cultural transformation for Cornerstone Building Brands to be a leader in exemplifying world-class Quality and continuous improvement behaviors. * Essential Duties & Responsibilities:* Develop analytical models, automating reporting and providing simple yet effective visualizations for stakeholders, using Power BI, SharePoint, Excel, and other software programs. *  Use effective communication skills, working closely with internal customers to understand the business need and determine what data can best be used to drive quality business decisions. *  Help research, define, implement, and maintain quality management plans. *  This role will require a range of capabilities including but not limited to: exploratory data analysis, data trending, statistical analysis, regression, time-series, control charts and other mathematical techniques. *  Ability to work in teams to understand, define and implement solutions to problems. *  Define and track KQI (key quality indicators) for all quality essentials *  Manage Non-conformance database and participate in Root Cause Analysis and CAPA activities. *  Prepare and communicate reports on quality and manufacturing activities and efficiencies *  Lead periodic review of quality management systems to evaluate the effectiveness and identify opportunities for improvement *  Support teams and apply wide range of process improvement tools to assist in identifying and eliminating waste and support growth including: Process Mapping, FEMA, Gauge R&R, Control plan, Pareto, Fishbone, 5 Whys 8D, SPC, DOE. *  Identify, lead and drive CoPQ (Cost of Poor Quality) initiatives across business units *  Commitment to behavioral based safety program and Cornerstone Core Values: Innovation, Integrity and Teamwork. * Education and/or Experience:* Experienced with Power BI and SharePoint development *  Bachelor’s degree in Operations, Manufacturing or Engineering strongly preferred. * Knowledge, Skills & Abilities:* Strong computer and analytic skills including Power BI, SharePoint, InfoPath, Excel, Word, PowerPoint, and project management software. Ability to learn new skills and programs quickly to adapt to technological advancements. *  Ability to travel up to 50% *  Cornerstone Building Brands is an Equal Opportunity Employer. All qualified applicants will receive consideration for employment without regard to race, color, religion, sex, sexual orientation, gender identity, national origin, or protected veteran status and will not be discriminated against on the basis of disability. You can find the Equal Employment Opportunity Poster here. If you’d like to view a copy of the company’s affirmative action plan or policy statement, please email HRCompliance@cornerstone-bb.com. If you have a disability and you believe that you need a reasonable accommodation in order to search for a job opening or to submit an online application, please e-mail HRCompliance@cornerstone-bb.com. This email is used exclusively to assist disabled job seekers whose disability prevents them from being able to apply online. Only emails received for this purpose will be returned. Messages left for other purposes, such as following up on an application or technical issues not related to a disability, will not receive a response. *  California Consumer Privacy Act (CCPA) of 2018 *  Must be at least 18 years of age to apply. *  Notice of Recruitment Fraud * We have been made aware of multiple scams whereby unauthorized individuals are using Cornerstone Building Brand's name and logo to solicit potential job-seekers for employment. In some cases, job-seekers are being contacted directly, both by phone and e-mail. In other instances, these unauthorized individuals are placing advertisements for fake positions with both legitimate websites and fabricated ones. These individuals are typically promising high-paying jobs with the requirement that the job-seeker send money to pay for things such as visa applications or processing fees. Please be advised that Cornerstone Building Brands will never ask potential job-seekers for any sort of advance payment or bank account information as part of the recruiting or hiring process.*","https://www.indeed.com/rc/clk?jk=3044cef4e12d18ed&fccid=661482a3e1184c30&vjs=3","On-site","Part-time","MSIS",0,0,0,0,0,0,1,0,0,0,0,0,0,0,0,0,0,0,0,0,"1387c36267867aac5bfd3bf54f8dabdf"
"16","data architect",2022-04-30,"Solution Architect Manager","Deloitte","Salt Lake City, UT 84111 (Downtown area)+1 location","* *  If you are passionate about how digital technology is transforming business, plan your next career move with Deloitte's ITS Application Studios. *   Deloitte's breadth, depth, and scale, combined with our relentless passion for innovation create powerful opportunities to help our clients and our own organization stay ahead of change, deliver impact that matters, and transform complexity and disruption into lasting value.*   Our teams are already leveraging Artificial Intelligence, analytics and cutting-edge capabilities to transform how we serve clients and operate our business. Moreover, the team is also actively exploring nascent applications such as IoT, Blockchain and AR/VR.*  Work You'll Do*   The Solution Architecture Senior Manager 1 manages large teams who are developing high level frameworks that align an organization's IT infrastructure with business processes/data to improve the efficiency and productivity of business operations including:*   The person in this role will be responsible for envisioning and developing new digital products. The person will execute day-to-day product development activities across design, development, stakeholder communication, technology vendor management and delivery.*  Responsibilities*   Collaborating with product development teams to provide a high-level vision of enterprise solutions and development initiatives*    Understanding and communicating the Enterprise strategy to Application, Data and Solution Architects along with other non-technical stakeholders*    Collecting, generating, and analyzing innovative ideas and technologies to use across the business*    Provide strategy to meet Audit Approach Manual (AAM) 22852 Certification for all products and solutions in Audit & Assurance portfolio.*    Prepares large enterprise system development cost estimates, budgets, and schedules.*    Participating in the strategy for building and maintaining the development platform along with modeling, design, and coding practices*    Monitors architecture & design creation process and reviews the project artifacts.*    Promoting Continuous Integration & Continuous Deployment processes and DevOps capabilities*    Evaluate results within business unit to determine if organizational objectives are being met*   The Team*   Information Technology Services (ITS) helps power Deloitte's success. ITS is the engine that helps to drive Deloitte, which serves many of the world's largest organizations. We develop and deploy cutting-edge internal and go-to-market solutions that help Deloitte operate effectively and lead in the market. Our reputation is built on a tradition of delivering with excellence.*   The ~2,200 professionals in ITS deliver services internally including:*   Cyber security*    Technology support*    Technology & Infrastructure*    Application development and management*    Relationship management group*    Strategy*    Deployment*    PMO*    Financials*    Communications*   For more information on ITS, you can visit our dedicated recruitment page at https://usrecruiting.deloitte.com/-its-recruiting-for-experienced-hires .*   Deloitte Application Studios (DAS) *   Deloitte Application Studios (DAS) is the internal software and applications development team responsible for delivering leading-edge technologies to Deloitte professionals. Their broad portfolio includes web and mobile productivity tools that empower our people to log expenses, enter timesheets, book travel and more, anywhere, anytime. DAS enables our client service professionals through a comprehensive suite of applications across the business lines. In addition to application delivery, DAS offers full-scale design services, a robust mobile portfolio, cutting-edge analytics, and innovative custom development.*  Qualifications*  Required Qualifications:*   A Bachelor's degree in Computer Science, Business Administration, or related discipline. While an advanced degree is preferred, the value is placed on the extent of the relevant experience and accomplishments*    6+ years Industry experience, in architecture and delivery of software products and solutions.*    2+ years of experience in planning, analyzing, designing, architecting & supporting Audit & Assurance products and solutions.*    5+ years in a data engineering role with demonstrable experience with Cognitive computing, data integration, data mining, Natural Language Processing, Hadoop platforms, and automating machine learning components.*    3+ years of experience designing and implementing off-prem public cloud (Azure, AWS, GCP, etc.) environments and architectures and operational models. Including developing cloud-ready*    3+ years of experience as a Senior architect role in a large Scaled Agile program.*    1+ years of experience in a leadership role.*    One or more programming languages (i.e. C#, Java, Python); One or more databases (SQL/No SQL), Web front end technologies (Angular, ReactJS, VueJS etc.), Application frameworks (.Net, Java), Business Intelligence solutions (Power BI, Tableau), Enterprise integration patterns (MOM, SOA etc.), Machine learning & AI, Big Data analytics, One or more cloud provider (Azure, AWS, GCP), Container technologies (Docker, Kubernetes, Azure Service Fabric etc.)*    Certified Cloud Solution Architect by one or more cloud providers (Azure, AWS, GCP) Preferable*    Work is non-standardized and widely varied, involving many complex and significant variables including significant time spent planning, evaluating complex solutions and issues, and negotiating outcomes. Strong analytic ability and inductive thinking are frequently required to devise new approaches to situations where previously accepted solutions have proven inadequate. Supervision typically consists of periodic coaching, advice and feedback. Management of a team within a business line*    Limited immigration sponsorship may be available*    Ability to travel up to 25% (While 25% of travel is a requirement of the role, due to COVID-19, non-essential travel has been suspended until further notice.)*   Preferred Qualifications:*   Knowledge about PCAOB regulations & standards, accounting standards like US GAAP & IFRS is a plus.*    For individuals assigned and/or hired to work in Colorado, Deloitte is required by law to include a reasonable estimate of the compensation range for this role. This compensation range is specific to the State of Colorado and takes into account the wide range of factors that are considered in making compensation decisions including but not limited to skill sets; experience and training; licensure and certifications; and delivery model. We would not anticipate that the individual hired into this role would land at or near the top end of the range, but such a decision will be dependent on the facts and circumstances of each case. A reasonable estimate of the range is $95,070.00 to $158,450.00. *   Additional wording is also required around AIP and Incentive Comp, if applicable. You should only add the following language if your job is AIP and/or incentive comp-eligible.*     For AIP-eligible roles include: You may also be eligible to participate in a discretionary annual incentive program, subject to the rules governing the program, whereby an award, if any, depends on various factors, including, without limitation, individual and organizational performance. *     For incentive comp-eligible roles include: You may also be eligible to participate in a sales incentive program, whereby you may be eligible to receive certain incentive compensation amounts based on achievement of certain sales goals set forth each year, subject to the terms and conditions of any applicable program document. *    *   EA_ExpHire *   EA_ITS_ExpHire* *","https://www.indeed.com/rc/clk?jk=551ae416425656b0&fccid=9e215d88a6b33622&vjs=3","On-site","Part-time","MSIS",0,1,1,1,0,1,1,0,0,0,0,0,0,0,1,0,0,0,0,0,"d273722df7bcf70f60856f165ef2efb7"
"17","data architect",2022-04-30,"Senior Frontend Software Engineer - Engineering Services","Domo","Remote in American Fork, UT 84003","We are Domosapiens- uniquely skilled, passionate data lovers anchored in a culture of connectivity. We are transforming the way business is managed by putting real-time data into the hands of every decision maker across organizations. Diversity is valued here because homogenized teams create echo chambers; and nobody benefits from that. The insight garnered from diverse backgrounds, perspectives and lived experiences results in pioneering innovations across the organization and better experiences for our customers. The more diverse our talent, the more impactful the Domosphere becomes.**Position Summary:**Our software engineering team is rapidly growing and looking for Software Engineers to be part of a fast-paced, high-energy team. Our engineers are serious about the success of the company and are given the tools and environment they need to succeed. If you are an experienced engineer with a passion for technology and solving complex business problems and believe planning, hard work, teamwork and quality is what it takes to succeed, then this is the job for you.**The Domo custom apps platform team builds the tools and frameworks necessary for partners and clients to extend the Domo product. This exciting and innovative team allows for the broad scalability of a wide variety of possible features as well as the creation of incomparable value for our customers.**Key Responsibilities:*Develop scalable user-friendly modern frontend interfaces for Domo*Work with stakeholders and technical architects to define the engineering requirements and structure for Business Intelligence (BI) applications*Help guide the design and development of Domo's app platform*Develop strategies with other engineering teams to optimize the usage and efficiency of Domo's app platform*Develop methods and tools to monitor the performance and reliability of Domo's custom app platform*Job Requirements:*3+ years of strong UX-minded software development experience with TypeScript and modern JavaScript (ES6) libraries/frameworks*Demonstrated proficiency with React.js, CSS3, and HTML5*Preferred experience with Typescript, Redux, React component design systems, and frontend data visualization libraries*Knowledge of and experience with RESTful web services patterns and practices*Ability to communicate and interface with technical and non-technical members of the organization*Working knowledge in development tools and processes, such as source control, requirement spec, design and design review, debugging, unit test, system test, performance test, etc.*Knowledge of and experience working with big data technologies*Experience in SaaS and Enterprise DB technologies including both structured (relational) and unstructured (NoSQL) data*Knowledge of and experience with both row-based and column-based database platforms*Experience with AGILE and SCRUM methodologies*Demonstrated aptitude for learning new technologies*Bachelor's degree or higher in Computer Science, Information Systems or a related field or equivalent professional development experience**Domo is an equal opportunity employer.","https://www.indeed.com/rc/clk?jk=200abfad1b3ca16a&fccid=f7b222421b3f02d8&vjs=3","Remote","Part-time","MSIS",0,0,1,0,0,0,0,0,0,0,0,1,0,1,0,0,0,0,0,0,"ce1f443fee3d7f8a039800a6ced05bc6"
"18","cloud engineer",2022-04-30,"Principal Cloud DevOps Engineer","Fidelity Investments","Salt Lake City, UT 84104","* *  Job Description:*  *   Join Fidelity’s Enterprise Technology SRE Chapter in our mission to design, implement, manage and improve our kubernetes based solutions. You’ll work in a collaborative, trusting, thought-provoking environment—one that encourages diversity of thought and creative solutions that are in the best interests of our customers globally.*   The Team*   The Enterprise Technology SRE Chapter is critical to the success of Fidelity’s cloud adoption. The SRE team implements, manages and improves a complex and advanced kubernetes system spanning multiple clouds, public and private. As a natural extension of this system, the team also ensures that the hosted web applications and microservices are healthy, monitored and designed to scale. These goals are achieved through highly integrated relationships with the kubernetes solution development teams, application support teams and our vendor partners*   The Expertise You Have*   Experience with enabling and managing cloud services, usage, and optimizations*    4+ years software engineering with a focus on CI/CD and release management*    Experience with enabling and managing cloud services, usage and optimization*    4+ years experience designing, implementing and managing Kubernetes (EKS, AKS)*    4+ years experience managing solutions as code by using GIT*    2+ years with Jenkins*    2+ years with Shell Scripting*    3+ years experience in 24x7 production environments.*    Experience with programing languages such as Python and Go*    Experience designing, implementing and hosting solutions based in AWS and/or Azure*    AWS, Azure and/or Kubernetes certifications*    Bachelor’s Degree in Computer Science, Mathematics, or related sciences – or equivalent work experience*    8+ years IT experience*   The Skills You Bring*   Extensive experience in designing and developing automation*    Lead significant production improvements that result in direct business opportunities for Fidelity*    Create solutions that support a DevOps practices for delivery and operations of services*    Adapting to rapid changes in Cloud with ability to learn very quickly*    Track record of ideation and innovating technology at scale*    Systematic problem-solving approach, coupled with strong communication skills and a sense of ownership and drive.*   The Value You Deliver*   SREs troubleshoot, debug, evaluate and resolve computer-identified alarms, make feature enhancements, bug fixes, systems management, perform software deployments and migrations, host management and automate routine operational tasks.*    The position requires a combination of strong troubleshooting, technical and communication skills and includes a mix of on call and operational tasks and involves small to medium level software development work.*    Dive deep to resolve problems at their root, looking for failure patterns amenable to long-term solutions via simplification and automation.*    Cultivate relationships with developers, engineers and other technology partners to understand their infrastructure needs.*    Act as a technical point of escalation, provide mentorship, and technical direction to team-members and evangelize best practices and methodologies.*  *   Certifications:*  *   Company Overview *   Fidelity Investments is a privately held company with a mission to strengthen the financial well-being of our clients. We help people invest and plan for their future. We assist companies and non-profit organizations in delivering benefits to their employees. And we provide institutions and independent advisors with investment and technology solutions to help invest their own clients’ money.*   Join Us *   At Fidelity, you’ll find endless opportunities to build a meaningful career that positively impacts peoples’ lives, including yours. You can take advantage of flexible benefits that support you through every stage of your career, empowering you to thrive at work and at home. Honored with a Glassdoor Employees’ Choice Award, we have been recognized by our employees as a Best Place to Work in 2022. And you don’t need a finance background to succeed at Fidelity—we offer a range of opportunities for learning so you can build the career you’ve always imagined. *   As a result of COVID-19, many of our associates are continuing to work remotely. When Fidelity employees eventually return to the office, our goal is for most people to work flexibly in a way that balances both personal and business needs with time onsite and offsite through what we’re calling “Dynamic Working.” *   We invite you to Find Your Fidelity at fidelitycareers.com.*   Fidelity Investments is an equal opportunity employer. We believe that the most effective way to attract, develop and retain a diverse workforce is to build an enduring culture of inclusion and belonging. *   Fidelity will reasonably accommodate applicants with disabilities who need adjustments to participate in the application or interview process. To initiate a request for an accommodation, contact the HR Leave of Absence/Accommodation Team by sending an email to accommodations @fmr.com, or by calling 800-835-5099, prompt 2, option 3.* *","https://www.indeed.com/rc/clk?jk=223057ebf22574cc&fccid=deb234f9dd3edcea&vjs=3","Remote","Part-time","MSIS",1,1,0,0,0,1,0,0,0,0,0,0,0,0,0,0,0,0,0,0,"df9a6661a2d1a884365ba8286ff42540"
