"","Search","Date","Title","Company","Location","Description","Link","Work Model","Job_Type","Program","R","Python","SQL","Tableau","PowerBI","Azure","Excel","Talend","SAS","Spark","Qualtrics","Domo","Salesforce","SAP","Hadoop","Qlik","Looker","Zoho","Stata","Snowflake","ID"
"1","data scientist",2022-09-02,"Senior Forecasting Data Scientist","Acima","Hybrid remote in Draper, UT 84020","* *  ACIMA*  * *   Acima Credit is a young and dynamic leasing company that provides consumers financing options for life necessities that otherwise would not be available to them. We help with financing options from tires/wheels to furniture and appliances. Acima blends the use of innovative online technology with a fast and easy application process for thousands of retailers nationwide. Customers love us because we make the impossible possible. Retailers love us because we make it easy for them.*  *  Summary: * *   We are looking for an experienced data scientist with experience forecasting time series using machine learning techniques in addition to traditional methods such as ARIMA, GARCH, or Holtz-Winters. The ideal candidate will have 7+ years of experience in building and maintaining forecasting models. Additionally, they will have experience using tools such as Python, SQL, Redshift, AWS, Excel/GSheets, and Docker.*  *  Responsibilities * Wrangle data using python or SQL to access our Redshift hosted data warehouse *  Build models to predict various business insights using python, notebooks, etc. *  Build dashboards showcasing your findings using the BI tool, Sisense/Periscope *  Create forecasting models to predict application volume, funding volume, lease performance, etc. *  Work closely with the finance team to provide clear insight into how you arrived at your forecast *  Collaborate with team members * Compensation * 401K matching *  Health Care etc. *  Unlimited DTO * Qualifications * Can commute to Draper Utah for in office work (a hybrid of work from home and office is potentially feasible) *  Be willing to work in Python (numpy, pandas, scipy, sklearn, xgboost, tensorflow, flask, fastapi, pydantic, etc.) *  Understands how to train models that generalize well *  Able to meet strict deadlines and deliverables *  Works as a liaison between business and several functions, as well as transforming business requirements into analytical outputs. *  Ability to work independently and to take responsibility *  7+ years of experience in forecasting *  5+ years of experience in Python or R, preferably python*","https://www.indeed.com/rc/clk?jk=83d29cbbc1122245&fccid=6fa8a3ac70e320b0&vjs=3","Hybrid","Part-time","MSBA",0,1,1,0,0,0,1,0,0,0,0,0,0,0,0,0,0,0,0,0,"37be8ed6edd1538b224fdbaf2fabfc42"
"2","data analyst",2022-09-02,"Senior Financial Analyst","AgReserves, Inc.","Salt Lake City, UT 84111 (Downtown area)","AgReserves, Inc. is seeking a collaborative Sr. Financial Analyst to join our corporate finance team. The Financial Analyst will deliver analytical, financial modeling, and technical expertise to help the company evaluate profitability, optimize value creation and margin, as well as the associated risk of potential investments.*Responsibilities:*Gather, prepare and update the discounted cash flow (DCF) analysis for various investments.* Maintain database resource of enterprise prices and expenses, economic data and industry-related statistics.* Assist to ensure the consistency of investment practices that mitigate risk for the individual investment and at portfolio levels.* Help maintain the business planning toolkit which includes investment policies and standards, analytical tools and business plan creation guidelines.* Conduct research to support new investments, analyze investment risk in various countries, product market trends, acres grown and supply and demand.* Analyze data and provide insights/observations to the executive leadership team.*Qualifications:*Bachelor’s degree in Finance, Economics, Accounting or related field. Master’s degree preferred.* 5+ years experience analyzing investments, asset valuation, and/or accounting.* Proficient in discounted cashflow analysis (DCF) techniques; familiar with measures of investment analysis (NPV, MIRR, ROI, etc.)* Strong demonstrated interpersonal, communication skills with excellent attention to detail and accuracy.* Technical proficiency with Microsoft tools, advanced Excel skills.* Ability to work after hours on critical business systems, as needed.* Able to travel to various office locations, both domestic and internationally.*AgReserves, Inc. provides equal employment opportunities to all employees and applicants for employment and prohibits discrimination and harassment of any type without regard to race, color, religion, age, sex, national origin, disability status, genetics, protected veteran status, sexual orientation, gender, identity or expression, or any other characteristic protected by federal, state or local laws. Qualified applicants must be legally and lawfully authorized to be employed and work in the United States without current or future visa sponsorship - AgReserves, Inc is not sponsoring visas at this time.*Job Type: Full-time*Benefits:*401(k)* 401(k) matching* Dental insurance* Employee assistance program* Flexible spending account* Health insurance* Life insurance* Paid time off* Parental leave* Professional development assistance* Referral program* Retirement plan* Tuition reimbursement* Vision insurance*Physical setting:*Office*Schedule:*Day shift* Monday to Friday*Supplemental pay types:*Bonus pay*Work Location: One location","https://www.indeed.com/pagead/clk?mo=r&ad=-6NYlbfkN0BQ7aRWblteNrc9P2lNsTqDVVoPzLRKdwE1o90wbQOnduxsZvexRWqkBVsYem5PifLANQBuS9r3F1JfxiVNubq1aWCQyKLEZXGpadpf1A1ppqJ4ECE4jFUPEb3nzmwMqSCMCXCyouYPC0XvXkvafvs4L5wIwFuQlJcgU_8ODfK2FoD2D1hrPmBziIDR5R_i2rupoORhii-SK0SCoLpOeYorttDki_eCL9eEUWOvBCelqsie0eAKUzMgTwEPjgF3eiDu6OQKrI66W1yDnmfvbwih5FLjsvjLSzeHtDfjeM3waB9KTccmq-dZ-1j1xn0a1LC826YPnJvPa8UzPps2k734B6ZCnl8lcAwiYmTA4wIErdyHsXPv92cXBAocrqRd5Y8CAtg-B9i-jkr89-xBqBhVWPXR1gTRya9TPIVqOaH8iUB6Cm-m0qCq5jBBQID19vBck2tbsTQymH2OVAN8PklTRF44r62UMZgUmLN7MBACTwkGYj6roZMttEXBNKDRUliCP782yDeZg-5teMSRknGpxzYiw4VIfPdLoEFBh_eV1g==&xkcb=SoDZ-_M3a_K6xERj3p0JbzkdCdPP&p=0&fvj=1&vjs=3","On-site","Full-time","MSBA",0,0,0,0,0,0,1,0,1,0,0,0,0,0,0,0,0,0,0,0,"35d2facee0ab592ae59c854d1f7d0f07"
"3","security manager",2022-09-02,"Lead Fire Alarm & Security Technician 41149","Anistar Technologies","Salt Lake City, UT","Job Title: Lead Fire Alarm & Security Technician*Location: Salt Lake City, UT*Company Summary:*Our client is a proven leader in the communications industry, offering a professional level of cabling expertise to their partners. Having been around for over forty years, our client provides the resources necessary for their team members to excel and reach their career goals in the communications industry.*Position Summary:*Anistar is seeking an experienced Security Technician to provide assistance with the installation, termination, and testing of various types of voice and data cables as well as security/access control equipment. MUST be comfortable working from a lift.*The ideal candidate must possess the following:*Technicians MUST have experience working with various cables that include, but are not limited to: twisted pair, coax, Category 5, Category 6, single and multi-mode fiber optic cables. Cable installation includes: pulling, placement, terminating, testing, and labeling. BICSI cert (current or past) a plus, but not needed. IDF/MDF, rack install, fiber termination and testing experience a plus. We are looking for individuals who will pay attention to detail and work efficiently under minimal supervision.*Job Responsibilities:*Pulling and routing CAT5 or CAT6 cable in a new construction and existing structure commercial environment* Installing CCTV cameras (Bosch brand cameras)* Installing and troubleshooting fire alarm systems* Installing support structures (ladders, racks, j-hooks)* Must be comfortable working from scissor/boom lifts if required*Basic scope of work includes:*Pulling, routing, installing and terminating structured cabling infrastructure in a commercial environment.* 5+ years’ experience installing and servicing voice and data systems in a commercial environment.* Ownership of basic telecom tools: Punch down, snips, wire strippers, cordless drill, Hard Hat, Boots, Safety Glasses, etc.* Familiarity with BICSI, EIA, TIA or NEC Standards.*About Us*At Anistar Technologies, we connect individuals from a variety of industries with respected companies, both nationally and internationally. Each day, our Recruiters are presenting our clients with talented industry professionals for their most in-demand positions. To accomplish this, the Anistar staffing team will invest the time to understand your goals, work experiences, and career objectives.*To search for other exciting opportunities in your area, visit our website at www.anistar.com.*Anistar Technologies is an Equal Opportunity Employer and is dedicated to fostering diversity in the workplace. Anistar utilizes E-Verify. We offer variable hour employment on contract and contract-to-hire opportunities, as well as permanent placement.*Interested Candidates, click “Apply”, or contact the Anistar office at the number listed below.*Contact:*Anistar Technologies*PH: 800-750-3843*Fax: 888-293-5055*Job Type: Full-time*Schedule:*8 hour shift*Work Location: On the road","https://www.indeed.com/pagead/clk?mo=r&ad=-6NYlbfkN0DLz1l7SDr-GPH_hl323sweOkyACYPqXPQuZyEgkpFukl_NRORSepMjCZhP9_f9rnkbFO4dgf1pxvMbCqOVVVhxohgO7PCy1A5hLMOUwop4Pl07NrkSrbkmgO5Mwus0u_Ep5F7A77IkgywP4mwpC8U1yPi-5duu6iH8V-nu7AjgZyJtd9C8N6_OFe-y55sb_lXY2IpRSsOWQIYTbN_1g6dIjNZZ822i-2CtKEuBqjZGDq4gjwov-GVJlM10Mxo6XFrNvgSsAGcXpwdumwgbghkEx0Bfv9HhXms452IlvDql0si8DzfrJRBa3Dq-2hRZwk-c6hLVVab1wSTN3QksMdRSdUN1VjI-8-E79BT_pYlig6W4m8uXuyFI4CN61JWmrNbiIgd6LNvWs-A_AuJng_LZz2ByQrB_PW_OXGR3b8Qf1_jwWCE2A9Q7kMp3xvHkS0ZGx6h-D8KaKzKXE2GLGdQIf0wbJFHoNwrJcojoR5U7ox7ye1kRtHGkbjWWGQD80x6r5Fn8EMDp0w==&xkcb=SoA2-_M3a_KSxLX-6B0JbzkdCdPP&p=2&fvj=1&vjs=3","On-site","Full-time","MSCM",0,0,0,0,0,0,1,0,0,0,0,0,0,0,0,0,0,0,0,0,"bf5d033d9410248179e13fc0c347b8ff"
"4","business intelligence analyst",2022-09-02,"Data Analyst","Aristotle","Provo, UT 84601","Come work in a startup like environment (small team, big challenges, massive growth opportunity, relaxed office culture) with solid company stability (30+ years) and benefits including health, regular holidays, 401K, PTO, and great office views. Together with our 200+ university research partners, we have built PredictIt.org, into the “The Stock Market of Politics” where more than 100,000 enthusiastic Traders make $1 winner-take-all political forecasts with stunning accuracy thanks to the wisdom of the crowd. Now we need your help taking it to the next level.As a Data Analyst for PredictIt you will need to understand the site and our data well enough to be the go-to expert who can help answer the hard questions. Under the direction of the Director of Software Development, you’ll work with different teams to make sure your coworkers have the data insights they need to do their jobs. You will work on several projects at a time, and you’ll need to balance ad hoc requests with medium- and long-term priorities set by management. Because our team is small, you may be asked to help with other work that doesn’t align with the typical responsibilities of a data analyst (e.g., writing a story for the PredictIt homepage, producing material for marketing to share, drafting process documents, communicating with academic research partners, etc.). You will be expected to put in the work, and wherever possible, improve the process to make it easier in the future. However, as a member of a small team you will also get to take on challenges and responsibilities that make the job extremely fulfilling and rewarding.RequirementsWe are looking for a Data Analyst who can come in and take our data analysis process/systems to the next level. Specifically, we need someone who can:*Provide ad hoc reports and data sets based on end user requests* Interpret data, analyze results using statistical techniques and provide ongoing reports* Develop and implement databases, data collection systems, data analytics and other strategies that optimize statistical efficiency and quality* Acquire data from primary or secondary data sources and maintain databases/data systems* Identify, analyze, and interpret trends or patterns in complex data sets* Filter and clean data by reviewing computer reports, printouts, and performance indicators to locate and correct code problems* Work with management to prioritize business and information needs* Locate and define new process improvement opportunities*The ideal candidate will possess the following: *Bachelor’s degree in Statistics, Mathematics, or related field* 2+ years of solid SQL Development experience* Advance knowledge of SQL, SSRS* Knowledge of statistical concepts* Experience using statistical software (R/Python preferred)* Experience using visualization software (Power BI, Tableau, etc.).* Ability to present research findings via oral and written analysis*Pluses: *Google Analytics* Database Management skills, including backup and recovery procedures* Experience in some combination of data science, statistical modeling, and business analytics* Some understanding of financial markets and market structure*BenefitsAll positions are Full-Time, with competitive compensation, medical benefits, paid vacation, 401k plan, and stock options. Casual dress code and a non-corporate atmosphere make this a fun place to work and learn in a team environment. Please visit our website at www.aristotle.com.Please note: _ Due to the COVID-19 pandemic, Aristotle has implemented a requirement that new hires be fully vaccinated _and receive the booster shot when eligible, absent an approved exemption/accommodation, which may include a written statement from the new hire that vaccination would be injurious to the health and well-being of the new hire or would conflict with the new hire’s sincerely held religious or personal belief.*Job Type: Full-time","https://www.indeed.com/rc/clk?jk=891a46624946cace&fccid=7806898e0ae521d7&vjs=3","On-site","Full-time","MSIS",0,1,1,1,0,0,0,0,0,0,0,0,0,0,0,0,0,0,0,0,"6385fae1c59c71196a19e1e6855b9017"
"5","security compliance analyst",2022-09-02,"Registration Analyst II","Assa Abloy","Salt Lake City, UT","** *  *   *    *     *      Application due 2022-12-02*       Customer Service & Contact Center Operations*        Associate*        Salt Lake City, Utah, United States*      *    *    *    *     *      *       *         An Amazing Career Opportunity for a Registration Analyst!! *         Location: Salt Lake City, UT *         Job ID: 13736*         *         Are you the type of person who finds typos in published media? Are you a positive go-getter who loves welcoming clients and providing great customer service? Are you seeking to expand your career into a niche tech industry working with various government agencies? If so, we want to hear from you!*         *         Who are we? *         HID Global powers the trusted identities of the world’s people, places, and things, allowing people to transact safely, work productively and travel freely. We are a high-tech software company headquartered in Austin, TX, with over 4,000 worldwide employees. Check us out here: www.hidglobal.com and https://youtu.be/23km5H4K9Eo*         *         IdenTrust’s Business Operations Department: *         IdenTrust, part of HID Global, is a public key certificate authority that provides digital certificates to financial institutions, healthcare providers, government agencies and enterprises. The software development team is responsible for developing new applications, enhancing existing applications, solving problems, and resolving defects. The team is based in Salt Lake City.*         As our Registration Analyst, you’ll support HID’s success by: *        Utilize web-based system to review incoming certificate applications for completeness. *         Perform Identification & Authentication according to specific levels as required by IdenTrust customers. *         Contact customers directly to resolve application related discrepancies. *         Process incoming mail to match up with pending applications, specialized request forms, notarized forms, disputes, and other documentation. *         Review notarized documentation for completeness and contact appropriate agencies to determine validity of notary. *         Record incoming certificate applications and agreements, including preparation of customer files (original and working), exceptions, revocations, disputes, etc. *         Meet productivity targets set by management. *         Participate in annual goal setting and performance reviews.*         *         What we will love about your background: *        Excellent communication skills and proven record of providing excellent customer service. *         Ability to securely handle customer data. *         Ability to read and interpret technical journals, specifications, international technical standards. *         Capability to work flexible hours based on business need. *         Proficient in MS Office applications, such as Word, Excel, PowerPoint, etc. *         Familiar with operating systems, such as Windows, etc. *         Ability to type a minimum of 50 wpm.*         *         Your Experience and Education include: *        High School diploma or GED. *         Minimum 1-3 years’ combined customer service and/or administrative office experience.*         *         Who you are as a Team Member: *        Exceptional communication skills, both written and verbal. *         Willingness to ‘roll up sleeves and dive deep into tactical work when necessary. *         Good interpersonal skills, willingness to learn and continue to grow professionally. *         Strong team player and ability to work well with others. *         You proactively seek to adopt and implement diversity into your work, including valuing different backgrounds, experiences and thinking. You also embrace creating and nurturing a culture of diversity, inclusion, and belonging.*         *         Applicant Requirements: *        Must be a U.S. citizen. *         Must be legally eligible to work in the United States. *         Compliance to all relevant HID Global policies and procedures related to Quality, Security, Safety, Business Continuity, and Environmental systems. *         As a Trusted Role, the candidate must agree to, and successfully pass a comprehensive background check to include: *         Financial review (credit worthiness). *         Civil review (public records, judgments, liens, etc.). *         Criminal background check; and *         Drug screening. *        *        Why apply? *        Empowerment: You’ll work as part of a global team in a flexible work environment, learning and enhancing your expertise. *         Innovation: You embrace challenges and want to drive ambitious change. *         Integrity: You are results-orientated, reliable, and straightforward and value being treated accordingly.*         *         HID Global is an Equal Opportunity/Affirmative Action Employer – Minority/Female/Disability/Veteran/Gender Identity/Sexual Orientation.*         *        *          #HIDJobs #LI-onsite #saltlakecityjobs #registrationanalyst*        *       *      *     *     *     *      *       *         We make it easier for people to get where they want to go!On an average day, think of how many times you tap, twist, tag, push or swipe to get access, find information, connect with others or track something. HID technology is behind billions of interactions, in more than 100 countries. We help you create a verified, trusted identity that can get you where you need to go – without having to think about it.When you join our HID team, you’ll also be part of the ASSA ABLOY Group, the global leader in access solutions. You’ll have 50,000 colleagues in more than 70 different countries. We empower our people to build their career around their aspirations and our ambitions – supporting them with regular feedback, training, and development opportunities. Our colleagues think broadly about where they can make the most impact, and we encourage them to grow their role locally, regionally, or even internationally. As we welcome new people on board, it’s important to us to have diverse, inclusive teams, and we value different perspectives and experiences. *        *          #LI-HIDGlobal*        *       *      *     *    *   *  * **","https://www.indeed.com/rc/clk?jk=b59e2a2aa2211e38&fccid=0a4ad7ebd9b0c8ee&vjs=3","On-site","Part-time","MSCM",0,0,0,0,0,0,1,0,0,0,0,0,0,0,0,0,0,0,0,0,"968df891c6b8e04534d6190676636e7a"
