"","Search","Date","Title","Company","Location","Description","Link","Work Model","Job_Type","Program","R","Python","SQL","Tableau","PowerBI","Azure","Excel","Talend","SAS","Spark","Qualtrics","Domo","Salesforce","SAP","Hadoop","Qlik","Looker","Zoho","Stata","Snowflake","ID"
"1","data integration engineer",2022-08-17,"Software Engineering Team Lead - Fulfillment","3PL Central","Remote in Salt Lake City, UT","* Extensiv is the fastest-growing SaaS solution in the third-party logistics market. Keeping up with the massive increase in online retail activity from companies like Amazon, Shopify, and Target, and the growth in supply chain logistics can be challenging for warehouses. Born within an active 3PL warehouse, Extensiv built the first cloud-based warehouse management platform to better serve customers and increase warehouse efficiencies to grow their businesses. We pride ourselves on understanding and delivering best practices and excellence to 3PLs and their customers.* *  The Role: *  Extensiv is seeking an experienced Software Developer Team Lead (hybrid or remote) to join our talented software development team. You will lead a talented engineering team and will also help ensure code is well-written and architected according to best practices for performance, scalability, reliability, and usability. You will also be a key player leading one of our newest products and helping to build the team.* *  You Will: * Be a hands-on, contributing developer on your team *  Manage the development team's work, assist with daily standup, coordinate case assignment, and manage branching strategies and release merges *  Review business requirements with Product Management, perform technical analysis of requirements, and participate in the estimation process *  Be part of architectural discussions and decisions for new applications across our technology stack *  Contribute ideas for making the application better and easier to use *  Oversee development efforts for the Onboarding team *  Recruit, mentor, and support team members*  *  You Bring: * Degree in Computer Science or Information Systems *  Minimum of 7+ years of experience in full-stack development, architecture, and engineering *  Demonstrated ability to build enterprise-level software *  Demonstrated experience with Cloud development *  5+ years as a front-end JavaScript developer *  Experiences in Javascript and frontend frameworks especially React. Able to use ES6 and beyond for reusable code development. *  Experience with Frontend technologies - Redux, Typescript, Single-spa *  Experiences in web frontend technologies, including HTML/XML/SCSS/JSON *  Experience with automated testing including unit and integration tests *  Familiar with NoSQL - DynamoDb, Backend system technologies - Node, Typescript *  Good verbal and written communication skills *  Strong competencies in system design, data structures, algorithms and problem solving. *  Working knowledge of REST service patterns and other client/server interaction models *  Deep knowledge of Node.js *  Extensive experience with Automated Testing (especially Unit and Integration, preferably also End-to-End and Load) *  Excellent written and verbal communication skills and ability to communicate with individuals across the organization *  Experience with Build and Deployment automation (CI/CD) *  Experience with ticket/release management tools, e.g. Jira *  Experience with Git (GitLab) and Jenkins *  Experience working within remote or geographically distributed teams is preferable*  *  Bonus Points If You Have: * AWS or other cloud certifications *  Experience building solutions per the AWS Well-Architected Framework*  *  About Us: *  We look for team players/authentic people that strive for excellence and aren’t afraid to be themselves while they do it — because that’s what special teams are made of. If you’re ready to make an impact, take on responsibility, and be a part of our team, then apply to join our team. Our promise is to enable and equip you for long term success, all while being surrounded by good people looking to do amazing work.* *  To create the highest-performing team of professionals, Extensiv focuses on recruiting a dynamic, diverse, and inclusive team that represents our customers and greater communities. To increase diversity, Extensiv’s recruiting and hiring efforts focus on attracting individuals that are diverse in thought, experience, age, race, ethnicity, gender identity, sexual orientation, religion or belief, nationality, disability, veteran status, and any other protected status.* *  Teams at Extensiv are expected to empower, engage, and hold their peers accountable for nurturing an inclusive environment where every individual has an equal opportunity to advance and be fairly compensated for their work.* *  Extensiv does not accept unsolicited resumes from recruitment agencies or search firms and is not responsible for any fees related to unsolicited resumes.*","https://www.indeed.com/rc/clk?jk=7c237d673b3c525d&fccid=5a3eec18e156873d&vjs=3","Hybrid","Part-time","MSIS",0,0,1,0,0,0,1,0,0,0,0,0,0,0,0,0,0,0,0,0,"c3e33598e2940132d45840681c2cfd4e"
"2","cloud engineer",2022-08-17,"Senior Database Engineer","Adobe","Lehi, UT 84043","* *  Our Company*   Changing the world through digital experiences is what Adobe’s all about. We give everyone—from emerging artists to global brands—everything they need to design and deliver exceptional digital experiences! We’re passionate about empowering people to create beautiful and powerful images, videos, and apps, and transform how companies interact with customers across every screen.*   We’re on a mission to hire the very best and are committed to creating exceptional employee experiences where everyone is respected and has access to equal opportunity. We realize that new ideas can come from everywhere in the organization, and we know the next big idea could be yours!* * * *   The Senior Database Engineer will be responsible for designing, building, deploying, and supporting complex database systems and data models. You will collaborate with business units to analyze current-state business processes and help modernize and build scalable and sustainable solutions to help ensure data integrity and security. We look for self-motivated individuals who can function and adapt in an agile development model with iterative delivery, incorporating feedback rapidly into delivery components. Our team partners closely with groups inside and outside of the Finance organization and requires individuals to bring a can-do, positive attitude, with a focus on delivering exception customer support.* *","https://www.indeed.com/rc/clk?jk=ca5b15f1f6fb71aa&fccid=f89deb5a97c7738a&vjs=3","On-site","Part-time","MSIS",0,0,0,0,0,0,0,0,0,0,0,0,0,0,0,0,0,0,0,0,"cc4045be803e686969c3e437f1a140a8"
"3","cloud engineer",2022-08-17,"Senior Software Engineer (React/JS)","Angel Studios","Remote in Provo, UT","* *  *   Who We Are*  *  *  *    Angel Studios is the home of stories that amplify light. Through its platform, thousands of “Angel” investors choose which titles will be created, funded, and distributed. Angel Studios allows creators and audiences to form passionate communities around their creative projects, making the story behind the story as important as the final project itself. The studios’ first projects—The Chosen and Dry Bar Comedy—have earned billions of views around the world. Learn more at Angel.com*  *  *  *    We’re looking for passionate team members who want to build world-class products that will reshape media over the coming decades. Learn more about:*  *  *    Our North Star*  *  *    Company Strategy*  *  *    Team Principles*  *  *    Join us and be part of stories that matter.*  *  *  *    Role*  *  *  *    We are looking for a Mobile Engineer who loves building great user experiences to join our team and help build our growing portfolio of products that enable a consumer to enjoy content that they can co-create with the creators through our platform. In this role, you’ll work with a high-energy, cross-functional team, which will include other developers, product managers, and designers to perfect the viewing and community engagement experience for viewers of TV shows and movies across all of Angel Studios.*  *  * *  *   You may enjoy working with us if you:*    Are self-driven and highly motivated to deliver top-tier solutions with minimal guidance. You also recognize when you're wrong, learning from your mistakes and moving past them.*      Enjoy creating massively scalable and high performance applications that support experiences that delight and surprise every consumer who use your carefully crafted interfaces.*      Are curious about the evolution of technology and are constantly seeking to improve your craft by taking advantage of the advances made in the field.*      Strive to embrace best practices and are always searching for opportunities to continually improve, learn and grow.*      Enjoy collaborating with a diverse team and empowering everyone to do the best work of their life.*    *  * *  *   We would love to work with you if:*    You are a Software engineer who has experience crafting high performance reusable code for UI components and developing rich applications for Mobile with React or interest in learning React Native*      You are experienced in the infrastructure needed to make compelling frontend experience such as API development (GraphQL, REST), and mobile frameworks (React Native, React, Android, iOS)*      You are passionate about careful design & architectural planning that lead to a codebase that is future-proof and maintainable.*      You enjoy the challenge and opportunity to lead and improve the development experience at Angel Studios by enhancing development tools, test coverage, and code structure.*      You are proactive and detail-oriented, yet comfortable working in a dynamic environment with tight deadlines and evolving requirements.*    *  * *  *   Work environment - When in the main office, expect a comfortable, air-conditioned work environment. Employees are issued their own desks, but the office is an open, shared space and can be fast-paced and occasionally noisy.*  *  *  *    Physical demands - Ability to sit at desk and use computer for prolonged periods of time*  *  *  *    Position type and expected hours of work - Regular full-time, 40 hours per week.*  *  *  *    Travel required - Travel is not anticipated for this position but must be willing to travel if necessary.*  *  *  *    Work authorization - Must be authorized to work in the United States.*  *  *  *    EEO statement*  *  *    We are committed to equal employment opportunity regardless of race, color, ancestry, religion, sex, national origin, sexual orientation, age, citizenship, marital status, disability, gender identity or Veteran status.*  *  *  *    Other duties*  *  *    Please note this job description is not designed to cover or contain a comprehensive listing of activities, duties or responsibilities that are required of the employee for this job. Duties, responsibilities and activities may change at any time with or without notice.*  *  *  *    Angel is an Equal Opportunity Employer:*  *  *  *    We are actively seeking to create a diverse work environment because teams are stronger with different perspectives and experiences.*  *  *    We value a diverse workplace and encourage women, people of color, LGBTQIA individuals, people with disabilities, members of ethnic minorities, foreign-born residents, older members of society, and others from minority groups and diverse backgrounds to apply. We do not discriminate on the basis of race, gender, religion, color, national origin, sexual orientation, age, marital status, veteran status, or disability status. All employees and contractors of Angel are responsible for maintaining a work culture free from discrimination and harassment by treating others with kindness and respect.*  * *","https://www.indeed.com/rc/clk?jk=ea6591516bc6d3e5&fccid=31deb4e9336f4b27&vjs=3","Remote","Full-time","MSIS",0,0,0,0,0,0,0,0,0,0,0,0,0,0,0,0,0,0,0,0,"da709b8c0ca32b4e5befeb9dda2f27c0"
"4","business intelligence analyst",2022-08-17,"Sales Operations Analyst","Ariana Solutions","Lehi, UT","Title: Sales Ops Analyst 1*Location: Lehi UT*Duration: 4 Months*Skills:*What you’ll do: Identify & communicate relevant service needs Support sales teams & promote the value of services Report on status of service operations activity & service pipeline Build dashboards to provide insights into service program adoption & health Achieve service targets attach rates & bookings Establish KPIs & measure new and existing service & operational performance Operate key service processes within APAC region leading to increased service sales Identify & implement improvements within service sales & operations Capture and share feedback on services offerings & operations Manage service operations to ensure that the status & trend on key metrics are understood & regularly reported. Manage service sales governance leading to increased compliance and address operational gaps. What you need to succeed: Experience working within a technology professional services business Experience working within service sales and/or sales operations roles Proficient working with salesforce CRM & Microsoft Excel reporting and working with sales pipeline data Experience collating, summarising & presenting data from multiple sources Experience supporting, preparing and delivering enablement webinars Highly organized & efficient Strong time management skills Self-motivated*Education: 1 to 3 years or experience as an Analyst Someone who is a BBA or MBA interested to understand Sales and Sales Operations*Job Type: Contract*Pay: $30.00 - $35.00 per hour*Schedule:*8 hour shift*Experience:*Sales and Sales Operations: 2 years (Preferred)* sales/business analyst: 1 year (Preferred)*Work Location: One location","https://www.indeed.com/company/Ariana-Solutions/jobs/Sales-Operation-Analyst-9d6c9ac7f9e3b859?fccid=7a542c90fc760e4d&vjs=3","On-site","Part-time","MSIS",0,0,0,0,0,0,1,0,0,0,0,0,1,0,0,0,0,0,0,0,"3bab9276ae490e73c550d6d9eee066d9"
"5","data integration engineer",2022-08-17,"Electrical Engineer, GBSD","Bechtel","Ogden, UT","Since 1898, we have helped customers complete more than 25,000 projects in 160 countries on all seven continents that have created jobs, grown economies, improved the resiliency of the world's infrastructure, increased access to energy, resources, and vital services, and made the world a safer, cleaner place. *Differentiated by the quality of our people and our relentless drive to deliver the most successful outcomes, we align our capabilities to our customers’ objectives to create a lasting positive impact. *We serve the Infrastructure; Nuclear, Security & Environmental; Oil, Gas & Chemicals; and Mining & Metals markets. Our services span from initial planning and investment, through start-up and operations. *Core to Bechtel are our values – ethics, safety, quality, people, culture, relationships, innovation and sustainability, and our covenants – integrity, respect, collaboration, trust, and delivery. They are what we believe, what customers can expect, and how we deliver. * Project Overview *Bechtel is on the Northrop Grumman Corp. team preparing to deliver the U.S. Ground Based Strategic Deterrent (GBSD) system of inter-continental ballistic missiles and launch infrastructure. GBSD is a vital U.S. Air Force program designed to modernize the nation’s aging force of inter-continental ballistic missiles, which make up the ground element of the nuclear deterrent. As part of the Northrop Grumman GBSD nationwide team, Bechtel will provide launch system design, construction, and integration. * A major contractor for the United States and allied governments, Bechtel has handled such efforts as chemical weapons demilitarization projects, missile-defense, infrastructure, base operations, procurement and project management, and restoration and recovery spanning half a century. We use our expertise to help our customers securely and effectively transform mission delivery. * We invite you to join our team for this very interesting opportunity! * Position Summary *This position is for a Electrical Engineer who will prepare designs for Electrical systems associated with DOD and USAF projects. The successful candidate must have strong organizational and teamwork skills, proven problem-solving abilities, can-do attitude, and the desire to innovate designs. This role will specifically support the USAF Ground Based Strategic Deterrent (GBSD) program Engineering and Manufacturing Development (EMD) phase. * Responsibilities *This role will support design development of Electrical systems and equipment for the GBSD program project by preparing studies, drawings, calculations, specifications, data sheets, and evaluations, in accordance with applicable procedures, codes, standards, and contract requirements. *Work with Electrical engineers and other technical disciplines in a team environment. * Develop design drawings and other design documents * Perform system analysis and equipment sizing calculations * Prepare design and equipment specifications * Develop design configuration packages for configuration control and change management * Design Building Information Modeling and coordination with other disciplines * Execute to schedule requirements while maintaining a high degree of quality in work product * Coordinate closely with other technical disciplines in planning and executing work as an integrated team * Qualifications and Skills *Basic Qualifications *Level I: BS degree in Electrical Engineering, from an accredited university, with 1 year of relevant experience. * Level II: BS degree in Electrical Engineering, from an accredited university, with 3 years of relevant experience. * Relevant experience includes, but is not limited to design drawings, calculations, and specifications for Electrical systems and equipment on nuclear or industrial process facilities, data centers, central utility plants, or complex building Electrical systems. * US citizenship is required per contract requirement. * This role requires a facility-specific clearance that requires U.S. Citizenship to obtain. * Minimum Qualifications *Excellent communication skills (both verbal and written). * Ability to utilize office automation tools effectively. * Knowledge of industry and regulatory guides, codes, and standards, * Broad knowledge of the application of Electrical engineering design principles. * Preferred Qualifications *Level I: MS degree in Electrical Engineering, from an accredited university. * Level II: MS degree in Electrical Engineering, from an accredited university, with 1 year of relevant experience. * Active Secret Security Clearance * Knowledge in use of Bechtel Corporate guides and standards. * Prior work experience in multi-project environment and demonstrated flexibility in work assignments. * Experience developing equipment configuration packages for procurement and maintenance * Passed Engineering in Training/Fundamentals of Engineering Examination in USA (Electrical Engineering). * Hands-on experience using Revit MEP, including Architectural interface, drawing generation, view templates, design options, and phasing. * Experience working with procedures meeting quality assurance programs ISO-9000. * Basic knowledge of developing CSI Masterformat specifications, or SpecsIntact. * Experience executing engineering design with Revit Knowledge of electrical systems, schematics and layouts. * Understanding of engineering drawings, systems calculations, equipment sizing and cable sizing. * Knowledge of power systems load modeling and analysis * Prior experience working with government agencies, preferably the Department of Defense Design experience with Unified Facilities Criteria and the Whole Building Design *","https://www.indeed.com/pagead/clk?mo=r&ad=-6NYlbfkN0D1HrGvM3IO11DU-hdc4u4iftvEi0SlREeNwZASq2ihTw1OyUwQHweFYxnUKMnFMou8TZNfOSbLa9SHbko3TTKVe9T3oXcjdJMjYenxfGFCx_X4dxjMR7hcxJQXSyMcKhTrZPeFNmBk0SrJVf-V-iygcxsamvhQq4glbg1ZPC6Q0Ad8DDkUrRu28O91wQyMt6yhK57YqQM8buXs6q7dNGNgRR5_l8ERsZyECCaUTqrTPDuafZnPBCabRJt-NZYGf5jGs9a6mHdLcRoG1TvpQ9LonV43MW9M39XkeVVaubsMULpCdnhUy6W8uUzep7WAlOELznhryvBlY_7ZO2dhHzjE1HXzosJcHsxm680CP_arKKm41w3GRNEJIuI2KFSz8nA_hSLHRveHUU6FBTDFUihSIfD44XwHdpt0R9gl_X0ttimsDsOZjQS3G_SMpMxlfxqZsByvnQQqHNOGEceGziuZpKuETD3MGYVFJEcVY5T9Qo4Wqoqo5o_auLDlGZMIsqfqNDvodlsdvUDcFv4RdcHpAWhjaTx7MrppUEPjjhApPY13DiljKY3nBmWPHe-pORM=&xkcb=SoDQ-_M3aV-LlFwiyJ0IbzkdCdPP&p=6&fvj=0&vjs=3","On-site","Part-time","MSIS",0,0,0,0,0,0,1,0,0,0,0,0,0,0,0,0,0,0,0,0,"b1eeedaf7b7b82dcbbf8cd63259f7cb9"
