"","Search","Date","Title","Company","Location","Description","Link","Work Model","Job_Type","Program","R","Python","SQL","Tableau","PowerBI","Azure","Excel","Talend","SAS","Spark","Qualtrics","Domo","Salesforce","SAP","Hadoop","Qlik","Looker","Zoho","Stata","Snowflake","ID"
"20","security compliance analyst",2022-08-17,"Associate Business Process Analyst","Optum","Remote in Salt Lake City, UT 84101","* *  Combine two of the fastest-growing fields on the planet with a culture of performance, collaboration and opportunity and this is what you get. Leading edge technology in an industry that's improving the lives of millions. Here, innovation isn't about another gadget, it's about making health care data available wherever and whenever people need it, safely and reliably. There's no room for error. Join us and start doing your life's best work.(sm) *  You’ll enjoy the flexibility to telecommute* from anywhere within the U.S. as you take on some tough challenges. *  Primary Responsibilities: *  Plan/Define Approach for Gathering Business Requirements *  Participate in the definition of project roles to drive the gathering of detailed business, functional and non-functional requirements *   Identify applicable technical and business stakeholders, using appropriate Stakeholder Analysis tools/approaches (e.g., RACI, SIPOC) *   Define the approach and effort required for defining business requirements (i.e., business, functional and non-functional) *   Define and update the project schedule to track/measure progress of the requirements-gathering process (e.g., status, milestones, tasks, deliverables) *   Define approach for storing and updating business requirements (e.g., SharePoint, ADR, Rally, Quality Center) *   Adhere to established project lifecycle standards/requirements (e.g., SDLC, UDP, RSA, ADR requirements) *  Gather, Analyze and Define Business Requirements *  Collaborate with business and technical stakeholders (e.g., business owners, process owners, domain experts) to identify specific business requirements *   Conduct current state analysis to gather current business, functional and non-functional requirements and constraints (i.e., ""as-is"" state) *   Document future state using appropriate tools/processes (e.g., ""to-be"" process maps) *   Gather information needed for the definition of requirements (e.g., business use cases, user stories) *   Facilitate all needed requirements-gathering activities (e.g., meetings, workshops, JAD sessions) *   Develop business context diagrams (e.g., business data flows, process flows) to analyze/confirm the definition of project requirements *   Define desired future state requirements based on input from all applicable stakeholders *   Identify the business impact of system/application changes, using appropriate tools as needed (e.g., impact analysis, FMEA, risk analysis) *   Identify capability gaps between current state and desired state (e.g., system capacity, emerging technologies) *   Ensure adherence to enterprise standards for gathering and documenting project requirements (e.g., RSA, UDP, applicable templates) *  Document and Communicate Business Requirements *  Collaborate with technology stakeholders (e.g., System Analysts, architects) to communicate business and technical requirements *   Collaborate with project team members to create detailed requirements documents (e.g., PRDs, Requirements Specifications, assumptions and constraints, VFQs, user stories) *   Ensure that project requirements are clearly and comprehensively documented, understood and support traceability (e.g., peer review, SMART, requirements traceability matrix, Agile inspection) *   Ensure that project requirements meet all applicable regulations (e.g., HIPAA, SOX, ARRA, DOI, audit requirements) *   Communicate ongoing updates to all stakeholders to ensure understanding of and alignment with project status/changes *   Manage/update requirements documents as needed throughout the design/development process (e.g., document revisions, change requests) *   Perform reviews with all stakeholders to obtain approval/sign-off of project requirements documents (e.g., walkthroughs) *  Participate in/Support the Solutioning Process *  Support, contribute to and/or facilitate the identification/prioritization of business/process solutions (e.g., analysis tools, solutioning discussions, solution selection matrix, IET, use case development) *   Participate in reviews of conceptual designs and provide appropriate guidance/consulting to help ensure that they satisfy all documented requirements (i.e., business, functional and non-functional) *   Partner with applicable stakeholders to identify the operational impact of changes within defined solutions (e.g., changes to policies/processes/procedures, compliance with applicable legal/regulatory requirements, additional requirements) *   Seek opportunities to improve operating efficiencies/effectiveness (e.g., downstream impacts, role/responsibility realignment, enhanced business value) *   Identify opportunities to engage external resources to provide solutions, and contribute to the development of supporting documentation to facilitate appropriate vendor identification and selection (e.g., Requests For Proposals [RFPs], Requests For Information [RFIs], Statements of Work [SOWs], contractual obligations) *   Support ongoing operations/maintenance/enhancement of existing solutions, in partnership with applicable stakeholders (e.g., IT, business owners/ partners, vendors) *   Develop and implement plans for piloting and staging solutions, and manage stakeholder expectations, as applicable *   Analyze and balance risk/reward considerations for identified solutions (e.g., options analysis) *   Ensure that all stakeholders are fully informed of new/updated solutions, and identify/escalate any issues communicated by stakeholders *   Support ongoing monitoring and adjustment of project scope/timelines/dependencies *   Develop and/or contribute to training programs to support implementation of the solution *   Ensure that identified solutions meet business requirements for all applicable stakeholders (e.g., traceability) *  Participate in/Support the Testing and Validation of Identified Solutions *  Identify and/or establish appropriate testing metrics/targets to validate that business requirements are being met (e.g., performance metrics, process deliverables, traceability, business value) *   Conduct and/or support testing activities, as appropriate (e.g., production testing, regression testing, user acceptance testing, production validation, compliance with test scenarios) *   Plan/execute user testing scenarios/scripts and prepare test data *   Translate problems/issues identified during the testing/piloting process, and engage the appropriate stakeholders (e.g., business, IT) to help identify impact and potential solutions *   Communicate testing results to appropriate stakeholders (e.g., business owners, operations groups, project team) *   Validate usability of technical solutions prior to deployment -Participate in creation of implementation plans for identified solutions (e.g., warranty period support) *   Provide ongoing support to ensure proper implementation and adoption of the solution (e.g., post-deployment support, definition/monitoring of control plans) -Adhere to established systems development standards/requirements (e.g., SDLC, UDP, RSA, ADR) *  You’ll be rewarded and recognized for your performance in an environment that will challenge you and give you clear direction on what it takes to succeed in your role as well as provide development for other roles you may be interested in. *  Required Qualifications: *  Associate's Degree OR 4+ years of experience in a Business Process Analyst or similar position *   3+ years of experience as a Business Process Analyst or similar position *   1+ years of experience prioritizing and managing multiple assignments simultaneously *   Intermediate proficiency in MS Word and Excel *  Preferred Qualifications: *  1+ years of experience in process improvement managing projects working with multiple partners *   Demonstrate Business and Industry Knowledge *   Demonstrate and apply understanding of UnitedHealth Group's business (e.g., specific business capabilities, functions, processes and business cycles) *   Demonstrate and apply understanding of health care industry trends and their drivers -Demonstrate and apply knowledge of technology industry trends and tools -Demonstrate and apply understanding of applicable regulations (e.g., HIPAA, SOX) and UHG policies/standards (e.g., RSA, security) *   Demonstrate understanding of the difference between business requirements and technical solutions *   Maintain awareness of best practices/approaches related to the business analysis discipline (e.g., Business Analysis Body of Knowledge) *   Maintain awareness of best practices/approaches related to quality and productivity (e.g., process improvement, DMAIC, Lean) *  To protect the health and safety of our workforce, patients and communities we serve, UnitedHealth Group and its affiliate companies require all employees to disclose COVID-19 vaccination status prior to beginning employment. In addition, some roles and locations require full COVID-19 vaccination, including boosters, as an essential job function. UnitedHealth Group adheres to all federal, state and local COVID-19 vaccination regulations as well as all client COVID-19 vaccination requirements and will obtain the necessary information from candidates prior to employment to ensure compliance. Candidates must be able to perform all essential job functions with or without reasonable accommodation. Failure to meet the vaccination requirement may result in rescission of an employment offer or termination of employment *  Careers with Optum. Here's the idea. We built an entire organization around one giant objective; make the health system work better for everyone. So when it comes to how we use the world's large accumulation of health-related information, or guide health and lifestyle choices or manage pharmacy benefits for millions, our first goal is to leap beyond the status quo and uncover new ways to serve. Optum, part of the UnitedHealth Group family of businesses, brings together some of the greatest minds and most advanced ideas on where health care has to go in order to reach its fullest potential. For you, that means working on high performance teams against sophisticated challenges that matter. Optum, incredible ideas in one incredible company and a singular opportunity to do your life's best work. SM *  *All Telecommuters will be required to adhere to UnitedHealth Group’s Telecommuter Policy. *  Colorado, Connecticut or Nevada Residents Only : The salary range for Colorado residents is $21.68 to $38.56. The salary range for Connecticut / Nevada residents is $23.94 to $42.40. Pay is based on several factors including but not limited to education, work experience, certifications, etc. In addition to your salary, UnitedHealth Group offers benefits such as, a comprehensive benefits package, incentive and recognition programs, equity stock purchase and 401k contribution (all benefits are subject to eligibility requirements). No matter where or when you begin a career with UnitedHealth Group, you’ll find a far-reaching choice of benefits and incentives*  *   Diversity creates a healthier atmosphere: UnitedHealth Group is an Equal Employment Opportunity/Affirmative Action employer and all qualified applicants will receive consideration for employment without regard to race, color, religion, sex, age, national origin, protected veteran status, disability status, sexual orientation, gender identity or expression, marital status, genetic information, or any other characteristic protected by law.  UnitedHealth Group is a drug-free workplace. Candidates are required to pass a drug test before beginning employment.*  *  Keywords: #RPO* *","https://www.indeed.com/rc/clk?jk=93f3eb88f35380c2&fccid=3c38342724c75954&vjs=3","Remote","Part-time","MSCM",1,0,0,0,0,0,1,0,0,0,0,0,0,0,0,0,0,0,0,0,"347d3db1dfa2e8b6f52fc5c7e1eeefc6"
"21","business intelligence analyst",2022-08-17,"D365 F&O Functional Analyst","Orbit Irrigation Products, LLC","Remote in North Salt Lake, UT 84054+1 location","** Orbit, located in North Salt Lake, UT (10 minutes north of downtown Salt Lake City), is looking for a full-time D365 F&O Functional Analyst. We are “Changing the Way the World Waters” by developing and manufacturing innovative irrigation products.*  Are you ready help us “Change the Way the World Waters”?*   Are you ready to be part of a team that values “Quality of Life” and Flexibility?*   Are you seeking an employer who values “Caring Relationships” and treating all team members as people?*   Do you have a Positive “Attitude” and seek to work with likeminded individuals?*   Are you ready to be a part of a team who has used “Innovation and Continuous Improvement” to succeed over the last 50 years?*  A Day in the Life*  The D365 F&O Functional Analyst collaborates with business counterparts to analyze business requests and identify appropriate solutions. They configure solutions and collaborate with development team to develop and test solutions. The D365 F&O Functional Analyst serves as a technical resource to executives, managers, and/or end-users to determine objectives of project assignments.*  What are the requirements for this position?*  5-7 years of experience as a Dynamics AX/D365 subject matter expert or Business Analyst*   Bachelor’s degree in business, information systems, or related field of study required.*   Experience with and proficiency in Dynamics AX/D365 Operations module including Supply Chain Management (SCM), Manufacturing, Planning, Warehouse Management (WM), Material Requirement Planning (MRP), Procurement, etc.*   Are you qualified for this position? If yes, apply NOW!*  Are there any preferred qualifications?*  Experience with Dynamics AX/D365 sales module including quotes, purchase order, sales order, fulfillment, etc.*   Firm knowledge and understanding of business analysis skills.*   Basic knowledge and experience with Microsoft Suite, Outlook, Azure DevOps, core systems, and other applicable software as required.*   Understanding of software testing methodology and techniques.*   Ability to work individually or collaboratively with a team to create a positive environment for associates to grow. and learn and to use sensitivity, tact, and professionalism in dealing with others.*   Ability to take calculated risks, question norms, and respectfully challenge others.*   Be self-motivated, plan, and estimate your own work effort.*   Good team building skills including trust, professionalism, and ability to garner consensus across diverse groups.*   Able to provide 24/7 support.*  We offer great benefits:*  Competitive Pay (salaried), plus bonus *  A free onsite care clinic*   Flexible office hours (standard M-F, 8 AM to 5 PM)*   Medical, dental, vision*   Life insurance*   Long-term and short-term disability*   Subsidized UTA Eco pass (Front runner, Trax, & buses)*   Opportunities for remote work*  Responsibilities: * Eliciting, gathering, and documenting business requirements for system enhancement(s) and/or new system(s), serving as a liaison between the business area and IT.*   Monitors system performance to ensure proper operation and identifies possible problem areas.*   Designs, implements, tests, and maintains required software; establishes and documents standards for use and operation of software.*   Creates and maintains system support documentation.*   Provides ongoing support to programming and systems, including developing proposals for improvements utilizing current industry best practices; provides necessary training.*   Configure Microsoft Dynamics AX and/or Microsoft Dynamics 365 (D365) Operations functions.*   Maintain a functional knowledge of systems, applications, programs, and processes within Operations and its integration with related sales and finance processes.*   Provide support for key Operations business processes including Supply Chain Management (SCM), Manufacturing, Planning, Warehouse Management (WM), Material Requirement Planning (MRP), Procurement, etc.*   Collaborates with sales, marketing and finance to meet common objectives.*   Proactively promote process improvement, automation, and identify technology needs in the Supply Chain area.*   Provide information from industry research and expertise to decision makers enabling them to make better choices faster.*   Understand best business operations practices, applications and how these are supported through applied software.*   Follow standard methodology for documentation, training, and agile processes.*  About Orbit*  Orbit was founded 50+ years ago and is now part of Husqvarna Group's Gardena Division creating the global leader in residential watering solutions. In addition, Orbit's B-hyve suite of smart products, with 1.4 million connected devices, helps consumers conserve water, promote plant health, and save money. “We are changing the way the world waters.”*  Learn more at:*  https://www.orbitonline.com/*   https://www.gardena.com/us/*   https://www.husqvarnagroup.com/en/*  Orbit Irrigation is an Equal Employment Opportunity Employer, who participates in E-Verify. Reference checks are a prerequisite for employment. All offers are contingent on completion of a drug screening and may be contingent on completion of a criminal background check. All successful candidates must provide original documents that will establish their identity and eligibility to work in the United States as required by the Immigration Reform and Control Act.* *  Experience Required*  Dynamics AX/D365 Operations module including Supply Chain Management (SCM), Manufacturing, Planning, Warehouse Management (WM), Material Requirement Planning (MRP), Procurement, etc.*   5 - 7 years: In the field or related area*  Education Required*  Bachelors or better in Information Technology or related field*","https://www.indeed.com/rc/clk?jk=5c8acf14c119301a&fccid=8a375c7d7f08f326&vjs=3","Remote","Full-time","MSIS",0,0,0,0,0,1,0,0,0,0,0,0,0,0,0,0,0,0,0,0,"7cee171f9ca393b5864bf0dd1d3e8ce9"
"22","data integration engineer",2022-08-17,"Quality Engineering Manager","PRICE WATERHOUSE COOPERS","Remote in Salt Lake City, UT 84111","* A career in Quality Engineering will provide you with the opportunity to deliver innovative solutions that are valuable, usable, fit with our market and aligned with accomplishing the company's mission. We help build software and design data platforms, manage large volumes of client data, develop compliance procedures for data management, and continually researching new technologies to drive innovation and sustainable change. As part of our Quality Engineering team, you'll help with testing management, strategy development, execution, and data analysis to enhance our clients enterprise technology.*  To really stand out and make us fit for the future in a constantly changing world, each and every one of us at PwC needs to be an authentic and inclusive leader, at all grades/levels and in all lines of service. To help us achieve this we have the PwC Professional; our global leadership development framework. It gives us a single set of expectations across our lines, geographies and career paths, and provides transparency on the skills we need as individuals to be successful and progress in our careers, now and in the future.* *  As a Manager, you'll work as part of a team of problem solvers, helping to solve complex business issues from strategy to execution. PwC Professional skills and responsibilities for this management level include but are not limited to:* *  Pursue opportunities to develop existing and new skills outside of comfort zone.*   Act to resolve issues which prevent effective team working, even during times of change and uncertainty.*   Coach others and encourage them to take ownership of their development.*   Analyse complex ideas or proposals and build a range of meaningful recommendations.*   Use multiple sources of information including broader stakeholder views to develop solutions and recommendations.*   Address sub-standard work or work that does not meet firm's/client's expectations.*   Develop a perspective on key global trends, including globalisation, and how they impact the firm and our clients.*   Manage a variety of viewpoints to build consensus and create positive outcomes for all parties.*   Focus on building trusted relationships.*   Uphold the firm's code of ethics and business conduct.*  Custom Orgs:Global LoS:  AdvisoryJob Requirements and Preferences: Basic Qualifications: Minimum Degree Required:  Bachelor DegreeRequired Fields of Study:  Computer Engineering, Computer and Information Science, Engineering, Engineering and Business, Information Technology, Management Information SystemsMinimum Years of Experience:  5 year(s) Preferred Qualifications: Preferred Knowledge/Skills: * * Demonstrates thorough abilities and/or a proven record of success in testing enterprise level applications. This may include partnering or working closely with key vendors and service providers as well as technology team members to plan and manage a tool set that supports business needs and is in compliance with corporate and industry standards, including the following:*  Working in different phases of testing;*   Supporting testing tools and processes like MicroFocus UFT, Selenium, Cucumber, Qualitia, etc;*   Understanding of Performance Testing tools;*   Understanding of Behaviour driven frameworks;*   Creating test reports, metrics, test plans and dashboards;*   Understanding of SDLC/Agile Methodologies and DevOps;*   Understanding of process analysis, defect management, and risk assessment/mitigation; and,*   Working independently or in team oriented environments and meet deadlines.*  Demonstrates thorough abilities and/or a proven record of success in supporting Quality Assurance and Testing-based engagements, which includes the following:*  Assisting with assessments and appraising the maturity of existing test organizations against full life cycles of a defined Testing Methodology;*   Helping to implement recommendations that lead clients to a higher level of maturity and improve efficiencies;*   Assisting in engagements which may include Development Integration Testing (Component/Feature Testing), System Integration Testing (SIT), User Acceptance Testing (UAT) and Production Acceptance Testing (PAT), supporting responses for proposal documents and project teams for client engagements;*   Helping to implement testing recommendations, organizational designs and other process recommendations;*   Performing Quality Assurance and Testing-related work;*   Providing technical and consulting support from Quality Assurance & Testing-related activities and functions; and,*   Understanding of SDLC.*  Demonstrates thorough abilities and/or a proven record of success with leading Quality & Assurance Testing engagements that provide clients with a program, methodology, tools and templates to capture and classify their application portfolios, analyze functional redundancies, assess performance considerations and calculate total cost of ownership, which includes thorough abilities to utilize the following:*  Testing tools certification;*   Possessing SDLC methodology certification (ITIL etc.);*   Possessing Project Management (PMP) certification;*   Performing Functional / System Testing;*   Performing Test Plan reviews and developments;*   Performing Test Script development;*   Understanding of Quality Center and other testing tools and/or testing tool certifications; and,*   Understanding of Automation of performance metrics and technologies that support this, including Microsoft Access, Microsoft SharePoint, and Program Assessment Rating tool.*  At PwC, our work model includes three ways of working: virtual, in-person, and flex (a hybrid of in-person and virtual). Visit the following link to learn more: https://pwc.to/ways-we-work.*  PwC does not intend to hire experienced or entry level job seekers who will need, now or in the future, PwC sponsorship through the H-1B lottery, except as set forth within the following policy: https://pwc.to/H-1B-Lottery-Policy.*  All qualified applicants will receive consideration for employment at PwC without regard to race; creed; color; religion; national origin; sex; age; disability; sexual orientation; gender identity or expression; genetic predisposition or carrier status; veteran, marital, or citizenship status; or any other status protected by law. PwC is proud to be an affirmative action and equal opportunity employer.*  For positions based in San Francisco, consideration of qualified candidates with arrest and conviction records will be in a manner consistent with the San Francisco Fair Chance Ordinance.*  For positions in Colorado, visit the following link for information related to Colorado's Equal Pay for Equal Work Act: https://pwc.to/coloradoadvisorymanager.*  #LI-Remote*","https://www.indeed.com/rc/clk?jk=a2a99ed4b9ac2252&fccid=5e964c4afc56b180&vjs=3","Hybrid","Part-time","MSIS",0,0,0,0,0,0,0,0,0,0,0,0,0,0,0,0,0,0,0,0,"ff4c2d57f63eabc01c87725ed8bc10ff"
