"","Search","Date","Title","Company","Location","Description","Link","Work Model","Job_Type","Program","R","Python","SQL","Tableau","PowerBI","Azure","Excel","Talend","SAS","Spark","Qualtrics","Domo","Salesforce","SAP","Hadoop","Qlik","Looker","Zoho","Stata","Snowflake","ID"
"11","data architect",2022-07-12,"Principal Software Architect - Web UI","Disney","Salt Lake City, UT 84111 (Downtown area)+1 location","* *  Job Description :*  *   We are a group of Disney technologists who love to work on the latest technology to build new features and improve existing components of Disney's Online Commerce Platform specializing in Ticketing Products. We also take pride in building the next generation of Commerce products for several business units within the Walt Disney Company. Key Products within Commerce include Tickets, Annual Passes, Special Events, Park Reservations, Unified Checkout across many products including Dining and Lodging across Walt Disney World, Disneyland California, and Disneyland Paris* * * *   Responsibilities :*   Lead Architecture, Design and Technical Roadmap of cloud scale Software Platforms that support a large variety of Disney Products.*    Mentor a team of Developers and Architects to design, prototype and develop software.*    Help align stakeholders from all areas – Business, Commercial, Product, Cross Vertical Technology and Operational Teams.*    Work in an Agile Environment with Detailed Planning and Estimation accuracy*    Design and implement new software systems, build distributed systems with efficiency and stability in mind.*    Lead design reviews with peers and partners to build the right solution using available technologies or solutions that caters to the best Guest and Cast Experience*    Identify areas of improvement in our application ecosystem and patterns of repeated problems proposing solutions that can be applied globally.*    Set Architecture best practices to improve scalability, performance, and availability based on technical and business considerations*    Analyze user requirements and define non-functional requirements (scalability, reliability, performance, throughput, availability, security, and maintainability).*    Develop proof of concepts and prototypes for innovative technologies and new business needs.*    Maximize the Return on Investment on Projects by building scalable and performant software systems*    Participate in Brainstorming Phases of Large-Scale Efforts within Commerce and other areas of Disney Parks and Experience Products.*  * * *   Basic Qualifications :*   10+ years' experience in Software Development*    Experience within a fast-paced, software application delivery, and product launch environment*    Hand-on Experience with:*     Modern JavaScript-based applications and development frameworks such as Angular, Node.js, jQuery.*      Creating dynamic mobile friendly web apps that are cross-browser/cross-platform compatible.*      RESTful Web Services*      Jenkins and GIT*      TDD and writing unit tests.*      Web components*      UI Optimization, Automation, and Performance Tuning*      Familiarity working with Mobile Web Views*    *    Experience with AWS Suite (Service Management and Deployments, EC2 and ECS Containers, Elastic Search Caching, Lambdas, DynamoDB, MariaDB/MySQL, Kinesis, Developer Tools)*    Development Experience with expectation of 50% or more Code Engagement and Detailed Knowledge in areas:*     Messaging Patterns (Queuing vs Pub/Sub)*      HTTP/HTTPS protocol knowledge*      Relational Database knowledge (Primary keys, Indexes, Foreign keys, SQL)*      Basic cryptographic knowledge (symmetric/asymmetric encryption mechanisms)*      Web-based application security mechanisms (OAuth, HMAC)*      Knowledge of RESTful architectural style*      Experience writing API specifications*    *    Experience troubleshooting performance issues*    Hands-on Knowledge on Design Patterns - Great understanding in the following design patterns: Singleton, Factory, Observer, Builder, Adapter, Publisher/Subscriber, Decorator.*    Hands On Knowledge on Data Structures - Using Lists, Sets, Maps, Linked Lists, Queues, Stacks.*    Hands-on Knowledge of Algorithms- solve coding problems on whiteboard, Big O notation, time, and space complexity of the algorithms.*    Hands On Knowledge on Design and Architecture principles – Scalability, High Availability, Resiliency, Fault Tolerance, Redundancy, Reusability, Interoperability, Performance, Security, Maintainability, Cost optimization.*  * * *   Preferred Qualifications :*   Knowledge of Android or iOS Development:*     Swift, SwiftUI, Interface Builder, and Cocoa Touch, iOS back-end services*      Kotlin (Coroutines, Jetpack, Cocoa Pods, Carthage)*    *    Familiarity with Firebase Test Lab, Sauce Labs Test Cloud, or AWS Device Farm*  * * *   Required Education :*   Bachelors degree in Computer Science, Computer Engineering, or Related Disciplines, or Equivalent Professional Experience*  * * *   Preferred Education :*   Masters degree in Computer Science, Computer Engineering, or Related Disciplines, or Equivalent Professional Experience*  * * *   #DISNEYTECH #DPEPFLA #LI-JP9* *","https://www.indeed.com/pagead/clk?mo=r&ad=-6NYlbfkN0DAFTyt7pbDCC2JPO79CSdi1dIb81yjczP5qsKcZIxgiRd1qisRd4re16D_VG3-wzUWs9OwoP3tNGgwo8VSRaBRXMftba--bTdPGenlmxJEpLMXK8ZGUVWKaG8BJzvLNIVk29Wvgw37slk-A_oLEzpjpUMt9a1EaeREYOi6CvExMKopOmG4Vzm1_l6re3HkGt9chjAQR1DbW6jXuZPmSZ5L9uOAoai9oKaXbpe0nyFAh8E7bHGa8aqM4KUQaSKjMlR1hc59gl8TDl0RRPnguTSFuiDeLQExsU7Gf3TBWOsVJPlvAOce1UIhgOu49-wz5063nel52-URsWmw4lXXaS_rzJo5b-rI4tIXnGgu6qESyFG0mfW68WnFcfFeW7pF49VVRAqJb0VH9CQQgXrTNZ_Y7R3kCY3i7-nr3JfQfdqPaai9AKykdapQyxlIwIa8BOU=&xkcb=SoBL-_M3c5BCI8wu9R0LbzkdCdPP&p=3&fvj=0&vjs=3","On-site","Part-time","MSIS",0,0,1,0,0,0,0,0,0,0,0,0,0,0,0,0,0,0,0,0,"f9bb0e173f23f1eed468853cb4b5d348"
"12","data engineer",2022-07-12,"Senior Data Engineer","Fidelity Investments","Temporarily Remote in Salt Lake City, UT 84104","* Job Description:* *  Data Engineer*  Fidelity Investments is looking for a Sr Data Engineer to join the ETGS Software Engineering Chapter team supporting Enterprise Cybersecurity (ECS) business unit. The ECS organization is responsible for delivering appropriate security solutions to ensure enterprise resources are protected in a constantly evolving cyber-threat landscape.*  The Team*  Within ECS, the Customer Protection Services (CP) product area builds and supports authentication and identity management applications to facilitate secure access to Fidelity’s customer facing systems. We operate through multiple channels including internet, voice and trusted partner sites providing both direct and federated authentication services.*  The Expertise You Have * Crafted and implemented operational data stores, as well as data lakes in multi-site High Availability environments.*   Prior experience designing data processing pipelines and resilient messaging services.*   Experience with AWS or other cloud-based data platforms*   SQL specialist; ETL background and experience with schedulers a plus*   Data modeling skills and familiarity with BI reporting tools a plus*   An understanding of microservice architectures and twelve factor app patterns; comfortable with core Java technologies and database libraries*  The Skills You Bring*  A proven foundation in software engineering – bachelor’s degree + preferred, 5 years’ experience*   Strong background in data field with full-stack software development knowledge and critical thinking skills to design end-to-end solutions*   Experience and comfort working in an agile environment (Scrum and Kanban)*   You are a strategic thinker, bring your curiosity and excitement; desire to collaborate and work closely in a paired programming environment; be energized by fast, iterative and extreme programming practices*   You are open to direction and following agreed upon standards; yet be comfortable with ambiguity and enjoy experimenting, developing and presenting alternatives*   You have maniacal focus on automation and always looking towards reducing waste and improving efficiencies*   You should enjoy communicating and learning the business behind the application*   You have hands-on experience in designing and developing using the following technologies*   Experience with DB2; Expertise with StoredProcs & SQL*   Unix and Shell scripting skill expertise, programming with Python desired.*   Experience with AWS cloud-based data platforms a must*   Experience with MQ configuration and mgmt, QREP configuration and setup desired*   Experience with Directory structures, Knowledge of SCIM open standard protocol and PING Directory product a plus*  The Value You Deliver*  Collaborating in an autonomous team, owning all aspects of delivery (Coding, Quality, DevSecOps)*   Team player developing/deploying software in a fast-paced and highly flexible environment*   Continued focus on improving test coverage, release velocity and production health*   Working with global Agile teams and will contribute to enhancing engineering practices*   Exercising operational expertise in a team, targeting Engineering and DevOps excellence*   Forever learning and growing your skillsets to be an active contributor to a well-rounded team*   Automating yourself out of today’s job so that you can move on to the next big challenge* *  Certifications:* *  Company Overview *  Fidelity Investments is a privately held company with a mission to strengthen the financial well-being of our clients. We help people invest and plan for their future. We assist companies and non-profit organizations in delivering benefits to their employees. And we provide institutions and independent advisors with investment and technology solutions to help invest their own clients’ money.*  Join Us *  At Fidelity, you’ll find endless opportunities to build a meaningful career that positively impacts peoples’ lives, including yours. You can take advantage of flexible benefits that support you through every stage of your career, empowering you to thrive at work and at home. Honored with a Glassdoor Employees’ Choice Award, we have been recognized by our employees as a Best Place to Work in 2022. And you don’t need a finance background to succeed at Fidelity—we offer a range of opportunities for learning so you can build the career you’ve always imagined. *  Many of our associates are continuing to work remotely temporarily due to COVID-19. When Fidelity employees eventually return to the office, our goal is for most people to work flexibly in a way that balances both personal and business needs with time onsite and offsite through what we’re calling ""Dynamic Working."" *  We invite you to Find Your Fidelity at fidelitycareers.com.*  Fidelity Investments is an equal opportunity employer. We believe that the most effective way to attract, develop and retain a diverse workforce is to build an enduring culture of inclusion and belonging. *  Fidelity will reasonably accommodate applicants with disabilities who need adjustments to participate in the application or interview process. To initiate a request for an accommodation, contact the HR Leave of Absence/Accommodation Team by sending an email to accommodations @fmr.com, or by calling 800-835-5099, prompt 2, option 3.*","https://www.indeed.com/rc/clk?jk=dbd02ff380b3b438&fccid=deb234f9dd3edcea&vjs=3","Remote","Part-time","MSIS",1,1,1,0,0,0,1,0,0,0,0,0,0,0,0,0,0,0,0,0,"f55dbc41346dc3d937d15945be19e28c"
"13","business intelligence analyst",2022-07-12,"Data Analyst","Foursight Capital, LLC.","West Valley City, UT","* *  Oh, Hi! We are Foursight! Our culture is built around people who act with integrity and passion while remaining humble and accountable to themselves and the team. If this sounds like you, we should meet! *   Looking to further your skills? We are a GROWING COMPANY and have won awards for Top Places to Work and been listed in Inc. 5000 Fastest Growing Companies for SIX YEARS in a row! Don't just take our word for it, check out our employee reviews on Google, Indeed and Glass Door!* *  *   Oh, Hi! We are Foursight! Our culture is built around people who act with integrity and passion while remaining humble and accountable to themselves and the team. If this sounds like you, we should meet! *   Looking to further your skills? We are a GROWING COMPANY and have won awards for Top Places to Work and been listed in Inc. 5000 Fastest Growing Companies for SIX YEARS in a row! Don't just take our word for it, check out our employee reviews on Google, Indeed and Glass Door! *  * Job description: *  Do you want to join a company where your input matters? Foursight Capital is currently seeking a self-motivated individual for our Data Analyst position. This individual will provide input, data analysis, modeling, and reporting to help to shape the direction of the underwriting department, servicing department, and other teams of Foursight Capital. *  Pay: 55k-75k per year (DOE) *  Schedule: Monday through Friday from 9:00AM-5:00PM or 8:00AM-4:00PM *  Job Duties: * Data Mining *  Statistical Analysis *  Machine Learning model development, deployment, and maintenance *  Portfolio Analytics *  Ad Hoc Reporting * Required Experience/Education: * Experience in analytics, data mining, statistics, and model development *  Bachelor's Degree in Information Systems, Statistics, Computer Science, or other technical related fields *  Experience in SQL, R, and Excel *  Excellent verbal and written communication skills * *   Get in on all the awesome at Foursight! *   We believe that when and where an employer can help alleviate the stressors both within and outside of work, our culture thrives! Because of this philosophy, we offer standard benefits like life insurance, medical, dental, vision, and supplemental insurance plans. *   Additionally, we offer unique perks like: *  Generous PTO Plan*  Paid Maternity/Paternity leave*  401k with employer match contribution*  HSA medical plan with employer contribution*  6 Paid Holidays*  Well-being fitness tracker w/Medical Plan*  Pet insurance for your four-legged friends*  $500 Employee Referral Bonus Program*  Dave Ramsey Smart Dollar Financial Literacy Program*  Emotional/Mental Health Well-being program*  Occasional catered breakfast & lunches (Month End Pizza, just because we can)*  High quality leadership most of whom helped develop the business functions we use today*  *","https://www.indeed.com/rc/clk?jk=87f290a77790d4a3&fccid=e41ca475af59334d&vjs=3","On-site","Part-time","MSIS",0,0,1,0,0,0,1,0,0,0,0,0,0,0,0,0,0,0,0,0,"c7fe87d131355467d1c3560b5b0def13"
"14","data warehouse analyst",2022-07-12,"Data Analyst","Geek Hive","Remote in Salt Lake City, UT","* Summary *  The Data Analyst is a key enabler of business intelligence, business/data analysis, data quality, and related data strategies and will be highly influential in helping to shape the future direction of the data analytics practice.*  *  Essential Duties and Responsibilities include the following. Other duties may be assigned. *  *  Identify and execute strategic and tactical analysis, providing insight to clients in various areas, including business, marketing, and technology.*  Analyze customer data in CRM, CMS, CDP, Marketing Automation, and other platforms in response to business and marketing objectives and initiatives.*  Identify customer data sources across online and offline channels, devices, and touchpoints and create corresponding customer data inventories.*  Provide subject matter expertise on web analytics and tag management, assisting in page performance and cookie compliance tests.*  Interpret data, analyze results using statistical techniques and provide ongoing reports.*  Translate user requirements into a data solution design that identifies and maps source system data and rules for data cleansing, integration, and validation.*  Develop and implement databases, data collection systems, data analytics, and other strategies that optimize statistical efficiency and quality.*  Identify, analyze, and interpret trends or patterns in complex data sets.*  Collaborate with cross-functional teams in data migration, cleansing, and load efforts.*  Locate and define new process improvement opportunities based on data analysis and reporting.*  Demonstrate strong presentation skills and the ability to communicate ideas and concepts relating to data analysis/modeling.*  Communicate client's business requirements by constructing easy-to-understand data and process flows.*  Meet with clients to audit their Analytics platforms and provide recommendations for a data strategy and performance gaps the data uncovers.*  Train clients on the use of Google Analytics and Google Tag Manager to maximize the performance of their marketing initiatives.*  Share information and transfer knowledge to others by providing informal advice and training.*  *  *  Qualifications *  To perform this job successfully, an individual must be able to perform each essential duty satisfactorily. The requirements listed below are representative of the knowledge, skill, and/or ability required. Reasonable accommodations may be made to enable individuals with disabilities to perform the essential functions. *  *  Experience leading data analysis efforts.*  Experienced in leading business users, and data analysts in data requirements gathering exercises.*  Ability to communicate the results of analyses in a clear and compelling manner*  Experience with the integration of complex data sets.*  Excellent verbal and written communication skills along with presentation skills.*  Strong working knowledge of data structures and algorithms and understanding of statistical and programming languages including, but not limited to: Python, R, Java, JavaScript, SQL, C/C++,*  Working knowledge of prominent data visualization tools including, but not limited to: Tableau, Microsoft Excel, Power BI, Google Charts, Google Data Studio, FusionCharts, and Datawrapper.*  Strong working knowledge of data analysis methods and techniques including, but not limited to: descriptive analysis, inferential analysis, exploratory analysis, diagnostic analysis, cluster analysis, cohort analysis, regression analysis, and time series analysis.*  Working knowledge of data warehouse/database tools including, but not limited to: Snowflake, Cloudera, Databricks, Teradata, BigQuery, Amazon Redshift, Db2, MS SQL Server, MYSQL, and Postgres.*  Working knowledge of Customer Data Platforms (CDP) including, but not limited to: Treasure Data, BlueConic, Blueshift, Tealium, 6sense, RedPoint, Salesforce Interaction Studio, Sitecore CDP, Lytics, BlueVenn, and Oracle Unity.*  *  *  Education and/or Experience *  Fifth-year college or university program certificate; 4-7 years of relevant experience.*  *  Language Skills *  Ability to read, analyze, and interpret common scientific and technical journals, financial reports, and legal documents. Ability to respond to common inquiries or complaints from customers, regulatory agencies, or members of the business community. Ability to write speeches and articles for publication that conform to prescribed style and format. Ability to effectively present information to top management, public groups, and/or boards of directors.*  *  Reasoning Ability *  Ability to solve practical problems and deal with a variety of concrete variables in situations where only limited standardization exists. Ability to interpret a variety of instructions furnished in written, oral, diagram, or schedule form.*  *  Physical Demands *  The physical demands described here are representative of those that must be met by an employee to successfully perform the essential functions of this job. Reasonable accommodations may be made to enable individuals with disabilities to perform the essential functions. *  While performing the duties of this Job, the employee is frequently required to stand; walk; sit; use hands to finger, handle, or feel; reach with hands and arms; climb or balance and stoop, kneel, crouch, or crawl. The employee must frequently lift and/or move up to 10 pounds.**","https://www.indeed.com/rc/clk?jk=f9a9e5e6466b9dc8&fccid=dd616958bd9ddc12&vjs=3","Remote","Part-time","MSIS",0,1,1,1,0,0,1,0,0,0,0,0,1,0,0,0,0,0,0,1,"41a7f56c9d01919ba15d25d2f6635923"
"15","data warehouse analyst",2022-07-12,"Data Analyst","Honeyville, Inc","Remote in Ogden, UT 84404","* The Data Analyst is a key contributor in refining Honeyvilles data vision and strategy and enhancing and optimizing our automation, reporting, planning, and communication infrastructure. The data analyst works with other departments to develop reports, improve data quality, and promote data-driven decision making. This position reports directly to the Manager of Analytics.* * Core Responsibilities: * Generates ad hoc reports and analysis per requests from other departments.*   Reviews existing reports, alerts, and dashboards and evaluates usefulness and relevancy.*   Creates interactive and dynamic data dashboards utilizing various internal tools such as Tableau, Power BI, SSRS, etc.*   Identifies, communicates, troubleshoots, and resolves data quality issues in core business systems.*   Explores and develops ways to automate internal processes through data integration, Robotic Process Automation (RPA), sensors/PLC collection, scripts, software enhancements, and self-serve functions such as web portals.*   Develops, tests, and deploys new data integrations between internal and external systems using API calls, flat files, EDI, SQL stored procedures, scripts, etc.*   Utilizes experimentation and the scientific method in problem solving and engages in continuous improvement.*   Assists in developing and designing Honeyvilles data warehouse and data catalog.*   Liaises with other departments to understand project requirements, develops interdepartmental processes to improve data quality, and guides the appropriate and effective use of data to improve company performance.*   Explores how the Analytics department can provide self-serve data reporting and analytics platforms.*   Extracts and uncovers data insights and links those insights to recommendations for the business.*   Works with the department manager to create data models and algorithms using statistics and machine learning to improve Honeyvilles decision making and standard rate setting. *  Collaborates on initiatives seeking to improve data collection, quality, and useability, specifically focusing on the item, production, customer, and vendor datasets.*   Seeks to continuously learn and develop skills.*   Supports the mission, vision, strategies, objectives, and goals of the business.*   Other duties as assigned.*  Desired Competencies: * Project Management Effectively allocates personal and team resources to balance the execution of many projects simultaneously and is able to prioritize appropriately *  Problem Solving Uses rigorous logic and methods to provide solutions to problems, can see hidden issues, provides excellent and honest analysis, looks beyond the obvious and first answer *  Process Management Identifies and resolves inefficiencies, knows what to measure and how to measure, can simplify complex problems*   Business Acumen Understands the business and the processes, can develop ad hoc programs/initiatives to meet business needs*   Quick Learner Able to get up to speed with new software, data, and situations quickly and navigate a path forward.*   Ability to see the forest and the trees, able to see the big picture while also understanding the details.* *  Qualifications and Educational Requirements:* *  Bachelors degree highly preferred or combination of education & experience, ideally in information systems, analytics, computer science, finance, accounting, or another quantitative field *  1-3 years of data analysis experience*   1-3 years of experience in an analytics, strategy, or cross functional continuous improvement role*   Intermediate experience with writing & evaluating SQL queries, views, subqueries, etc.*   Experience working with data reporting software such as Tableau, Power BI, SSRS, etc. preferred.*   Basic understanding of statistics and hypothesis testing*   Exposure to many business areas and a multidisciplinary background.*   Ability to work independently or in a team environment*   Strong creative thinking, problem solving and analytical skills.*   Good business writing and presentation skills. * At Honeyville, Inc., career development is a shared responsibility in which all employees are encouraged to develop, improve, and enhance their skills and professional growth to support our business objectives.*","https://www.indeed.com/rc/clk?jk=8457e38fe4a3b4c7&fccid=c3ecec60849e1b67&vjs=3","Remote","Part-time","MSIS",0,0,1,1,0,0,1,0,0,0,0,0,0,0,0,0,0,0,0,0,"3d23aeb199a0eb7eb2786759a11735ed"
