"","Search","Date","Title","Company","Location","Description","Link","Work Model","Job_Type","Program","R","Python","SQL","Tableau","PowerBI","Azure","Excel","Talend","SAS","Spark","Qualtrics","Domo","Salesforce","SAP","Hadoop","Qlik","Looker","Zoho","Stata","Snowflake","ID"
"22","network security engineer",2022-05-01,"Senior Technical Support Engineer","Insight Global","Draper, UT 84020","* Must Haves: * 8+ years senior level technical support experience in networking/security/proxy products problem resolution at the packet and protocol level*  Ability to use network analysis tools such as Wireshark, TCPdump, and Sniffers.*  Excellent networking troubleshooting skills*  Expert knowledge of TCP/IP, HTTP and SSL at the packet/protocol level*  Strong knowledge of protocols including but not limited to: FTP, DNS, SMTP, ICAP, CIFS, MAPI, authentication protocols (LDAP, RADIUS, NTLM, Kerberos)*  Excellent verbal and written communication skills* Plusses: * Knowledge of streaming protocols, instant messaging, and SOCKs*  Knowledge of PKI, Certificate Management Systems, OpenSSL and Cryptography*  Experience in embedded operating systems, Linux/UNIX based operating systems and Windows* Day to Day: * This individual contributor reports within the Strategic Customer Success organization. This person works directly with the Network Information Security (NIS) core customers, and partners with other Support personnel, customer account teams, and product engineering to provide world-class support for NIS products. This person may be assigned as a Designated Support Engineer (DSE) for specific customers. This person provides support services and incident management via email, web and telephone in accordance with established internal and customer facing SLO commitments. Responsibilities include setting & managing customer expectations, timely communication, identification of root-cause, performance & process improvement, troubleshooting, trending and resolving support cases. This position may include working closely with the sustaining and development engineering teams, QA, and release teams. This engineer will identify and reproduce issues, recommend improvements to the product, and may assist with beta testing of new releases.* RESPONSIBILITIES:* Diagnose and solve complex software, hardware and networking issues*  Provide direct support to internal and external customers via email, web and telephone in a fast-paced support environment, including occasional on-call work outside of normal business hours. Contributes to meeting the team service level objectives.*  Utilize case management tools to clearly document all customer interactions, technical action plans, status updates and resolutions.*  Set and manage realistic customer expectations.*  Take complete ownership of reported issues and own/manage them through to their completion. Perform root-cause analysis and drive performance & process improvements.*  Coordinate problem resolution across multiple departments and disciplines; proactively work with internal engineering teams to communicate and resolve technical problems.*  Develop an in-depth knowledge of the products, functions and diagnostic capabilities. Learn from training and self-study to acquire, maintain and improve job skills.*  Use knowledge management tools to research, document and share problems and their resolutions, including knowledge base articles, product forums, chat rooms or other preferred methods for knowledge sharing.*  Work as a team member with other Technical Support Engineers and support personnel both in and outside the TSE team to enable customer success. Provide mentoring to help others with case investigations, problem solving and knowledge enhancement.*  Develop and deliver supplemental product training to other Technical Support Engineers.*  Provide feedback to engineering on product performance, stability, quality and supportability at all stages of the product life cycle.*  Occasional travel to customer sites to diagnose and resolve issues* Job Type: Full-time* Pay: $110,000.00 - $175,000.00 per year* Benefits:* 401(k)*  Dental insurance*  Health insurance*  Paid time off*  Vision insurance* Schedule:* 8 hour shift*  Monday to Friday* Supplemental Pay:* Bonus pay*  Signing bonus* Ability to commute/relocate:* Draper, UT 84020: Reliably commute or willing to relocate with an employer-provided relocation package (Required)* Education:* High school or equivalent (Preferred)* Experience:* Technical Support Occupations: 8 years (Preferred)*  Network Engineers & Analysts: 3 years (Preferred)*  Network protocols: 5 years (Preferred)* Work Location: One location*","https://www.indeed.com/pagead/clk?mo=r&ad=-6NYlbfkN0BKkHZu3wF05EeDimN_p6sYpKCMArvwa95YdH7UpkaBCuXZAtggzO9lWFPdGsiWEnX71723JqVoswKws3nMJUNEzocuSg7yAiNq1JUDrA5HUgxLNQiDHHohFdVbeGPVucQ2bylMj7xndSCoQ5vxZN9DMtzw_WMFLyP95d_SqjGlXA-07oDJ2ydNS4ApDz6h9So7KI_vaU4AnguFhAaG4EMDuA3Gb6_wSSnTDBW39hXV72sJ0tMrLS2EDb6c0K7p5ZN_3FFY5rDTkhK5z0lyaefL748V5Y17L_Cfgl4ZjxEUT9p0Ck7ZzgJ2tzA6lBEj_g7IRmOiFCOua7O3fJ-t5xiD3KajIj1LRQvoQ3bmyY5JFsIG_7mNrtY-8olWpMuXk4jKkFXcVBQXYgkti95VcNvD2QxLWLbXEAgCiRUfSMRJzUSHVVLYEriSrfGWiVh7t1QwKTvt2DD326y-IwXGbuY1vmO9uQeomMJJ2we2VXvoDAegb1EFqgAwYsJgJW6Vt7RJX3rvyOOh2Rtrpecro_ob&p=1&fvj=1&vjs=3","On-site","Full-time","MSCM",0,0,0,0,0,0,1,0,0,0,0,0,0,0,0,0,0,0,0,0,"f0dd254d77fa9b3031f0f9a2c4accb77"
"23","cloud engineer",2022-05-01,"Senior Technical Support Engineer","Insight Global","Draper, UT 84020","* Must Haves: * 8+ years senior level technical support experience in networking/security/proxy products problem resolution at the packet and protocol level*  Ability to use network analysis tools such as Wireshark, TCPdump, and Sniffers.*  Excellent networking troubleshooting skills*  Expert knowledge of TCP/IP, HTTP and SSL at the packet/protocol level*  Strong knowledge of protocols including but not limited to: FTP, DNS, SMTP, ICAP, CIFS, MAPI, authentication protocols (LDAP, RADIUS, NTLM, Kerberos)*  Excellent verbal and written communication skills* Plusses: * Knowledge of streaming protocols, instant messaging, and SOCKs*  Knowledge of PKI, Certificate Management Systems, OpenSSL and Cryptography*  Experience in embedded operating systems, Linux/UNIX based operating systems and Windows* Day to Day: * This individual contributor reports within the Strategic Customer Success organization. This person works directly with the Network Information Security (NIS) core customers, and partners with other Support personnel, customer account teams, and product engineering to provide world-class support for NIS products. This person may be assigned as a Designated Support Engineer (DSE) for specific customers. This person provides support services and incident management via email, web and telephone in accordance with established internal and customer facing SLO commitments. Responsibilities include setting & managing customer expectations, timely communication, identification of root-cause, performance & process improvement, troubleshooting, trending and resolving support cases. This position may include working closely with the sustaining and development engineering teams, QA, and release teams. This engineer will identify and reproduce issues, recommend improvements to the product, and may assist with beta testing of new releases.* RESPONSIBILITIES:* Diagnose and solve complex software, hardware and networking issues*  Provide direct support to internal and external customers via email, web and telephone in a fast-paced support environment, including occasional on-call work outside of normal business hours. Contributes to meeting the team service level objectives.*  Utilize case management tools to clearly document all customer interactions, technical action plans, status updates and resolutions.*  Set and manage realistic customer expectations.*  Take complete ownership of reported issues and own/manage them through to their completion. Perform root-cause analysis and drive performance & process improvements.*  Coordinate problem resolution across multiple departments and disciplines; proactively work with internal engineering teams to communicate and resolve technical problems.*  Develop an in-depth knowledge of the products, functions and diagnostic capabilities. Learn from training and self-study to acquire, maintain and improve job skills.*  Use knowledge management tools to research, document and share problems and their resolutions, including knowledge base articles, product forums, chat rooms or other preferred methods for knowledge sharing.*  Work as a team member with other Technical Support Engineers and support personnel both in and outside the TSE team to enable customer success. Provide mentoring to help others with case investigations, problem solving and knowledge enhancement.*  Develop and deliver supplemental product training to other Technical Support Engineers.*  Provide feedback to engineering on product performance, stability, quality and supportability at all stages of the product life cycle.*  Occasional travel to customer sites to diagnose and resolve issues* Job Type: Full-time* Pay: $110,000.00 - $175,000.00 per year* Benefits:* 401(k)*  Dental insurance*  Health insurance*  Paid time off*  Vision insurance* Schedule:* 8 hour shift*  Monday to Friday* Supplemental Pay:* Bonus pay*  Signing bonus* Ability to commute/relocate:* Draper, UT 84020: Reliably commute or willing to relocate with an employer-provided relocation package (Required)* Education:* High school or equivalent (Preferred)* Experience:* Technical Support Occupations: 8 years (Preferred)*  Network Engineers & Analysts: 3 years (Preferred)*  Network protocols: 5 years (Preferred)* Work Location: One location*","https://www.indeed.com/pagead/clk?mo=r&ad=-6NYlbfkN0BKkHZu3wF05EeDimN_p6sYpKCMArvwa95YdH7UpkaBCuXZAtggzO9lWFPdGsiWEnX71723JqVoswKws3nMJUNEzocuSg7yAiNq1JUDrA5HUgxLNQiDHHohFdVbeGPVucQ2bylMj7xndSCoQ5vxZN9DMtzw_WMFLyP95d_SqjGlXA-07oDJ2ydNJTvWgl7rjDCkdgxM8osHd5OLR3UwXI6UbNlaxfBFdhbCg_xaaYYakwir1HzcsfTgzpKteCAeVwGI8DkrdpJX_hQ0Zb3W5t03FTXikSZRjWhdUej7R7qOOAcD9L5_2SpScot8oRsLYzoofJ5Oz2u79j1YAumVViV0uL2hA0ppZ8uWvbXnp-w7ZpSl2Vg--DpCUGBlK1R6OnsVdWgbpf49LzeFrvQjH4BBcLnjXu8E3_8_LH6KuQwFke97SRzdCD8uq_bx8K8XHjyCt2wVJy9IGSrBnsn93HQfm8YtBBiZhEwLzPN6ntdxdje9ESRk0uEaMMSxnmrO9fV4snR6rHNMlA==&p=11&fvj=1&vjs=3","On-site","Full-time","MSIS",0,0,0,0,0,0,1,0,0,0,0,0,0,0,0,0,0,0,0,0,"000bc2c6f55fc2d55fbda314b6f1b068"
"24","cloud engineer",2022-05-01,"DevOps Engineer","JupiterOne","Salt Lake City, UT","* JupiterOne is a fast growing, cyber security company trusted by companies like Hashicorp, Databricks, Marqeta, Divvy, Auth0, and more to secure their digital operations and infrastructure. In less than one year, JupiterOne has earned the trust of Fortune 100 customers and gained more than $49M in funding and support from investors, and advisors like Bain Capital Ventures, Sapphire Ventures, Cisco Investments, Splunk Ventures, and more.* Our software helps companies create a contextual knowledge base using graphs and relationships as the single source of truth for an organization's cyber asset operations. We help security, IT, and cloud teams answer the questions that matter.* At JupiterOne, we are passionate about following the best practices and automating everything. We’re looking for a developer that has experience with cloud native infrastructure. Hands-on experience with AWS is preferred, but we also welcome developers that have managed infrastructure in Azure, Google, and Kubernetes.* As a DevOps engineer, you recognize the importance of gathering metrics and identifying early warning indicators. You know how to filter out the noise and provide actionable alerts to the entire development team. You know how to utilize Infrastructure as Code and Immutable Builds. You have used tools like CloudWatch Metrics, CloudWatch Alerts, Docker, Sentry, SumoLogic, DataDog, New Relic, ELK stack, Grafana, and Prometheus. You know how to choose the right tool for the job. You are able to use your experience to make informed decisions based on cost/benefit analysis.* Our ideal DevOps engineer has a strong development background that emphasizes the Dev in DevOps. As a DevOps engineer at JupiterOne, you will be expected to write code. Production infrastructure changes are made via code-not by pointing-and-clicking in a UI.* A DevOps engineer at JupiterOne is also expected to be an extension of the development team and security team. You recognize the importance of doing things right and not compromising on security. You will help implement safeguards to ensure that production data is safe and secure.* Key Qualifications:* 3+ years of experience in a DevOps or Software Engineering role*  Experience using Infrastructure as Code tools such as terraform, AWS CloudFormation, AWS Cloud Development Kit (CDK)*  Hands-on experience with managing cloud infrastructure in AWS, Azure, Google Cloud, and Kubernetes*  Experience using Application Performance Monitoring (APM) tools*  Experience using log collection and analysis tools*  Experience using security tools (code scanners, guard rails, etc.)*  Able to write clean and maintainable code* Desired Qualifications:* Able to guide developers on how to reduce cost*  Able to guide developers on how to identify, fix, and prevent infrastructure problems*  Able to prioritize, plan, and budget*  Bachelor’s degree in Computer Science or equivalent preferred* Technologies We Use:* AWS (Neptune, Lambda, API Gateway, DynamoDB, Kinesis, SQS, S3, Comprehend, etc.)*  terraform*  TypeScript*  Node.js*  Serverless (AWS Lambda and AWS Fargate)*  Sentry*  Docker*  GraphQL*  Elasticsearch*  Redis*  Terraform*  APM*  Logging*  Alerting* What we offer:* Competitive Salary, plus Annual Bonus incentive eligibility, plus Equity OptionsMedical & Rx Insurance with dedicated Health Advocate & TelemedicineRobust Dental and Vision Plans (includes adult orthodontics!)Zero cost medical/dental/vision options for employee only coverageFlexible Paid Time Off (PTO) plus 10 Paid Holidays, including JupiterOne Day on July 21stPaid Maternity & Paternity Leave at 100% of your salaryPaid Time Off to Volunteer every quarterWellness Activities Reimbursement401(k), Life Insurance, STD/LTD OptionsGenerous Employee Referral ProgramFantastic Company Culture - Fun Company Events - Career Growth Potential* Why JupiterOne?* We are committed to growing fast with the support of our customers, team, and community.We enjoy a culture of excellence among an accomplished group of executive leaders, engineers, sales, and marketing professionals. Here are some awards we’re proud to share:JupiterOne named Forbes Top 20 Cybersecurity Startups to watch in 2021JupiterOne Founder and CEO, Erkang Zheng, selected as The Top 25 Cybersecurity CEOs of 2021JupiterOne CISO, Sounil Yu, named Winner of the Top 10 CISOs of 2021 and Finalist for Top 10 Cyber Security Experts in the Black Unicorn Awards at Black Hat 2021This is an opportunity to join a fully funded startup with incredible prospects for growth (corporate, financial, and personal).We're an inclusive team that is dedicated to creating a diverse environment and proud to be an equal opportunity employer.Due to current limitations our company is not able to sponsor international employees working in the United States at this time.* Job Type: Full-time* Pay: $125,000.00 - $200,000.00 per year* Benefits:* 401(k)*  401(k) matching*  Dental insurance*  Employee assistance program*  Flexible schedule*  Flexible spending account*  Health insurance*  Health savings account*  Life insurance*  Paid time off*  Parental leave*  Referral program*  Retirement plan*  Vision insurance* Schedule:* Monday to Friday* Application Question(s):* Do you now, or will you in the future, require sponsorship for employment visa status (e.g., H-1B visa status, etc.) to work legally for our company in the United States?*  What are your salary expectations?* Experience:* using Infrastructure as Code tools: 5 years (Required)*  using Application Performance Monitoring (APM) tools: 5 years (Required)*  AWS, Terraform, TypeScript, or GraphQL: 5 years (Required)*  DevOps or Software Engineering: 3 years (Required)* Work Location: Multiple Locations*","https://www.indeed.com/company/JupiterOne/jobs/Devop-Engineer-4086c918f24fbef0?fccid=7aa6fff86ba27381&vjs=3","On-site","Full-time","MSIS",0,0,0,0,0,1,1,0,0,0,0,0,0,0,0,0,0,0,0,0,"301fa613f6b8d72ad62190c0aa630d1b"
"25","data integration engineer",2022-05-01,"Electronics Engineer, Design, Test, Integration, Early Caree...","LOCKHEED MARTIN CORPORATION","Hill AFB, UT 84056","COVID-19 continues to significantly impact our employees, families and communities. With employee health and safety as our top priority, and as a federal contractor, Lockheed Martin is taking action to address the increased risk and uncertainty COVID variants pose in the workplace and ensuring we meet our commitments to national security.*To uphold safety for all employees, we will continue to request vaccination status for all Lockheed Martin employees including new hires. All current and newly hired employees who are unvaccinated will be required to adhere to onsite safety protocols.Description:Take your career to a new level and work at an extraordinary company in Ogden Utah!*The coolest jobs on this planet… or any other… are with Lockheed Martin Space!*Lockheed Martin is a pioneer, partner, innovator and builder. Our amazing men and women are on a mission to make a difference in the world and every single day we use our skills and experiences to create, design and build solutions to some of the worlds’ hardest engineering problems.**Do you want to be part of a culture that inspires employees to think big, perform with excellence and build incredible products? We provide the resources, inspiration and focus. If you have the passion and courage to dream big, then we want to build a better tomorrow with you.*Ready to Support the Air Force Strategic Missions?*Come join Lockheed's Advanced Strategic Programs. This group of diverse engineers has a long history of supporting the Air Force mission reaching back to the 1960's. Today's challenge is to support the modernization of the Minuteman Weapon System by crafting, building, testing and deploying new Reentry Systems and Ground Equipment that will enable the new system to perform for many years to come. We need your expertise to deliver amazing new technologies to our customers while maintaining the technical requirements of strategic deterrence.**Our Weapon System Integration Contract (WSIC) is seeking engineering support within the Integrated Test Team Subgroup (ITT SG) for the US Air Force (USAF) Intercontinental Ballistic Missile (ICBM) MK21 Reentry Vehicle (RV) Fuze Modernization Program. The Mk21 Fuze Modernization Program includes replacement of the current Mk21 Fuze to meet warfighter requirements and maintain current nuclear capabilities.*As an Electronics Integration Engineer you will:Provide Engineering support to the Integrated Test Team SG.Work with subcontractor (Boeing) to maintain and calibrate the Integration Test Bed (ITB) at the subcontractor facility.Perform/Support all WSIC ground test events as a part of the ITT team.Troubleshoot and remedy equipment failures as needed.Review an analyze test data from ground testing.Support efforts to upgrade ITB equipment from manual test set to software-controlled system.Perform telemetry de-commutation and processing for MK21 Reentry Vehicle.Work with ITB SMEs to develop expertise in total operation of the ITB system.Review and prepare ITT documents as required.*YOU WILL TYPICALLY HAVE:2 - 5 years of professional experience for this role.Willing and able to obtain and maintain a DoD Secret clearance, thus US Citizenship is required.*BENEFITS OF EMPLOYMENT:*Learn more about Lockheed Martin’s comprehensive benefits package.**We are an equal opportunity employer and value diversity at Lockheed Martin. We do not discriminate on the basis of race, religion, color, national origin, gender, sexual orientation, age, marital status, veteran status, or disability status.*We will ensure that individuals with disabilities are provided reasonable accommodation to participate in the job application or interview process, to perform essential job functions, and to receive other benefits and privileges of employment. Please contact us to request accommodation.Basic Qualifications:Bachelor of Science or higher from an accredited college in Electrical Engineering, Aerospace Engineering or related discipline, or equivalent experience/combined education.Strong troubleshooting skills and ability to perform technical analysis of test data.*Desired Skills:Self-starter with limited oversight needed to complete tasks.Experience with Microsoft Office applications.Hardware, Radio Frequency, and/or Software experience.Active secret Clearance.Experience with LabView.ICBM acquisition experience.Experience troubleshooting hardware.Familiarity with Zuken and P-spice.*BASIC QUALIFICATIONS:*job.QualificationsLockheed Martin is an Equal Opportunity/Affirmative Action Employer. All qualified applicants will receive consideration for employment without regard to race, color, religion, sex, pregnancy, sexual orientation, gender identity, national origin, age, protected veteran status, or disability status.*Join us at Lockheed Martin, where your mission is ours. Our customers tackle the hardest missions. Those that demand extraordinary amounts of courage, resilience and precision. They’re dangerous. Critical. Sometimes they even provide an opportunity to change the world and save lives. Those are the missions we care about.*As a leading technology innovation company, Lockheed Martin’s vast team works with partners around the world to bring proven performance to our customers’ toughest challenges. Lockheed Martin has employees based in many states throughout the U.S., and Internationally, with business locations in many nations and territories.EXPERIENCE LEVEL:*Experienced Professional","https://www.indeed.com/rc/clk?jk=a17b6e7f9707d52b&fccid=aeb15e43a6800b9d&vjs=3","On-site","Part-time","MSIS",0,0,0,0,0,0,1,0,0,0,0,0,0,0,0,0,0,0,0,0,"add98020d33dfb03da23eb8d583d015c"
