"","Search","Date","Title","Company","Location","Description","Link","Work Model","Job_Type","Program","R","Python","SQL","Tableau","PowerBI","Azure","Excel","Talend","SAS","Spark","Qualtrics","Domo","Salesforce","SAP","Hadoop","Qlik","Looker","Zoho","Stata","Snowflake","ID"
"1","network security engineer",2022-07-23,"Sr. Data Architect","3PL Central LLC","Salt Lake City, UT","* *  Senior *  Data Architect*  * *   Extensiv is a visionary technology leader focused on creating the future of omnichannel fulfillment. Through our unrivaled network of more than 2,000 connected 3PLs and a suite of integrated, cloud-native warehouse, order, and inventory management platforms we allow modern merchants and brands to fulfill demand anywhere with superior flexibility and scale without painful platform migrations.* * * *   The Role:*  * *   Extensiv (formally 3PL Central) is seeking an experienced Data Architect to join our talented Software Architecture team. You will direct the efforts of talented data engineers and data scientists in the process of building our in-house solution that translates analytical questions into effective reports that drive business action. You will identify business and technical requirements, conduct full technical discovery, and architect the analytics solutions. You will guide the engineers as they design, build, and support the analytics datasets, which can then be easily consumed by visualization tools. You will guide the engineers as they build data pipeline workflows so that the created datasets refresh automatically on a recurring basis. You will evaluate ever-evolving analytics technology stacks and provide recommendations, will be responsible for incoming analytics requests, and will collaborate with other Software Engineering teams.* * * *   You Will:*  * Be a hands-on, contributing member on the Architecture team *  Partner with the Product Manager of BI Products to deliver innovative data insights for customers *  Oversee continuous data quality, data latency, and query performance monitoring and improvement *  Be a key contributor of architectural discussions and decisions for new applications across our product portfolio *  Ensure data privacy and security policies are defined and followed * Clearly document processes and procedures*  * *   You Bring:*  * Degree in Computer Science or Information Systems (Masters in Data Analytics is a plus) *  10+ years of experience building enterprise-level software * Demonstrated experience with Cloud development *  Demonstrated experience using analytics tools to generate reports and data visualizations (e.g., MS PowerBI, Tableau) *  Demonstrated experience developing and optimizing data warehouses *  Demonstrated experience with ETL Tools (e.g., Pentaho, AWS DMS) *  Extensive experience creating ETL workflows on large volumes of raw data from multiple sources. * Extensive experience with SQL and NoSQL databases *  Experience with columnar databases such as Amazon RedShift *  Experience building and managing data pipeline workflows *  Experience working in Big Data distributed SQL query engines *  Strong understanding of large-scale content management systems and data modeling * Excellent written and verbal communication skills and ability to communicate with individuals across the organization *  Experience with ticket/release management tools, e.g., Jira *  Experience with any hosted Git provider (e.g., GitLab, GitHub, BitBucket)*  * *   Bonus Points If You Have:*  * Experience with AWS Quicksight *  Experience developing machine learning models *  Experience with real-time business intelligence *  AWS certifications*  * *   About Us:*  * *   We look for team players and authentic people that strive for excellence and aren’t afraid to be themselves while they do it — because that’s what special teams are made of. If you’re ready to make an impact, take on responsibility, and be a part of our team, then apply to join our team. Our promise is to enable and equip you for long-term success, all while being surrounded by good people looking to do amazing work.*  * *   To create the highest-performing team of professionals, Extensiv focuses on building a dynamic, diverse, and inclusive team that represents our customers and greater communities. To increase diversity, Extensiv's recruiting and hiring efforts focus on attracting individuals that are diverse in thought, experience, age, race, ethnicity, gender identity, sexual orientation, religion or belief, nationality, disability, veteran status, and any other protected status.*  * *   Teams at Extensiv are expected to empower, engage, and hold their peers accountable for nurturing an inclusive environment where every individual has an equal opportunity to advance and be fairly compensated for their work.* *  * *   Extensiv does not accept unsolicited resumes from recruitment agencies or search firms and is not responsible for any fees related to unsolicited resumes.* *","https://www.indeed.com/rc/clk?jk=35c94310251ed835&fccid=f04b52e6fc81607d&vjs=3","On-site","Part-time","MSCM",0,0,1,1,1,0,1,0,0,0,0,0,0,0,0,0,0,0,0,0,"7977ba0ca57cbbe3eec7404f5b69a9b8"
"2","business intelligence analyst",2022-07-23,"Business Process Analyst 4","Adobe","Lehi, UT 84043","* *  Our Company*   Changing the world through digital experiences is what Adobe’s all about. We give everyone—from emerging artists to global brands—everything they need to design and deliver exceptional digital experiences! We’re passionate about empowering people to create beautiful and powerful images, videos, and apps, and transform how companies interact with customers across every screen.*   We’re on a mission to hire the very best and are committed to creating exceptional employee experiences where everyone is respected and has access to equal opportunity. We realize that new ideas can come from everywhere in the organization, and we know the next big idea could be yours!* * * *   The Opportunity* * *   The Global Controllership Organization is responsible for Adobe’s global accounting operations, technical accounting, reporting of Adobe’s financial results and the payroll and equity teams. It also leads all aspects of the global procure-to-pay operations, travel and expense teams and supports the organization to drive innovation through the Business Optimization and Enablement (BOE) team. We are looking to recruit a Business Optimization Analyst to be a key contributor and catalyst to our organization. They will ensure that high priority projects in the Controllership are executed in a timely manner while achieving the desired business objectives!* * *   The successful candidate will be part of a diverse, multinational, globally distributed team, will learn how a fast-paced work environment operates and be in an outstanding position to “network” through exposure to the team’s experience and cross-functional connections with senior leadership and executives across the organization. They will collaborate in driving project and organizational optimization initiatives.* * *   They will also help to build a strategy, implementing and delivering training to ensure all teams optimally accept the change and training on Adobe’s Internal systems and processes. These improvements will contribute to adding value to business processes, system improvements and optimization initiatives impacting cross-functional teams.* * *   What you'll Do* *  Design, develop, and deploy operational improvement initiatives.*   Collaborate and handle work-streams in large scale business process optimization programs*   Ability to understand the business strategic direction and translate it into functional and operational change and improvement plans*   Research market trends and industry-standard methodologies to augment functional operating models*   Build strong business cases for projects and work with the organization leaders on prioritization*   Influence growth to drive key decisions for sharpened project execution.*   Map and re-engineer business processes to ensure that operations are streamlined and optimized*   Collect business and technical requirements and frame debates and dialog to drive execution*   Work within a large team and on individual tasks*   Work with different MS tools, PPT, Excel, Sway, Word, Visio, SharePoint, PowerBI and Teams as well as Adobe Workfront and various ERP tools* *   What you need to succeed* *  Undergrad degree required; MBA preferred but not mandatory.*   6+ years of relevant experience*   Ability to develop new insights and influence business decisions*   Strong attention to detail with an ability to handle multiple ambitious priorities*   Great interpersonal and presentation skills. Flexible and willing to learn innovative approaches*   Ability to adapt and operate in a fast-paced and evolving business landscape while working independently or within a team*   Approach work with energy and a “Can do” positive attitude*   Strong Microsoft office skills, sophisticated presentation skills a plus* * *   While the job description describes what is anticipated as the requirements of the position, the job requirements are subject to change based upon any changing needs and requirements of the business.* *","https://www.indeed.com/rc/clk?jk=453848933a79fccc&fccid=f89deb5a97c7738a&vjs=3","On-site","Part-time","MSIS",0,0,0,0,1,0,1,0,0,0,0,0,0,0,0,0,0,0,0,0,"5c538f15cf4724c665b5173e131d1f84"
"3","business intelligence analyst",2022-07-23,"Business Analyst (Non IT) II: 22-04302","Akraya Inc.","Remote in Salt Lake City, UT","* Primary Skills: Consumer products, HCI, Interaction Design,(IVR) systems,Chat Bots*  Contract Type: W2*  Duration: 4 months contract*  Location:Salt Lake City,UT* To follow up with any questions, please contact Rohini @ 408-512-2455* Looking for 100% Remote job?* JOB RESPONSIBILITIES:*  Understand the client ecosystem, processes, and products* Develop conversational flows to guide customers to relevant answers*  Incorporate workflow automation into the conversational experience to enable customers to self-serve*  Assist with the development and improvement of the Natural Language IVR NLU model*  Monitor and improve the performance of the Natural Language IVR*  Work with partners to incorporate new features to support corporate initiatives*  * JOB REQUIREMENTS:* • Hands on experience in the development and training of Natural Language Understanding (NLU) models and experience with conversational flow design* Experience analyzing performance of automated self-service platforms,identifying improvement opportunities,producing performance reports, tracking KPIs,productivity suites: Microsoft, Google etc.,*  Demonstrated experience in articulating, negotiating, and refining design solutions with partnersand strong abilities in sketching, mocking up, and evaluating interaction design and experience in a customer service or a contact center environment is a plus*  Comfort operating in global environments across cultures, locations, and time zones and experience with both Interactive Voice Response (IVR) systems and Chat Bots,familiarity and experience with platforms that power virtual assistants*  2-4 years' experience in interaction design for consumer products,Degree in HCI, Interaction Design, or related discipline and experience developing conversational assistants leveraging Google Dialogflow, Kore.ai, Nuance Mix, or similar platforms* ABOUT AKRAYA*  Akraya is an award-winning IT staffing firm and the staffing partner of choice for many leading companies across the US. Akraya was recently voted as a * 2021 Best Staffing Firm to Temp For by Staffing Industry Analysts and voted by our employees and consultants as a * 2022 Glassdoor Best Places to Work.*","https://www.indeed.com/rc/clk?jk=219ede7d4088952a&fccid=474b9602e1305593&vjs=3","Remote","Part-time","MSIS",1,0,0,0,0,0,0,0,0,0,0,0,0,0,0,0,0,0,0,0,"0bffd46df074603cc2db4214dc9ddd9e"
"4","security manager",2022-07-23,"Security Site Supervisor - Logistics Company","Allied Universal","Salt Lake City, UT 84111 (Central City area)+2 locations","* *  Allied Universal®, North America’s leading security and facility services company, provides rewarding careers that give you a sense of purpose. While working in a dynamic, diverse and inclusive workplace, you will be part of a team that fuels a culture that will reflect in our communities and customers we serve. We offer medical, dental and vision coverage, life insurance, 401K, employee assistance programs, company discounts, perks and more for all full-time positions!* * *   Now Hiring Professional Security Supervisor* * *   $17.50 / Hr* * *   Great Benefits* * *   Uniforms Provided* * *   Weekly Pay* * *   Daily Pay Option* *  * * *  APPLY NOW!* *  * * Allied Universal Services is seeking the position of a Security Site Supervisor.*  * The Security Site Supervisor will supervise and coordinate the delivery of quality services to an assigned customer. The Security Site Supervisor will act as a liaison between customers, Operation Managers and security officers. They will supervise site staff and provide coaching, recognition and discipline within approved empowerment range.*  * QUALIFICATIONS/REQUIREMENTS:*  Be at least 21 years of age with high school diploma or equivalent*   Possess effective written and oral communication and interpersonal skills with ability to deal with all levels of personnel and the general public in a professional and effective manner*  *   *     Licensing requirements are subject to state and/or local laws and regulations and may be required prior to employment.*   *   As a condition of employment, employee must successfully complete a background investigation and a drug screen in accordance with all federal, state, and local laws*   Display exceptional customer service and communication skills*   Have intermediate computer skills to operate innovative, wireless technology at client specific sites*   Ability to handle crisis situations at the client site, calmly and efficiently*   Capably utilize scheduling and billing software to produce reports (such as Scheduling Activity, Training Detail reports, etc.) that require interpretation and action for effective business management*   Enforce Contract Standards*   Administers site safety programs outlining site-specific hazards for security officers including vehicle / driving safety as appropriate to corporate procedures*   Prepared to participate in unemployment hearings*   Enforces Allied Universal’s policies as outlined in the handbooks and executive memos *  Able to:*    Work in various environments such as cold weather, rain/snow or heat*     Occasionally lift or carry up to 40 pounds*     Climb stairs, ramps, or ladders occasionally during shift*     Stand or walk on various surfaces for long periods of time*   * *   Allied Universal® is an Equal Opportunity Employer. All qualified applicants will receive consideration for employment without regard to race/ethnicity, age, color, religion, sex, sexual orientation, gender identity, national origin, genetic information, disability, protected veteran status or relationship/association with a protected veteran, or any other basis or characteristic protected by law. For more information: www.aus.com* *  * * *  If you have any questions regarding Equal Employment Opportunity, Affirmative Action, Diversity and Inclusion, have difficulty using the online system and require an alternate method to apply, or require an accommodation at any time during the recruitment and/or employment process, please contact our local Human Resources department. To find an office near you, please visit: www.aus.com/offices.* *","https://www.indeed.com/pagead/clk?mo=r&ad=-6NYlbfkN0Bkl6eMu1FM1r07QHNveSMIb5NS-ooqLFrV5tiSRjmHVl6py5KZ0S4DKa1iU7nA1j5cR0dcBrczjfCzh4acZ5Hy56IlmuQnOM58ahfgYY84rmyyYHOGF3yzRTX1fBhZK8ZjVGpjbIZnOHk4DPO7ms1UqW3tCfHqmkMljbzT0sbRgCyHf4HYUv9WW9Mq1Lkt7FZpBboYCXljN6JRIuZYhN81aY3MT6ShaZPHByG-LYPhxBbEqgDH-r2GJWr7NoDsjUgdMbLzOcDUlPTuW7kBD8M_Tt8OvCEU1XjIEcp1B0QMslRfZjbMQMcgyLOX3UlxNxvwSBIUWadxz0V-EVIcb67RxddVGOGfexdxBeyOXx86cHvBGKLp3oUNbmgzdPqz9HhVixmGkgbIhNrH4ftVKVRO2mzk8vvYYarfw88YNxczxA==&xkcb=SoAT-_M3bVV4f9xj5x0KbzkdCdPP&p=3&fvj=0&vjs=3","On-site","Full-time","MSCM",0,0,0,0,0,0,0,0,0,0,0,0,0,0,0,0,0,0,0,0,"17879610b9f2e3938fc5f09c022ea2fa"
"5","data engineer",2022-07-23,"Senior Data Engineer","Angel Studios","Provo, UT","* *  *   Who We Are*  *  *  *    Angel Studios is the home of stories that amplify light. Through its platform, thousands of “Angel” investors choose which titles will be created, funded, and distributed. Angel Studios allows creators and audiences to form passionate communities around their creative projects, making the story behind the story as important as the final project itself. The studios’ first projects—The Chosen and Dry Bar Comedy—have earned billions of views around the world. Learn more at Angel.com*  *  *  *    We’re looking for passionate team members who want to build world-class products that will reshape media over the coming decades. Learn more about:*  *  *    Our North Star*  *  *    Company Strategy*  *  *    Team Principles*  *  *    Join us and be part of stories that matter.*  *  *  *    Job Description*  *  *  *    Summary/objective: Angel Studios is seeking an experienced Senior Data Engineer to lead the strategy and building, maintenance, and optimization of data pipelines and data architecture.*  *  * *  *   Essential functions:*    Implement strategies directed at acquiring data and promoting the development of new insights across the business.*      Create automated systems that verify data pipeline integrity and appropriate implementation across clients*      Own and extend the business’s data pipeline through the collection, storage, processing, and transformation of large datasets.*      Collaboratively work closely with the business’s various departments and teams to ensure all needed data is delivered in successful format.*      Monitor the existing metrics, analyze data, and lead partnership with other data analysts and engineering teams in an effort to identify and implement system and process improvements.*      Drive the design, architecture, implementation, and support of key datasets.*      Create automated systems that verify data pipeline integrity and appropriate implementation across clients.*      Work with the data analysts, data warehousing engineers, and data scientists in finding and applying best practices.*      Define the business’s data requirements and road map to successfully achieve set goals and processes.*      Ensure that the collected data is of a high quality and optimal for use across the department and the business at large.*      Clearly communicate datasets and information to executives, senior management, and stakeholders as necessary.*      Must attend and contribute to regularly scheduled staff meetings.*      Proficiency in speaking, reading and writing in the English language required. *     Additional language proficiency is a plus.*     *     *       Reasonable accommodations may be made to enable individuals with disabilities to perform these essential functions.*     *    *  * *  *   Competencies:*    Exceptional listener with excellent written and verbal communication skills.*      Proficiency with Microsoft Office and Google Workspace.*      Detail-oriented perspective and able to pick up on overlooked details.*      Organization and time management.*      Able to maintain confidentiality of information.*      Must be able to manage multiple assignments, set priorities, and adapt to changing conditions.*      Resourceful and able to problem-solve and manage tasks with ambiguity.*      Willing to perform an array of tasks both in and out of the office.*      Can take feedback to tasks and assignments positively and create better solutions.*      A quick study, able to pick up new skills and learn how to use new programs.*      Must participate in setting and achieving regularly scheduled and outlined objectives.*      Must be capable of conveying information and instructions clearly down the line to various teams*      Must have exceptional skills in SQL server reporting services, analysis services, Tableau, Salesforce, integration services, or any other data visualization tools.*      Demonstrate strong computer skills and a deep passion for analytics.*      Possess an ability to perform complex data analyses with large data volumes.*     *     *       Work environment - When in the main office, expect a comfortable, air-conditioned work environment. Employees are issued their own desks, but the office is an open, shared space and can be fast-paced and occasionally noisy.*     *     *       Physical demands - Ability to sit at desk for long periods*     *     *       Position type and expected hours of work - Regular full-time, 40 hours per week.*     *    * *  * *  *    Required education and experience:*    Bachelor’s Degree or equivalent*      5+ years as Data Engineer*      5+ years with SQL*      3+ years experience with Python*      3+ years of experience with Snowflake data warehouse or comparable platform*      3+ years of experience with Looker, Grafana, Metabase, or comparable visualization platform*      Keen understanding of complex data models*    * *  * *  *    Preferred education and experience:*    Bachelor’s Degree in a business-related field*      Experience as a Data Engineer in a fast-paced environment and complex business setting*      One or more of the following AWS certifications:*      Solutions Architect - Professional*      Data Analytics - Specialty*      Database - Specialty*      3+ years of experience with Segment CDP (Customer Data Platform) or comparable platform*     *     *       Work authorization - Must be authorized to work in the United States.*     *     *       EEO statementWe are committed to equal employment opportunity regardless of race, color, ancestry, religion, sex, national origin, sexual orientation, age, citizenship, marital status, disability, gender identity or Veteran status.*     *     *       Other duties - Please note this job description is not designed to cover or contain a comprehensive listing of activities, duties or responsibilities that are required of the employee for this job. Duties, responsibilities and activities may change at any time with or without notice.*     *    *  * *  *   Angel is an Equal Opportunity Employer:*  *  *  *    We are actively seeking to create a diverse work environment because teams are stronger with different perspectives and experiences.*  *  *    We value a diverse workplace and encourage women, people of color, LGBTQIA individuals, people with disabilities, members of ethnic minorities, foreign-born residents, older members of society, and others from minority groups and diverse backgrounds to apply. We do not discriminate on the basis of race, gender, religion, color, national origin, sexual orientation, age, marital status, veteran status, or disability status. All employees and contractors of Angel are responsible for maintaining a work culture free from discrimination and harassment by treating others with kindness and respect.*  * *","https://www.indeed.com/rc/clk?jk=f73c91b4b1cc2127&fccid=31deb4e9336f4b27&vjs=3","On-site","Full-time","MSIS",0,1,1,1,0,0,1,0,0,0,0,0,1,0,0,0,1,0,0,1,"8a4b3f3511d3a9ef34a1cf21b67b4b5e"
