"","Search","Date","Title","Company","Location","Description","Link","Work Model","Job_Type","Program","R","Python","SQL","Tableau","PowerBI","Azure","Excel","Talend","SAS","Spark","Qualtrics","Domo","Salesforce","SAP","Hadoop","Qlik","Looker","Zoho","Stata","Snowflake","ID"
"9","data integration engineer",2022-05-23,"Communications Engineer","Guidehouse","North Salt Lake, UT 84054+4 locations","Overview*Guidehouse is a leading global provider of consulting services to the public and commercial markets with broad capabilities in management, technology, and risk consulting. We help clients address their toughest challenges and navigate significant regulatory pressures with a focus on transformational change, business resiliency, and technology-driven innovation. Across a range of advisory, consulting, outsourcing, and digital services, we create scalable, innovative solutions that prepare our clients for future growth and success. The company has more than 10,000 professionals in over 50 locations globally. Guidehouse is a Veritas Capital portfolio company, led by seasoned professionals with proven and diverse expertise in traditional and emerging technologies, markets, and agenda-setting issues driving national and global economies. For more information, please visit: www.guidehouse.com.Responsibilities*This position is for the AFNWC ICBM Directorate ISC 2.0 project.*Oversees planning, staffing, and budgetary matters to ensure timely delivery of contractual commitments to the government*Manages all aspects of a major Air Force contracts to include leadership, technical performance, personnel and financial performance*May be asked to direct or will direct (depending on seniority) and manage all personnel issues to include interviewing, hiring, performance evaluation and determining proper compensation*Organizes and oversees technical performance on the contract and ensure delivery of all required deliverables*Communicates daily with peers within the business unit as well as customers, Site Leads and Senior Subject Matter Experts (SMEâ€™s) to identify and resolve problems and challenges to ensure sound execution of contracted effort to include successfully resolving issues requiring senior level (government and corporate) attention*Travels (sometimes frequent) to various program sites as necessary to ensure sound program execution*Identifies, develops, and implements efficiencies that enhance productivity and/or reduce overall contract costs to the government*Leads, guides and mentors other team members*Outstanding analytic and problem solving skills*Strong leadership and the ability to develop/lead a high performing team focused on the customers mission*Outstanding analytic and problem solving skills*Skill set includes ability to perform all stated/implied duties within the level/tier and those reasonably derived frompreceding levels.*Must have the ability to work in a dynamic environment and effectively interact with numerous DoD, military/civilian personnel and industry partners*Working knowledge of Microsoft Office (Word, Powerpoint, and Excel)*Possess a high degree of originality, creativity, initiative requiring minimal supervisionQualifications*Due to our contractual requirements and an Executive Order from the White House, every federal government employee and onsite federal contractor will be asked to attest to their vaccination status. In the interest of health and safety during the continued unprecedented COVID-19 pandemic, anyone who does not attest to being fully vaccinated will be required to follow CDC guidelines which may include (subject to specific contractual requirements): wearing a mask on the job no matter their geographic location, physically distancing from all other employees and visitors, complying to any screening testing requirements. This requirement will apply to Guidehouse employees who work onsite for the federal government.*Principal- BS Degree in any engineering discipline AND MS Degree in Electrical, Computer, or Software Engineering + 15 years of related experience OR PhD Degree in Electrical, Computer, or Software Engineering + 9 years of related experience*Experience with integration and testing of optical communications systems or component sub-systemsWorking knowledge of communication engineering theory and applicationExperience providing technical solution of complex communication problemsAbility to communicate and collaborate with inter-organizational teams/employees and outside customer contactsAt least 1 yr experience with antenna specifications, testing, and RF data collectionExperience with network spectrum analyzers, software defined radios, and sub wavelength analysisExperience in lab environments with setup of radios, running experiments, collecting data, providing routine maintenance, and recording accurate documentationExperience with any RF type communications protocolsExperience with programming software defined radiosKnowledge of Very Low Frequency (VLF) communicationsKnowledge of different antenna types and capabilitiesKnowledge of High Frequency (HF) analogue and digital techniquesKnowledge of signal propagation with RF, HF, and VLFPrincipal skill set includes ability to perform all stated/implied duties within this tier and those reasonably derived from preceding tiers.*Depending on level communications-engineering services AND possible technical leadership of engineering team*DESIRED:*Professional Engineering License desired*Systems Engineering Certification desired*ICBM experience desired*TS clearance desired*Other relevant core and advanced certifications as established/required per local, national and international industry standards or as necessitated by performance expectations associated with level of appointmentAdditional Requirements*The successful candidate must not be subject to employment restrictions from a former employer (such as a non-compete) that would prevent the candidate from performing the job responsibilities as described.Disclaimer*Guidehouse is an Equal Employment Opportunity / Affirmative Action employer. All qualified applicants will receive consideration for employment without regard to race, color, national origin, ancestry, citizenship status, military status, protected veteran status, religion, creed, physical or mental disability, medical condition, marital status, sex, sexual orientation, gender, gender identity or expression, age, genetic information, or any other basis protected by law, ordinance, or regulation.*Guidehouse will consider for employment qualified applicants with criminal histories in a manner consistent with the requirements of applicable law or ordinance including the Fair Chance Ordinance of Los Angeles and San Francisco.*If you have visited our website for information about employment opportunities, or to apply for a position, and you require an accommodation, please contact Guidehouse Recruiting at 1-571-633-1711 or via email at RecruitingAccommodation@guidehouse.com. All information you provide will be kept confidential and will be used only to the extent required to provide needed reasonable accommodation.*Guidehouse does not accept unsolicited resumes through or from search firms or staffing agencies. All unsolicited resumes will be considered the property of Guidehouse and Guidehouse will not be obligated to pay a placement fee.*Rewards and Benefits*Guidehouse offers a comprehensive, total rewards package that includes competitive compensation and a flexible benefits package that reflects our commitment to creating a diverse and supportive workplace.*Benefits include:*Medical, Rx, Dental & Vision Insurance*Personal and Family Sick Time & Company Paid Holidays*Parental Leave and Adoption Assistance*401(k) Retirement Plan*Basic Life & Supplemental Life*Health Savings Account, Dental/Vision & Dependent Care Flexible Spending Accounts*Short-Term & Long-Term Disability*Tuition Reimbursement, Personal Development & Learning Opportunities*Skills Development & Certifications*Employee Referral Program*Corporate Sponsored Events & Community Outreach*Emergency Back-Up Childcare Program","https://www.indeed.com/pagead/clk?mo=r&ad=-6NYlbfkN0DOpfXD7aCvxSiR73RUZjyy6OuclKM9Xpb799vH3iY_yIwO4XWkzYByfUjHp5qaKjU5dYOxyGmX4Jf1tp1qi7qfF9Txi-rcPxu3DxmQ5xWoiWb32TFWd3a-XZUcRETqYYqdPNFotAf8j3yvu9wLIiDFdDS9-Vwcwd48pPJPF8CTl74oNsVMjF-HWQhyNbYUxTHpDvUNRTLIWDoAFguP1fIaR5xgSEnsJJPSe7-rMfXItloEd7XklsHZtdt3uiOzQyaNStNQVlEmVj0DDkSBNKmbMe0fUQbUlji9GBlckrBZoHCFDpwStqLpMIPVzQ9Vd54FOSuJLZE4BX2p7HFvswRCWub9mbeQJdk87741_HXS9vwGVyIZzxV5ug3Lyd2Ova5x-bSYj1psb2H3JliIRWqC6ZvYX4byCoY-3klVJvyLYY5EFkD7ZRRPBGRRIlva3u6oQgAtSHtIEg==&p=2&fvj=0&vjs=3","On-site","Part-time","MSIS",1,0,0,0,0,0,1,0,0,0,0,0,0,0,0,0,0,0,0,0,"a107ac8e10f6aafdc185b3ad32f3407b"
"10","data integration engineer",2022-05-23,"Network Engineer","Guidehouse","Syracuse, UT 84075+3 locations","Overview*Guidehouse is a leading global provider of consulting services to the public and commercial markets with broad capabilities in management, technology, and risk consulting. We help clients address their toughest challenges and navigate significant regulatory pressures with a focus on transformational change, business resiliency, and technology-driven innovation. Across a range of advisory, consulting, outsourcing, and digital services, we create scalable, innovative solutions that prepare our clients for future growth and success. The company has more than 10,000 professionals in over 50 locations globally. Guidehouse is a Veritas Capital portfolio company, led by seasoned professionals with proven and diverse expertise in traditional and emerging technologies, markets, and agenda-setting issues driving national and global economies. For more information, please visit: www.guidehouse.com.Responsibilities*This position is for the AFNWC ICBM Directorate ISC 2.0 project.Develops and maintains data networking and telecommunications systems*Analyzes network characteristics (e.g., traffic, connect time, transmission speeds, packet sizes, and throughput), troubleshoots problems and recommends procurement, removals, and modifications to network componentsWorks with network topologies and site configurationsImplements plans to install, transition, convert and cutover network components and capabilitiesMonitors operations of telecomm systems and services of vendorsCoordinates requirements with users and suppliersPerforms network administration, provides technical assistance in the integration and test of computer integrated networksMay require direct supervisionQualifications*Require:Minimum SECRET security clearance.* BS Degree in Electrical, Computer or Software Engineering + 6 yrs of related experience OR BS Degree in an engineering discipline AND MS Degree in Electrical, Computer or Software Engineering + 4 yrs of related experience OR BS and/or MS in engineering discipline AND PhD Degree in Electrical, Computer or Software Engineering + 2 yrs experienceSystems Engineering Experience*Experience with network monitoring tools such as: Cisco Prime, Juniper Junos, SolarWinds Orion, etc.Advanced proficiency with MS Office suite*Extensive knowledge using industry standard network engineering principlesAbility to analyze and report on data collected from issue resolution/ network performance metricsAble to keep pace with vendor software/ hardware enhancements and provide recommendations for tech refreshAbility to develop technical solutions to complex problemsHighly motivated, self-starter and team player with a high energy level and willingness to aggressively take on responsibilityExcellent customer service skillsDemonstrated ability to approach job responsibilities with a focus on process improvementAble to work and effectively communicate with and present ideas, to all levels of mgmt, through written and verbal meansUnconditional integrity and commitment to achieving goalsICBMs, acquisition and/or sustainment experience preferredJourneyman skill set includes ability to perform all stated/implied duties within this tier and those reasonably derived from preceding tierAdditional Requirements*DESIRED:*ICBM experience desired*TS clearance desired*Contractor shall obtain and maintain certificaitons as required by current versions of AFMAN 17-1303, DoDi 8570.01-M and other applicable lasw and regulations.*Professional Engineering License Desired*Systems Engineering Certification desireable*Additional specialty certification related to firewall, wireless, security or mgmt*Advanced knowledge of monitoring tools, ticketing systems, and Office suiteDisclaimer*About Guidehouse*Guidehouse is an Equal Employment Opportunity / Affirmative Action employer. All qualified applicants will receive consideration for employment without regard to race, color, national origin, ancestry, citizenship status, military status, protected veteran status, religion, creed, physical or mental disability, medical condition, marital status, sex, sexual orientation, gender, gender identity or expression, age, genetic information, or any other basis protected by law, ordinance, or regulation.*Guidehouse will consider for employment qualified applicants with criminal histories in a manner consistent with the requirements of applicable law or ordinance including the Fair Chance Ordinance of Los Angeles and San Francisco.*If you have visited our website for information about employment opportunities, or to apply for a position, and you require an accommodation, please contact Guidehouse Recruiting at 1-571-633-1711 or via email at RecruitingAccommodation@guidehouse.com. All information you provide will be kept confidential and will be used only to the extent required to provide needed reasonable accommodation.*Guidehouse does not accept unsolicited resumes through or from search firms or staffing agencies. All unsolicited resumes will be considered the property of Guidehouse and Guidehouse will not be obligated to pay a placement fee.*Rewards and Benefits*Guidehouse offers a comprehensive, total rewards package that includes competitive compensation and a flexible benefits package that reflects our commitment to creating a diverse and supportive workplace.*Benefits include:*Medical, Rx, Dental & Vision Insurance*Personal and Family Sick Time & Company Paid Holidays*Position may be eligible for a discretionary variable incentive bonus*Parental Leave and Adoption Assistance*401(k) Retirement Plan*Basic Life & Supplemental Life*Health Savings Account, Dental/Vision & Dependent Care Flexible Spending Accounts*Short-Term & Long-Term Disability*Tuition Reimbursement, Personal Development & Learning Opportunities*Skills Development & Certifications*Employee Referral Program*Corporate Sponsored Events & Community Outreach*Emergency Back-Up Childcare Program","https://www.indeed.com/pagead/clk?mo=r&ad=-6NYlbfkN0DOpfXD7aCvxSiR73RUZjyy6OuclKM9Xpb799vH3iY_yIwO4XWkzYByfUjHp5qaKjU5dYOxyGmX4Ntb6H3eqg2tybWV62oOZxEPqcl7nsLDJ8Qi-syXOGTkHkEGcsHUrv28l0HNZcfpUJQzyElYbNTKWcSSoQZSBgqe3UueV7ZG5gyE5hJk23MtOoYFBUARWn_b0gnRjN2cElXK9vxoxISQDRXbKBH5iFBb8BQPAYxQbnUWHfsYl2-XgdfyjcQrjrF4hsczhTKxgEca5I_xoEdC7PHECSXmTPcEhO7vpu-VCG9Qa4YplG_7ubY8F_NbXL3NKHvJvVRVr3DTQICcDgE39PCsDMleIygZ3fXl_tgbF3hSLFs-gzC2Cvt0LqgcNib0oRqQs7N25LIOnbEr8eELU1F_kCUoL65ihX1rE70HmSU1m_oTW0VZEFi_S6yrhPx0mlwRJrVhrw==&p=6&fvj=0&vjs=3","On-site","Part-time","MSIS",1,0,0,0,0,0,1,0,0,0,0,0,0,0,0,0,0,0,0,0,"ce7f77f1932601089ab14af1d4e265fe"
"11","data engineer",2022-05-23,"Senior Data Analytics Engineer","Level Home","Remote in Draper, UT","About the company:**Founded by ex-Apple Product and Engineering leaders, Level is redefining the smart home with technology that is simple, intuitive, useful, and invisible. We recently raised a $100M C round and we're looking to grow our engineering team.**At Level, we take a unique approach to designing products - one that shifts focus from what we make to how we make it and who we make it for. It's an approach that results in elegant and unique solutions, raising the bar for the entire smart home ecosystem.**It's also an approach that has led to our partnerships with Apple, Amazon (including Ring integration), Walmart, and other industry leaders â€“ assuring that our products provide solutions that align with the technology choices and preferences of our customers.**About the role:**As a Senior Analytics Engineer you support decision making across the organization. This support spans the organization from the product and engineering teams to operations and finance. More specifically you work closely with subject matter experts to document, curate, and build tools to enable them to make decisions informed by data.**This role is uniquely cross functional, as this decision support will sometimes span all the way from automating data acquisition to analysis. But that's not all, a big part of this role is providing leadership in the process of discovery, design, and building tools you and the rest of the Data Team leverage to provide all of the above.*Responsibilities:*Create new data models, views, and data flows from a variety of sources to support product experimentation and device troubleshooting*Collaborate with engineers across our stack to improve our telemetry collection capabilities and better inform downstream alerting metrics and troubleshooting tools*Build data quality tests for our IOT device telemetry and ERP system including testing for data recency, cardinality, etc*Lead product analytics standardization across web and mobile to take maximum advantage of both off the shelf product analytics tools and our internal analytics stack.*Support business users through workshops, query and dashboard performance monitoring, creating upstream processing steps as needed. (Ex. aggregates, event sequencing/grouping, time series spines, etc)*Build analytics on our analytics stack, everything from access auditing/monitoring to building qualitative insights on trends in inbound data requests.*Required Qualifications:*Advanced SQL skills to get the data you need from a data warehouse (e.g., BigQuery, Athena, Redshift) and perform data segmentation and aggregation from scratch*Expert-level knowledge of SQL, dbt, BigQuery*Data modeling and schema design*Familiar with ETL/ELT tools (we use Airflow and Stitch)*Experience in modern advanced analytical tools and programming languages such as Python*Software engineering fundamentals and ability to write production-ready code*Experience with version control systems (i.e. Git, Github) and workflows*Experience working with data visualization tools such as Tableau, Data Studio, Looker, Mode, Metabase, Superset etc. (we use SigmaComputing)*Preferred Qualifications:*Knowledge of Computer science fundamentals: data structures, algorithms, performance complexity, and implications of computer architecture on software performance (e.g., I/O and memory tuning)*Cloud (AWS) & DevOps concepts (e.g., CICD), Software container technology (e.g., Kubernetes, Docker)*Familiarity with Data Science workflow and life cycle*Familiarity with Agile Methodologies and processes (we use Agile/SCRUM in JIRA)*Understanding of CI/CD best practices (we have Github Webhooks -> dbt Cloud)*Solid programming skills with Python data stack libraries and tools such as pandas, Jupyter Notebooks, Matplotlib, etc*Traits required for success in this role:*Comfortable with ambiguity: You love tackling nebulous problems through discovery, experimentation and iteration*Curious about People: You dive into nebulous problems and ask progressively better questions as you get more info about the problem being solved*Curious about Process: You're curious about the minimal information artifacts which need to be captured from a business process or user interaction in order to run an experiment.*Pragmatic about Maintainability: You take pride in the experience you provide to those who read your queries or extend your abstractions; an instinctive understanding of the tradeoff between time and succinctness shows in your work*More about Level Home:**When we look around our homes today, we see opportunity. We see ""smart"" products that lack utility and connected devices that push us further apart. We see consumers with high expectations, current standards set too low, and products that simply fail to deliver.**Level Home Inc. is re-inventing the standard. We're redefining ""smart"", to center around thoughtfulness, practicality, and the people who make the problem worth solving. We approach product design with a blank slate, zero assumptions, and an open-mind, because the way a problem is defined sets the stage for its solution. We couple deep expertise with unbridled curiosity, because to us ""smart"" means simple, intuitive, and useful.**We start with empathy, take new perspectives, and challenge existing standards. People are at the heart of what we do, and respecting their style, choices, and preferences is the first step to uncovering a thoughtful solution that truly improves their daily lives. After all, we're not just designing products for a house, we are designing them for the people who make it a home.**Level Home Inc. is an Equal Opportunity Employer and all qualified applicants will receive consideration for employment without regard to race, color, religion, disability or genetic information, sex, sexual orientation, gender identity, or national origin.**A note to Recruitment Agencies: Please don't reach out to Level employees or leaders about our roles - we've got Recruiting covered. We don't accept unsolicited agency resumes and we are not responsible for any fees related to unsolicited resumes. Thank you for your understanding.","https://www.indeed.com/rc/clk?jk=6d650b139187096c&fccid=dd616958bd9ddc12&vjs=3","Remote","Part-time","MSIS",0,1,1,1,0,0,0,0,0,0,0,0,0,0,0,0,1,0,0,0,"aa7a4b2069c98683dfbe205cd049508a"
