"","Search","Date","Title","Company","Location","Description","Link","Work Model","Job_Type","Program","R","Python","SQL","Tableau","PowerBI","Azure","Excel","Talend","SAS","Spark","Qualtrics","Domo","Salesforce","SAP","Hadoop","Qlik","Looker","Zoho","Stata","Snowflake","ID"
"1","data analyst",2022-05-01,"ETL Analyst","A.P. Moller - Maersk","Salt Lake City, UT 84116 (Jordan Meadows area)","* This LTL Pricing Analyst will assist the Head of Transportation in developing and implementing a strategic pricing strategy for our Less than Truckload logistics services products, perform analytics on current and prospective clients related to developing strategic pricing strategy, optimization, carrier mix, bid creation, and ad hoc reporting requests. The LTL Pricing Analyst will also assist with preparing client RFP’s and carrier vendor pricing bids, reports to measure KPI’s to support our growing logistics services. This position will, also, conduct detailed analytical work for small parcel and fulfillment pricing activities. The LTL Pricing Analyst requires advanced excel knowledge, data analytics, phone and email interaction with operations and sales management, and client services.* What You’ll Do as a LTL Analyst* Develop and implement market competitive LTL pricing for new and existing clients according to overall company strategies*  Analyze data to predict and report on revenue, cost, and margin trends*  Query multiple data sources to aggregate data for reporting and analysis*  Optimize pricing based on market conditions, client needs and shipping profile*  Analyze existing and potential new business opportunities*  Work with internal teams to develop company pricing strategies*  Develop business proposals and bid responses to support sales presentations*  Monitor that all pricing rates are accurate and reflect negotiated contracts*  Other duties as assigned that support the sales, management, and operations teams* What You’ll Bring as a LTL Analyst* Team-oriented mentality*  Conduct business and work cross functionally in a professional manner*  Ability to effectively communicate verbally and in writing*  Ability to work in a team environment and communicate well with personnel from multiple departments and disciplines*  Strong understanding of how to collect and analyze statistical data as well as the ability to differentiate good data from bad data*  Strong attention to detail*  Ability to work in a dynamic environment and learn new skills* Requirements* Bachelor’s degree in any of the following: Business, Finance, Operations, Analytics, Logistics, Transportation, Supply Chain, or equivalent experience in data analytics*  Recent work experience as an analyst*  Advanced Microsoft Office Suite: Word, Excel, Access, Outlook, Power Point*  Proficient in business intelligent software solutions (e.g., Power BI, Tableau)*  Experience with MS SQL, MySQL, Oracle, SQLite, or PostgreSQL*  Experience interfacing with all levels of management*  Dynamic team player with the ability to serve internal and external customers*  Ability to develop, prioritize, and manage work with minimal supervision*  Excellent math, verbal, presentation, and written skills*  Ability to analyze complex problems and develop multiple approaches to a solution*  Experience in Less than Truckload shipping preferred* Job Type: Full-time* Benefits:* 401(k)*  Dental insurance*  Health insurance*  Paid time off*  Vision insurance* Schedule:* 8 hour shift*  Monday to Friday* Experience:* MySQL: 1 year (Required)*  Analytics: 1 year (Required)*  PostgreSQL: 1 year (Preferred)*  Business intelligence: 1 year (Required)* Work Location: One location*","https://www.indeed.com/company/Maersk/jobs/ETL-Analyst-c73d6a2f5dda18a9?fccid=14e7391c55beeb80&vjs=3","On-site","Full-time","MSBA",0,0,1,1,0,0,1,0,0,0,0,0,0,0,0,0,0,0,0,0,"67887c230503abd38f05ddb702eae065"
"2","data analyst",2022-05-01,"Sr Financial Analyst (Finance Business Partner)","A.P. Moller - Maersk","Salt Lake City, UT 84116","* The Finance Business Partner (FBP) position reports to the Head of E-Commerce Logistics (ECL) Finance and supports ECL products/segments by managing existing business and supporting profitable volume growth. The position owns the segment forecasting process, analysis of financial performance, and provides solid business unit support through recommendations and projects to assist in decision-making. The FBP also owns the financial models and analyses related to CAPEX/Lease/M&A decisions.What You’ll Do: * Ensure financial results reflect a true and fair representation of underlying business, thereby bringing attention to issues and driving the organization toward solutions and improvements*  Prepare monthly forecasts and analyses including financial metrics and key performance indicators*  Create monthly variance reports and recommendations for business and finance leadership*  Prepare ad-hoc reports for Senior Management using Excel, PowerPoint, and Hyperion (Essbase)*  Work with operation to setup/streamline reporting infrastructure, manage non-compliant controls, mitigate risks, and support performance management*  Play an integral part in the setting up of accounting and reporting structures, including processes and controls, for new customers and products*  Collaborate closely with various department heads and work on special projects* What You’ll Bring: * Ability to gain and maintain a high level of product knowledge across multiple business segments*  Advanced problem resolution and communication skills*  Strong decision-making and performance abilities under tight deadlines*  Ability to work independently but with strong guidance from Head of Finance*  Capable of working in a fast-paced and oft-changing environment*  Customer-centric mentality, with the ability to anticipate customer needs*  A capacity to learn the supply chain industry (fulfillment, freight, parcel, packaging)* . Requirements:* Financial acumen – must understand business/process impact on financial results*  Financial Analyst/Controller background and relevant work experience*  Advanced Excel skills – basic proficiency is not sufficient*  Ability to analyze data, translate analysis into specific, targeted actions to drive results*  Solid organizational, written communication, oral communication, and presentation skills*  Ability to work independently*  Excellent ability to manage to deadlines* Job Type: Full-time*","https://www.indeed.com/company/Maersk/jobs/Senior-Financial-Analyst-17bebfedba825c4c?fccid=14e7391c55beeb80&vjs=3","On-site","Full-time","MSBA",0,0,0,0,0,0,1,0,0,0,0,0,0,0,0,0,0,0,0,0,"cd73fab6fcae1146a87c5c836f2a7144"
"3","business intelligence analyst",2022-05-01,"Lead Product Analyst","Angi","Remote in Salt Lake City, UT","Angi® is transforming the home services industry, creating an environment for homeowners, service professionals and employees to feel right at ""home."" For most home maintenance needs, our platform makes it easier than ever to find a qualified service professional for indoor and outdoor jobs, home renovations (or anything in between!). We are on a mission to become the home for everything home by helping small businesses thrive and providing solutions to financing and booking home jobs with just a few clicks.**Over the last 25 years we have opened our doors to a network of over 200K service professionals and helped over 150 million homeowners love where they live. We believe home is the most important place on earth and are embarking on a journey to redefine how people care for their homes. Angi is an amazing place to build your dream career, join us—we cannot wait to welcome you home!*About the team:**The Product Analytics team partners closely with the product and engineering teams to develop and test consumer and service provider experiences on our site and app. Our business is a two-sided marketplace of homeowners and service professionals, which makes our jobs complex and data rich. We work daily with the operations and product leadership teams to develop, execute, monitor, and refine initiatives that drive tangible value to homeowners, service professionals, and Angi. Due to the multifaceted nature of the business, our team provides an excellent environment to grow your business acumen, technical knowhow and quantitative skills.**About the role:**The Lead Product Analyst will partner with Product teams with the goal of delivering a best-in-class experience to our consumers and service providers. As a Lead Product Analyst, you will be the point of contact for our stakeholders. You need to be experienced in managing stakeholder expectations, leading a small team's sprint (planning, daily scrums, retros/reviews), onboarding new team members, collaborating on team OKRs and ultimately, and driving the team's success.**You and your team will be supporting key initiatives by designing and measuring the impact of experiments, as well as partnering with product, engineering, and business leaders to identify and size new product opportunities. This product group depends on a collection of several large-scale data sources to inform the strategy for the business.**What you'll do:*Lead a small team (1-3 analysts) sprint cycle and mentor more junior analysts.*Partner with our stakeholders and advocate for analytics needs.*Utilize data to identify opportunities for growth, retention, and areas of friction within the product.*Communicate product health, experiment results, opportunities, etc. to product/business teams.*Influence and inform product/business teams through presentation of data-based recommendations.*Bring a deep understanding of growth & optimization best practices.*Synthesize large data sets into digestible information.*Partner with engineering to define logging requirements for net-new datasets.*Continue to develop your technical skills – particularly optimizing and automating our testing strategy.*Constantly strive to improve processes for our team to become more efficient - don't just accept the status quo.*What qualities are we looking for?*6+ months of experience leading team sprints.*Strong preference having direct report(s) in a previous role.*5+ years of quantitative analysis in a business facing capacity.*5+ years of SQL experience.*3+ years of experience analyzing A/B/n and multivariate experiments.*3+ years of experience in Tableau, Looker, or any comparable BI tool.*Experience in Adobe Analytics or any comparable web analytics tool.*Experience working with large scale data sets of varying granularities.*Superior analytical, problem-structuring, and problem-solving skills; experience synthesizing data into actionable insights.*Strong grasp of statistics and statistical software (R, Python, etc.).*Excellent verbal and written communications skills.*Ability to manage multiple projects simultaneously.*Attention to detail, a sense of urgency, and relentless follow through.*Bachelor's or Master's degree in a technical field such as Business Analytics, Engineering, Finance, Economics, etc.*Compensation & Benefits:*The salary band for this position ranges commensurate with experience and performance. Compensation may vary based on factors such as cost of living.*This position will be eligible for a competitive year end performance bonus & equity package*Full medical, dental, vision package to fit your needs*Flexible vacation policy; work hard and take time when you need it*Pet discount plans & retirement plan with company match (401K)*The rare opportunity to work with sharp, motivated teammates solving some of the most unique challenges and changing the world*#LI-Remote**#BI-Remote","https://www.indeed.com/rc/clk?jk=0e703496e9387cd3&fccid=a459150a450820d9&vjs=3","Remote","Part-time","MSIS",0,1,1,1,0,0,1,0,0,0,0,0,0,0,0,0,1,0,0,0,"da669080bc3ca5992bd19afb6e8eac20"
"4","business intelligence analyst",2022-05-01,"I.T. Project Manager/Business Analyst","Associated Foods Stores, Inc | Associated Food...","Salt Lake City, UT 84104 (Glendale area)","* *  I.T. Project Manager / Business Analyst*   Your opportunity awaits at Associated Food Stores. If you want to work for a company with over 80 years of success, join our award-winning team! The AFS Corporate Headquarters, located in Salt Lake City, Utah, boasts numerous career opportunities in a fast-paced and ever-changing industry. Team members enjoy great benefits like health insurance, 401(k) matching, HSA matching, employee discounts, tuition reimbursement, paid parental leave and paid time off. Be part of a company that truly cares about your personal growth and giving back to the community through meaningful service and charitable giving.*   JOB SUMMARY*   Function as a Business Analyst to work with the assigned business units to resolve technology related issues, identify technology needs and define solutions to meet those needs. Fulfill the role of project manager to oversee the development of software solutions and the implementation of purchased software. Responsible for all aspects of the development and implementation of assigned IT projects and provides a single point of contact for those projects. Manages project teams to oversee the timely completion of work assignments and successful completion of identified I.T. projects for the assigned business area. Develops work plans, schedules, project estimates, resource plans, and status reports. Conducts project meetings. Responsible for project tracking and analysis. Ensures adherence to quality standards and reviews project deliverables. This position provides the opportunity to work remotely a portion of the time each week.*   ESSENTIAL DUTIES AND RESPONSIBILITIES*   Work with project sponsors to develop the SOW (Statement of Work) for projects approved for development.*    Facilitate and communicate scope changes to project plans and timelines*    Identify project risk factors and work with project team to mitigate risks that could impact the success of the project*    Working with the project sponsor hold weekly or bi-weekly project status meetings to provide regular project status updates and to keep projects on schedule for completion*    Meet with the leadership of the Business Unit on a regular basis to provide project updates and establish project priorities*    Manage I.T. resources to allow them to focus on correct project priorities and ensure that they are working on assigned projects*    Keep project tasks, issues and targeted completion dates updated and accurate and provide weekly project updates to the within PM tool*    Effectively use I.T. resources to provide technical assistances in meeting the objectives of the Business Unit*    Develop a strong working relationship with the leadership of the Business Unit and a good understanding of the business unit processes and responsibilities*    Participate in the development of Business Unit strategies and identify the technology role in supporting the strategy*    Help users from within the Business Units to develop business cases to be used to support and prioritize project requests*    Performs other related duties as requested.*   POSITION REQUIREMENTS*   Minimum Age: 18 Years of Age*    Education/Training: Minimum of a Bachelors degree in Computer Science or equivalent area required. Previous work experience in project management related to software development and implementation desired.*    Experience using Agile project management methodologies preferred.*    Experience using MS DevOps for work management and planning.*    Solid understanding of modern development tools and methods.*    Excellent troubleshooting and problem-solving skills with ability to quickly resolve issues and create sound solutions.*   PHYSICAL/SENSORY DEMANDS*   Work is performed in an office environment. Job consists of working on a computer and requires prolonged exposure to computer screens and indoor lighting, sitting, and repetitive motion involved with keyboard and mouse.*   Brand: Associated Foods Stores, Inc *   Address: 1850 West 2100 South Salt Lake City, UT - 84119 *   Property Description: AFS Corporate Office *   Property Number: 1000* *","https://www.indeed.com/rc/clk?jk=b16c3a6612cc9f7c&fccid=a8bdb8b9e2ef9f7c&vjs=3","Remote","Part-time","MSIS",0,0,0,0,0,0,1,0,0,0,0,0,0,0,0,0,0,0,0,0,"02361a5a084d31fc71c894c7cf78c0fa"
"5","data analyst",2022-05-01,"Business Analyst - Analytics","Avetta, LLC","Remote in Orem, UT 84097","SUMMARY** The Business Analyst for the Professional Services Analytics Team will need to understand the key business metrics of our clients. This will require gathering technical client requirements and responsible for the creations of custom dashboards within our existing Analytics 2.0 platform (powered by Sisense). The individual will be the primary contact for our client data and will require maneuvering large data sets, recognize trends, and guide our clients on key business decisions.** This position requires a client-first attitude to ensure all client requests are properly documented, managed, communicated and fulfilled. The ideal candidate will use their analytical and problem-solving skills to help identify and communicate solutions.** The Business Analyst interfaces and collaborates with other teams including but not limited to Implementation Project Management, Sales, Account Management, Product, Engineering and Professional Services.** ESSENTIAL DUTIES AND RESPONSIBILITIES:*Gather and analyze client requirements and develop a scope of work to communicate expectations and timelines.*Develop distribution ready reports, analysis and dashboards for clients.*Proactively manage report development to meet expectations of format and delivery timeframe.*Align client needs with product, engineering and professional services team goals.*Identify problematic areas with the data and research to determine the best course of action to correct the data.*Identify process improvement opportunities and work with key stakeholders to develop and implement effective solutions*Develop optimal data management and reporting practices to ensure best practices are put in place*Serve as a data steward to validate data to ensure accurate reporting*Lead and participate in client-facing and internal meetings, such as scoping sessions, project kickoffs, etc.**MINIMUM QUALIFICATIONS:*2+ years in a Business Analyst or Business Intelligence role. Experience with a premier BI consulting firm, a major enterprise applications SAAS software firm, or a BI software vendor is a plus*Experience in other BI tools such as Logi, Sisense, Tableau, Click, Oracle, Business Objects or other will be considered. Experience with ETL tools.*Experience with SalesForce reporting & analytics.*Working skills with RDBMS and the ability to prepare SQL. NoSQL/MongoDB skills a plus*Excellent written and oral communication skills, especially in conveying technical concepts to non-technical audiences*Strong analytical skills and ability to identify appropriate analytical approaches based on the client request or business need*Strong attention to detail to ensure accuracy and provide validation of results*Balance multiple, competing priorities effectively, track documentation and deliverables in an organized manner.*Solid understanding of systems and applications such as UI, data flows, API and release cycles.*Ability to work/communicate with Database Administrators and Software Developers.*Advanced SQL querying experience*Advanced working knowledge of Microsoft Excel*Ability to read and understand complex requirements documents, identify gaps and capturing one-off use cases, etc.*Deliver customer requests on time and deliver high quality solutions.*Ability to think and operate in a logical manner, break down processes and investigate issues by asking the right questions to determine potential solutions.*Obsessively customer-driven with strong customer discovery and problem validation skills*Experience using Jira or similar ticketing system to manage product backlogs*Experience using Confluence to build wiki and display reports*Exposure to or familiarity with an Agile or Scrum based methodology**METRICS THAT MATTER:*Gather and analyze client requirements and develop a scope of work to communicate expectations and timelines.*Develop distribution ready reports, analysis and dashboards for clients.*Proactively manage report development to meet expectations of format and delivery timeframe.*Align client needs with product, engineering and professional services team goals.*Identify problematic areas with the data and research to determine the best course of action to correct the data.*Identify process improvement opportunities and work with key stakeholders to develop and implement effective solutions*Develop optimal data management and reporting practices to ensure best practices are put in place*Serve as a data steward to validate data to ensure accurate reporting*Lead and participate in client-facing and internal meetings, such as scoping sessions, project kickoffs, etc.*#LI-Remote","https://www.indeed.com/rc/clk?jk=8a09466f086d9b0f&fccid=b1588b29770d2107&vjs=3","Remote","Part-time","MSBA",0,0,1,1,0,0,1,0,0,0,0,0,0,0,0,0,0,0,0,0,"33d98f52972a0f35eb3d372806af4932"
