"","Search","Date","Title","Company","Location","Description","Link","Work Model","Job_Type","Program","R","Python","SQL","Tableau","PowerBI","Azure","Excel","Talend","SAS","Spark","Qualtrics","Domo","Salesforce","SAP","Hadoop","Qlik","Looker","Zoho","Stata","Snowflake","ID"
"33","data architect",2022-09-02,"Manager Architecture","Pearson","Salt Lake City, UT 84190","* At Pearson, we are committed to a world that is always learning and to our talented team who makes it all possible. We are bold thinkers and standout innovators who push the boundaries of technology. We create seeds of learning that become the catalyst for the world’s innovations. Within the Pearson Virtual Schools (PVS) division, we have reimagined K-12 education through our virtual school and curriculum offerings. Our schools, Connections Academy and Pearson Online Academy, provide a best-in-class online learning environment for K-12 students to acquire the skills and confidence they need to adapt and thrive in a changing world. * We are looking for someone with proven Technology, People, and Thought leadership skills that have a passion for education and technology transformation. This is a unique opportunity for a technology leader to help us build something that will directly enhance the lives of hundreds of thousands of kids. Join a high-performing team focused on delivering digital transformation! * Purpose of the position: * The Manager of Solution Architecture’s role in the organization is to build and support a team of Solution Architects responsible for creating end-to-end solutions that support the product roadmap and align with Enterprise Architecture's vision and strategy. The Solution Architect team will create, manage, and lead these solutions, working with Enterprise Architecture, Product Management, and Software Engineering to progress projects from concept to completion. They will accomplish this by evaluating how business process, data, and technology elements can be applied to deliver products that align with our ongoing strategy and evolution. * The Solution Architect team should be able to accurately define the scope of a project by outlining technical components and parameters, identifying applications and interfaces, and documenting these components in detailed design documents. They act as thought leaders to bring product transformation to life by implementing the strategic enterprise architecture vision in partnership with software architects & engineers, and other key stakeholders. * The Manager of Solution Architecture will govern the team’s deliverables and performance, setting goals and objectives and defining key performance indicators and reporting. They will be responsible for building strong relationships with Product Management and Enterprise Architecture and look holistically across all in-flight solutions to ensure we are marching down the correct strategic pathways. * Core tasks and responsibilities: * Provide cross-cutting vision and leadership in developing and implementing initiatives that drive innovation and transformation across the Pearson Online Classroom ecosystem *  Implement and own best practices related to the creation of solution-design documents that include the proposed solutions, technology components, estimated costs, proposed resources, estimated timelines, technology sequencing, and master end-to-end plan *  Help define and continually refine ways of working with Enterprise Architecture, Software Engineering, and Product Management to ensure strategic alignment and an effective and efficient flow of work *  Collaborate with senior leaders in business and technology to define MVP scope for various initiatives *  Partner with all levels of the organization, including Enterprise Architecture, Product Owners, Business stakeholders, Engineering, DevOps, Agile Facilitation, Management, Production Support, and Site Reliability Engineering to drive product vision and manage scope & expectations in the development of end-to-end solutions *  Actively monitor for time, resources, and scope risks across all solutions and take proactive steps to remediate *  Provide key insights and progress into the status of solution development to senior leadership *  Consult on requests for new technology innovation, weighing in on potential feasibility, size, and scope *  Support frequent reviews of in-flight solutions to stakeholders, management, and leadership *  Provide technical leadership, coaching, and mentoring. Foster a culture of growth and learning among your team and those teams around you *  Work closely with Software Engineering leadership to ensure delivery of complete and consumable solutions *  Collaborate with Enterprise Architecture and Site Reliability Engineering for all aspects related to integration with other systems, platform strategy, infrastructure design, and cloud resource allocation * Required Skills, Experience, and Competencies: * Bachelor’s degree or equivalent practical experience *  6+ years of supervisory experience in managing and leading teams *  8+ years of experience in software development, including a minimum of 4+ years ofexperience architecting solutions within a customer-facing web application and 6+ years of experience with .NET Framework and Core development, with a focus on web-related frameworks like ASP.NET WebForms and ASP.NET MVC *  You are a proven leader in detail-oriented, faced paced environments. People listen to you because what you have to say makes sense and is actionable. You have experience with recruiting, hiring, coaching, mentoring and building a solid team *  You are a collaborative thought leader by default. You draw in diverse perspectives, both technical and non-technical, and you can convey technical things in a language your business partners can understand. *  Ability to manage multiple projects, prioritize, and meet deadlines in a fast-paced environment *  Demonstrated experience in adapting to changing priorities *  Familiar with Azure or equivalent cloud platform, including auto-scaling and global deployments of application architecture. *  4+ years of experience analyzing business requirements, recommending technical solutions, and writing technical specifications and requirements *  Must have strong verbal and written communication skills, including the ability to facilitate interactive sessions with business and technology teams *  Possesses the ability to work well across teams in a cross-functional organization to get things done *  Ability to “connect the dots” when it comes to large system design and understands and solves enterprise-scale technical integration concerns *  Current understanding of best practices regarding design-in security best practices *  Knowledge of Learning Management Systems (LMS) and Educational Management Systems (EMS) is preferred * As required by the Colorado Equal Pay Transparency Act, Pearson provides a reasonable range of minimum compensation for roles that may be hired in Colorado. Actual compensation is influenced by a wide array of factors including but not limited to skill set, level of experience, and specific office location. For the state of Colorado only, the range of starting pay for this role is $98,000.00 - $185,00.00. This position is eligible to participate in an annual incentive program, and information on benefits offered can be found on our benefits website: https://pearsonbenefitsus.com/. * Learning is the most powerful force for change in the world. More than 20,000 Pearson employees deliver our products and services in nearly 200 countries, all working towards a common purpose – to help everyone achieve their potential through learning. We do that by providing high quality, digital content and learning experiences, as well as assessments and qualifications that help people build their skills and grow with the world around them. We are the world’s leading learning company. Learn more at pearsonplc.com. * Pearson believes that wherever learning flourishes, so do people. We are committed to being an anti-racist company in everything we do. We value the power of an inclusive culture and a strong sense of belonging. We promote a culture where differences are embraced, opportunities are accessible, consideration and respect are the norm, and all individuals are supported in reaching their full potential. Through our talent, we believe that diversity, equity, and inclusion make us a more innovative and vibrant place to work. People are at the center, and we are committed to a sustainable environment and workplace where talent can learn, grow, and thrive. * To learn more about Pearson’s commitment to a diverse and inclusive workforce, please click here: http://www.pearson.com/careers/diversity-and-inclusion.html * Pearson is an Affirmative Action and Equal Opportunity Employer and a member of E-Verify. We are committed to building a team that represents a variety of backgrounds, perspectives, and skills. The more inclusive we are, the better our work will be. All employment is decided based on qualifications, merit, and business need. All qualified applicants will receive consideration for employment without regard to race, ethnicity, color, religion, sex, sexual orientation, gender identity, gender expression, age, national origin, protected veteran status, disability status, or any other group protected by law. * Job: TECHNOLOGY * Organization: Virtual Learning * Schedule: FULL\_TIME * Req ID: 7663**","https://www.indeed.com/rc/clk?jk=853f7cfdeaf156c4&fccid=915b1c0ee87e5e8a&vjs=3","On-site","Part-time","MSIS",0,0,0,0,0,1,0,0,0,0,0,0,0,0,0,0,0,0,0,0,"6e53dae4e571b18dae0237e800169e53"
"34","business intelligence analyst",2022-09-02,"Reliability Data Analyst II","PinnacleART","Salt Lake City, UT","* *  We are building a team of trailblazers, who embody growth, impact, and excellence.* * * *   Job Description* * * *   Job Duties* *  Solve complex reliability problems using professional judgment to ensure tasks include the appropriate level of assessment, analysis, and evaluation while following best practices and RAGAGEP*   With minimal procedural guidance, analyze the overall risk levels for fixed and non-fixed assets to create reliability strategies*   Organize and analyze pertinent data to evaluate the consequence and probability of failures in fixed and non-fixed assets across multiple sites and units*   Gather and organize operations and maintenance data to make recommendations in reliability strategies*   Facilitate customer validations meetings in process interviews, task selections, and other reliability focused areas of scope*   Leverage internal and external software to deliver analysis and strategies for large industrial complex facilities*   Extract and verify pertinent reliability information from multiple data sources using different technologies*   Organize large industrial complex facilities into smaller and more manageable sections based on industry standards or customer guidance*   Gather asset counts and documentation related to project scopes of work*   Analyze effectiveness of historical non-destructive examination methods using various methodologies*   Use verbal and written communication skills to work with our customers* * *   Accountabilities* *  Meet and maintain excellent quality and efficiency for all deliverables*   Execute strategies to deliver reliability services to our customers*   Demonstrate effective time management skills to ensure timely completion of assigned tasks*   Maintain professional relationships and effectively communicate with team members*   Participate in endeavors that provide professional development and technical/soft skill training*   Recognize inefficiencies and facilitate innovation that results in significant improvements* * *   Required Qualifications* *  Bachelor’s degree in an engineering field or 3+ years working in the reliability data industry*   Independent problem solver and high performing team player*   Able to adapt to evolving client demands and dynamic work environment*   Ability to understand technical literature (e.g. process descriptions, training manuals)*   Ability to develop technical documents. (Technical Writing Skills)*   Ability to understand Piping and Instrument Diagrams, Logic Diagrams, Cause and Effect Diagrams, and Electrical One-Line Diagrams*   Effective and professional verbal and written communication skills*   Detail-oriented with a strong aptitude for learning new processes and skills*   Initiative to exceed beyond set expectations*   Willingness to travel up to 50% of the time*   Commitment to relocate domestically or internationally (multiple locations)*   Proficiency in Microsoft Office Suite* * *   Preferred Qualifications* *  1+ years of professional working experience in the petroleum, chemical, mining process, or wastewater industries*   Any of the following API Certifications:*    510*     570*     580*     653*   * * *   Equipment and Software Knowledge* *  Microsoft Office Suite – intermediate to advanced level proficiently*   Integrated Database Management Systems (PCMS, Meridium, etc.)* * *   Direct Reports* * *   There will be no direct reports to this role.* * * *   Working Environment* *  Conditions may include working inside and/or outside. May work around office machinery with moving parts and moving objects. Working near radiant and electrical energy. Working closely with others or working alone. Working extended or irregular hours and travelling by all possible modes of transportation.* * *   Physical Job Requirements* *  Ability to sit for extended periods of time, repeated motions of the hands, wrists and fingers, identify colors, hear with aid, see, write, count, read, speak, communicate with other to exchange information, analyze, lift and carry under 30 lbs., and perceive depth.* * *   Tools and PPE Requirements* *  Equipment (machines, tools, devices) used in performing the essential job function include but not limited to computers and related equipment, calculators, copiers, fax machines, and telephone.* * *   Limitations and Disclaimer* * *   This job description describes the general job duties, accountabilities and physical requirements associates with the position; it is not an exhaustive list of all the duties, accountabilities, or skills required for the position.* * * *   The general job duties, accountabilities and physical requirements associated with the position are subject to modification to reasonably accommodate individuals with disabilities. Some physical requirements may exclude individuals who pose a threat or risk to the health or safety to themselves or others.* * * *   This job description neither states nor implies that the listed general job duties, accountabilities, and physical requirements associated with the position are the only tasks expected of an employee. An employee is also required to follow any other job-related instructions and perform any other job-related tasks requested by their supervisor and not in violation of any applicable laws, regulations, or rules.* * * *   Requirements are representative of minimum levels of knowledge, skills, and abilities. To perform this job successfully, an employee must possess the abilities and aptitude to perform each duty, accountability, and physical requirement proficiently.* * * *   Visa Sponsorship: Employment eligibility to work with Pinnacle in the U.S. is required and the company will not pursue Visa sponsorship for this position.* * * *   Pinnacle participates in E-Verify, a federal government system used to verify employment authorization and social security number of each new employee.* * * *  *   *    *     *       Pinnacle is an equal employment opportunity employer and does not discriminate based on race, color, national origin, religion, gender identity, sexual orientation, sex, age, disability, veteran or military status, genetic information, or any other characteristic protected by applicable law.*     *    *   *  * *","https://www.indeed.com/rc/clk?jk=cafabfb459b72891&fccid=e7645430ecc3f63b&vjs=3","On-site","Part-time","MSIS",0,0,0,0,0,0,1,0,0,0,0,0,0,0,0,0,0,0,0,0,"d492774b84eef4310e6b0d251dcb8ade"
"35","data architect",2022-09-02,"Healthcare Interoperability Cloud Solutions Architect","PRICE WATERHOUSE COOPERS","Remote in Salt Lake City, UT 84111","* A career in our Digital and Applications Design practice, within Application and Emerging Technology services, will provide you with a unique opportunity to help our clients identify and prioritise emerging technologies that can help solve their business problems. We help our clients design approaches to integrate new technologies, skills, and processes so they can get the most out of their technology investment and drive business results and innovation. Our team helps organisations align their business and operational requirements through the careful design of digital platforms and applications. You’ll help our clients with application optimisation, strategic integration of custom packaged solutions like Enterprise Resource Planning and Customer Relationship Management, and roadmap development.*  To really stand out and make us fit for the future in a constantly changing world, each and every one of us at PwC needs to be a purpose-led and values-driven leader at every level. To help us achieve this we have the PwC Professional; our global leadership development framework. It gives us a single set of expectations across our lines, geographies and career paths, and provides transparency on the skills we need as individuals to be successful and progress in our careers, now and in the future.* *  As a Manager, you'll work as part of a team of problem solvers, helping to solve complex business issues from strategy to execution. PwC Professional skills and responsibilities for this management level include but are not limited to:* *  Develop new skills outside of comfort zone.*   Act to resolve issues which prevent the team working effectively.*   Coach others, recognise their strengths, and encourage them to take ownership of their personal development.*   Analyse complex ideas or proposals and build a range of meaningful recommendations.*   Use multiple sources of information including broader stakeholder views to develop solutions and recommendations.*   Address sub-standard work or work that does not meet firm's/client's expectations.*   Use data and insights to inform conclusions and support decision-making.*   Develop a point of view on key global trends, and how they impact clients.*   Manage a variety of viewpoints to build consensus and create positive outcomes for all parties.*   Simplify complex messages, highlighting and summarising key points.*   Uphold the firm's code of ethics and business conduct.* *  Basic Qualifications: Minimum Degree Required:  Bachelor DegreeMinimum Years of Experience:  7 year(s) Preferred Qualifications: * * Develop the solution architecture for healthcare payer, provider clients who need help with developing Azure cloud based solutions to solve healthcare interoperability problems*   Lead global delivery teams*   Must have led multiple large scale tech delivery engagements*   Familiarity with devops, continuous integration / continuous deployment*   Must have led cross functional teams of data engineers, API engineers, cloud and infrastructure engineers*   Must have experience with with healthcare data privacy and must have developed solutions that implement authentication, roles based access control to data*   Must have experience developing and implementing APIs in the cloud*   Assist in defining data mapping from source to target with transformation rules.*   Assist in defining Unified Care Record Data Models*   Assist in defining and enforcing processes and procedures to ensure the quality and reliability of data ingestion pipeline, transformation rules, audit logging requirements*   Create and maintain documentation for data integration and ETL solutions*   Design and Develop complex data modeling, data tagging, transformations, automated data quality validation routines.*   Design and Develop Data Ingestions, ETL strategy, ETL flow implementations*   Present solutions and represent development team in code reviews*   Represent development team in broader technical reviews and agile ceremonies around requirements grooming, planning, design, code, test cases, or other project artifacts*   Oversee and enforce documentation of all code changes (including inline comments) with leading agile practices*   Collaborate with Application/ Integration Architect in the design and development of proof of concept and prototype application environments*   Develop and maintain code repositories according to established version management approaches and methods as defined*   Develop and refresh code construction fundamentals for coding practices, guideline for use of data, control-related concepts, and error-detection practices*   Collaborate with IT Project Management team to identify and evaluate risks; participate in mitigation and control activities*   Provide on-call support in support of systems and applications in production including incident and problem management, code corrections, upgrades and patches*   Support the development of metrics to measure and demonstrate Health Data Exchange value*   Support business stakeholders before and during project delivery (e.g. t-shirt sizing, scoping, requirements gathering, testing)*  At PwC, our work model includes three ways of working: virtual, in-person, and flex (a hybrid of in-person and virtual). Visit the following link to learn more: https://pwc.to/ways-we-work.*  PwC does not intend to hire experienced or entry level job seekers who will need, now or in the future, PwC sponsorship through the H-1B lottery, except as set forth within the following policy: https://pwc.to/H-1B-Lottery-Policy.*  All qualified applicants will receive consideration for employment at PwC without regard to race; creed; color; religion; national origin; sex; age; disability; sexual orientation; gender identity or expression; genetic predisposition or carrier status; veteran, marital, or citizenship status; or any other status protected by law. PwC is proud to be an affirmative action and equal opportunity employer.*  For positions based in San Francisco, consideration of qualified candidates with arrest and conviction records will be in a manner consistent with the San Francisco Fair Chance Ordinance.*  For positions in Colorado, visit the following link for information related to Colorado's Equal Pay for Equal Work Act: https://pwc.to/coloradoadvisorymanager.*  #LI-Remote*","https://www.indeed.com/rc/clk?jk=3222233a86d7d8bb&fccid=5e964c4afc56b180&vjs=3","Hybrid","Part-time","MSIS",0,0,0,0,0,1,0,0,0,0,0,0,0,0,0,0,0,0,0,0,"aae54458c4b6f288693f4515dcce743b"
