"","Search","Date","Title","Company","Location","Description","Link","Work Model","Job_Type","Program","R","Python","SQL","Tableau","PowerBI","Azure","Excel","Talend","SAS","Spark","Qualtrics","Domo","Salesforce","SAP","Hadoop","Qlik","Looker","Zoho","Stata","Snowflake","ID"
"36","data architect",2022-07-12,"System Engineer II","PillPack, LLC","West Valley City, UT","Bachelor's Degree or equivalent experience to a Bachelor's degree based on 3 years of work experience for every 1 year of education * Programming experience with at least one modern language such as C++, C#, Java, Python. * Hands-on technical expertise in building web services and highly scalable applications with Services * Experience with building tools (building, testing, releasing or monitoring) * Several years building and running 24x7 and/or distributed services * Strong Computer Science and development fundamentals, including object-oriented design, data structures, and complexity analysis * Knowledge of professional software engineering and best practices for the full software development life cycle, including coding standards, code reviews, source control management, build processes, testing, and operations. * Hands-on expertise in many disparate technologies, typically ranging from front-end user interfaces through to back-end software systems and all points in between. * Job summary *Amazon Pharmacy is a full-service pharmacy delivering medications and clinical support to our customers. The Pharmacy IT organization is looking for an experienced Systems Engineer II to build and manage AWS and third party tool to support Customer Care operations. * As a Systems Engineer II on the IT team you will work with internal Amazon service owners and AWS product teams to develop and maintain services and solutions for the Customer Care team. This role will act as the lead technical development resource for the System Operations team. The team develops, implements, and manages several operations dependent services. These services include our virtual contact center, its operations/business relevant content, integrations, our workforce management system (WFM), Quality management system (QM), and real time dashboard service. * A Systems Engineer II is involved in projects with software which houses, produces, and processes highly sensitive data. The first priority of an engineer on this team should be security of data and a Systems Engineer II should be well versed in implementing compliant solutions. * A Systems Engineer II builds solutions that scale and perform. Team's systems are heavily integrated with various products including AWS tools and Third Party solutions. A Systems Engineer II should be able to construct scalable solutions for integration. A Systems Engineer is considered knowledgeable in certain key areas by others on the team, and the team looks to them for assistance in those areas. Our projects often involve sophisticated solutions which depend on an understanding of cloud service integrations, API's, and the development/interpretation of data structures. *Key job responsibilities:* Support and maintain the QM tool *Support and maintain the WFM tool *Support new program launches and provide post-launch support *Troubleshoot any application related issues *Act as a subject matter expert, with a high level understanding of company operations, tool integrations with other systems, and user facing interface *Lead Office hours, QM/WFM & IT weekly touch base meetings *Collaborate across multiple engineering, development and project teams, and engage with stakeholders *Drive decisions through data analysis and quantifying the impact of proposed processes and system optimization *Work with the 3rd party stakeholders to maintain and support our 3rd party tools *Drive operations for system configurations by analyzing existing challenges and business opportunities * Master’s degree (MS/ME) or higher in Computer Science, Computer Engineering, or related technical discipline * AWS Certifications such as Solutions Architect, Security, and Professional. * AWS Cloud Development kit, Code Guru, Code Pipeline, Code Build experience (or) relevant development experience in Cloud * Security focused when developing and reviewing systems * Have worked on highly concurrent, high throughput systems with knowledge of distributed systems * Familiarity with professional software engineering & best practices for full software development life cycle, including coding standards, code reviews, source control management, continuous deployments, testing and operations * Experience communicating with users, software development engineering teams, and management to collect requirements, describe software product features and technical designs * Strong sense of ownership and drive * Sharp problem-solving skills and ability to resolve ambiguous requirements * Ability to dive deep into data, existing processes, people and systems in order to invent, simplify, and improve inefficient or unnecessarily complex processes. * Demonstrated ability to meet tight deadlines while managing multiple competing projects in a fast-paced environment. * Strong interpersonal skills including written and verbal communication skills necessary to build effective working relationships and positively influence decision making. * Knowledge of HIPAA regulations and PHI compliance Amazon is committed to a diverse and inclusive workplace. Amazon is an equal opportunity employer and does not discriminate on the basis of race, national origin, gender, gender identity, sexual orientation, protected veteran status, disability, age, or other legally protected status. For individuals with disabilities who would like to request an accommodation, please visit https://www.amazon.jobs/en/disability/us. * Amazon is committed to a diverse and inclusive workplace. Amazon is an equal opportunity employer and does not discriminate on the basis of race, national origin, gender, gender identity, sexual orientation, protected veteran status, disability, age, or other legally protected status. For individuals with disabilities who would like to request an accommodation, please visit https://www.amazon.jobs/en/disability/us.","https://www.indeed.com/rc/clk?jk=04f6bddc7d8fe702&fccid=fe2d21eef233e94a&vjs=3","On-site","Part-time","MSIS",0,1,0,0,0,0,0,0,0,0,0,0,0,0,0,0,0,0,0,0,"683b2df439f4e7e805e339626ce26957"
"37","network security engineer",2022-07-12,"Service Desk Associate","Pomeroy IT","Salt Lake City, UT 84101 (Downtown area)","Pomeroy is currently recruiting for a Service Desk Technician to work with our growing client located in Salt Lake City, Utah. This position is a 6 + month contract that will primarily work remote. The main responsibility of this position is to respond to end-users inquiries regarding technology issues in a service desk environment.*Job Responsibilities:*Includes incident recognition, research, isolation and follow-up steps for first and second tier issues.* Provide IT-related employee communications to the company or affiliates. Provide training/presentations to end-users on a regular basis on various aspects of technology and its application in the company. Recommend systems modifications to reduce user problem* Provide documentation and create knowledgebase article* Consult with other information technology personnel to coordinate activities related to testing and implementing new technology. Be a key participant in user testing, implementing, document creation and communication for information technology department and the end-user.*Qualifications - Internal*Knowledge of M365, Teams, SharePoint, OneDrive, Client/server, network, mainframe and applications environment.* Demonstrated aptitude in incident recognition and troubleshooting* Strong customer verbal and written communication skills.* Strong analytical and problem-solving skills.* Ability to prioritize and handle multiple tasks and projects concurrently.*For over 35 years, Pomeroy has enabled technology that enhances and empowers people in the workplace.*Today we partner with our clients to help them transform from a “one size fits all” delivery model to a personalized human experience that is a competitive differentiator and the key to delivering digital transformation and better business outcomes.*It’s all about delivering an exceptional experience, one that is simple, intuitive and secure – anytime, anyplace and from any device. Our workplace is no longer a physical location or workstation, rather it’s the place where a person can work at any given time with full capacity to do their job productively and effectively.*We deliver that experience by connecting the dots between people and their applications, across a network that is intuitive and automated to where the applications live, today that is in a hybrid IT environment, on premise and in the cloud, with security an integral part of everything we do.*We provide managed IT services to support our clients from our locations throughout North America, Latin America and Europe. Our service delivery model combines monitoring, prevention and resolution in an approach that is always aware, proactive and responsive.*Our field engineers support more than 50,000 sites across North America alone and respond to more than 3 million incidents and user requests annually covering 2 million desktops, laptops, smartphones and tablets, servers, printers and other peripherals.*Our expertise connecting the workplace, network and hybrid IT is industry recognized, including Gartner recognition for over 17 years as one of a select few who can deliver agile, quality Managed Workplace Services.1*And although technology and innovation are key ingredients in our solutions, our people are our greatest asset. Over 3,000 highly motivated and diverse, dedicated to supporting our 700+ clients, from midsize organizations to large, well-known US and global brands, 15 in the Fortune 500.*“The Pomeroy Way” is our guiding principle. It’s a conscious understanding that who we are as individuals and how we choose to interact with others is a direct reflection of who we are as a company and how we will be viewed as an organization. It defines our company and our culture as the place to be, the place to stay and the place to grow.*Job Type: Full-time*Pay: $23.00 - $27.00 per hour*Schedule:*8 hour shift*Ability to commute/relocate:*Salt Lake City, UT: Reliably commute or planning to relocate before starting work (Required)*Experience:*Help desk: 1 year (Preferred)* Windows: 1 year (Preferred)*Work Location: One location","https://www.indeed.com/company/Pomeroy-IT/jobs/Service-Desk-Associate-b9a4b464e2b71597?fccid=54efcb84041ccbe9&vjs=3","Hybrid","Full-time","MSCM",0,0,0,0,0,0,0,0,0,0,0,0,0,0,0,0,0,0,0,0,"941065bfd3c60d235ee18bcd22fb7f1b"
"38","security compliance analyst",2022-07-12,"EnerBank Vendor Risk Analyst","Regions","Salt Lake City, UT 84101 (People's Freeway area)","Thank you for your interest in a career at Regions. At Regions, we believe associates deserve more than just a job. We believe in offering performance-driven individuals a place where they can build a career --- a place to expect more opportunities. If you are focused on results, dedicated to quality, strength and integrity, and possess the drive to succeed, then we are your employer of choice. * Regions is dedicated to taking appropriate steps to safeguard and protect private and personally identifiable information you submit. The information that you submit will be collected and reviewed by associates, consultants, and vendors of Regions in order to evaluate your qualifications and experience for job opportunities and will not be used for marketing purposes, sold, or shared outside of Regions unless required by law. Such information will be stored in accordance with regulatory requirements and in conjunction with Regions’ Retention Schedule for a minimum of three years. You may review, modify, or update your information by visiting and logging into the careers section of the system. *Job Description:* At Regions, the Vendor Risk Analyst performs comprehensive vendor risk and control assessments, ensuring there are effective contract provisions that align to the vendor engagement and safeguard Regions client and associate data, to include Regions brand and reputation. * Primary Responsibilities *Manages internal and regulatory compliance having clear understanding of federal regulatory requirements and industry best practice associated with vendor risk management *Utilizes a basic understanding of applicable legal and contractual provisions with emphasis on security and data privacy to assess critical operational risk and control functions across the enterprise *Manages professional risk assessments against a contract driven vendor relationship and the creation of a comprehensive vendor risk and controls assessment that aligns with respective vendor engagement *Assists in ensuring effective contract provisions exist to safeguard key operational outsources functions *Manages regular engagement with enterprise vendor relationship owners and coordinates vendor ongoing monitoring and performance scorecards *Monitors program compliance and may perform quality assurance to determine if vendor products or services have changed and to determine if scorecard values impact vendor tier risk rating *Assists in maintaining all data attributes within the Vendor Risk Management Master Tier Segmentation database * This position is exempt from timekeeping requirements under the Fair Labor Standards Act and is not eligible for overtime pay. * Requirements *Bachelor's degree in a related field * Preferences *Experience in Audit, Compliance, Legal, Risk, Vendor Management, or related area * Skills and Competencies *Ability to learn additional systems as needed *Ability to research, analyze data, and derive facts *Ability to work under direct guidance *Developed relationship-building skills *Proficiency in Microsoft Office (Excel, Word, PowerPoint, Outlook, etc.) *Strong problem-solving skills against a legal contract driven relationship *Strong verbal, written communication, and organizational skills *Strong work ethic and self-motivation * Position Type Full time * Benefits Information *Regions offers a benefits package that is flexible, comprehensive and recognizes that ""one size does not fit all"" for associates. Listed below is a synopsis of the benefits offered by Regions for informational purposes, which is not intended to be a complete summary of plan terms and conditions. *Paid Vacation/Sick Time *401K with Company Match *Medical, Dental and Vision Benefits *Disability Benefits *Health Savings Account *Flexible Spending Account *Life Insurance *Parental Leave *Employee Assistance Program *Associate Volunteer Program * Please note, benefits and plans may be changed, amended, or terminated with respect to all or any class of associate at any time. To learn more about Regions’ benefits, please click or copy the link below to your browser. * https://www.regions.com/welcometour/benefits.rf * Location Details Enerbank Salt Lake City *Location: Salt Lake City, Utah * Bring Your Whole Self to Work * We have a passion for creating an inclusive environment that promotes and values diversity of race, color, national origin, religion, age, sexual orientation, gender identity, disability, veteran status, genetic information, sex, pregnancy, and many other primary and secondary dimensions that make each of us unique as individuals and provide valuable perspective that makes us a better company and employer. More importantly, we recognize that creating a workplace where everyone, regardless of background, can do their best work is the right thing to do. *OFCCP Disclosure: Equal Opportunity Employer/Disabled/Veterans","https://www.indeed.com/rc/clk?jk=b28417f8926caa0a&fccid=14b6efc0812e707a&vjs=3","On-site","Part-time","MSCM",0,0,0,0,0,0,1,0,0,0,0,0,0,0,0,0,0,0,0,0,"70536e2b616d19dc6cd6e68f46a398ec"
"39","network security engineer",2022-07-12,"Full Stack Web Developer","Route","Lehi, UT","* About Route *  Route is helping people discover and celebrate the world's brands through a completely reimagined e-commerce marketplace that directly connects and empowers both consumers and brands. *  Route's unique platform takes a holistic approach to online shopping, rethinking the consumer experience from discovery to delivery via the Route app, while offering a suite of features that provides merchants the tools necessary to enhance the overlooked post-purchase experience. Since launching in 2018, Route has built a network of over 1.5 million app users and 7,000 merchants. Route has offices in Lehi, UT and Los Angeles, CA. For more information go to route.com *  About the Role *  Route is looking for Full Stack Software Engineers on our Monetization team. This team will be responsible for building out and maintaining experiences that are key to the company's success on the web. *  We value engineers who can bring fresh ideas and are willing to lead problem solving and implementing their solutions. They need to be comfortable working in a fast-paced startup culture where there is tremendous opportunity and the challenges that come with it. *  Your participation: * Design, develop, test, deploy, monitor and improve software across the stack *  Manage project priorities, deadlines, and deliverables *  Embody a culture of innovation, transparency, and radical candor * Minimum qualifications: * Solid understanding of Computer Science fundamentals *  5+ years of relevant work experience *  Experience with one or more general-purpose languages, e.g. Javascript, PHP, Go, Java, C# *  Interest and ability to learn other languages as needed * Preferred qualifications: * Experience with one or more of the following: AWS, SaaS software systems, microservices, REST API design, React *  GoLang experience is a plus *  Experience contributing to architecture decisions on systems with high security, reliability, and scalability requirements * Benefits: *  Route offers an array of benefits including generous salaries, stock options, 100% healthcare coverage, and an unlimited PTO policy. *  Route is an Equal Opportunity Employer. We embrace diversity and equal opportunity in a serious way. We are committed to building a team that represents a variety of backgrounds, perspectives, and skills. The more inclusive we are, the better our work will be.*","https://www.indeed.com/rc/clk?jk=b41077781458167d&fccid=d0539e96ce4f5d70&vjs=3","On-site","Part-time","MSCM",0,0,0,0,0,0,0,0,0,0,0,0,0,0,0,0,0,0,0,0,"bcf0bd232286d31cdd609e3b8d5f0ee8"
"40","cybersecurity analyst",2022-07-12,"IT Risk & Compliance Analyst 1","The Church of Jesus Christ of Latter-day Saints","Riverton, UT 84065","* This position that works on assignment with clear instruction and supervision from leaders to leverage designated tools and processes in available in defense of applications, systems, data, and networks. This position may also be assigned to work with Information Technology (IT) portfolios, or other internal departments and organizations, to assist in the review, documentation, and/or implementation of controls, practices, or technology solutions to meet the defined policies and standards for risk and compliance. * This individual works with divine guidance to provide or support technology that furthers the mission of the Church and reflects the eternal impact of the gospel.* ** As directed, assist in establishing and carrying out compliance plans, schedules, and activities *  Assist in the work with compliance customers to determine and obtain data points necessary to validate ongoing compliance with both internal Church and external regulatory requirements *  As directed, assist in carrying out compliance validation processes *  Assists with validating prospective issues with compliance customers, providing technical and procedural guidance regarding remediation of these issues, and tracking progress of remediation activities until closed *  Assists with reporting compliance results to compliance customers and other key stakeholders *  As directed, assist in identifying, clarifying, and escalating concerns to compliance customers and other key stakeholders where appropriate *  As directed assist to facilitate the implementation of risk and compliance programs with periodic guidance from manager and Sr. Analysts *  Assist to the creation of IT risk plans that correlate back to Church policies, standards, and controls *  As directed, assists in the facilitation of IT risk analyses and the creation of risk management processes *  Assists in the investigation and analysis of technology audit recommendations *  Helps monitoring and reporting on audit remediation efforts as directed by manager or Sr. Analysts *  As directed, assists in the ongoing maturation of the Information Security (IS) Compliance program*  ** *  *   *    *     Education:*    *   *   *    *     Associate degree or equivalent work experience in security, privacy, compliance or related area(s)*     *   *   *    *     Work Experience:*    *   *   *    *     Prefer previous experience in security risk and/or compliance assessment *      One or more broad-based Information Security certification like Certified Information Systems Auditor (CISA), Certified Information System Security Professional (CISSP), or Certified Information Security Manager (CISM) a plus*     *   *   *    *     Demonstrated Skills & Abilities:*    *   *   *    *     Professional written and oral communication skills *      Detail-oriented with the proven ability to follow instructions *      Ability to successfully work in a team *      Basic knowledge of IT organization patterns *      Proficiency with MS Office, Excel, Word, and PowerPoint particularly with data analytical features *      Basic understanding of project management and budgeting practices*     *   *   *    *     Desired Skills & Abilities: *     Basic knowledge of Governance, Risk, and Compliance (GRC) platforms like Archer, Metric Stream, or ServiceNow GRC a plus*     *   *   *    *     This job operates in a professional office environment *      To successfully perform the essential functions of the job there may be physical requirements which need to be met such as sitting for long periods of time and using computer monitors/equipment*     *   *  * * ** *  Church employees find joy and satisfaction in using their unique talents and abilities to further the Lord’s work. From the IT professional who develops an app that sends the gospel message worldwide, to the facilities manager who maintains our buildings— giving Church members places to worship, teach, learn, and receive sacred ordinances—our employees seek innovative ways to share the gospel of Jesus Christ with the world. They are literally working in His kingdom. * * *  Only members of the Church who are worthy of a temple recommend qualify for employment. Apart from this, the Church is an equal opportunity employer and does not discriminate in its employment decisions on any basis that would violate U.S. or local law. * * *  Qualified applicants will be considered for employment without regard to race, national origin, color, gender, pregnancy, marital status, age, disability, genetic information, veteran status, or other legally protected categories that apply to the Church. The Church will make reasonable accommodations for qualified individuals with known disabilities.* *","https://www.indeed.com/rc/clk?jk=1bd047d86c44920e&fccid=7e408d96768a4a43&vjs=3","On-site","Part-time","MSCM",0,0,0,0,0,0,1,0,0,0,0,0,0,0,0,0,0,0,0,0,"923658b6859c22fc47fa30b48c56b63a"
