"","Search","Date","Title","Company","Location","Description","Link","Work Model","Job_Type","Program","R","Python","SQL","Tableau","PowerBI","Azure","Excel","Talend","SAS","Spark","Qualtrics","Domo","Salesforce","SAP","Hadoop","Qlik","Looker","Zoho","Stata","Snowflake","ID"
"12","cloud engineer",2022-05-23,"Senior IoT Test Automation Engineer","Level Home","Draper, UT","About the company:**Founded by ex-Apple Product and Engineering leaders, Level is redefining the smart home with technology that is simple, intuitive, useful, and invisible. We recently raised a $100M C round and we're looking to grow our engineering team.**At Level, we take a unique approach to designing products - one that shifts focus from what we make to how we make it and who we make it for. It's an approach that results in elegant and unique solutions, raising the bar for the entire smart home ecosystem.**It's also an approach that has led to our partnerships with Apple, Amazon (including Ring integration), Walmart, and other industry leaders â€“ assuring that our products provide solutions that align with the technology choices and preferences of our customers.**About the role:**Level Home Software Test Engineers are responsible for creating and executing manual and automated tests at the Product level. You will work alongside the product feature team to help develop and maintain high-quality product releases. You will work closely with the other members of the quality team developing test rigs and harnesses and will be the expert on your product area for the team. You will provide technical leadership and mentorship to other members of the team.**Responsibilities*Create and design High-level test plans at the product level*Designs, executes, and directs team in test strategies*Trains and provides technical leadership to the team*Conducts test cases, code reviews, and runs bug triage meetings*Create test code, harnesses, and test cases from a user story and epic at the product level*Create test plans covering security requirements*Create test plans covering performance requirements*Create easily reproducible defect reports*Responsible for adhering to established QA process and bug prioritization criteria*Active participant in feature definition and design*Knows the competitors in our space and can help make business decisions based on this knowledge*Required qualifications:*5+ years' of experience creating test applications and/or automation frameworks*Experience in designing and executing tests and test code at the feature level*Can program in at least one language (C#, Python, Java, or similar)*Can understand and write queries against a database*Strong understanding of Software testing life cycle*Experience testing Firmware or Embedded Software (RTOS, Vxworks, Zephyr, etc.)*Experience working in a fast-paced environment*Strong troubleshooting skills and attention to detail*It would be great if you also have:Experience with IoT hardware*Experience testing wireless embedded systems or consumer electronics*More about Level Home:**When we look around our homes today, we see opportunity. We see ""smart"" products that lack utility and connected devices that push us further apart. We see consumers with high expectations, current standards set too low, and products that simply fail to deliver.**Level Home Inc. is re-inventing the standard. We're redefining ""smart"", to center around thoughtfulness, practicality, and the people who make the problem worth solving. We approach product design with a blank slate, zero assumptions, and an open-mind, because the way a problem is defined sets the stage for its solution. We couple deep expertise with unbridled curiosity, because to us ""smart"" means simple, intuitive, and useful.**We start with empathy, take new perspectives, and challenge existing standards. People are at the heart of what we do, and respecting their style, choices, and preferences is the first step to uncovering a thoughtful solution that truly improves their daily lives. After all, we're not just designing products for a house, we are designing them for the people who make it a home.**Level Home Inc. is an Equal Opportunity Employer and all qualified applicants will receive consideration for employment without regard to race, color, religion, disability or genetic information, sex, sexual orientation, gender identity, or national origin.**A note to Recruitment Agencies: Please don't reach out to Level employees or leaders about our roles - we've got Recruiting covered. We don't accept unsolicited agency resumes and we are not responsible for any fees related to unsolicited resumes. Thank you for your understanding.","https://www.indeed.com/rc/clk?jk=a475a925575690a0&fccid=dd616958bd9ddc12&vjs=3","On-site","Part-time","MSIS",0,1,0,0,0,0,0,0,0,0,0,0,0,0,0,0,0,0,0,0,"51b156f3d85e6c4fb6e5b4860ab82299"
"13","data scientist",2022-05-23,"Statistical Programmer II - Remote","PAREXEL","Remote in Centerville, UT 84014+16 locations","Come join the Parexel Statistical Programmer team today!**The Statistical Programmer II provides technical expertise for the conduct of clinical trials, and works with*minimal supervision to support various programming activities related to the analysis and reporting of*clinical study data. In addition, the Statistical Programmer II may fill the Statistical Programming Lead role*(or part of that role) on small, non-complex projects. Qualifications Qualifications:*Excellent analytical skills.*Proficiency in SAS.*Knowledge and understanding of the programming and reporting process.*Knowledge of SOPs/Guidelines, ICH-GCP, and any other applicable local and international**regulations such as 21 CFR Part 11.*Ability to learn new systems and function in an evolving technical environment.*Ability to manage competing priorities and flexibility to change.*Attention to detail.*Ability to successfully work as part of a global team.*Work effectively in a quality-focused environment.*Effective time management in order to meet daily metrics or team objectives.*Show commitment to and perform consistently high quality work.*Business/operational skills that include customer focus, commitment to quality management, and**problem solving.*Knowledge and Experience:Competent in written and oral English.*Good communication skills.*Education:Educated to degree level in a relevant discipline and/or equivalent work experience. EEO Disclaimer Parexel is an equal opportunity employer. Qualified applicants will receive consideration for employment without regard to legally protected status, which in the US includes race, color, religion, sex, sexual orientation, gender identity, national origin, disability or protected veteran status.*","https://www.indeed.com/pagead/clk?mo=r&ad=-6NYlbfkN0Awiy0szp24tPN-CLKKoEcPPgeke7kxOMr2z-MVaD2GkpP576WiTWgsdVyZZB-hBKkvgrG-VBxeoax0pk2rA3SyD8lFahtohaUTbSHSFToGo6KobSh6rzHQlWEsC7MEDLR6ZK_C7Ud72MBRpQdfRfOfdzrnuG0YAbCfb0qUvuM7H1_9L5U0X-mJ4Amv4Cjpdqd-FxamdfTeFJxHPJnIbpxtRVNcCCKW_r3nPlhZ35XnaaR7qvNRv281SjLPEVmXNUutuaMaHMdDsBN3BX6rSgm31DIrvUEd5UcM3VYaOzYm8p305XSgN7BL5Lb48eXQ915xXyeL81d2v7UpNMeoJzsTYQ2SjZjNn0cMvxMu6PsZLDnCk2Vgm_7UPZ4ALJNwipBOJONcVhrU-DIIN0mLoDx0V3v4K2qhkua0bdVjTXr0gQ==&p=0&fvj=0&vjs=3","Remote","Part-time","MSBA",1,0,0,0,0,0,1,0,1,0,0,0,0,0,0,0,0,0,0,0,"b7c714a4284ffd556aea3a5b3917126e"
"14","data scientist",2022-05-23,"Principal Statistical Programmer - Remote","PAREXEL","Remote in Bountiful, UT 84011+11 locations","Be part of our empowered Parexel Statistical Programming team today!**As a Principal Programmer you will be recognized as a subject matter expert, providing technical support and expert advice to internal and external sponsors. Parexel will provide you with the perfect opportunity to expand on your experiences and develop new skills in a stimulating work environment**KEY RESPONSIBILITIES include (not an exhaustive list of duties):**Input into and negotiate statistical programming timelines.*Ensure that timelines are adhered to coordinate and lead a statistical programming team to successful completion of a study within given timelines and budget*Monitor project resourcing, project budgets, and identify changes in scope*Ensure quality control (QC) on all process and technical activities related to derived dataset, table, listing, and figure programming in accordance with corporate quality standards*Maintain all supporting documentation for studies in accordance with WSOPs/Guidelines to ensure traceability and regulatory compliance*Provide a broad range of leadership and influencing capabilities to achieve the business objectives and goals for both Parexel and sponsors*Provide leadership, project specific training, stakeholder management, external sponsor support, resource management, and project management for the required programming tasks supporting clinical trial activities Skills**Proficiency in SAS*Knowledge of the programming and reporting process*Knowledge of WSOPs/Guidelines/System Life Cycle methodologies, ICH-GCP and any other applicable local and international regulations such as 21 CFR Part 11 and proven practical application*Strong leadership skills*Ability to successfully work together with a (â€œvirtualâ€) team (including international teams as required) as well as independently*Excellent analytical skills*Effective time management in order to meet daily metrics or team objectives Qualifications Education*Educated to degree level in a relevant discipline and/or equivalent work experience*Language Skills*Excellent communication skills both verbal and written*Required skills and experience:*7+ years proficiency in SAS programming*2+ years of ADaM, CDISC or SDTM*Lead experience in a Pharma setting*Attention to detail, ability to be self-driven and solid organization skills*Excellent communication skills (verbal and written) EEO Disclaimer Parexel is an equal opportunity employer. Qualified applicants will receive consideration for employment without regard to legally protected status, which in the US includes race, color, religion, sex, sexual orientation, gender identity, national origin, disability or protected veteran status.","https://www.indeed.com/pagead/clk?mo=r&ad=-6NYlbfkN0Awiy0szp24tPN-CLKKoEcPPgeke7kxOMr2z-MVaD2GkpP576WiTWgsdVyZZB-hBKkvgrG-VBxeoc4jaxrMkYQ6FUjQAW2qZpviwMmUMTkcYK_P3dJe-7K2Ub1i22Mwk7IP4-Q-OGEL-Y8jPhbXAXPLL6H1un3EQwBZK1WEZUy0je0TCWlVA55Lt1zTzn06cI-KUXaINJzEPIu56ERRjJzO0hHxaHtqWr_u4b8hmAZFBhShO7du1NeH12K_nh9FpnEYzeWH01gd9ytOO3MAoFXH8DoIVKHz_uG5GLB9TXH5PV9QFTfJY-331Tu-VkXOxnRVUhmM8AGoGoWNUjLQO1hqyfcjGfDK9Odm1KNaPKZJQ54FuWBd7Ou6MMqgGLV6chOWDlFGmYi9wCSo9DlQWOXMsR1hMhJzgsahyR1QsHoQsA==&p=2&fvj=0&vjs=3","Remote","Part-time","MSBA",1,0,0,0,0,0,1,0,1,0,0,0,0,0,0,0,0,0,0,0,"ea60cf86e1624be1b8283e5248de2033"
"15","data scientist",2022-05-23,"Senior/Principal Statistical Programmer - Remote","PAREXEL","Remote in Bingham Canyon, UT 84006+10 locations","Be part of our empowered Parexel Statistical Programming team today!**As a Principal or Senior Programmer you will be recognized as a subject matter expert, providing technical support and expert advice to internal and external sponsors. Parexel will provide you with the perfect opportunity to expand on your experiences and develop new skills in a stimulating work environment**KEY RESPONSIBILITIES include (not an exhaustive list of duties):**Input into and negotiate statistical programming timelines.*Ensure that timelines are adhered to coordinate and lead a statistical programming team to successful completion of a study within given timelines and budget*Monitor project resourcing, project budgets, and identify changes in scope*Ensure quality control (QC) on all process and technical activities related to derived dataset, table, listing, and figure programming in accordance with corporate quality standards*Maintain all supporting documentation for studies in accordance with WSOPs/Guidelines to ensure traceability and regulatory compliance*Provide a broad range of leadership and influencing capabilities to achieve the business objectives and goals for both Parexel and sponsors*Provide leadership, project specific training, stakeholder management, external sponsor support, resource management, and project management for the required programming tasks supporting clinical trial activities Qualifications Skills*Proficiency in SAS*Knowledge of the programming and reporting process*Knowledge of WSOPs/Guidelines/System Life Cycle methodologies, ICH-GCP and any other applicable local and international regulations such as 21 CFR Part 11 and proven practical application*Strong leadership skills*Ability to successfully work together with a (â€œvirtualâ€) team (including international teams as required) as well as independently*Excellent analytical skills*Effective time management in order to meet daily metrics or team objectives Education*Educated to degree level in a relevant discipline and/or equivalent work experience Language Skills*Excellent communication skills both verbal and written*Required skills and experience:*5 plus years proficiency in SAS programming*2+ years of ADaM, CDISC or SDTM*Lead experience in a Pharma setting*Attention to detail, ability to be self-driven and solid organization skills*Excellent communication skills (verbal and written) EEO Disclaimer Parexel is an equal opportunity employer. Qualified applicants will receive consideration for employment without regard to legally protected status, which in the US includes race, color, religion, sex, sexual orientation, gender identity, national origin, disability or protected veteran status.","https://www.indeed.com/pagead/clk?mo=r&ad=-6NYlbfkN0Awiy0szp24tPN-CLKKoEcPPgeke7kxOMr2z-MVaD2GkpP576WiTWgsdVyZZB-hBKkvgrG-VBxeocKxlJz2vL_TBNLVsXjRg4kMMUeWeZkbJX6uG4NiPJG2G65whVMqLuLHfWoBu_rKMy_jaCvgSGFUVJcMV0fU0XTWBip9pk8Lg6R4TbSUqzZuhMYp_7PwhtFaBQkEqihANl3cxbqmJAk_gGYFuEXAn5-J9mLDkVDgFih5zLeH4sf_uicjeA_kZlaUli30jhnNpG20z0KJ-i7eFEVlflFzhhn0HQzcMK5LMrHpMIME4fHX66UUpYbdAKTdWlwQZDRhcq4EdRqYDipJ1x4_PGA-BCvl_cX9hVkKxZLdIokrryrfjRMudBLz66UWT7ngJ6KY3UAmpJF6mVn41Jl5raqacTQPm1Z42VDzqeB8OqsbxM6I&p=3&fvj=0&vjs=3","Remote","Part-time","MSBA",1,0,0,0,0,0,1,0,1,0,0,0,0,0,0,0,0,0,0,0,"039b798246462606c69896f734e40899"
"16","data architect",2022-05-23,"NIS - Platform Architect","PRICE WATERHOUSE COOPERS","Remote in Salt Lake City, UT 84111","A career in Information Security, within Internal Firm Services, will provide you with the opportunity to develop and support our internal security technologies and services across the entire global and local PwC network. Youâ€™ll focus on being the forefront of designing, developing, and implementing information technology including hardware, software, and networks that enhances security of internal information and protect our firms intellectual assets.*To really stand out and make us fit for the future in a constantly changing world, each and every one of us at PwC needs to be a purpose-led and values-driven leader at every level. To help us achieve this we have the PwC Professional; our global leadership development framework. It gives us a single set of expectations across our lines, geographies and career paths, and provides transparency on the skills we need as individuals to be successful and progress in our careers, now and in the future.*As a Manager, you'll work as part of a team of problem solvers, helping to solve complex business issues from strategy to execution. PwC Professional skills and responsibilities for this management level include but are not limited to:*Develop new skills outside of comfort zone.*Act to resolve issues which prevent the team working effectively.*Coach others, recognise their strengths, and encourage them to take ownership of their personal development.*Analyse complex ideas or proposals and build a range of meaningful recommendations.*Use multiple sources of information including broader stakeholder views to develop solutions and recommendations.*Address sub-standard work or work that does not meet firm's/client's expectations.*Use data and insights to inform conclusions and support decision-making.*Develop a point of view on key global trends, and how they impact clients.*Manage a variety of viewpoints to build consensus and create positive outcomes for all parties.*Simplify complex messages, highlighting and summarising key points.*Uphold the firm's code of ethics and business conduct.*The Power Platform Engineer will join the team responsible for implementing and supporting innovative solutions for our PwC Global network using Microsoftâ€™s Power Platform. The role will include building services design, implementation, administration and automation. They will perform configuration changes and technology upgrades to the platform and will be required to troubleshoot and monitor issues that require knowledge of development languages.*Job Requirements and Preferences:Basic Qualifications:Minimum Degree Required:*High School DiplomaMinimum Years of Experience:*4 year(s)Preferred Qualifications:Degree Preferred:*Bachelor DegreePreferred Fields of Study:*Information Technology, Computer Systems Analysis, Management Information Systems, Computer Applications, Computer Engineering, Computer Programming, Systems EngineeringPreferred Knowledge/Skills:*Demonstrates extensive abilities and/or a proven record of success within a professional business services environment by:*Assisting in building out a PowerApps center of excellence (COE) for PwC;*Understanding Microsoft Cloud collaboration platforms including Azure, Power Platform, and Office;*Managing cloud infrastructure and responding to support requests regarding resource management, modern authentication protocols, Data Loss Prevention (DLP);*Understanding of REST APIs, PowerShell, HTML, XML;*Being familiar with application development methodologies and programming languages, administrating systems, infrastructure operations, service management principles, Windows server and desktop administration;*Working collaboratively to provide design guidance for specific projects that follows the enterprise architecture vision and adheres to applicable application technology roadmaps and standards; and,*Understanding and mitigating the impact of technical design to security, performance and data privacy.*At PwC, our work model includes three ways of working: virtual, in-person, and flex (a hybrid of in-person and virtual). Visit the following link to learn more: https://pwc.to/ways-we-work.*PwC does not intend to hire experienced or entry level job seekers who will need, now or in the future, PwC sponsorship through the H-1B lottery, except as set forth within the following policy: https://pwc.to/H-1B-Lottery-Policy.*All qualified applicants will receive consideration for employment at PwC without regard to race; creed; color; religion; national origin; sex; age; disability; sexual orientation; gender identity or expression; genetic predisposition or carrier status; veteran, marital, or citizenship status; or any other status protected by law. PwC is proud to be an affirmative action and equal opportunity employer.*For positions based in San Francisco, consideration of qualified candidates with arrest and conviction records will be in a manner consistent with the San Francisco Fair Chance Ordinance.*For positions in Colorado, visit the following link for information related to Colorado's Equal Pay for Equal Work Act: https://pwc.to/coloradoifsmanager.*#LI-Remote","https://www.indeed.com/rc/clk?jk=7a4fa9c21b3ee841&fccid=5e964c4afc56b180&vjs=3","Hybrid","Part-time","MSIS",0,0,0,0,0,1,1,0,0,0,0,0,0,0,0,0,0,0,0,0,"648f265e7beef3881cb21e48341dc309"
"17","cloud engineer",2022-05-23,"Senior Scatterometry Development Engineer","Texas Instruments","Lehi, UT 84043","* *  *   About TI *    Texas Instruments Incorporated (TI) is a global semiconductor design and manufacturing company that develops analog ICs and embedded processors. By employing the worldâ€™s brightest minds, TI creates innovations that shape the future of technology. TI is helping about 100,000 customers transform the future, today. Weâ€™re committed to building a better future â€“ from the responsible manufacturing of our semiconductors, to caring for our employees, to giving back inside our communities and developing great minds. Put your talent to work with us â€“ change the world, love your job!*  *  *   About the job *    A Senior Scatterometry Development Engineer is responsible for the development of scatterometry models to monitor key wafer measurements and monitoring the quality of the models to ensure precise and accurate data is reported to internal customers.They meet with customers to understand measurement needs and design solutions to meet the measurement needs of a technologically advanced wafer manufacturing facility. The ideal candidate will be a technical leader in the area of scatterometry and ellipsometry to understand the optical characteristics of films used in semiconductor processing.*  *  *   Responsibilities include: *  *  Work closely with internal metrology customers to determine their need for scatterometry measurements and to communicate the capabilities of measurements. *   Use DOE methodologies to capture relevant data needed for development of scatterometry measurements. *   Use project management skills to organize the development of multiple measurements simultaneously. *   Communicate estimated timeframes of measurements to stakeholders and work to reduce roadblocks in meeting agreed deadlines. *   Develop robust scatterometry models that meet MSA criteria. *   Work with internal metrology customers and process integration engineers to implement the scatterometry measurement inline. *   Train and mentor other engineers on industry leading methods for developing scatterometry.*  *    The person performing this role must be capable to plan effectively, drive schedules, meet critical deadlines on multiple tasks in parallel, lead technical discussions in their area of expertise, and work effectively across organizational boundaries. They must be able to clearly communicate project status and actions. Additionally, they must be able to interface with multiple organizations and work well on a diverse team to accomplish goals.*  *  *    Minimum requirements: *  *  Doctorate degree in physics or a engineering related field with experience in semiconductors *   -Or- Bachelor's degree in an engineering field with a minimum of 4 years directly building scatterometry models on semiconductor wafers*  *   Preferred qualifications: *  *  Demonstrated strong analytical and problem solving skills *   Strong verbal and written communication skills *   Ability to work in teams and collaborate effectively with people in different functions *   Strong time management skills that enable on-time project delivery *   Demonstrated ability to build strong, influential relationships *   Ability to work effectively in a fast-paced and rapidly changing environment *   Ability to take the initiative and drive for results*  Successful applicants for this position must be fully vaccinated against COVID-19 as a condition of employment. Vaccine verification will be required on your start date unless an exemption has been approved by TI as a medical or religious accommodation.*  Texas Instruments is an equal opportunity employer and supports a diverse, inclusive work environment. All qualified applicants will receive consideration for employment without regard to race, color, religion, creed, disability, genetic information, national origin, gender, gender identity and expression, age, sexual orientation, marital status, veteran status, or any other characteristic protected by federal, state, or local laws.*  If you are interested in this position, please apply to this requisition.* *","https://www.indeed.com/rc/clk?jk=9593fffee4059d87&fccid=d59215ef88e83b80&vjs=3","On-site","Part-time","MSIS",0,0,0,0,0,0,0,0,0,0,0,0,0,0,0,0,0,0,0,0,"b98879e73be89ef95563e04da124cb60"
