"","Search","Date","Title","Company","Location","Description","Link","Work Model","Job_Type","Program","R","Python","SQL","Tableau","PowerBI","Azure","Excel","Talend","SAS","Spark","Qualtrics","Domo","Salesforce","SAP","Hadoop","Qlik","Looker","Zoho","Stata","Snowflake","ID"
"18","data integration engineer",2022-05-29,"Principal Site Reliability Engineer","Myriad Genetics Inc.","Remote in Salt Lake City, UT 84108","* *  Principal Site Reliability Engineer (Remote) *  Myriad Genetics is looking for a principal Site Reliability Engineer to use their skills and experience in software and systems to build and maintain scalable, reliable, and secure services for internal and external users. We will need you to approach the problem of running production systems from a software and engineering perspective with a focus on testing, automation, and managed change. You will provide tools and expertise to other Myriad technology groups to support their engineering efforts. *  A Site Reliability Engineer at Myriad Genetics incorporates aspects of software engineering and applies them to infrastructure and operations problems alongside our software developers and IT operations staff. The main goals are to create ultra-scalable and highly reliable software systems. *  Our SRE team builds tooling and enables teams to deploy, monitor, and maintain their own production environments. *  WHAT YOU WILL DOâ€¯â€¯ *  Participate in the architecture of cloud/containerization infrastructure for the enterprise *   Facilitate the migration of applications to cloud/containers and on boarding of development teams onto those technology platforms *   Mentor a team of DevOps Engineers to improve their skill set and introduce new technologies *   Design and develop software build automation based on defined process and procedure *   Work with Development Teams and Architects to provide technical support on systems architecture, performance, capacity planning, deployments, environment configuration and monitoring *   Aid in maintaining highly available and stable production systems by implementing monitoring and standardization of configurations *   Address production related issues and work with developers to correct systematic issues *   Spearhead the testing and evaluation of new technologies to increase the DevOps teamâ€™s performance and application reliability *   Be on call for critical outages in a scheduled rotation. *   Manage overall health of software in production measured by uptime, performance metrics, and quality of service delivery *   Operate and maintain container orchestration infrastructure in AWS *   Establish and maintain proactive monitoring and alerting for container orchestration infrastructure and containerized applications *   Establish effective working relationships between IT Operations and Development teams *  ABOUT YOU *  Required Skills and Experience *  Experience in a technical field including SRE, DevOps, software development, or systems administration: 8-10 years *   Experience with algorithms, data structures, complexity analysis and software design *   Experience with Python (5+ years) *   Experience with containerization (Docker / Kubernetes / Openshift / etc) (3 years) *   Experience with Amazon AWS (5 years) *   Experience with at least on CI/CD technology, e.g. Tekton, ArgoCD, Jenkins, GoCD, TeamCity, etc *   Experience with monitoring and metrics tools: DataDog, New Relic, Prometheus/Grafana, etc *   Strong communication skills *   A commitment to self-directed learning *   Excellent time management, scheduling, and organizational skills *   Ability to manage multiple tasks in a fast-paced environment *   Ability to work effectively under tight timelines and schedules *   Ability to work independently and as a contributing team member *   Ability to sense the importance or impact of issues and situations and take appropriate actions *   Must be flexible, innovative, and self-motivated *   Must have the flexibility to work extra hours to meet corporate and departmental goals *   Strong communication, interpersonal and organizational skills *  Preferred Qualifications and Experience *  BS degree in Computer Science or related technical field *   Experience with other programming languages, including .NET, Java, Javascript, etc (5+ years) *   Scripting languages: Groovy, Bash/Golang/Python/Perl etc. *   Continuous integration/continuous delivery tools: GoCD, Jenkins *   Experience with designing, analyzing and troubleshooting distributed systems *   Database management: SQL, Oracle/Postgres, Liquibase/Flyway, etc. *   Atlassian Suite administration *   Logging: Splunk/SumoLogic *   Asychronous message brokers: Rabbit MQ/Kafka *   Linux/Unix/Windows OS: Ubuntu, RHEL, CentOS, Alpine, etc *   Configuration management tools: SaltStack/Ansible *   Cloud virtualization/infrastructure provisioning: Terraform, CloudFormation *   Familiarity with architectural patterns like microservices, REST, DDD, Enterprise Integration Patterns a plus*  *  TO DISCOVER ALL THE REMARKABLE ADVANCEMENTS THROUGHOUT MYRIAD GENETICS, INC PLEASE VISIT: *  Myriad Neuroscience: https://genesight.com/about-myriad-neuroscience/ *   Myriad Oncology: https://myriad-oncology.com/ *   Myriad Urology: https://myriadmyrisk.com/urology/ *   Myriad Women's Health: https://myriadwomenshealth.com/ *   For more information on how Myriad is making a difference, please visit the Company's website: www.myriad.com *   For other great information, you can visit us on Linkedin at: https://www.linkedin.com/company/myriad-genetics/ *   Myriad Genetics: Health Illuminated*  *  #LI-remote *  #LI-MG2 *  Same Posting Description for Internal and External Candidates* * * *","https://www.indeed.com/rc/clk?jk=fbefb7717f437888&fccid=8ab992a89d2cabd9&vjs=3","Remote","Part-time","MSIS",1,1,1,0,0,0,1,0,0,0,0,0,0,0,0,0,0,0,0,0,"981e5456bedf15f6f9b231976573ae80"
"19","cloud engineer",2022-05-29,"Cloud Architect - Manager","PRICE WATERHOUSE COOPERS","Remote in Salt Lake City, UT 84111","A career in our Digital and Applications Design practice, within Application and Emerging Technology services, will provide you with a unique opportunity to help our clients identify and prioritise emerging technologies that can help solve their business problems. We help our clients design approaches to integrate new technologies, skills, and processes so they can get the most out of their technology investment and drive business results and innovation. Our team helps organisations align their business and operational requirements through the careful design of digital platforms and applications. You’ll help our clients with application optimisation, strategic integration of custom packaged solutions like Enterprise Resource Planning and Customer Relationship Management, and roadmap development.*To really stand out and make us fit for the future in a constantly changing world, each and every one of us at PwC needs to be a purpose-led and values-driven leader at every level. To help us achieve this we have the PwC Professional; our global leadership development framework. It gives us a single set of expectations across our lines, geographies and career paths, and provides transparency on the skills we need as individuals to be successful and progress in our careers, now and in the future.*As a Manager, you'll work as part of a team of problem solvers, helping to solve complex business issues from strategy to execution. PwC Professional skills and responsibilities for this management level include but are not limited to:*Develop new skills outside of comfort zone.*Act to resolve issues which prevent the team working effectively.*Coach others, recognise their strengths, and encourage them to take ownership of their personal development.*Analyse complex ideas or proposals and build a range of meaningful recommendations.*Use multiple sources of information including broader stakeholder views to develop solutions and recommendations.*Address sub-standard work or work that does not meet firm's/client's expectations.*Use data and insights to inform conclusions and support decision-making.*Develop a point of view on key global trends, and how they impact clients.*Manage a variety of viewpoints to build consensus and create positive outcomes for all parties.*Simplify complex messages, highlighting and summarising key points.*Uphold the firm's code of ethics and business conduct.*Basic Qualifications:*Minimum Degree Required:**Bachelor DegreeMinimum Years of Experience:**5 year(s)*Preferred Qualifications:*Certification(s) Preferred:*Google Cloud Professional Cloud Architect certification and/or other Google Cloud certifications*Preferred Knowledge/Skills:Demonstrates extensive level of ability to, and/or a proven record of success directing efforts in the following areas:*Working knowledge of Cloud platforms and the technologies that make them work. (AWS, Azure, Google Cloud Platform); and,*Working knowledge of IT Service Management and how it is implemented across different operating models. (ITIL, ServiceNow).* Demonstrates extensive level of ability to, and/or a proven record of success directing efforts in the following areas:*Excelling in delivering high-value solutions in dynamic and ambiguous environments;*Leading complex projects by bringing together the right perspectives, identifying roadblocks, and integrating feedback from clients and team members;*Guiding delivery from project scoping to conclusion, while consistently keeping the client’s goals in mind;*Having a passion for developing and growing team members;*Communicating at an executive level;*Serving as both a mentor and advocate for your team and PwC Community;*Excelling in creating and maintaining professional relationships and leverage your professional network to seek new business opportunities;*Approaching new projects with an open mind, learn from your mistakes and ask for help when needed;*Believing empathy for coworkers and customers is key to your success;*Believing in the value created by diverse teams and can adapt to a variety of working styles; and,*Leading development of thought leadership and sales materials to grow the PwC Community, build new client relationships and business opportunities.* Demonstrates extensive level of ability to, and/or a proven record of success directing efforts in one or more of the following areas:*Cloud Platforms (Amazon Web Services (AWS), Azure, GCP);*Cloud Strategy, Design, Architecture and Migration;*DevOps, Automation CI/CI;*AI, Machine Learning, IoT ;*ServiceNow, ITIL, SACM;*COBIT, Remedy, Service Catalogue, CMDB; and,*Incident, Problem and Change Management.*At PwC, our work model includes three ways of working: virtual, in-person, and flex (a hybrid of in-person and virtual). Visit the following link to learn more: https://pwc.to/ways-we-work.*PwC does not intend to hire experienced or entry level job seekers who will need, now or in the future, PwC sponsorship through the H-1B lottery, except as set forth within the following policy: https://pwc.to/H-1B-Lottery-Policy.*All qualified applicants will receive consideration for employment at PwC without regard to race; creed; color; religion; national origin; sex; age; disability; sexual orientation; gender identity or expression; genetic predisposition or carrier status; veteran, marital, or citizenship status; or any other status protected by law. PwC is proud to be an affirmative action and equal opportunity employer.*For positions based in San Francisco, consideration of qualified candidates with arrest and conviction records will be in a manner consistent with the San Francisco Fair Chance Ordinance.*For positions in Colorado, visit the following link for information related to Colorado's Equal Pay for Equal Work Act: https://pwc.to/coloradoadvisorymanager.*#LI-Remote","https://www.indeed.com/rc/clk?jk=5cb676da9e3afd25&fccid=5e964c4afc56b180&vjs=3","Hybrid","Part-time","MSIS",0,0,0,0,0,1,1,0,0,0,0,0,0,0,0,0,0,0,0,0,"e1d5a63b609ee1e2436fa00b3ed7131e"
"20","cloud engineer",2022-05-29,"Senior Software Engineer (Backend) at Tech Startup","Recruiting From Scratch","Remote in Salt Lake City, UT 84103+1 location","* *  *   Who is Recruiting from Scratch: *   Recruiting from Scratch is a premier talent firm that focuses on placing the best product managers, software, and hardware talent at innovative companies. Our team is 100% remote and we work with teams across the United States to help them hire. We work with several companies funded by the best investors including Sequoia Capital, Lightspeed Ventures, Tiger Global Management, A16Z, Accel, DFJ, and more. *   Our goal is to find a job that works for you, especially if you're looking for remote, higher compensation, or a particular industry *   If you are a fit, the team will reach out to you about this role or any others that may be a fit for our clients. *   The Role *   Our clients are seeking senior software engineers with experience building secured applications who helps them ensure their solutions meet their customers’ security requirements for use in both public and their private environments. A successful candidate will help design and develop new features and tools to support secure service delivery. They are seeking someone who is passionate about designing, implementing, and supporting expanding distributed systems and appreciating the impact they have on all aspects of the member experience. They look for people who dig under the hood and understand what the technology is doing, so they can make wise decisions about how their technology should evolve. *   Qualifications *   At least 4 years of professional experience *    Both strong Python 2 and Python 3 development skills and experience on multiple projects *    A bachelor’s degree in computer science or related engineering field *    Excellent and demonstrable problem-solving skills *    Excellent communication skills and experience in working with customers *    Curiosity, a drive to understand, and a passion to excel and create satisfied customers *    Being a self-starter who is also able to work in a team *   Preferred/Bonus Qualifications *   Familiarity with SQL and No-SQL databases, and using them via Python *    Familiarity with Node.js, javascript, and AWS *   *   Benefits: PTO, Healthcare, and more! Base Salary Range: $150,000 to $200,000*  * *","https://www.indeed.com/rc/clk?jk=faa2c8991a172016&fccid=09e02654c2f26bbd&vjs=3","Remote","Part-time","MSIS",0,1,1,0,0,0,1,0,0,0,0,0,0,0,0,0,0,0,0,0,"4a222b6a65b5b9269f712f1bd6435b24"
"21","data architect",2022-05-29,"Senior Data Engineer - Data Pipelines & Data Science Platfor...","S&P Global","Magna, UT 84044+1 location","* The Role: Data Engineer * Location: Team is in Boston, but is available for remote or on-site throughout the US. * GL (for internal use only): 10 *  Panjiva is a data-driven technology company that uses machine learning to provide powerful search, analysis, and visualization of billions of shipping records from nearly every country in the world. More than 3,000 customers in over 100 countries, ranging from Fortune 500 companies and startups to government agencies and hedge funds, rely on our platform for supply chain intelligence. In global trade, better insight means better decision making and stronger connections between companies and governments across the globe. *  Recognizing Panjiva’s cutting-edge technology, S&P Global acquired Panjiva in 2018. This acquisition has grown our resources, dramatically expanded our access to data, and accelerated our growth plans. People are Panjiva’s greatest strength – join our engineering team as we map out a key part of the world economy! * Job Description * As a data engineer on our team, you will play a key role in developing our next-generation data science infrastructure and underlying core technologies. You will work with Panjiva’s world-class data scientists, analysts, and engineers to create products that solve important real-world business problems in a collaborative, fast-paced, and fun environment. *  You’ll work closely with our data science team to develop new platforms, infrastructure, and tools that will allow for machine learning applications at production scale over ever-growing datasets. *  You’ll design and leverage distributed computing technologies, data schemas, and APIs to construct data science pipelines. In addition, you’ll be expected to participate in augmenting our infrastructure to seamlessly integrate new data sets through constant R&D of the technologies and systems we use. * Join us in building the next generation of products as we continue to deliver valuable and actionable insights to decision-makers in the $15 trillion global trade industry. *  Responsibilities * Architect and implement distributed systems that perform complex transformations, processing, and analysis over very large scale datasets * Develop processes to monitor and automate detection of quality regressions in raw data or in the output of Panjiva’s machine learning models * Working with our data scientists to turn large-scale messy, diverse, and often unstructured data into a source of meaningful insights for our customers * Optimizing slow-running database queries and data pipelines * Helping enhance our search engine, capable of running sophisticated user queries quickly and efficiently * Building internal tools and backend services to enable our data scientists and product engineers to improve efficiency * Qualifications * B.S., M.S., or Ph.D. in Computer Science (or a related field) or equivalent work experience * 3+ years of experience working with data-at-scale in a production environment * Experience designing and implementing large-scale, distributed systems * Experience in multi-threaded software development (or some form of parallelism) * Significant performance engineering experience (e.g., profiling slow code, understanding complicated query plans, etc.) * Solid understanding of core algorithms and data structures, including the ability to select (and apply) the optimal ones to computationally expensive operations over data-at-scale * Strong understanding of relational databases and proficiency with SQL * Deep knowledge of at least one scripting language (e.g., Python, Ruby, JavaScript) * Deep knowledge of at least one compiled language (e.g., Scala, C++, Java, Go) * Experience developing software on Linux-based operating systems * Experience with distributed version control systems * Nice-to-Haves * Familiarity with relational database internals (especially PostgreSQL) * Proficiency with cloud computing platforms, specifically AWS * Working knowledge of probability & statistics * Contributions to open-source software * Experience building customer-centric products * Compensation/Benefits Information:*  S&P Global states that the anticipated base salary range for this position is $68,300 to $155,900 . Base salary ranges may vary by geographic location. * This role is eligible to receive S&P Global benefits. For more information on the benefits we provide to our employees, visit https://www.spgbenefitessentials.com/newhires . *  S&P Global is an equal opportunity employer committed to making all employment decisions without regard to race/ethnicity, sex, pregnancy, gender identity or expression, color, creed, religion, national origin, age, disability, marital status (including domestic partnerships and civil unions), sexual orientation, military veteran status, unemployment status, or any other basis prohibited by federal, state or local law. Only electronic job submissions will be considered for employment. *  If you need an accommodation during the application process due to a disability, please send an email to: EEO.Compliance@spglobal.com and your request will be forwarded to the appropriate person. *  The EEO is the Law Poster http://www.dol.gov/ofccp/regs/compliance/posters/pdf/eeopost.pdf describes discrimination protections under federal law. *  ----------------------------------------------------------- *  Equal Opportunity Employer * S&P Global is an equal opportunity employer and all qualified candidates will receive consideration for employment without regard to race/ethnicity, color, religion, sex, sexual orientation, gender identity, national origin, age, disability, marital status, military veteran status, unemployment status, or any other status protected by law. Only electronic job submissions will be considered for employment. *  If you need an accommodation during the application process due to a disability, please send an email to: EEO.Compliance@spglobal.com and your request will be forwarded to the appropriate person. * US Candidates Only: The EEO is the Law Poster http://www.dol.gov/ofccp/regs/compliance/posters/pdf/eeopost.pdf describes discrimination protections under federal law. *  ----------------------------------------------------------- 20 - Professional (EEO-2 Job Categories-United States of America), IFTECH202.1 - Middle Professional Tier I (EEO Job Group), SWP Priority – Ratings - (Strategic Workforce Planning) * Job ID: 266145 * Posted On: 2022-05-27 * Location: Cambridge, Massachusetts, United States*","https://www.indeed.com/rc/clk?jk=93940c9c9233f6db&fccid=b716e44d2c6283e7&vjs=3","Remote","Part-time","MSIS",0,1,1,0,0,0,0,0,0,0,0,0,0,0,0,0,0,0,0,0,"d9af81021a853df18be04684831d29d4"
"22","cloud engineer",2022-05-29,"Senior PHP Software Engineer","Software Technology Group","Salt Lake City, UT","* Job Description *Senior PHP Software Engineer** *Software Technology Group is a software development consulting company. We help our clients to build software solutions that transform their applications and businesses. Our full-time, salaried employees enjoy building and strengthening their skill sets with our custom Career Development Plans, Certifications, Mentorships, and training. Our focus is to help you have the career you want and the skill set you desire. We are looking for Senior PHP Software Engineers to join our team. Come see how STG can develop your career, your skills and your life.* Required skills/experience:* 3-5 experience of PHP development experience*  3-5 years of experience using MySQL*  Experience with Magento*  Familiarity of LAMP stack (Linux, Apache, MySQL, PHP)*  Knowledge and experience in JQuery, CSS, JavaScript, and HTML*  Solid understanding of Object Oriented Programming*  Excellent communication skills*  Experience with a MVC Framework such as CakePHP, Symfony, Zend, etc*  Knowledge and experience with Web Services, SOAP, and REST*  Experience working in an Agile environment* **About STG* Since 1996, Software Technology Group has been employing top software developers along the Wasatch Front. Our business model makes us unique: most STG consultants are full-time employees, complete with benefits and paid time off. Positions with us combine the variety and excitement of contract work with the stability of permanent employment.* A few of the things that set us apart* Work-life balance – We are a multi-year winner of the Alfred P. Sloan award for our outstanding accomplishments in workplace flexibility.*  Continuous learning –We offer a mentoring program that pairs junior software consultants with our senior consultants. Software consultants at all levels benefit from our regular training programs and education reimbursement options.*  Quality people & Quality work – STG’s management and consultants are considered industry leaders, working together to develop advanced, innovative solutions for our clients.*  Employee value – Without our employees, STG could not exist. We offer outstanding benefits, regular bonus opportunities, and above all, gratitude and appreciation for your contributions.* **It is the policy of Software Technology Group, Inc. to ensure equal employment opportunity to its employees and applicants for employment by fitness and merit without regard to race, color, religion, sex, national origin, age, disability, or genetic information.** Job Type: Full-time* Benefits:* 401(k)*  Dental insurance*  Health insurance*  Paid time off*  Professional development assistance*  Vision insurance* Schedule:* Monday to Friday* Work Location: Multiple Locations*","https://www.indeed.com/company/Software-Technology-Group/jobs/Senior-PHP-Software-Engineer-1b08e9cc3523af52?fccid=3eb222770037e1df&vjs=3","On-site","Full-time","MSIS",0,0,1,0,0,0,1,0,0,0,0,0,0,0,0,0,0,0,0,0,"115a510fde1546f4266b34e291d92ab8"
