"","Search","Date","Title","Company","Location","Description","Link","Work Model","Job_Type","Program","R","Python","SQL","Tableau","PowerBI","Azure","Excel","Talend","SAS","Spark","Qualtrics","Domo","Salesforce","SAP","Hadoop","Qlik","Looker","Zoho","Stata","Snowflake","ID"
"12","cloud engineer",2022-08-24,"Senior Systems Engineer","Cox Automotive","Salt Lake City, UT","* The Senior Systems Engineer is responsible for designing, implementing, tuning, optimizing, troubleshooting and the general administration of storage/backup systems to support the technical capabilities of Cox Automotive. The individual works closely with customers to gather and understand the requirements and configure systems to ensure the company’s needs are met. The engineer performs system installations, resolves incidents, performs security and data analysis, and analyzes system space and performance capacity. The engineer takes the lead to research and provide solutions to complex problems. The individual must be able to work with minimal to no supervision on multiple concurrent complex projects and be able to coordinate work of others. The engineer must possess excellent troubleshooting skills, in- depth knowledge and attention to detail. The engineer must work effectively using excellent communication skills, both with team members and business contacts. The Engineer must be able to work collaboratively with other infrastructure groups.* SPECIFIC RESPONSIBLITIES INCLUDE, BUT ARE NOT LIMITED TO: * Engineer should be detail oriented and must be able to think independently; exhibit a high level of initiative and self-confidence along with strong verbal and written communication skills; demonstrate excellent time management skills. *  Participate in the design and implementation of new or changing systems based on customer needs and internal guidelines. *  Define and evaluate integration strategies and architecture enhancements to meet mission objectives/needs. Develops detailed technical plans to guide development and integration activities. *  Respond to trouble tickets from the Service Desk automated trouble ticketing system. *  Perform Ad Hoc Backups as well as schedule and monitor automated backs and oversee data replication. *  Responsible for disaster recovery, backup, and recovery functions, including providing training and guidance for other system engineers on basic backup & restore functions. *  The ability to troubleshoot and resolve system issues leading to failed Backups. *  Working experience with VMware vSphere/vCenter. *  Working experience with SQL cluster servers. *  Working experience with Windows/Linux servers. *  Experience in Avamar & Data Domain Backup technologies design, implementation and administration and management including DDBoost. *  Working knowledge of DPA report. *  Perform Avamar/DDOS code upgrades & patching. *  Share knowledge by effectively documenting work and processes. *  Stay current on new technology and methodologies in area of expertise. *  Develop and maintain a thorough knowledge of assigned support areas. *  Work with the team to ensure the quality of implementations. *  Proactively generate solutions for managing a large system base. *  Conducts requirement analysis. *  Respond quickly and effectively to production issues and take responsibility for seeing those issues through resolution. *  Participate in problem solving and troubleshooting for assigned areas. *  Manage and address trouble tickets as assigned. *  Easily adjusts to changing priorities or projects *  Maintains a calm, professional tone when consulting with customers *  Develops technology plans and road maps for migration of systems and the development/analysis of recommendations for upgrades and enhancements to the existing storage infrastructure. *  Proactively seeks out new training initiatives and alternative ways that can expand one’s technical knowledge. *  Provide weekly status for all projects and tasks. *  Participate in on-call rotation of 24x7 support and be flexible in availability as needed. *  Mentor less experienced Engineers. * QUALIFICATIONS: * Bachelor’s degree or equivalent work experience *  Experience working with Avamar/DataDomain *  5+ years of experience in Information Technology related field *  Extensive knowledge of NFS, CIFS and iSCSI protocols *  Experience working with ESXi * PREFERRED QUALIFICATIONS: * NetApp Cluster-Mode Administration experience *  Netapp Storage Grid *  DataDomain Cloud Tier *  DataDomain Administration *  Avamar Grid Administration *  Dell PPDM (Power Protect) *  Experience with various server administration, including UNIX/Linux and Microsoft Windows *  UNIX Shell and/or PowerShell scripting experience *  Working knowledge with Service NOW is a plus *  Knowledge of data center networking infrastructure * To be employed in this role, you’ll need to clear a pre-employment background check and drug test. Cox Automotive does not currently consider a pre-employment drug test for marijuana for this position. However, we are a drug-free workplace, so the possession, use or being under the influence of drugs illegal under federal or state law during work hours, on company property and/or in company vehicles is prohibited.* Compensation:* *  Compensation includes a base salary of $86,400.00 - $144,100.00. The salary rate may vary outside of the anticipated range based on factors such as the ultimate location of the position and the selected candidate's experience.*   Position is eligible for additional compensation that may include commission (annual, monthly, etc.) and/or and incentive program.* *  About Cox Automotive*  At Cox Automotive, people of every background are driven by their passion for mobility, innovation and community. We transform the way the world buys, sells, owns and uses cars, accelerating the industry with global powerhouse brands like Autotrader, Kelley Blue Book, Manheim and more. What’s more, we do it all with an emphasis on employee growth and happiness. Drive your future forward and join Cox Automotive today!*  About Cox*  Cox empowers employees to build a better future and has been doing so for over 120 years. With exciting investments and innovations across transportation, communications, cleantech and healthcare, our family of businesses – which includes Cox Automotive and Cox Communications – is forging a better future for us all. Ready to make your mark? Join us today!*  -*  Benefits of working at Cox may include health care insurance (medical, dental, vision), retirement planning (401(k)), and paid days off (sick leave, parental leave, flexible vacation/wellness days, and/or PTO). For more details on what benefits you may be offered, visit our benefits page.*  Cox is an Equal Employment Opportunity employer - All qualified applicants/employees will receive consideration for employment without regard to that individual’s age, race, color, religion or creed, national origin or ancestry, sex (including pregnancy), sexual orientation, gender, gender identity, physical or mental disability, veteran status, genetic information, ethnicity, citizenship, or any other characteristic protected by law. Cox provides reasonable accommodations when requested by a qualified applicant or employee with disability, unless such accommodations would cause an undue hardship.*  Statement to ALL Third-Party Agencies and Similar Organizations: Cox accepts resumes only from agencies with which we formally engage their services. Please do not forward resumes to our applicant tracking system, Cox employees, Cox hiring manager, or send to any Cox facility. Cox is not responsible for any fees or charges associated with unsolicited resumes.*","https://www.indeed.com/pagead/clk?mo=r&ad=-6NYlbfkN0CNTaigg53tgKMQQsjdGlhApYl6RSsbpQl6QWYzGuod7-bTY1RMAoc8WFq_oZTNX27AYf0PfY5eP_iwiXozRQ8vgOvV7U9jJzbO1W0aJSDhHQjkTR7AsLxwoP9g2FeWTGKQrNYuwjeXPrmD4-zurV4Nd9SWMvRK_N9YbkAz5BEPYxY5DoT4NCxE2_zGycB9LNzfaqsYimxgbdkruqM3MLbJZ8U_z6dIphhT7s88BrRsH7t1tOO_EFQJpgeQ4KQGQsLcE-LIS176ddP0YH0iTXlCLGLrRJ6YFFqNLvgGRVz8rSMaiTHA81L52O8iCVKI0YUXNZHMNfs185-0WNA457c8U6cuYlDGVq3mrZq9jlhw887NEXSDtSiXVobG5BYftLAQjQVkE8FX9K3mGxB3ohsSpuuCKdZyuLIGUaTbIWiaA9ysbbBPk6Ww_mW7cW9sXCTE4g2s4t-vsi98a4XMKvn4fF0JUexUV-wt5Jf1MX56r66ErBcJzCVkzhdjEOlwBfKpkYQUTqJh5BdR69VkuMZVZReuxKMrxZ5W3Ag7kOb4zqW-Wg1Y-i3u6QgX1VahYtTDCDN0GRHC4RT0CnPmOsxo4z2k20S5TgE9OFy1DGDf4_rpyOwUgauRVwChal0MI0O_Vg3maDNjKsPgDGQ1AKtxpQmb6BwdtKUXFydkMTn6E9WojtPVNddIHoZnSD66I4bS5eJ0fDA8PU2hOc_ULHDY_kIOG4w9tsbGTKAeMoag5thEPhYs1g8SNvZmg_M2FXJBQp_FdwdaphavkCO4ENjLjRWxJs2JQMKbEexOF0hqeWYdd2PLda4yuK1rdjNAyWf4HH-O9LLxgaODyOVXBC7cK7Dj27WvmwSdYg-LUnHuvoW-V2KopzZ0ZxNIBJiB9EujdaBUnWkXVMRy8nM_M4d0bkAbNuUH9d0-8qepBOinl89e8tJrq_m4v6Ot81nD8QO97RAeKrsJ-G0Of2dHWdemvX481KI6uFn7mmZwHp-X-12uV0PWZPg1PjBUH1Tra3mI0TmxkTkzOQU6EDl7uJ_xAYtDsrzINTswxE4F3XibDlsuEUj2n14pHGY0QOWz3C1v0qfx4_Nbs_DT9SOX8EGvJsdbploeHy85zXGkUExNFg==&xkcb=SoDh-_M3an_tVaw4oJ0LbzkdCdPP&p=0&fvj=0&vjs=3","On-site","Part-time","MSIS",0,0,1,0,0,0,1,0,1,0,0,0,0,0,0,0,0,0,0,0,"64eabd91343faa240875c69b9f6b4d52"
"13","business intelligence analyst",2022-08-24,"Senior Data Analyst","Cox Automotive","Remote in Draper, UT","* Cox Automotive is currently looking for a Senior Data Analyst to join our team in Atlanta or remote. * Your Role: * The role of Sr. Data Analyst is a blend of tech-savvy data wrangler, critical thinker, and creative resolution guru . You will be a part of a highly analytic team within Sales Strategy and contribute to the quantitative analysis of the organization’s key challenges and opportunities. You will oversee and contribute to synthesizing and analyzing many different markets, business, and sales performance datasets. * As an analytic subject matter expert, you will analyze key questions, sales performance scenarios, hypothesis development, testing, and modeling of recommended solutions, as well as interact with and communicate findings/recommendations/results to senior business leaders on behalf of the team. * If you often think there is “No detail too small” and you find you thrive on finding solutions to complex challenges, we need you on our team! Come join an organization that is pushing the boundaries of the automotive industry in all directions. We are a powerhouse in providing software, inventory, digital, and mobility solutions to our clients with an exciting future of continued growth. * What You’ll Do: * Help manage processes to build new and improve existing data pipelines. *  Help drive, guide, and inspect the quality of team deliverables. *  Contribute to the development of statistical models to inform strategic business decisions and set up/maintain a robust model pipeline. *  Set up and support cloud infrastructure for the team in AWS for data and model pipelines. *  Prototype new, innovative analytic solutions, and work with a cross-functional team to move vetted solutions to production as needed. *  Support data inquiries. Analyze data and identify trends. Draw conclusions, present insights, and tell compelling stories. * What’s in It for You? * As a dynamite Sr. Data Analyst, you deserve success in your life as well, and at Cox, we define “success” as being a part of a company that gives you lots of opportunities and options. * First, we’ve created an exceptional salary package , plus an additional annual bonus target incentive. We are an inclusive, friendly environment where different perspectives are valued and celebrated. *  We offer a work/life balance that allows you to enjoy flexibility, family, and friends. *  Cox gives you generous paid time-off , provides access to a lifestyle coach, comprehensive and affordable healthcare , ongoing wellness programs, adoption assistance, pet insurance, retirement planning, 401K with generous company-matching contributions, employee discounts, tuition reimbursement, career development, and mentoring, Cox University with thousands of free online courses, parental benefits, employee resources and more! * Here’s what we’re looking for: * Required: * Bachelor's Degree in Finance, Mathematics, Economics or like discipline and 4 years of relevant experience, ideally in a data/business analysis role, or equivalent combination of education and experience. * Preferred: * MBA or Advanced Degree preferred *  5 or more years of direct experience with analytics, reporting, data mining, advanced analytical modeling, and data visualization. *  Experience with cloud environments, specifically AWS (s3, Redshift, EC2) , is strongly preferred. *  Experience querying RDMBS environments such as Snowflake, Redshift, Oracle, Netezza , Teradata *  Proficient in SQL, Python/Pandas a plus *  Knowledge of BI tools ( PowerBI, Tableau, Alteryx ) *  Statistics experience / experience in descriptive, exploratory, inferential, predictive, and causal analysis. *  Salesforce experience is a plus. * Come join the Cox family of businesses and Make Your Mark today.* About Cox Automotive*  At Cox Automotive, people of every background are driven by their passion for mobility, innovation and community. We transform the way the world buys, sells, owns and uses cars, accelerating the industry with global powerhouse brands like Autotrader, Kelley Blue Book, Manheim and more. What’s more, we do it all with an emphasis on employee growth and happiness. Drive your future forward and join Cox Automotive today!*  About Cox*  Cox empowers employees to build a better future and has been doing so for over 120 years. With exciting investments and innovations across transportation, communications, cleantech and healthcare, our family of businesses – which includes Cox Automotive and Cox Communications – is forging a better future for us all. Ready to make your mark? Join us today!*  -*  Benefits of working at Cox may include health care insurance (medical, dental, vision), retirement planning (401(k)), and paid days off (sick leave, parental leave, flexible vacation/wellness days, and/or PTO). For more details on what benefits you may be offered, visit our benefits page.*  Cox is an Equal Employment Opportunity employer - All qualified applicants/employees will receive consideration for employment without regard to that individual’s age, race, color, religion or creed, national origin or ancestry, sex (including pregnancy), sexual orientation, gender, gender identity, physical or mental disability, veteran status, genetic information, ethnicity, citizenship, or any other characteristic protected by law. Cox provides reasonable accommodations when requested by a qualified applicant or employee with disability, unless such accommodations would cause an undue hardship.*  Statement to ALL Third-Party Agencies and Similar Organizations: Cox accepts resumes only from agencies with which we formally engage their services. Please do not forward resumes to our applicant tracking system, Cox employees, Cox hiring manager, or send to any Cox facility. Cox is not responsible for any fees or charges associated with unsolicited resumes.*","https://www.indeed.com/rc/clk?jk=e6cd2950e54c1d5c&fccid=7e465a3d521b3ac3&vjs=3","Remote","Part-time","MSIS",0,1,1,1,1,0,0,0,0,0,0,0,1,0,0,0,0,0,0,1,"a90086ea1eda20fcd3a4efeeaa7fbd78"
"14","data integration engineer",2022-08-24,"Senior Systems Engineer","Cox Automotive","Salt Lake City, UT","* The Senior Systems Engineer is responsible for designing, implementing, tuning, optimizing, troubleshooting and the general administration of storage/backup systems to support the technical capabilities of Cox Automotive. The individual works closely with customers to gather and understand the requirements and configure systems to ensure the company’s needs are met. The engineer performs system installations, resolves incidents, performs security and data analysis, and analyzes system space and performance capacity. The engineer takes the lead to research and provide solutions to complex problems. The individual must be able to work with minimal to no supervision on multiple concurrent complex projects and be able to coordinate work of others. The engineer must possess excellent troubleshooting skills, in- depth knowledge and attention to detail. The engineer must work effectively using excellent communication skills, both with team members and business contacts. The Engineer must be able to work collaboratively with other infrastructure groups.* SPECIFIC RESPONSIBLITIES INCLUDE, BUT ARE NOT LIMITED TO: * Engineer should be detail oriented and must be able to think independently; exhibit a high level of initiative and self-confidence along with strong verbal and written communication skills; demonstrate excellent time management skills. *  Participate in the design and implementation of new or changing systems based on customer needs and internal guidelines. *  Define and evaluate integration strategies and architecture enhancements to meet mission objectives/needs. Develops detailed technical plans to guide development and integration activities. *  Respond to trouble tickets from the Service Desk automated trouble ticketing system. *  Perform Ad Hoc Backups as well as schedule and monitor automated backs and oversee data replication. *  Responsible for disaster recovery, backup, and recovery functions, including providing training and guidance for other system engineers on basic backup & restore functions. *  The ability to troubleshoot and resolve system issues leading to failed Backups. *  Working experience with VMware vSphere/vCenter. *  Working experience with SQL cluster servers. *  Working experience with Windows/Linux servers. *  Experience in Avamar & Data Domain Backup technologies design, implementation and administration and management including DDBoost. *  Working knowledge of DPA report. *  Perform Avamar/DDOS code upgrades & patching. *  Share knowledge by effectively documenting work and processes. *  Stay current on new technology and methodologies in area of expertise. *  Develop and maintain a thorough knowledge of assigned support areas. *  Work with the team to ensure the quality of implementations. *  Proactively generate solutions for managing a large system base. *  Conducts requirement analysis. *  Respond quickly and effectively to production issues and take responsibility for seeing those issues through resolution. *  Participate in problem solving and troubleshooting for assigned areas. *  Manage and address trouble tickets as assigned. *  Easily adjusts to changing priorities or projects *  Maintains a calm, professional tone when consulting with customers *  Develops technology plans and road maps for migration of systems and the development/analysis of recommendations for upgrades and enhancements to the existing storage infrastructure. *  Proactively seeks out new training initiatives and alternative ways that can expand one’s technical knowledge. *  Provide weekly status for all projects and tasks. *  Participate in on-call rotation of 24x7 support and be flexible in availability as needed. *  Mentor less experienced Engineers. * QUALIFICATIONS: * Bachelor’s degree or equivalent work experience *  Experience working with Avamar/DataDomain *  5+ years of experience in Information Technology related field *  Extensive knowledge of NFS, CIFS and iSCSI protocols *  Experience working with ESXi * PREFERRED QUALIFICATIONS: * NetApp Cluster-Mode Administration experience *  Netapp Storage Grid *  DataDomain Cloud Tier *  DataDomain Administration *  Avamar Grid Administration *  Dell PPDM (Power Protect) *  Experience with various server administration, including UNIX/Linux and Microsoft Windows *  UNIX Shell and/or PowerShell scripting experience *  Working knowledge with Service NOW is a plus *  Knowledge of data center networking infrastructure * To be employed in this role, you’ll need to clear a pre-employment background check and drug test. Cox Automotive does not currently consider a pre-employment drug test for marijuana for this position. However, we are a drug-free workplace, so the possession, use or being under the influence of drugs illegal under federal or state law during work hours, on company property and/or in company vehicles is prohibited.* Compensation:* *  Compensation includes a base salary of $86,400.00 - $144,100.00. The salary rate may vary outside of the anticipated range based on factors such as the ultimate location of the position and the selected candidate's experience.*   Position is eligible for additional compensation that may include commission (annual, monthly, etc.) and/or and incentive program.* *  About Cox Automotive*  At Cox Automotive, people of every background are driven by their passion for mobility, innovation and community. We transform the way the world buys, sells, owns and uses cars, accelerating the industry with global powerhouse brands like Autotrader, Kelley Blue Book, Manheim and more. What’s more, we do it all with an emphasis on employee growth and happiness. Drive your future forward and join Cox Automotive today!*  About Cox*  Cox empowers employees to build a better future and has been doing so for over 120 years. With exciting investments and innovations across transportation, communications, cleantech and healthcare, our family of businesses – which includes Cox Automotive and Cox Communications – is forging a better future for us all. Ready to make your mark? Join us today!*  -*  Benefits of working at Cox may include health care insurance (medical, dental, vision), retirement planning (401(k)), and paid days off (sick leave, parental leave, flexible vacation/wellness days, and/or PTO). For more details on what benefits you may be offered, visit our benefits page.*  Cox is an Equal Employment Opportunity employer - All qualified applicants/employees will receive consideration for employment without regard to that individual’s age, race, color, religion or creed, national origin or ancestry, sex (including pregnancy), sexual orientation, gender, gender identity, physical or mental disability, veteran status, genetic information, ethnicity, citizenship, or any other characteristic protected by law. Cox provides reasonable accommodations when requested by a qualified applicant or employee with disability, unless such accommodations would cause an undue hardship.*  Statement to ALL Third-Party Agencies and Similar Organizations: Cox accepts resumes only from agencies with which we formally engage their services. Please do not forward resumes to our applicant tracking system, Cox employees, Cox hiring manager, or send to any Cox facility. Cox is not responsible for any fees or charges associated with unsolicited resumes.*","https://www.indeed.com/pagead/clk?mo=r&ad=-6NYlbfkN0CNTaigg53tgKMQQsjdGlhApYl6RSsbpQl6QWYzGuod7-bTY1RMAoc8WFq_oZTNX27AYf0PfY5eP_iwiXozRQ8vgOvV7U9jJzbO1W0aJSDhHQjkTR7AsLxwoP9g2FeWTGKQrNYuwjeXPrmD4-zurV4Nd9SWMvRK_N9YbkAz5BEPYxY5DoT4NCxEwCXl6vu3FH8es1H4758dCaii2PL2P4fD793_dbZe2mFSmR2hSPYbycchatsnS9scljtzon6XPpM3-rbDyuu7vbsXCpXVtULv5wnz6zZ8nK4yneaRztStP_r1kB6YZnbokqQTmBZPmghXRyVzIH6MS3M5VZMmcdrfapBtt7q8odKU7jIIbqR9RZJUFOEeHEQyrPR4zfKY78feNjoHtCHDClDk_xa5usTejzhkmhTfDcWtB-Hh1sfw8oOIrhNGS4M67Qh5ZYp5IZ-M76-1pEUfdlMnb5t_Wx8aF9T0DZpKVP1yTmuumwKMupgbvSml3VwDXYOLpuef_-_vzkWv7maDT5NB82niX3ZLp2t20KhehbpeePUwGSTz2B-QV21rrYfxDeNo9VuHp2AtTC0T_yJGisV8CEmHfaNLQZ8dsrxE01EGDykfUbuQxxUsJMZZ8LntV0oXZlPnGzqJ2KHQFCi9sYWoJ8dkjt_CX__vQsaIKCmoZ3qW4A3_-DhdA9f_TSVEoBG9owpJuRNufCnS0XSemsmbi_SBG6dI8th_edSeBchGqZE9BaLLi_n4c8rEWssJgUp1ypj5omeKOwAxjNERwlHsPzABIcSoyDo6C3cqoNtzBDq0-uaJdjF_y9jL4-P1NCS3VL6cFTifg_8jSGhJuMC5Xc94wdOazLAxkuSnPEOQPu_nPs-2f2g-Oo3e8xxLKoYYamYiwiC6vNNhWrfbsNE4226ZainVa7oNksGk2sCQUKlGFmmRnIdUHbDlaKstHpSvH5q_a5XuvtQFUNpWzInnX2UbTyNlxDOrcH9MUtY39vX1-W1Dzf5Y4MHYj7RwtRWPvtTL-8FHZldGyJGpb-1Ejsw_Z2QelatTdZuRaHUr0-9wbzfywwTN6_hA6FV0Y28RTF53nGjY40AaeGTc35D3OKH32nqxFFnHiWU3vEoQ3AA6N_E_RjAATjSaaxpZ&xkcb=SoAb-_M3an_mSfw4oJ0LbzkdCdPP&p=0&fvj=0&vjs=3","On-site","Part-time","MSIS",0,0,1,0,0,0,1,0,1,0,0,0,0,0,0,0,0,0,0,0,"b049add0c51bd08b50fc448e20389340"
