"","Search","Date","Title","Company","Location","Description","Link","Work Model","Job_Type","Program","R","Python","SQL","Tableau","PowerBI","Azure","Excel","Talend","SAS","Spark","Qualtrics","Domo","Salesforce","SAP","Hadoop","Qlik","Looker","Zoho","Stata","Snowflake","ID"
"6","data architect",2022-05-29,"HRST Digital Enablement-Service Now","Deloitte","Salt Lake City, UT 84111 (Downtown area)","* *  Role description*   The HR Strategy and Transformation Digital Enablement team implements core, firmwide Talent applications leveraged to support key Talent strategies and processes. Our Talent organization is transforming the way that services are delivered through the implementation of the ServiceNow HR Service Delivery module. This platform will bring the employee experience to life by creating connected, transparent, and efficient services across the Talent lifecycle.*   Our team - in partnership with our Talent stakeholders, IT partners, and technology vendors - is at the forefront of designing, configuring, implementing, and running innovative, new solutions for our stakeholders. *   We are seeking an innovative and highly motivated talent technology professional to design, implement, and enhance these ServiceNow HR services as part of our multi-year transformation roadmap.*   This individual will play a technical requirements role - advising on configuration, data flow, downstream system integrations, and more to support end-to-end case management, workflow management, knowledge, and system communications. This role will be the nexus of testing, integration, release management, and platform health by partnering with our enterprise platform team, the vendor, and our Talent teams. *   Additionally, this role will serve as a conduit to our ITS organization and will be a critical point of contact for both new solutions and existing digital assets. This individual will have the opportunity to architect, incubate, and deliver projects in partnership with Talent stakeholders and ITS.*   This role requires at least five years of technical experience with case management and workflow management technology, vendor management, Talent process and other human resources domain experience. Additionally, this individual requires strong project management skills and stakeholder management experience.*  Work you'll do*   As the Digital Enablement Manager, you will:*   Incubate new solutions that leverage the power of the ServiceNow platform to design best-in-industry services.*    Act as a platform architect to sustain existing technical components of the platform.*    Design creative and sustainable solutions to technical issues and break-fixes as raised by the platform support team.*    Recommend optimizations and improvements for case management and other core applications, based on the feedback of the functional teams.*    Champion testing efforts for validation, user experience and systems integration testing as applicable; for example, you'll be the translator of user stories to the development team - making them developer-read, testable, and articulate.*    Create a set of processes to maintain and monitor systems integrations and process automation.*    Work with integrated systems (including 3rd party supported) and use your expertise to drive closure to open issues.*    Partner with ITS to coordinate application and platform upgrades and make recommendations on how to activate net-new features that become available with new releases.*    Load, manipulate and maintain data between case management platform and other systems.*    Monitor health, usage, and overall compliance of platform and its applications.*    Serve as a subject matter expert to the platform team responsible for analysis, design, development, implementation of modules, and applications on the platform.*    Manage third party vendor relationships when applicable.*    Perform other role-related duties as needed.*  The team *   The HR Strategy and Transformation team is reimagining how Talent fuels our Deloitte businesses through innovative, customer-centric, digitally enabled talent services. We take a human-centered approach to creating unified, personalized, and intuitive experiences that use data and digital solutions to optimize the way that Talent works, the workforce, and the workplace.*  Qualifications*   Bachelor's degree and 10+ years of relevant work experience*    5+ years experience with ServiceNow platform or comparable technology*    Problem solving skills and consultative approach with an ability to collaborate with team members on best practices*    Expertise leading talent technology implementations or enhancing other enterprise digital talent solutions - from concept to deployment*    Leadership experience in a dynamic, complex, client- and team-focused environment with minimal oversight and an agile mindset*    Proven stakeholder management and relationship-building skills*    Strong communication skills, both verbal and written*    Proficient with Microsoft Office technology (e.g., PowerPoint, Excel, OneNote, Word, Teams)*    Knowledge of the professional services industry is preferred*    Must be legally authorized to work in the United States without the need for employer sponsorship, now or at any time in the future.*   The wage range for this role takes into account the wide range of factors that are considered in making compensation decisions including but not limited to skill sets; experience and training; licensure and certifications; and other business and organizational needs. The disclosed range estimate has not been adjusted for the applicable geographic differential associated with the location at which the position may be filled. At Deloitte, it is not typical for an individual to be hired at or near the top of the range for their role and compensation decisions are dependent on the facts and circumstances of each case. A reasonable estimate of the current range is $95,070 to $175,080. *   You may also be eligible to participate in a discretionary annual incentive program, subject to the rules governing the program, whereby an award, if any, depends on various factors, including, without limitation, individual and organizational performance. *   #EA_ExpHire #EA_TALENT_ExpHire* *","https://www.indeed.com/rc/clk?jk=d0943271c2fe849c&fccid=9e215d88a6b33622&vjs=3","On-site","Part-time","MSIS",1,0,0,0,0,0,1,0,0,0,0,0,0,0,0,0,0,0,0,0,"22e70e268e8e2a8adac9a49ce17675e6"
"7","business intelligence analyst",2022-05-29,"Business Analytics Manager","Deloitte","Salt Lake City, UT 84111 (Downtown area)","* *  Business Analytics Manager *  Work you'll do *   The Strategic Finance team provides analytical and finance services in support of the Deloitte. Within Operations & Finance, the Analytics team specializes in providing a forward-looking perspective and helping leadership to make key business decisions. This role will be responsible for leading and supporting a range of deep analytical and predictive modeling projects that drive strategic objectives and improve business performance. *   Good communication, strategic thinking, analytical and problem-solving skills are required to be successful in this role. This role creates great value for the business by providing high quality, actionable recommendations in support of business decision making and performance improvement. *  Job Responsibilities *  Designs and implements predictive and statistical models to forecast future business performance leveraging advanced machine learning platforms. *   Analyzes internal and external data to understand performance drivers and identify improvement opportunities *   Streamlines and automates analytical processes and data pipelines that feed predictive models and dashboards for leadership *   Examines Deloitte's businesses from different perspectives, finding new analytical insights, while establishing analytics as a sustainable, world-class capability *   Works across Deloitte's businesses to support the Enabling Areas and Business Functions in a variety of special and complex analytics projects *   Communicate analysis and recommendations in a clear, succinct manner and produce leadership-quality deliverables that explain, present and analyze the financial performance and plans of the business *  The team *   The Strategic Analytics team provides specialized analytical and finance services in support of the Deloitte Leadership. The team drives key processes including strategic analytics, long-range financial planning, external and internal trend analysis, annual planning and investments analysis. *  Qualifications *   Required: *  Minimum of 5+ years of relevant experience with focus on advanced analytics and predictive modeling *   Deep knowledge about machine learning algorithms such as random forests, clustering, logistic regression, etc. *   Advanced experience in Dataiku and/or DataRobot. *   Bachelor's degree in Cognitive Science, Statistics or related field *   Preferred: *  Experience in data visualization and statistical modeling tools (e.g., Tableau, Python, R) *   Experience in UiPath*   EA_ExpHire *   EA_FA_ExpHire *   EA_Finance* *","https://www.indeed.com/rc/clk?jk=1c9387910f011338&fccid=9e215d88a6b33622&vjs=3","On-site","Part-time","MSIS",0,1,0,1,0,0,0,0,0,0,0,0,0,0,0,0,0,0,0,0,"9d7a7c208db309d1bf4fdac0b24e39cb"
"8","data integration engineer",2022-05-29,"Lead Cyber Analyst, Splunk Development & Administration","Deloitte","Remote in Salt Lake City, UT 84111","* *  Location: US (remote)*   Are you passionate about technology and interested in joining a community of collaborative colleagues who respectfully and courageously seek to challenge the status quo? If so, read on to learn more about an exciting opportunity with Deloitte's Information Technology Services (ITS). We are curious and life-long learners focused on technology and innovation.*  Work you'll do*   The Cybersecurity Engineer position supports the Fusion Center as an escalation point identifying and addressing potential Splunk content/level I and II engineering security concerns as this role serves as a point of escalation. This role is also responsible for supporting Security application(s) patching, content creation as requested from all stakeholders, and development of process documentation.*  Serves as Splunk developer responsible for creating Security Information and Event Management (SIEM) content to monitor security events and detect potential security incidents across the enterprise. Responsible for SIEM content management, content creation, rule tuning, reporting and alert creation *   Provide knowledge of recognizing and onboarding new data sources into Splunk, analyzing the data for parsing purposes to make it CIM compliant, then building dashboards to fulfill stakeholder requirements.*    Provide skillful knowledge within a Linux environment, editing and maintaining Splunk configuration files and apps.*    Work with other Cybersecurity Engineering team members and interact with end users to gather requirements, perform troubleshooting, and aid with the creation of Splunk search queries and dashboards as required.*    Interact with senior management, as necessary.*    Troubleshoot performance alerts from the Splunk infrastructure or Splunk agents*    Assist in the testing of vendor patches for all security applications the Engineering team supports.*    Maintain the Cybersecurity Engineering group in ServiceNow and ensure all request and incident SLA's are met as required by our stakeholders.*    Document and update the Team's process and Data Ingestion procedures.*    Actively seek to improve and develop new content based upon observed security activity*    Provide excellent customer service*   The team*   Information Technology Services (ITS) helps power Deloitte's success, which serves many of the world's largest, most respected organizations. We develop and deploy cutting-edge internal and go-to-market solutions that help Deloitte operate effectively and lead in the market. Our reputation is built on a tradition of delivering with excellence.*   The ~3,000 professionals in ITS deliver services including:*   Cyber Security*    Technology Support*    Technology & Infrastructure*    Applications*    Relationship Management*    Strategy & Communications*    Project Management*    Financials*   Cyber Security *   Cyber Security vigilantly protects Deloitte and client data. The team leads a strategic cyber risk program that adapts to a rapidly changing threat landscape, changes in business strategies, risks, and vulnerabilities. Using situational awareness, threat intelligence, and building a security culture across the organization, the team helps to protect the Deloitte brand.*   Areas of focus include:*   Risk & Compliance*    Identity & Access Management*    Data Protection*    Cyber Design*    Incident Response*    Security Architecture*    Business Partnership*   Qualifications*   Required:*   Bachelor's degree in Computer Science or Business Administration, or relevant educational or professional experience.*    5 years of related experience including at least 2 years experience with Splunk Administration.*    Strong Working Knowledge of the Splunk Platform.*    Ability to troubleshoot performance and issues, as well as installation and Splunk upgrades*    Strong experience in analyzing, troubleshooting and providing solutions for technical issues.*    Experience with Splunk Enterprise Security.*    Experience in Syslog, Splunk HTTP Event collection (HEC).*    Experience in ingesting logs from DB Connect app.*    Experience creating Alerts, Dashboards and reports in Splunk Tool.*    Experience in requirement gathering and documentation.*    Experience in Log parsing, lookups, calculated fields extractions using regular expression(regex).*    Experience in Developing Splunk Dashboards, Report, Alerts, Visualizations and Optimize searches.*    Hands-on Experience in Splunk Content Development.*    Sound judgment skills and ability to manage escalations.*    Determines methods and procedures on new assignments with minimal instruction,*    Excellent interpersonal and organizational skills.*    Must be legally authorized to work in the United States without the need for employer sponsorship, now or at any time in the future*   Preferred:*   Splunk Core User Certification*    Splunk Core Power User Certification*    Splunk Admin Certification*    Experience with Data Models*    Experience with writing correlated searches*    Writing Scripts and configure in Splunk Servers.*    Understanding of all Splunk backend components*    Experience with Splunk integration to AWS, Azure, and GCP*    Knowledge and experience in GIT.*    Knowledge of risk assessment tools, technologies and methods*   The wage range for this role takes into account the wide range of factors that are considered in making compensation decisions including but not limited to skill sets; experience and training; licensure and certifications; and other business and organizational needs. The disclosed range estimate has not been adjusted for the applicable geographic differential associated with the location at which the position may be filled. At Deloitte, it is not typical for an individual to be hired at or near the top of the range for their role and compensation decisions are dependent on the facts and circumstances of each case. A reasonable estimate of the current range is $86425 to $159165.*   #EA_ExpHire *   #EA_ITS_ExpHire* *","https://www.indeed.com/rc/clk?jk=2865182806771765&fccid=9e215d88a6b33622&vjs=3","Remote","Part-time","MSIS",0,0,0,0,0,1,1,0,0,0,0,0,0,0,0,0,0,0,0,0,"477013badc09147ccc003d395eb92ab8"
"9","cloud engineer",2022-05-29,"Senior Front End Engineer","EasyPost","Lehi, UT","* *  *   *    Founded in 2012, EasyPost is a YC unicorn whose mission is to make shipping simple for businesses, from garage startups to the Fortune 500. Shipping, now more than ever, is the backbone of the global economy, but integrating the technology-enabled operations of a modern business with the low-tech and complex shipping industry has always been a challenge. EasyPost solves this problem with the first developer-friendly REST API for shipping, and we continue to push boundaries and discover new ways to simplify shipping for all. Our team is rapidly growing, and this is the perfect time to get on board. Join us, and help build the shipping infrastructure of the future.*   *   *   *     About the role:*   *   *   *     We are looking for a Senior Front End Engineer who is comfortable in a polyglot environment and has strong experience with React to join the EasyPost team. You will be a key member of our small, fast growing UI engineering team making important technical decisions that will shape the company's future. If you love to code, like to build APIs, and enjoy working on unique challenges within a collaborative team of developers to build meaningful products, then we’d love to connect with you.*   *   *   *     What you will do:*   *   *   *     o Build and maintain frontend architecture*   *   *     o Collaborate with backend engineering, product, and design teams to write, test, and deploy code that integrates with EasyPost initiatives*   *   *     o Create new and innovative features for our users*   *   *     o Optimize pages for maximum speed*   *   *     o Solve problems creatively and efficiently*   *   *   *     About You:*   *   *   *     o Driven to build delightful user experiences*   *   *     o Experience delivering a high-quality product as an individual contributor as part of a high-performing team in a fast-paced, continuously changing environment*   *   *     o Excellent attention to detail*   *   *     o Excellent written and verbal communication skills*   *   *     o Familiarity with browser testing and debugging*   *   *     o 5+ years of JavaScript development experience*   *   *     o Core Web Vitals*   *   *     o Web security*   *   *     o Cross-browser support*   *   *     o Automated testing (Jest, Cypress)*   *   *  *   *    What We Offer:*   *   *   *     o Comprehensive medical, dental, vision, and life insurance*   *   *     o Competitive compensation package and equity*   *   *     o 401(k) match*   *   *     o Monthly work from home stipend of $100 net*   *   *     o Flexible work schedule and paid time off*   *   *     o Collaborative culture with a supportive team*   *   *     o A great place to work with unlimited growth opportunities*   *   *     o The opportunity to make massive contributions at a hyper-growth company*   *   *     o Make an impact on a product helping ship millions of packages per day*   *   *   *     Data Privacy Notice for Job Applicants:*   *   *     For information on personal data processing, please see our Privacy Policy: https://www.easypost.com/privacy*   *   *   *     ""EasyPost is an Equal Opportunity Employer. Employment decisions are made without regard to race, color, religion, national or ethnic origin, sex, sexual orientation, gender identity or expression, age, disability, protected veteran status or other characteristics protected by law.""*   *   *   *     To be considered for this position, you must be authorized and based in the United States.*   *  * *","https://www.indeed.com/rc/clk?jk=b8198998ba0522fd&fccid=96b9503e35c0f0a9&vjs=3","Remote","Part-time","MSIS",0,0,0,0,0,0,1,0,0,0,0,0,0,0,0,0,0,0,0,0,"2d6569b453dce9d927c9abd63483d489"
"10","cloud engineer",2022-05-29,"DevOps Engineer","GOLDPoint Systems","Hybrid remote in Provo, UT 84601","* Company Info* GOLDPoint Systems provides top-of-the line customized loan management software in the consumer lending field. We have had decades of financial tech experience even before fintech really became the cool new thing. We process billions of dollars in transactions across the US each year for many financial institutions and have become one of the top players in the market.* To help accomplish our team’s vision and take our processes to the next level in our effort to provide amazing support to our customers, we are looking for a Site Reliability Engineer with mid-level experience. A plethora of opportunities are there in the team as we venture into new technologies and find better ways to manage our existing systems. Our team culture is also one of support and communication that you don’t want to miss. Our SRE team has major impact on the company and you will feel needed, appreciated, and fulfilled in the work you do here. So, apply quick and we will get back to you super snappy.* Responsibilities may include: * Process Automation: Create tools to support and automate the maintenance of different scalable infrastructures including Kubernetes and Message Queue Systems*  Systems Administration: Maintain our servers in each test and production environment to provide maximum uptime and scalability at the infrastructure level*  Application and Infrastructure Monitoring: Manage and improve automated alerting and monitoring systems to minimize downtime and improve mean time to resolution*  Incident Management: Identify, troubleshoot, solve, coordinate, escalate, incidents pertaining to our applications and infrastructure* Position Qualifications: These are preferred qualifications only. We understand a great employee is not only about what they know.* 3+ Years of experience in any scripting language IE...PowerShell / bash*  3+ Years of any CI/CD Configuration Management tools IE…Jenkins/Chef/Octopus Deploy/Puppet*  Experience with any application performance monitoring tools or services IE…New Relic, AppDynamics, Dynatrace, etc…*  Experience with Git and/or Azure DevOps (VSTS)*  Experience in any of the following DBMS: MSSQL/Mongo/Elastic*  Experience with Kubernetes or other containerization orchestration*  Basic knowledge of C#/Python or some other development language*  Strong understanding of networking and virtualized infrastructures*  Any number of years in a customer support related role is a plus even though you likely won’t be working directly with our customers* Company Benefits: * 4 Weeks’ vacation for all employees*  Paid sick days*  Hybrid Work after training period*  Nine paid holidays per year (Including your birthday)*  Online professional training course subscriptions*  Health, dental, and vision insurance plans*  Company contribution to a Health Savings Account (HSA)*  401(k) plan with company matching contributions*  Year-end profit-sharing contribution to the 401(k) plan*  Large Year-end and other bonus opportunities*  Two hours of paid exercise time per week*  Gym, Racquetball courts, massages, and access to a personal trainer*  Subsidized meals*  Snacks in team rooms* Apply here or on our website! https://www.goldpointsystems.com/careers* Job Type: Full-time* Pay: $70,000.00 - $100,000.00 per year* Benefits:* 401(k)*  401(k) matching*  Dental insurance*  Flexible schedule*  Health insurance*  Health savings account*  Life insurance*  Paid time off*  Retirement plan*  Vision insurance* Schedule:* 8 hour shift*  Monday to Friday*  On call* Supplemental Pay:* Bonus pay* Ability to commute/relocate:* Provo, UT 84601: Reliably commute or planning to relocate before starting work (Required)* Work Location: One location*","https://www.indeed.com/company/GOLDPoint-Systems/jobs/Devop-Engineer-37c4dcb68c4d6a83?fccid=639ae3eec37658f0&vjs=3","Hybrid","Full-time","MSIS",0,1,1,0,0,1,0,0,0,0,0,0,0,0,0,0,0,0,0,0,"37746a1d2fc72a400438b0a06c7fe887"
