"","Search","Date","Title","Company","Location","Description","Link","Work Model","Job_Type","Program","R","Python","SQL","Tableau","PowerBI","Azure","Excel","Talend","SAS","Spark","Qualtrics","Domo","Salesforce","SAP","Hadoop","Qlik","Looker","Zoho","Stata","Snowflake","ID"
"1","security manager",2022-07-12,"Security Site Supervisor - Manufacturing Company","Allied Universal","Salt Lake City, UT 84111 (Central City area)+1 location","* *  Allied Universal®, North America’s leading security and facility services company, provides rewarding careers that give you a sense of purpose. While working in a dynamic, diverse and inclusive workplace, you will be part of a team that fuels a culture that will reflect in our communities and customers we serve. We offer medical, dental and vision coverage, life insurance, 401K, employee assistance programs, company discounts, perks and more for all full-time positions!* *  Allied Universal Services is seeking the position of a Security Site Supervisor.*  * The Security Site Supervisor will supervise and coordinate the delivery of quality services to an assigned customer. The Security Site Supervisor will act as a liaison between customers, Operation Managers and security officers. They will supervise site staff and provide coaching, recognition and discipline within approved empowerment range.*  * QUALIFICATIONS/REQUIREMENTS:*  Be at least 21 years of age with high school diploma or equivalent*   Possess effective written and oral communication and interpersonal skills with ability to deal with all levels of personnel and the general public in a professional and effective manner*  *   *     Licensing requirements are subject to state and/or local laws and regulations and may be required prior to employment.*   *   As a condition of employment, employee must successfully complete a background investigation and a drug screen in accordance with all federal, state, and local laws*   Display exceptional customer service and communication skills*   Have intermediate computer skills to operate innovative, wireless technology at client specific sites*   Ability to handle crisis situations at the client site, calmly and efficiently*   Capably utilize scheduling and billing software to produce reports (such as Scheduling Activity, Training Detail reports, etc.) that require interpretation and action for effective business management*   Enforce Contract Standards*   Administers site safety programs outlining site-specific hazards for security officers including vehicle / driving safety as appropriate to corporate procedures*   Prepared to participate in unemployment hearings*   Enforces Allied Universal’s policies as outlined in the handbooks and executive memos *  Able to:*    Work in various environments such as cold weather, rain/snow or heat*     Occasionally lift or carry up to 40 pounds*     Climb stairs, ramps, or ladders occasionally during shift*     Stand or walk on various surfaces for long periods of time*   * *   Allied Universal® is an Equal Opportunity Employer. All qualified applicants will receive consideration for employment without regard to race/ethnicity, age, color, religion, sex, sexual orientation, gender identity, national origin, genetic information, disability, protected veteran status or relationship/association with a protected veteran, or any other basis or characteristic protected by law. For more information: www.aus.com* *  * * *  If you have any questions regarding Equal Employment Opportunity, Affirmative Action, Diversity and Inclusion, have difficulty using the online system and require an alternate method to apply, or require an accommodation at any time during the recruitment and/or employment process, please contact our local Human Resources department. To find an office near you, please visit: www.aus.com/offices.* *","https://www.indeed.com/pagead/clk?mo=r&ad=-6NYlbfkN0Bkl6eMu1FM1r07QHNveSMIb5NS-ooqLFrV5tiSRjmHVl6py5KZ0S4DryhV055PNS92sOz1oP_GzaI-BPR3ubfoz0H_GCK1KszR7oqej6W_HhU_5hllHQlapaRsxh6cuJubD_8KF35zgpolXUvsUigdO-_g0q5jAaUEPk9XzI6yyDQij__JRGCVhE81XOKfCi078cMupbQj2EZp4k2hTHetQtaPlxn-uTYEHjavP0vAhirNOwZjod0NTbZvS0GnGmSmx3KwGwbgbpZYoB0SECWWBfZ-E5Lv-WGWBsOuVDcAh95ZSMLvy-7ROcEYCQflF8vFQd7jCuZ4npDo8mUWgBHfmtwZNiVUZQfpVRxRdci3_t7zNOtpjtmtl4CUnEF8wiz7r57VMy18plTVdp5-PGBTD63L_NWPPD0nGPEDF4m1JfBKCH8yuCX_&xkcb=SoAv-_M3c5BJ4dQu2h0KbzkdCdPP&p=2&fvj=0&vjs=3","On-site","Full-time","MSCM",0,0,0,0,0,0,0,0,0,0,0,0,0,0,0,0,0,0,0,0,"4f5452727b73a54bf35c687609d04fbe"
"2","cloud engineer",2022-07-12,"Sr. Mechanical Engineer","Always With Detail","Taylorsville, UT 84123","My Client is looking for a Mechanical Engineer to join their well-established and growing MEP team!*The ideal candidate shall thrive in a smaller MEP firm, and have a minimum of 5-10 years of HVAC and Plumbing system design.*POSITION RESPONSIBILITIES*– Designs mechanical and plumbing systems and performs load calculations*– Supervises and manages small design team for multiple projects, including establishing criteria and standards, reports, and project drawings and specifications*– Collaborates with client, architect, other disciplines, and contractor to provide appropriate, cost-effective, and coordinated solutions*– Attends poject meetings for assigned projects and site visits*– Reviews equipment submittals*– Participates in business development efforts*REQUIREMENTS:*– BSME, required*– P.E. license in Mechanical Engineering preferred*– AutoCAD /Revit design experience*– Bluebeam / Masterworks experience*– Ability to read and interpret architectural, structural, and other discipline documents.*– Construction process and experience a plus*– Ability to prioritize and balance mulitple project workload*– Good communication / interpersonal skills dealing with clients and supervising staff*– Ability to do minimum travel to client sites****COMPENSATION is commensurate with experience. Excellent Medical Benefits. End of year bonus.****Job Type: Full-time*Pay: $75,000.00 - $100,000.00 per year*Benefits:*401(k)* Dental insurance* Health insurance* Paid time off* Vision insurance*Schedule:*Monday to Friday* Overtime*Supplemental Pay:*Bonus pay*Ability to commute/relocate:*Taylorsville, UT 84123: Reliably commute or planning to relocate before starting work (Required)*Application Question(s):*Do you have supervisory experience?*Experience:*HVAC design: 4 years (Required)* Plumbing design: 4 years (Required)*Willingness to travel:*25% (Required)*Work Location: One location","https://www.indeed.com/company/Always-With-Detail/jobs/Senior-Mechanical-Engineer-3404cba504228e72?fccid=ced9042ac36a98c7&vjs=3","On-site","Full-time","MSIS",0,0,0,0,0,0,1,0,0,0,0,0,0,0,0,0,0,0,0,0,"43d7bf6598e7b7a590bd688417644d4a"
"3","data architect",2022-07-12,"Senior Business Intelligence Developer/Architect","BAE Systems","Hill AFB, UT 84056","* Why BAE Systems? BAE Systems is the third largest defense contractor in the world with an exceptional, mission-focused culture. The 800+ BAE Systems employees and sub-contractors located at Hill Air Force Base, Utah are closely aligned to the United States Air Force Nuclear Weapons Center. We support the Center in sustaining the existing LGM-30 Minuteman III (MM III) weapon system and acquiring its replacement, Sentinel program formerly known as Ground-Based Strategic Deterrent. We are a uniquely-valued mission partner delivering daily technical excellence and innovative solutions to our government customers. BAE Systems has earned accolades as a “Top Workplace” in Utah based on employee feedback for three consecutive years, earning special distinction for providing a healthy work-life balance for our valued employees. We work very hard to ensure this is a great place to work! * Why Utah? You’ve got to see it to believe it! Utah is an amazing state with diverse geography, an eclectic culture and an exceptional quality of life. We are located north of Salt Lake City at the foot of the beautiful Wasatch Mountains. The area offers an incredible range of outdoors pursuits across the seasons including hiking, climbing, hunting, fishing, camping, boating and world-class skiing at resorts that hosted the 2002 Winter Olympics. The state is home to five amazing National Parks and an easy drive from two more; Grand Teton and, famously, the first National Park in the world, Yellowstone. The Salt Lake City area offers a vast array of cultural activities and businesses including multiple professional sports teams. It is a western states hub for exceptional, cutting-edge medical care with people traveling from across the region for a range of nationally renowned specialty care centers and doctors. The Salt Lake International Airport is expanding and offers easy, direct access to just about anywhere you want to fly.*  Why Sentinel? The Sentinel Program is an enormous and complex “Mega-Project” modernizing the entire ICBM weapon system deployed across tens of thousands of square miles in five states. Without any doubt, Sentinel is one of the DoD’s most important acquisition efforts for the next decade, if not longer. It includes a complete refurbishment of hundreds of aging Minuteman III ICBM facilities to secure and support a newly designed, technologically advanced ballistic missile. It will also provide an entirely new command and control system as well as vast array of required support equipment specifically engineered to operate and sustain the new weapon system over the decades ahead. Sentinel is the Department of Defense’s newest official “program of record,” having just achieved Milestone B. It enjoys broad, strong support at the national level. It is a long-term project - the weapon system will deploy over a nine-year period beginning in approximately 2026, and remain operational until at least 2075. Sentinel is a career-defining program that will present unique and challenging opportunities that simply are not available with smaller projects. The primary focus of this position is to build and maintain a data warehouse. The current data warehouse is a SQL Server database housed in an on-premises, air-gapped network, so experience with T-SQL, C# or Powershell is a plus. Our data warehouse is a bit different than most found in corporate America. Most data warehouses and business intelligence outfits collect sales data to provide feedback to marketing. Their metrics are all based around revenue and income. We are a military acquisition, so all of our success metrics are based around expenditure and schedule. The data warehouse we are building collects all of the data about the acquisition: how much have we spent on what parts of Sentinel. Eventually we would like to collect metadata about actual engineering products to compare against our financial data, to actually gauge whether money spent equals progress made. This is something no other DoD program has ever attempted, and involves creating new and interesting data structures to collect and process the information. Please apply to find out more!* Required Education, Experience, & Skills* * Bachelor’s degree or higher in software engineering, computer science, or information technologies. Other degrees will be considered provided that a candidate can demonstrate experience developing and maintaining a data warehouse.*   7-10+ years of experience (5+ with Master’s degree)*   Strong data modeling skills*   Experience architecting, building, and/or maintaining a data warehouse*   Ability to distill technical specifications from customer requirements*   Self-motivated and works well under minimal supervision*   SQL, C# or Powershell*   Communication skills (written or verbal), including the ability to help others understand tools, technologies, and processes used to solve a problem*   Active DoD Secret Security Clearance adjudicated within the last six (6) years and the ability to obtain and maintain any necessary Special Program Access. The criteria for obtaining Clearance and SAP is set by the US Government.* * Preferred Education, Experience, & Skills* * Experience working on an Agile team*   Cross-functional engineering experience, such as aerospace/computer science or physics/programming OR Cross-functional business experience, such as project management/computer science or sales and marketing/data science*   Superior organizational skills and an affinity for detail*   Willingness to recommend solutions to improve new and existing database systems* * About BAE Systems Intelligence & Security *  BAE Systems, Inc. is the U.S. subsidiary of BAE Systems plc, an international defense, aerospace and security company which delivers a full range of products and services for air, land and naval forces, as well as advanced electronics, security, information technology solutions and customer support services. Improving the future and protecting lives is an ambitious mission, but it’s what we do at BAE Systems. Working here means using your passion and ingenuity where it counts – defending national security with breakthrough technology, superior products, and intelligence solutions. As you develop the latest technology and defend national security, you will continually hone your skills on a team—making a big impact on a global scale. At BAE Systems, you’ll find a rewarding career that truly makes a difference. Intelligence & Security (I&S), based in McLean, Virginia, designs and delivers advanced defense, intelligence, and security solutions that support the important missions of our customers. Our pride and dedication shows in everything we do—from intelligence analysis, cyber operations and IT expertise to systems development, systems integration, and operations and maintenance services. Knowing that our work enables the U.S. military and government to recognize, manage and defeat threats inspires us to push ourselves and our technologies to new levels. At BAE Systems, we celebrate the array of skills, experiences, and perspectives our employees bring to the table. For us, differences are a source of strength. We’re laser-focused on high performance, and we work hard every day to nurture an inclusive culture where all employees can innovate and thrive. Here, you will not only build your career, but you will also enjoy work-life balance, uncover new experiences, and collaborate with passionate colleagues.*","https://www.indeed.com/rc/clk?jk=73c24799eafd7c42&fccid=bae098e9666bd225&vjs=3","On-site","Part-time","MSIS",1,0,1,0,0,0,1,0,0,0,0,0,0,1,0,0,0,0,0,0,"0ae1a6e3217cc34d111f9b4fb4df2a83"
"4","cloud engineer",2022-07-12,"Senior Full Stack Software Engineer","Bill Good Marketing","Draper, UT","Who you are:  You thrive in solving complicated issues related to software, user experience and want to work with a company that will make AI a large part of its core technology. You work hard, but also know how to have a good time. You’ve worked with computers and software for a while and understand the importance of clean, documented code. You’ve been a leader and are excited about building a team. You are very technical but also understand how to convert product ideas into working software.*Who we are: BGM has been helping financial advisors for more than 45 years. We are a consulting, marketing, and CRM company that is focused on assisting the best advisors and their teams overcome the complexities of client acquisition, retention, and building an efficient practice. Over the past few years, we have modernized our culture, mission, team, and software platform. We’ve helped thousands of financial advisors grow their businesses over the last 45 years, and we are working hard to help them for the next 40. Our flagship CRM, Gorilla 5, is built on the NexJ platform, an award-winning CRM used by tens of thousands of users across North America. We are their premier US technology partner and are driving the adoption of this enterprise-class application to our SMB clients. Our version of G5 is customized to implement our best practices, marketing content, and business process automation to grow their business faster. The software is extremely robust, and we need your help improving usability, connectivity with other applications and integrate further with the systems our clients use the most.*The Role: We are looking for a Senior Full Stack Software Engineer to enable us to increase velocity, and connectivity to other cloud based applications and help improve usability by building our own tools to work on top of the CRM. You will be the go-to person and the first hire for our internal software development team. You will hit the ground running, working directly with our CEO on initiatives.*What you need: *Software Engineering, Computer Science, or related technical degree with 5+ years of software development experience, including co-operative work terms* Good understanding of algorithms, design patterns, data modeling and API development* Familiarity with scripting languages such as JavaScript or Scheme* Strong familiarity with REST API design* Experience working on enterprise-class web-based applications* Strong object-oriented programming and design patterns experience* Familiarity with cloud technologies (AWS, IBM Cloud, etc.)* Familiarity with container-based architecture and deployment patterns (Docker, Kubernetes)* Knowledge or experience of the SDLC using Agile Scrum development* Knowledge of relational database technologies such as Microsoft SQL Server, PostgreSQL* Understanding of enterprise messaging technologies such as Apache Tomcat*Job Type: Full-time*Pay: $90,000.00 - $120,000.00 per year*Benefits:*401(k)* 401(k) matching* Dental insurance* Health insurance* Health savings account* Paid time off* Parental leave* Professional development assistance*Schedule:*8 hour shift*Ability to commute/relocate:*Draper, UT: Reliably commute or planning to relocate before starting work (Required)*Application Question(s):*Why do you think you would be a good fit for us?*Education:*High school or equivalent (Preferred)*Experience:*REST: 5 years (Preferred)* Java: 5 years (Preferred)* Software development: 5 years (Required)* UX: 3 years (Preferred)*Work Location: One location","https://www.indeed.com/pagead/clk?mo=r&ad=-6NYlbfkN0D6SZM5GhPkKCeeckqpGIWT1mJoR5_y8WzB4xspiLLXNsYDWP47hlOdNGgS9QlBvX1fgjUtaunsoLRckueW3ExgMRum1GxNEJxcjbmxVg9_I8M37G-2IwdPS-kuviIItCihM0rgUH05ajcMCmedauuhJAXdFv-aQFDO5LBLWOs60a2KI-tCIhycFdvLoXBz4AoGfnlYE8YEY5nYEYL7nja7KuGyVF3yj-9VpiPErzeMdaLxIFE46jdtgRqfOVGHhpwiAElwJwwr1T_wPQvwwMoiIgbDRm3n1gCIOlhVijzbhbDEQ518SKnJBs2NxygysiZ6APjoaD5AYsQGMo_TChmbX8m57sDtDd7VnOZGKaLA4-Mk-aC3PCIkdtiDjeFcFvoz8MXFM5nDxi01GptrPDIuIawuzUT_oJL4MPuE7i-9Q3drzv-7R9WudvrohKmSzobkSIZC5G9HQacZecuUrjCUp3-TM6cpMLMNuRE61gx5QMIUzUC5Tao5ncovpal8R32bsGT1jZhRg0NN2QOWMjXt&xkcb=SoB6-_M3c5BfefA0PL0IbzkdCdPP&p=2&fvj=1&vjs=3","On-site","Full-time","MSIS",0,0,1,0,0,0,0,0,0,0,0,0,0,0,0,0,0,0,0,0,"62572dfd5f20f9d6b8ad796524796d11"
"5","data integration engineer",2022-07-12,"Systems Engineer IV/V","BioFire Diagnostics, LLC","Salt Lake City, UT 84108 (East Bench area)","* Description * Position Summary:*  This engineer works within a project team – generally in collaboration with a Project Manager. This engineer uses experience and education to perform the types of engineering activities which are generally considered within the realm of systems engineering, integrating electrical, mechanical, and firmware designs, and any other expertise that might be held by this particular individual. This engineer is expected to work and communicate well with other team members and leads to ensure instrument product development activities of the company are accomplished in accordance with bioMérieux’s quality system.* *  Responsibilities:*  General: uses experience and education to perform the types of engineering activities which are generally considered within the realm of systems engineering.*   Description: Uses engineering concepts, company SOPs/WIDs, department SOPs/WIDs to solve a variety of complex engineering problems across functional groups and disciplines.*  Works on: projects of moderate to significant scope and complexity. Generally works with a team of engineers.*   Influence: works in collaboration with a Project Manager, provides technical leadership on a project, and provides oversight and guidance to project engineers.*   System Engineering:*   Acts as the technical lead on projects under the direction of the department director and Project Manager. Interfaces with engineers, designers, technicians, and specialists of multiple disciplines to ensure that system level design objectives are met and conform to requirements.*    Works with engineers to resolve technical issues associated with design and implementation of the system.*    Determines the overall technical direction and architecture for the project with management to ensure solution meets corporate / strategic vision for the project.*    Writes the Engineering Risk Analysis, product (and/or process) requirements, product (and/or process) verification, high-level block diagram, and the verification plan with the Project Manager and in collaboration with other project leads.*    Attends project technical reviews. Reviews project documents for technical content.*    Attends risk analysis meetings, reviews FMEAs, and ensures risk mitigation and translation into specifications.*    Evaluate subsystems and subassemblies against system requirements. Ensures proper subsystem and subassembly interfaces.*    Ensures compliance to standards and regulations (e.g. UL, CE, FDA, ISO).*    Responsible for the technical aspects of the Design History File and the Device Master Record.*    May write the product (and/or process) level Design Change Notice and associated summary and Change Order supporting Instrument release.*    Supports the creation of the project Work Breakdown Structure in collaboration with the Project Manager. Assists the Project Manager with stakeholder identification.*   Compliance: Perform all work in compliance with company policy and ensures all project documents comply with company policy and within the guidelines of BioFire Diagnostics Quality System.* *  Principal Decisions:*  Lead projects technically by consulting with engineering leads and making data-based decisions. Assists in making final project decisions, subject to review by the Project Manager and Engineering Management. May make design and technical decisions subject to review by the department Director, Project Manager, Manager, Principal, and other engineers.*  Implements mitigation to evaluated design and process risks and provides translation into design and process specifications. Reviews all technical aspects of the project and makes determinations regarding system risks.* *  Supplemental Data:*  Travel: minimal travel required.*  Team: usually works on a team with several engineers and a Project Manager.* *  Qualifications:*  Training and Education:*  B.S. in Engineering or Equivalent*  Experience: 10+ years of experience in related field, including performance consistent with said experience for a level IV. 15+ years of experience in related field, including performance consistent with said experience for a level V.* *  Skills and Qualifications:*  Risk Analysis (e.g., FMEA)*   Electromechanical Systems Integration*   Software Systems Integration*   Requirements creation and management*   Data Analytics (e.g. Six Sigma)*   Test-Driven Development*   Electrical Design (e.g, Schematic Capture, PCB Layout, Analog Circuit Design, Digital Circuit Design, Control Systems)*   Mechanical Design (e.g. Solidworks, Plastics design, Optics design, sheet metal design, molding processes, materials, pneumatics, machining esp. CNC, GD&T*   Resource Allocation and Project Scheduling*   Compliancy (CE, UL, FCC, RoHS)* *  Physical Requirements:*  Able to safely lift 50 pounds.*","https://www.indeed.com/rc/clk?jk=f18e778f42b80b4c&fccid=976d3ed0652d3499&vjs=3","On-site","Part-time","MSIS",0,0,0,0,0,0,0,0,0,0,0,0,0,0,0,0,0,0,0,0,"33fbb98eef08581a6c62ef051ae2be24"
