"","Search","Date","Title","Company","Location","Description","Link","Work Model","Job_Type","Program","R","Python","SQL","Tableau","PowerBI","Azure","Excel","Talend","SAS","Spark","Qualtrics","Domo","Salesforce","SAP","Hadoop","Qlik","Looker","Zoho","Stata","Snowflake","ID"
"28","security systems engineer",2022-09-02,"Sentinel (GBSD) Principal Systems Security Engineer (3222-1)","Northrop Grumman","Roy, UT 84067","* Requisition ID: R10063494 * Category: Information Technology *  Location: Roy, Utah, United States of America *  Citizenship Required: United States Citizenship *  Clearance Type: Secret *  Telecommute: No- Teleworking not available for this position *  Shift: 1st Shift (United States of America) *  Travel Required: Yes, 10% of the Time *  Positions Available: 1* *  At Northrop Grumman, our employees have incredible opportunities to work on revolutionary systems that impact people's lives around the world today, and for generations to come. Our pioneering and inventive spirit has enabled us to be at the forefront of many technological advancements in our nation's history - from the first flight across the Atlantic Ocean, to stealth bombers, to landing on the moon. We look for people who have bold new ideas, courage and a pioneering spirit to join forces to invent the future, and have fun along the way. Our culture thrives on intellectual curiosity, cognitive diversity and bringing your whole self to work — and we have an insatiable drive to do what others think is impossible. Our employees are not only part of history, they're making history.*   Embark on a career putting innovative, reliable, and agile products and ideas into orbit, and beyond. Northrop Grumman has opportunities waiting for you that play a vital role in human space exploration, national defense, and scientific discovery, supporting multiple programs across the universe. With us, you’ll discover a culture of curiosity and collaboration that will have you Defining Possible from the day you start. Our space systems connect and protect millions of people on earth every day, now and for the future. Explore your future and launch your career today.*  *   Northrop Grumman Space Systems is seeking a Principal Systems Security Engineer. This position will be located in Roy, UT and will support the Ground Based Strategic Deterrent (GBSD) program. This role may offer a competitive relocation assistance package.*  *   What you’ll get to do:*  *   The Mission Defense Team (MDT) is seeking a highly motivated and qualified system engineer to serve as a Systems Security Engineer, Level 3. You will be responsible for assessing and prioritizing a broad spectrum of security threats. Key activities will involve intelligence fusion, vendor research, trusted foundry, program protection, anti-counterfeit, and supply chain security.*  *   Additional Responsibilities include:*   Develop, implement, and flow down hardware assurance requirements, and monitor to ensure implementation of hardware assurance*    Assessment and analysis of threats, vulnerabilities, and risk for identified mission-critical functions and critical components*    Risk identification after protection measures are implemented, including follow-up mitigation plans and actions as well as assessments of residual risk*    Participate in a variety of working groups and customer meetings; ensure communication of risk environment with stakeholders*    Execute completion Statement of Work requirements, Program Milestone Exit Criteria, and program maturity commitments*    Self-starters compelled to take action in the workplace without requiring prompting from supervisors*    Support MDT with other duties as assigned*    In addition to technical skills, you will be a self-starter with strong time management skills. Your organizational skills and ability to anticipate future challenges will serve you well.*  *   As a full-time employee of Northrop Grumman Space Systems, you are eligible for our robust benefits package including:*   Medical, Dental & Vision coverage*    401k*    Educational Assistance*    Life Insurance*    Employee Assistance Programs & Work/Life Solutions*    Paid Time Off*    Health & Wellness Resources*    Employee Discounts*  *   This position’s standard work schedule is a 9/80A. The 9/80 schedule allows employees who work a nine-hour day Monday through Thursday to take every other Friday off.*  *   You’ll bring these qualifications:*   Bachelor's degree in a STEM (Science, Technology, Engineering or Mathematics)*    A minimum 5 years of related experience with a Bachelor’s degree; 3 years with a Master’s; or 0 years with PhD. (Sr. Principal level requires 9 years with a Bachelor’s degree; 7 years with a Master’s degree; or 4 years with a PhD)*    U.S. Citizenship with an active DoD Secret Clearance with an investigation date within the last 6 years*    Ability to obtain Special Access Program Clearance*    Ability to obtain Top-Secret clearance within reasonable time*    Minimum 2 years of applying and understanding Systems Security Engineering principles applicable to US Government Defense Programs*    Ability to communicate effectively and clearly present technical approaches and findings*    Minimum 2 years of applying and understanding security best practices in addressing program protection risks*    Ability to show self as team player, able to multi-task, able to generate quality work products independently, able to make excellent judgement and show interpersonal skills*  *   These qualifications would be nice to have: *  Experience developing Systems Security Engineering requirements for hardware and software assurance*    Experience with Model-based Systems Engineering (MBSE) concepts and tools*    A solid understanding of Systems Security applicable to US Government Defense Programs and applied knowledge in the application of SSE principles across a broad spectrum of security measures (Cybersecurity, Counterfeit Awareness, Anti-Tamper, HW/SW Assurance, OPSEC, etc.) to protect critical program information (CPI)*    Evaluating program processes and compliance strategies for large, complex multi-site programs*  *   #GBSDsystems*  * *  Salary Range: $96,400 USD - $144,600 USD* * *  Employees may be eligible for a discretionary bonus in addition to base pay. Annual bonuses are designed to reward individual contributions as well as allow employees to share in company results. Employees in Vice President or Director positions may be eligible for Long Term Incentives. In addition, Northrop Grumman provides a variety of benefits including health insurance coverage, life and disability insurance, savings plan, Company paid holidays and paid time off (PTO) for vacation and/or personal business.*  * *  The health and safety of our employees and their families is a top priority. The company encourages employees to remain up-to-date on their COVID-19 vaccinations. U.S. Northrop Grumman employees may be required, in the future, to be vaccinated or have an approved disability/medical or religious accommodation, pursuant to future court decisions and/or government action on the currently stayed federal contractor vaccine mandate under Executive Order 14042 https://www.saferfederalworkforce.gov/contractors/.*  *   Northrop Grumman is committed to hiring and retaining a diverse workforce. We are proud to be an Equal Opportunity/Affirmative Action Employer, making decisions without regard to race, color, religion, creed, sex, sexual orientation, gender identity, marital status, national origin, age, veteran status, disability, or any other protected class. For our complete EEO/AA and Pay Transparency statement, please visit http://www.northropgrumman.com/EEO. U.S. Citizenship is required for most positions.* **","https://www.indeed.com/pagead/clk?mo=r&ad=-6NYlbfkN0DPf8Tf_oakpB62WadId2dzQiWExtALTi0lpCM--zHBL1trAzPQuAwg5oNkOU_MLY2kluQOHEzGkYPA9XiK_4vu3Ns-AJ2BXUBvkKGzz-J723NRT89uGjSiFU_-Ni1p36cy8L9R0kXrFkl3z89xkJbc7cou8mb6NJTwi7-7N4nsr4m_Fis2P9X7wa0a4lmhLFOYHjcs9L6P63EMliMBv7h3Y7hD9OyllRYtyoa0skoMH6l0WfBY5J-GnefiK0GX8dkIfoGaqsxpIF1Z26TuqW4NqacF8Vtjg3o-VaM6b81JFhv2kFfvlPgOTQZGPoQFgFO4G5vlCLwqEaPXmzWxhRrFs5jC2Jg1dqTnr03Qhpl2nuteooUGDfhPyeN49UCN_bd8nqlX9WaocRi35CPJVlYw9UkJmbYyTpYWBRbM4t9edt8sFfHrU06MYeSzVOGeuzZEPqRqCGqyFNQw0CX_G9wAfcq5mWNKvGSAfLOvyVpxyEkbJOW-_J2Ocae-AwGEloK8zmtCK7MaDKhOUPfY65hoh-_bq3dQ8rtnJmhYc-fHdm3MQkOs0iTsMgqE6mhaSD9R-v9oxp5OENgDBMEF7KTe84BWhZnrjArj1qbM1xbVB9Are7b4QgvctVsahikoDQkalF9HAdVyEKdSv-mamBIcIRwSBTfB4lTKweCR4CIoEiXuT-s2X7UyWCWu7SZa3iXHCiD4puKDDzBd6BB98ttaSEiGeybt2SkuYDODSOGv4jxNIjjLjqOCMHcAOl0SKXmlHH7FeeYoSbma0kL6KzARB6xdNCbrGC8xzmzA0DsHUOTF65dfI7Bjtp7opUg_ggUBmclT5CgGaodJoGdSu_uXBYoN-62JEHn5UhMXNLbY5Yl47xbsEQwi53shIH9bI_x_eBUCEUtYSxzeNNuuqp_-YUDXlup3UUQP9OTriAujsf7G99o0URFMBxr-DsDNyBLmly6EsFR0uCWBlQ3XTdAC8evZ-_alCXz6NJtl7WdtS1X6xDEwnxAm6DYPQMyKad8b4rbbZp3H8bD6TBt0wVISeMsVL-Uj5R2PiMAV5PG_znEzt-1Jy3PzxWIN4hA-cn6LKUDEmUVndN-DLKx8DUL4tihxTNVoY5feoYZ_Pbke6PtGjnPlyTHQqkNOulpXBPzH9Em7moU4avqgKgJYMSjOEShGpNj6fHk=&xkcb=SoAT-_M3a_KU8VX-Fx0JbzkdCdPP&p=0&fvj=0&vjs=3","On-site","Full-time","MSCM",0,0,0,0,0,0,1,0,0,0,0,0,0,0,0,0,0,0,0,0,"ece1562f129946c3a6303987e97adf42"
"29","cloud engineer",2022-09-02,"Sentinel (GBSD) – Sr. Staff Electrical Engineer – 8695","Northrop Grumman","Roy, UT 84067","* Requisition ID: R10065782 * Category: Engineering *  Location: Roy, Utah, United States of America *  Citizenship Required: United States Citizenship *  Clearance Type: Secret *  Telecommute: No- Teleworking not available for this position *  Shift: 1st Shift (United States of America) *  Travel Required: Yes, 10% of the Time *  Positions Available: 1* *  At Northrop Grumman, our employees have incredible opportunities to work on revolutionary systems that impact people's lives around the world today, and for generations to come. Our pioneering and inventive spirit has enabled us to be at the forefront of many technological advancements in our nation's history - from the first flight across the Atlantic Ocean, to stealth bombers, to landing on the moon. We look for people who have bold new ideas, courage and a pioneering spirit to join forces to invent the future, and have fun along the way. Our culture thrives on intellectual curiosity, cognitive diversity and bringing your whole self to work — and we have an insatiable drive to do what others think is impossible. Our employees are not only part of history, they're making history.*   Embark on a career putting innovative, reliable, and agile products and ideas into orbit, and beyond. Northrop Grumman has opportunities waiting for you that play a vital role in human space exploration, national defense, and scientific discovery, supporting multiple programs across the universe. With us, you’ll discover a culture of curiosity and collaboration that will have you Defining Possible from the day you start. Our space systems connect and protect millions of people on earth every day, now and for the future. Explore your future and launch your career today.*  *   Northrop Grumman Space Systems is seeking a Senior Staff Electrical Engineer to join our team of highly qualified and diverse individuals. This candidate will join Northrop Grumman’s Space System team supporting the Air Force’s Sentinel (Ground Based Strategic Deterrent (GBSD)) program. This position will be located in Roy, UT. Candidate will serve as the Technical Advisor and Subject Matter Expert for the Guidance, Navigation and Control team.*  *   What you’ll get to do:*   Provide technical oversight and issue resolution for Guidance Computer hardware during development and test, including Spacewire performance, flight control driver performance, digital interfaces, and nuclear hardness*    Provide technical direction and support to the hardware, software, and systems engineering teams in the development and documentation of hardware/software interfaces, including memory, registers, protocols, timing, and interrupts*    Assist GC IPT Lead and GN&C Chief Engineer in risk identification and tracking, especially risks associated with GC and NIMS hardware*    Liaison to Nuclear Hardness and Survivability in support of design, requirements verification, and test at parts, CCA, unit, and element levels*    Liaison to GN&C and AVE I&T for issues related to GC and integrated GC/SW performance*    Work with GCUTS development team on requirements, design, and production, including spiral updates and follow-on versions for sustainment support*    Work with GCNCTS development team on requirements, design, and production, including spiral updates and follow-on versions for sustainment support*    Provide other support to the GN&C Chief Engineer as needed*  *   As a full-time employee of Northrop Grumman Space Systems, you are eligible for our robust benefits package including:*   Medical, Dental & Vision coverage*    401k*    Educational Assistance*    Life Insurance*    Employee Assistance Programs & Work/Life Solutions*    Paid Time Off*    Health & Wellness Resources*    Employee Discounts*  *   This position’s standard work schedule is a 9/80. The 9/80 schedule allows employees who work a nine-hour day Monday through Thursday to take every other Friday off.*  *   This position may offer a competitive relocation plan.*  *   You’ll bring these qualifications:*  Bachelor's Degree (STEM Degree) with 14 years of engineering experience; 12 years with Masters; 10 Years with PhD.*   An active DoD Secret or Top-Secret Clearance*   Experience developing and managing technical requirements for military/aerospace subcontractors*   Strong CAD skills with experience developing wire diagrams or electrical schematics*   Experience designing, analyzing, and developing a power budget for an electrical power system of a military / aerospace system*   Experience developing multi discipline system architecture for a military / aerospace system*  *   These qualifications would be nice to have: *  20+ years of engineering experience on military / aerospace programs*   Experience as a technical team lead*   Experience working on an Agile team and/or as a Scrum Master or Product Owner*   Excellent communication skills.*  * *  Salary Range: $194,700 USD - $224,500 USD* * *  Employees may be eligible for a discretionary bonus in addition to base pay. Annual bonuses are designed to reward individual contributions as well as allow employees to share in company results. Employees in Vice President or Director positions may be eligible for Long Term Incentives. In addition, Northrop Grumman provides a variety of benefits including health insurance coverage, life and disability insurance, savings plan, Company paid holidays and paid time off (PTO) for vacation and/or personal business.*  * *  The health and safety of our employees and their families is a top priority. The company encourages employees to remain up-to-date on their COVID-19 vaccinations. U.S. Northrop Grumman employees may be required, in the future, to be vaccinated or have an approved disability/medical or religious accommodation, pursuant to future court decisions and/or government action on the currently stayed federal contractor vaccine mandate under Executive Order 14042 https://www.saferfederalworkforce.gov/contractors/.*  *   Northrop Grumman is committed to hiring and retaining a diverse workforce. We are proud to be an Equal Opportunity/Affirmative Action Employer, making decisions without regard to race, color, religion, creed, sex, sexual orientation, gender identity, marital status, national origin, age, veteran status, disability, or any other protected class. For our complete EEO/AA and Pay Transparency statement, please visit http://www.northropgrumman.com/EEO. U.S. Citizenship is required for most positions.* **","https://www.indeed.com/pagead/clk?mo=r&ad=-6NYlbfkN0DPf8Tf_oakpB62WadId2dzQiWExtALTi0lpCM--zHBL1trAzPQuAwg5oNkOU_MLY0tVX4SdfxOzHAA49VhnY7AylCeY2LZwyaUQFwOMhWfxAI_li8rrR7zQ2tzYb0Dagrz9DrEVlhdW9Y05E15CJifzIJAfGRZnI7n_zW4xtnGKqaMJo34fmbvPSGzLPTtFuI4O5iVTT4MMWZUXXlMA_tfbxgbDFfgSKnBpl7HAC3jstnhA8yNq50Q0ii4Nc0y5D6pQRNGTg2oqBtMeGMMaA4b_twSFxycykfRlLpj0J44u6EEsMgYdNPs4otxdGedwdU8kHNjW17sOZXLhHVW93gsneiDd3tGdMUdo35D8aUbkiqALyquit0EUdZN8XKGAuH3WWOxR-VbZJnCPVAVqnZ_31_Gtl48JoR61RnnX-wwIyXQxwPfO0bdC_j1dcN0m_yKDO9byMBmT48BLdCbGmqDQeKWBQ4bbSwKJQTps9slmUGbwS9xfUhWwBnSOowiM5mi_kg378fohEdmTYaIJLVEP3egplriIs2f6lCVrv_GSWDNfLDwxZl4EZbmGiC5vkTJTuZj5z88KFNYw6P7AsEeDorGQoPSwxWZ6EbJa9GwEYRJkUf-jWaAWGKN1SHnfgHk-7wcguCjkYmDdy7Jq7FKVGLgTic-5t2kcml5lZO7q9_K9Lu39mLiWOUHzmrb0usxcxnphBuWl1Nuh2IOXS0oPgd4TqqopZkkBUKrtDsPCszYl7JttLXbdZ0EswQUuTzIoBteg4j0bxnJB8zYmZ6ogF6xLDZ3FnTKZXu9y2f7hAwCXm2CQqViAVSRZEYIL3Ytd75gAQPk8cqvDJEoU3hy3-DEs1R4a1zLLRSCpnYRyzle52gXA6RfRJhpSts7cNAfGM9t71_xdxYHn0AGoryRySwk7z0wJPm2hSu6LxloLdocYGaeP-51JVme7W8EGeyuVZCI9s8ZT4aKMTeJj54XEs8JdL5b5EwFvggTCzn-HY7EIPjhmU0Dw6faZlHa-A4Ap9gOzRjQSEVJil3-ag0xs7FYCnfd0Gy-p_HJFZztxto8ZtCvDfRcLz5SwTbpU4ueK7rMmSxDlKOfNjalaCmvyzt6XIU2ZiLJ-hK7cAYQgw==&xkcb=SoA2-_M3a_Kli-3I2B0PbzkdCdPP&p=3&fvj=0&vjs=3","On-site","Full-time","MSIS",0,0,0,0,0,0,1,0,0,0,0,0,0,0,0,0,0,0,0,0,"0d7d3c2a1513d7e069dcc44e3d80ef0a"
"30","cloud engineer",2022-09-02,"Sentinel (GBSD) Principal/ Sr. Principal Material Process En...","Northrop Grumman","Roy, UT 84067","* Requisition ID: R10065277 * Category: Engineering *  Location: Roy, Utah, United States of America *  Citizenship Required: United States Citizenship *  Clearance Type: Secret *  Telecommute: No- Teleworking not available for this position *  Shift: 1st Shift (United States of America) *  Travel Required: Yes, 25% of the Time *  Positions Available: 1* *  At Northrop Grumman, our employees have incredible opportunities to work on revolutionary systems that impact people's lives around the world today, and for generations to come. Our pioneering and inventive spirit has enabled us to be at the forefront of many technological advancements in our nation's history - from the first flight across the Atlantic Ocean, to stealth bombers, to landing on the moon. We look for people who have bold new ideas, courage and a pioneering spirit to join forces to invent the future, and have fun along the way. Our culture thrives on intellectual curiosity, cognitive diversity and bringing your whole self to work — and we have an insatiable drive to do what others think is impossible. Our employees are not only part of history, they're making history.*   Embark on a career putting innovative, reliable, and agile products and ideas into orbit, and beyond. Northrop Grumman has opportunities waiting for you that play a vital role in human space exploration, national defense, and scientific discovery, supporting multiple programs across the universe. With us, you’ll discover a culture of curiosity and collaboration that will have you Defining Possible from the day you start. Our space systems connect and protect millions of people on earth every day, now and for the future. Explore your future and launch your career today.*  *   Northrop Grumman Space Systems is seeking a Principal/Senior Principal Material Process Engineer. This position will be located in Roy, Utah and will support the Sentinel (GBSD) program. This role may offer a competitive relocation assistance package. This requisition may be filled at a higher grade based on qualifications listed below.*  *   What you’ll get to do:*   Candidate will be responsible to perform point of contact (POC) duties on behalf of Parts, Materials, and Processes engineering department (PM&P) during the design of weapon systems and equipment under an overarching Systems Engineering framework.*   Candidate will demonstrate ability to communicate effectively across engineering disciplines and design teams. Must be able to work both independently and collaboratively to resolve issues, determine priorities, and implement solutions. Candidate experience with military standards and specifications is preferred.*   Candidate will demonstrate general knowledge of Systems Engineering, multi-generational program system and/or multi-generational program subsystem development, and familiarity with supplier management.*   Applicant is expected to work independently to provide innovative technical solutions to a wide range of difficult problems.*  *   Candidate will be self-motivated, work under general direction, and work well in teams.*  *   As a full-time employee of Northrop Grumman Space Systems, you are eligible for our robust benefits package including:*   Medical, Dental & Vision coverage*    401k*    Educational Assistance*    Life Insurance*    Employee Assistance Programs & Work/Life Solutions*    Paid Time Off*    Health & Wellness Resources*    Employee Discounts*  *   This position’s standard work schedule is a 9/80A. The 9/80 schedule allows employees who work a nine-hour day Monday through Thursday to take every other Friday off.*   This requisition may be filled at either a Principal level or level Sr. Principal level.*   You’ll bring these qualifications:*   Bachelor’s Degree in Electrical Engineering or similar STEM (Science, Technology, Engineering or Mathematics) degree*    A minimum 5 years of related experience with a Bachelor’s degree; 3 years with a Master’s; or 0 years with PhD. (Sr. Principal level requires 9 years with a Bachelor’s degree; 7 years with a Master’s degree; or 4 years with a PhD)*    Active DoD Secret clearance with investigation within the last 5.5 years or in Continues Evaluation/Deferred*    U.S. Citizenship with ability to obtain and maintain Special Program Access*    Experience in leading teams to ensure that PM&P program or contract requirements are applied to EEE parts and assemblies*    Must be proficient in Microsoft Office tools*    Familiar with military standards and specifications*  *   These qualifications would be nice to have: *  An Active, In-Scope DOD Secret Security Clearance or higher that has been granted / renewed within the past 6 years*    Special Program Access*    Working knowledge of SharePoint, JIRA, Confluence, Microsoft teams, siemens teamCenter or other life cycle management system*    Design experience of PWB’s, CCA’s, cables, wire harnesses*    Experience reviewing technical drawings and engineering data for EEE parts and assemblies*    Understanding of supply chain management as it relates to EEE parts management and obtaining technical specifications on components*    Excellent 2-way communication skills (upward and downward)*    Excellent communication, interpersonal skills, and the ability to interface with all levels of employees and management*  * *  Salary Range: $79,700 USD - $119,500 USD*  * *  Salary Range 2: $98,700 USD - $140,100 USD* * *  Employees may be eligible for a discretionary bonus in addition to base pay. Annual bonuses are designed to reward individual contributions as well as allow employees to share in company results. Employees in Vice President or Director positions may be eligible for Long Term Incentives. In addition, Northrop Grumman provides a variety of benefits including health insurance coverage, life and disability insurance, savings plan, Company paid holidays and paid time off (PTO) for vacation and/or personal business.*  * *  The health and safety of our employees and their families is a top priority. The company encourages employees to remain up-to-date on their COVID-19 vaccinations. U.S. Northrop Grumman employees may be required, in the future, to be vaccinated or have an approved disability/medical or religious accommodation, pursuant to future court decisions and/or government action on the currently stayed federal contractor vaccine mandate under Executive Order 14042 https://www.saferfederalworkforce.gov/contractors/.*  *   Northrop Grumman is committed to hiring and retaining a diverse workforce. We are proud to be an Equal Opportunity/Affirmative Action Employer, making decisions without regard to race, color, religion, creed, sex, sexual orientation, gender identity, marital status, national origin, age, veteran status, disability, or any other protected class. For our complete EEO/AA and Pay Transparency statement, please visit http://www.northropgrumman.com/EEO. U.S. Citizenship is required for most positions.* **","https://www.indeed.com/pagead/clk?mo=r&ad=-6NYlbfkN0DPf8Tf_oakpB62WadId2dzQiWExtALTi0lpCM--zHBL1trAzPQuAwg5oNkOU_MLY0NZfwo1nKyhxbC0XSzbH7MB-YiBAdKRtgQqn2dYZvFM07o0vvT-x-y04eYt7ADhU-uQ6PGbcpaj6-_a2Xu0E-UjYRdeYA68ZKCraSxYTQEAhLlxwNh38kJY2CJLEq5gHWHaDDDgwV6Q9WMdhpFruaoJSC7wtQBAflGQlQJKPyaSAhs5iFH4prjY5QbatnUUWrLt76U4Tljr8cbIA9ZXIE6PKNhf-VbXZtjErcuYFPmdU8XGIXclduF_eANBwbo9mSuJYmsSw-1FJi-ocGpNODEdzpw7bDHhO86_GQ2JdD_v2whovKJnX-cVpfZpPCDFKQ_NNOvQsCtymVBhi6r96fLSOkvXMZfTOCrXaN9Fi-mT1iiRlfGFFE3MPg9ScoHlVTNezjnWUVb4UJsiOC0mB5HP3fZk6SpopiKwH_1X6BLdW8f2NJOf5u_35dDKbLubZKlFqEoIkFWRQbz04CgvY0X2lXePWfL-5iMJKCxghja7Mmaz5Fi9nQoECviyy0m0xm3jxMAYrnHFtbuBQQyOz_rU8FOGdaBHb8Vuoi8HyZav8RghknZF2vClshz7bFUe2VdRJHi3VRpIOUKidtD_p8WLghrKoHkA_rPpzmNbAmkLHOFjxP-uLC_8jJxjwzyYV28uKkHL1WUW9xXOE2MGBgGu9vM2Z33zPVLr6ys4a3OaodEoRTB3OiO0gtN_mZgaRhWSGYWPj8MCj1pHprsOahbDbvKFDf3LzIBvGGisPXwtr07Sn8VYb1qVeC1NOy9kTa3JHJA1HkbbtKq2n0-JNWLSIAcLIRj6RPO8fJp5Igu9tTQ-D2Kf5Tz5RQ0VzCpsXT69zCSFS3cxDe3cXpRGHQcvjqQeXfsWkBv3DMTlGSyiIDcKam13sxcPvb-HjqcxfHlIqDcoMKypur2_M2bRvs0RYOsGb7czxfmE3YsW3epA1DaFG1AwvqzJgub8eYX0y4mfpH4U2IlMzhwktc9Y5W1w0r6sN2Xj4pwwEXdvoJEFi0dSbX2Q0km46_3zfrKGrr11HxlEc3axawwH19rggwk5EGlUeFBcPZeSj15HVpNQCZySXDmAIZA5RBwzWryOHG5FogK1Fdp1hBpPsREiO9wj4kBphsc3jM=&xkcb=SoCT-_M3a_Kli5XI2B0LbzkdCdPP&p=5&fvj=0&vjs=3","On-site","Full-time","MSIS",0,0,0,0,0,0,1,0,0,0,0,0,0,0,0,0,0,0,0,0,"342f9207de3bdbf206d8e4453ba63a2a"
