"","Search","Date","Title","Company","Location","Description","Link","Work Model","Job_Type","Program","R","Python","SQL","Tableau","PowerBI","Azure","Excel","Talend","SAS","Spark","Qualtrics","Domo","Salesforce","SAP","Hadoop","Qlik","Looker","Zoho","Stata","Snowflake","ID"
"20","cloud engineer",2022-07-12,"Senior Software Engineer","Mountain America Credit Union","Sandy, UT 84070","* *  LOCATION*   Mountain America Center - Hybrid*   9800 S Monroe St Sandy, UT 84070*  *  Hybrid- At-Home and In-Office available*  *   SCHEDULE*   Full Time*  *   To be effective, an individual must be able to perform each job duty successfully.*   Responsibilities include full stack software development covering database design, services and API implementations, and front-end UI development for an engaging user experience.*    Follows best practices and credit union coding standards, using design patterns and secure software guidelines.*    Regularly participates in collaborative coding sessions and code reviews.*    Creates unit tests with appropriate code coverage, and assists quality engineers in developing automated integration tests and UI tests.*    Collaborates effectively in a Scrum team, with the desire to perform a variety of tasks as needed to fully complete stories in accordance with the accepted definition of done.*    Identifies and contributes to process improvements and automation opportunities.*    Meets the needs of the end user in a quality, consistent, and professional manner, using independent judgment where appropriate.*    Researches and recommends new software products as it relates to new or improved technical services.*    Communicates effectively and professionally to both team members and credit union employees in other departments.*    Contributes to general and technical documentation of systems to support understanding and communication of software products across the organization.*    Assists in the architecture and design of full stack solutions for complex business problems, and breaks down projects and features into manageable tasks.*    Commits to continuously learn and improve, in both technical expertise and soft skills.*    Keeps current with emerging technologies and development techniques.*    Assists in mentoring less experienced software engineers.*    Assists in diagnosing and resolving production issues.*  *   KNOWLEDGE, SKILLS, and ABILITIES*   The requirements listed are representative of the knowledge, skills, and/or abilities required. Reasonable accommodations may be made to enable individuals with disabilities to perform the essential job functions.*  *   Experience *  Minimum 3 years of software development experience.*    Experience with mainstream object oriented languages such as C# or Java.*    Familiarity with .NET Core.*    JavaScript/TypeScript/HTML/CSS.*    Experience with front end frameworks such as React or Angular.*    Experience with web application optimization tools such as WebPack.*    Familiarity with creating and consuming web services, including both REST and SOAP.*    Source control experience, preferably with Git.*    Database access experience utilizing EF Core, Dapper or similar ORM libraries.*    Experience with Microsoft SQL Server, including stored procedures and query optimization.*    Experience with Scrum and associated tools such as Azure DevOps or Jira.*    Familiarity with core credit union/banking systems such as Symitar is preferred.*  *   Education*   Bachelor’s degree from an accredited institution in computer science, information systems, or related field. Education will be verified. OR four years combined education and experience in computer science.*  *   Licenses, Certifications, Registrations*   N/A*  *   Managerial Responsibility*   Has no supervisory/managerial responsibility.*  *   Computer/Office Equipment Skills *  Experience with Excel, Word, and PowerPoint are helpful, along with diagramming software such as Visio or Lucidcharts.*  *   Language Skills*   Demonstrated ability to clearly express ideas, methodology, results and recommendations verbally, in writing and through insightful reports and graphic illustrations*    Demonstrated ability to document outcomes and present information in a manner appropriate for key stakeholders and all levels of the organization.*  *   Other Skills and Abilities *  Ability to work both autonomously and collaboratively in a fast-paced environment.*    Self-starter with strong organizing and time management skills.*    Adaptive to change, responds positively to altered circumstances or conditions.*    Possess a desire and willingness to learn and continually update knowledge base on financial concepts, strategies, systems etc.*    Take initiative to be a problem solver and provide suggestions to improve processes and efficiencies.*    Excellent interpersonal skills including the ability to collaborate with other teams as needed.*    Data analytics and data validation skills.*  *   PHYSICAL ABILITIES / WORKING CONDITIONS *  *  Physical Demands*   Ability to sit, talk and hear consistently*   Ability to stand, walk, and use hands to handle or reach occasionally*  *   Vision Requirements*   Close vision (clear vision at 20 inches or less)*   Distance vision (clear vision at 20 feet or more)*  *   Weight Lifted or Force Exerted*   Ability to lift up to 10 pounds occasionally*  *   Environmental*   There are no unusual environmental factors (such as a typical office)*  *   Noise Environment*   Moderate noise (business office with computers and printers, light traffic)*  *   #LI-FB1* *","https://www.indeed.com/rc/clk?jk=aa59836e22e32c25&fccid=1adb53bf8f7ee77d&vjs=3","Hybrid","Part-time","MSIS",1,0,1,0,0,1,1,0,0,0,0,0,0,0,0,0,0,0,0,0,"de1f909bf9efc35adc9d26de306a45ce"
"21","data integration engineer",2022-07-12,"Sentinel (GBSD) Systems Engineer/ Principal Systems Engineer...","Northrop Grumman","Roy, UT 84067","* Requisition ID: R10054447 * Category: Engineering *  Location: Roy, Utah, United States of America *  Citizenship Required: United States Citizenship *  Clearance Type: Secret *  Telecommute: No- Teleworking not available for this position *  Shift: 1st Shift (United States of America) *  Travel Required: Yes, 10% of the Time *  Positions Available: 2* *  At Northrop Grumman, our employees have incredible opportunities to work on revolutionary systems that impact people's lives around the world today, and for generations to come. Our pioneering and inventive spirit has enabled us to be at the forefront of many technological advancements in our nation's history - from the first flight across the Atlantic Ocean, to stealth bombers, to landing on the moon. We look for people who have bold new ideas, courage and a pioneering spirit to join forces to invent the future, and have fun along the way. Our culture thrives on intellectual curiosity, cognitive diversity and bringing your whole self to work — and we have an insatiable drive to do what others think is impossible. Our employees are not only part of history, they're making history.*   Embark on a career putting innovative, reliable, and agile products and ideas into orbit, and beyond. Northrop Grumman has opportunities waiting for you that play a vital role in human space exploration, national defense, and scientific discovery, supporting multiple programs across the universe. With us, you’ll discover a culture of curiosity and collaboration that will have you Defining Possible from the day you start. Our space systems connect and protect millions of people on earth every day, now and for the future. Explore your future and launch your career today.*  *   Northrop Grumman Space Systems is seeking a Systems Engineer / Principal Systems Engineer. This position will be located in Roy, UT and will support the Ground Based Strategic Deterrent (GBSD) program. This role may offer a competitive relocation assistance package. This requisition may be filled at a higher grade based on qualifications listed below.*  *   What you’ll get to do:*   The selected candidate will be a key member of the Digital Engineering Environment (DEE) Agile Product Management team, the Product Systems Analyst: Performs technical planning, system integration, verification and validation, cost and risk, and supportability and effectiveness analyses for total systems. Analyses are performed at all levels of total system product to include: concept, design, fabrication, test, installation, operation, maintenance and disposal. Ensures the logical and systematic conversion of customer or product requirements into total systems solutions that acknowledge technical, schedule, and cost constraints. Performs functional analysis, timeline analysis, detail trade studies, requirements allocation and interface definition studies to translate customer requirements into hardware and software specifications.*  *   Responsibilities may include but not limited to:*   Supports DEE Product Owner (PO) and scrum master(s) on product definition and features in sufficient detail so that the DEE product development team can review, commit, and execute within a defined period of performance*    Captures and analyzes data and requirements on key areas of work on product backlog items during a program increment,*    Ensures that the DEE product development team understands the intent and requirements of features and user story definitions, and that the team is aligned on all acceptance criteria or the ‘definition of done’ per requirement, feature or user story*    Supports the DEE PO to perform verification and validation (or testing) tasks as sprints and program increments (PIs) are completed.*  *   Position Benefits:*   As a full-time employee of Northrop Grumman Space Systems, you are eligible for our robust benefits package including:*   Medical, Dental & Vision coverage*    401k*    Educational Assistance*    Life Insurance*    Employee Assistance Programs & Work/Life Solutions*    Paid Time Off*    Health & Wellness Resources*    Employee Discounts*  *   This position’s standard work schedule is a 9/80A. The 9/80 schedule allows employees who work a nine-hour day Monday through Thursday to take every other Friday off.*  *   Basic Qualifications:*   This requisition may be filled at either a Systems Engineer level or level Principal level.*   Bachelor's degree in a STEM (Science, Technology, Engineering or Mathematics)*    A minimum 2 years of related experience with a Bachelor’s degree; 0 years with a Master’s (Principal level requires 5 years with a Bachelor’s degree; 3 years with a Master’s degree; or 0 years with a PhD)*    U.S. Citizenship with the ability to obtain a DoD Secret Clearance within reasonable time, and to obtain DoD Top Secret and Special Access Program Clearance*    Technical experience with requirements analysis, systems development, integration, implementation, or operations of complex large-scale information systems and technologies; digital systems and digital engineering roadmaps*  *   Preferred Qualifications: *  Active DOD Top Secret security clearance*    Leadership, experience building or working in agile teams; excellent written and oral communications skills; emphasis on drawing, modeling and communicating systems engineering and digital engineering roadmaps and concepts (e.g., Digital Thread or Digital Twin)*    Ability to provide total system perspective including a technical understanding of relationships, dependencies and requirements of hardware and software components for a project, agile concepts like scrum, XP, SAFe*    Ability to independently prioritize, plan and execute work tasks in a rapidly changing environment*    Prior experience supporting various classified environments, and meeting government and security requirements or cybersecurity concepts including SAP, JSIG, JAFAN 6/3, STIG, RMF, ICD 705 and DFARS*    Exposure to Web development or Cloud architecture like AWS or Azure*    Knowledge of:*     MBSE (CAMEO)*      Siemens Teamcenter Unified*      Docker, Jenkins and/or Kubernetes*      Microsoft SharePoint*      IBM DOORS*      Atlassian JIRA or Confluence*      SW programming language like Python, Javascript or web programming language, Java, .NET language (e.g., C#, VB#, ASP.NET, etc.), Matlab*      Databases like: Oracle, SQL Server, Apache or Access""*    *  *   #GBSDsystems*  * *  Salary Range: $71,100 USD - $106,700 USD*  * *  Salary Range 2: $87,600 USD - $131,400 USD* * *  Employees may be eligible for a discretionary bonus in addition to base pay. Annual bonuses are designed to reward individual contributions as well as allow employees to share in company results. Employees in Vice President or Director positions may be eligible for Long Term Incentives. In addition, Northrop Grumman provides a variety of benefits including health insurance coverage, life and disability insurance, savings plan, Company paid holidays and paid time off (PTO) for vacation and/or personal business.*  * *  The health and safety of our employees and their families is a top priority. The company encourages employees to remain up-to-date on their COVID-19 vaccinations. U.S. Northrop Grumman employees may be required, in the future, to be vaccinated or have an approved disability/medical or religious accommodation, pursuant to future court decisions and/or government action on the currently stayed federal contractor vaccine mandate under Executive Order 14042 https://www.saferfederalworkforce.gov/contractors/.*  *   Northrop Grumman is committed to hiring and retaining a diverse workforce. We are proud to be an Equal Opportunity/Affirmative Action Employer, making decisions without regard to race, color, religion, creed, sex, sexual orientation, gender identity, marital status, national origin, age, veteran status, disability, or any other protected class. For our complete EEO/AA and Pay Transparency statement, please visit http://www.northropgrumman.com/EEO. U.S. Citizenship is required for most positions.* **","https://www.indeed.com/pagead/clk?mo=r&ad=-6NYlbfkN0DPf8Tf_oakpB62WadId2dzQiWExtALTi0lpCM--zHBL1trAzPQuAwg5oNkOU_MLY1tCuybbG3PbZjmWTNi_21XTiE7i4V9QhwIO6U5WO839DPSXtJzXMgej4WuxH5CCoEVyGrK2C2nAJ1EIvqPk8s3REuK6QpiHUmA6HKZ-qq1puFyt9_cg29MkuWdm0vE5dQYDO7-0OSX8b4UzI5sLsK39HDarAgDeuzpEQGOo9Qb4PbT-P-x0jh6YmbOzliEEZo6xfFQVwYlSNa2qiqScrB_LJGrYZlz3dQYD4xJbyAgOd5Am1Rux98cuc4-iMGnhB-CL4zZfZJYeT5eltLDXIFgBfq9Fj36QA2yVStuS_XWVEcJpPkvHY0DH1QQy6asYJzhsDTpQaF71NV3X-jaMPLA5-Ceas_nzgmmB8yuu__xTs_u9EeNCMY24zq8qdMA14lGg0xZlvM1xYqc9gcTtNwRMKxGe9P24ADjufGZc-4jXrDKK6ina70MbPXN3Ri-S1QVSoM_kT9yGUF3XlQW1YKp7H-X9vzbcNcn_pIK3OPqGdTKS30c3wqMr7Cq6stf5xxpTcLrzFj9G32TklC0G5AN5RQ0qtmNFibJsYm_9BCPBKQao4c_f2nTwioTRBnpreke4v14cwnIpnr4jsuO-Ec4ZGmRcgXO-jBNDlQFZr0oS1i8deTmRbpU3zmP-_OaWUJMorD30GkT-NuCMzox-eC6hRPVb3P4GLvDuUbyAcp6KtcPvI7NXXN1hoJNjRoPAr0ksscVQB1WU6pikfX4XS3Uh7J5faiANPEFzxP6v-HHBxGer_SsIN85hxmO-02_Ho4YL4BTJwKMnObSbR6_f7Z6Xepx-U3roKt8mToSpmB9Zadsj3lKOjhzw9tUGEOcX-B-EXQsN6JzsJhCMkogEz2So-7llODUIyCK9iYqk6V5fn4A99s5ebZGexP1edUZ71569C1ekvxmFcouFCQqHBRTQpxS01vCZ9C--WWv8r_ByPdPc-zfMimQzN55Cn_t6_nSSNU_2juZPUsaqCXStf2dhLZbFYMxrPmhmc50NMiFxuMi2bEGIFEcEGjkTgWAbMg38m7PxhvMpKMkbD5uUIVCCldnAUl5g5FdrM_yXKuscoLuyEjBruwXRedHiSBViXWjo8lqHvP6uOP7o6ujKAX6&xkcb=SoAZ-_M3c5BYUy2RzB0LbzkdCdPP&p=0&fvj=0&vjs=3","On-site","Full-time","MSIS",0,1,1,0,0,1,1,0,0,0,0,0,0,1,0,0,0,0,0,0,"52f0e8e5ab309717c9dbbd701c203948"
"22","data analyst",2022-07-12,"Sentinel (GBSD) Systems Engineer/ Principal Systems Engineer...","Northrop Grumman","Roy, UT 84067","* Requisition ID: R10054447 * Category: Engineering *  Location: Roy, Utah, United States of America *  Citizenship Required: United States Citizenship *  Clearance Type: Secret *  Telecommute: No- Teleworking not available for this position *  Shift: 1st Shift (United States of America) *  Travel Required: Yes, 10% of the Time *  Positions Available: 2* *  At Northrop Grumman, our employees have incredible opportunities to work on revolutionary systems that impact people's lives around the world today, and for generations to come. Our pioneering and inventive spirit has enabled us to be at the forefront of many technological advancements in our nation's history - from the first flight across the Atlantic Ocean, to stealth bombers, to landing on the moon. We look for people who have bold new ideas, courage and a pioneering spirit to join forces to invent the future, and have fun along the way. Our culture thrives on intellectual curiosity, cognitive diversity and bringing your whole self to work — and we have an insatiable drive to do what others think is impossible. Our employees are not only part of history, they're making history.*   Embark on a career putting innovative, reliable, and agile products and ideas into orbit, and beyond. Northrop Grumman has opportunities waiting for you that play a vital role in human space exploration, national defense, and scientific discovery, supporting multiple programs across the universe. With us, you’ll discover a culture of curiosity and collaboration that will have you Defining Possible from the day you start. Our space systems connect and protect millions of people on earth every day, now and for the future. Explore your future and launch your career today.*  *   Northrop Grumman Space Systems is seeking a Systems Engineer / Principal Systems Engineer. This position will be located in Roy, UT and will support the Ground Based Strategic Deterrent (GBSD) program. This role may offer a competitive relocation assistance package. This requisition may be filled at a higher grade based on qualifications listed below.*  *   What you’ll get to do:*   The selected candidate will be a key member of the Digital Engineering Environment (DEE) Agile Product Management team, the Product Systems Analyst: Performs technical planning, system integration, verification and validation, cost and risk, and supportability and effectiveness analyses for total systems. Analyses are performed at all levels of total system product to include: concept, design, fabrication, test, installation, operation, maintenance and disposal. Ensures the logical and systematic conversion of customer or product requirements into total systems solutions that acknowledge technical, schedule, and cost constraints. Performs functional analysis, timeline analysis, detail trade studies, requirements allocation and interface definition studies to translate customer requirements into hardware and software specifications.*  *   Responsibilities may include but not limited to:*   Supports DEE Product Owner (PO) and scrum master(s) on product definition and features in sufficient detail so that the DEE product development team can review, commit, and execute within a defined period of performance*    Captures and analyzes data and requirements on key areas of work on product backlog items during a program increment,*    Ensures that the DEE product development team understands the intent and requirements of features and user story definitions, and that the team is aligned on all acceptance criteria or the ‘definition of done’ per requirement, feature or user story*    Supports the DEE PO to perform verification and validation (or testing) tasks as sprints and program increments (PIs) are completed.*  *   Position Benefits:*   As a full-time employee of Northrop Grumman Space Systems, you are eligible for our robust benefits package including:*   Medical, Dental & Vision coverage*    401k*    Educational Assistance*    Life Insurance*    Employee Assistance Programs & Work/Life Solutions*    Paid Time Off*    Health & Wellness Resources*    Employee Discounts*  *   This position’s standard work schedule is a 9/80A. The 9/80 schedule allows employees who work a nine-hour day Monday through Thursday to take every other Friday off.*  *   Basic Qualifications:*   This requisition may be filled at either a Systems Engineer level or level Principal level.*   Bachelor's degree in a STEM (Science, Technology, Engineering or Mathematics)*    A minimum 2 years of related experience with a Bachelor’s degree; 0 years with a Master’s (Principal level requires 5 years with a Bachelor’s degree; 3 years with a Master’s degree; or 0 years with a PhD)*    U.S. Citizenship with the ability to obtain a DoD Secret Clearance within reasonable time, and to obtain DoD Top Secret and Special Access Program Clearance*    Technical experience with requirements analysis, systems development, integration, implementation, or operations of complex large-scale information systems and technologies; digital systems and digital engineering roadmaps*  *   Preferred Qualifications: *  Active DOD Top Secret security clearance*    Leadership, experience building or working in agile teams; excellent written and oral communications skills; emphasis on drawing, modeling and communicating systems engineering and digital engineering roadmaps and concepts (e.g., Digital Thread or Digital Twin)*    Ability to provide total system perspective including a technical understanding of relationships, dependencies and requirements of hardware and software components for a project, agile concepts like scrum, XP, SAFe*    Ability to independently prioritize, plan and execute work tasks in a rapidly changing environment*    Prior experience supporting various classified environments, and meeting government and security requirements or cybersecurity concepts including SAP, JSIG, JAFAN 6/3, STIG, RMF, ICD 705 and DFARS*    Exposure to Web development or Cloud architecture like AWS or Azure*    Knowledge of:*     MBSE (CAMEO)*      Siemens Teamcenter Unified*      Docker, Jenkins and/or Kubernetes*      Microsoft SharePoint*      IBM DOORS*      Atlassian JIRA or Confluence*      SW programming language like Python, Javascript or web programming language, Java, .NET language (e.g., C#, VB#, ASP.NET, etc.), Matlab*      Databases like: Oracle, SQL Server, Apache or Access""*    *  *   #GBSDsystems*  * *  Salary Range: $71,100 USD - $106,700 USD*  * *  Salary Range 2: $87,600 USD - $131,400 USD* * *  Employees may be eligible for a discretionary bonus in addition to base pay. Annual bonuses are designed to reward individual contributions as well as allow employees to share in company results. Employees in Vice President or Director positions may be eligible for Long Term Incentives. In addition, Northrop Grumman provides a variety of benefits including health insurance coverage, life and disability insurance, savings plan, Company paid holidays and paid time off (PTO) for vacation and/or personal business.*  * *  The health and safety of our employees and their families is a top priority. The company encourages employees to remain up-to-date on their COVID-19 vaccinations. U.S. Northrop Grumman employees may be required, in the future, to be vaccinated or have an approved disability/medical or religious accommodation, pursuant to future court decisions and/or government action on the currently stayed federal contractor vaccine mandate under Executive Order 14042 https://www.saferfederalworkforce.gov/contractors/.*  *   Northrop Grumman is committed to hiring and retaining a diverse workforce. We are proud to be an Equal Opportunity/Affirmative Action Employer, making decisions without regard to race, color, religion, creed, sex, sexual orientation, gender identity, marital status, national origin, age, veteran status, disability, or any other protected class. For our complete EEO/AA and Pay Transparency statement, please visit http://www.northropgrumman.com/EEO. U.S. Citizenship is required for most positions.* **","https://www.indeed.com/pagead/clk?mo=r&ad=-6NYlbfkN0DPf8Tf_oakpB62WadId2dzQiWExtALTi0lpCM--zHBL1trAzPQuAwg5oNkOU_MLY1tCuybbG3PbZjmWTNi_21XTiE7i4V9QhwIO6U5WO839DPSXtJzXMgej4WuxH5CCoEVyGrK2C2nAJ1EIvqPk8s3REuK6QpiHUmA6HKZ-qq1puFyt9_cg29MkuWdm0vE5dSUmYMsbXcZ7gD1j10ZD-clBIcR0MNc9WU2G1Jw0_5U4FrVukJJLirxHzV4zhr7afZ9sJo9Jw62-XCG3zO3JGD_kPdHl3DEY7Z68u6Rycwz3SoMAwWw73L6squ-yoCWLe-kycSjXR1lPI_F8S9wlEinSeXrhQIap0lfP-tUTHHK6W8WAZzagyPo0r7PWMyuEmQwzzIZC1fHGEb3SUl1jC7mtvBV7fUoTyKbqp6hmK0jJyc_r531rER1HxYVOg-dJ6UuGoSTOmXlvMRwPk6UM4_3LXkxXIobSv8q3LmVLhGDi9lhtsSqaF-RMPzlOv8Mu6Nr80G3xxmApAIhPm3S3JC630upXljlEmswcr0L-czByf_lGDMPKZ4vWChaMay9da4fZlzjMeiPbKQIF6n_1_MA7leTQnaDIKOmmXModCOtNtkQ9OYsidXqpwzg3a9n04FjtJ3J2fwA1Dnncd9SjxUu0TV6vqwxziWyz9la4_7AJpXy2m8vPv1cgC6Go97-4JG559KCvYb-2Ua09GsF98Cr2ff-MWygHf_BR78dy91QBIRCh_aQkPdz526jEUp6D1yPYT5igHKDfbh0cec43-vgGF5oL_xaoalf1-2Nsv2Smt-49Ca_NTxm-Z2mAOpfDaZeeyrYU3S3k9utjIZNFVCQNeUk7ugu9JqV-xR8KqKIcp3GbxtFdsZpiXTffLV1DuNuMqzgXuw_IeZrMEQzKqn0Z0Dv3_tOcPFJwkaxgzONTlNb44XL-fmTuLuV2rQNEH4_A3t1Uno_sSVitcH_MnxMy6QNWk8YqHyYFyD7jpSE07IrKUMMf0mm1xViT2naO41hFjcB0ajQYc-WwRD_moJzMaR0b_MgHS9X7pU8rTBQLg3WuYIELscEgF3xoA59UeQmi9EELFHw6GmMgmw14lpacMpQEhCqEEGkCn1lIZu8Xzc9B71nac5pun6g-XBPX_o=&xkcb=SoC--_M3c5BVekzAF50LbzkdCdPP&p=7&fvj=0&vjs=3","On-site","Full-time","MSBA",0,1,1,0,0,1,1,0,0,0,0,0,0,1,0,0,0,0,0,0,"3307241cdc85917afc3454c244b0bba4"
