"","Search","Date","Title","Company","Location","Description","Link","Work Model","Job_Type","Program","R","Python","SQL","Tableau","PowerBI","Azure","Excel","Talend","SAS","Spark","Qualtrics","Domo","Salesforce","SAP","Hadoop","Qlik","Looker","Zoho","Stata","Snowflake","ID"
"10","database administrator",2022-08-17,"Intermediate SQL Database Administrator","Dine Development Corporation","Ogden, UT","* Job Summary:: * *   DDC- IT Services is seeking an individual to fill the role of *  Intermediate SQL DBA. This person will work with a team of DBAs responsible for the day-to-day database management of our customers SQL Database infrastructure. This infrastructure is used to monitor and manage cyber resiliency and access of data across DISA’s domain. You will join an experienced DBA team that stays on the forefront of database administration developments. In this role, you can expect to interact on a daily basis with other departments like system integrators, network administrators and the operational team.*  Job Duties and Responsibilities: : *  Duties & Responsibilities…*  Provide support for SQL software and component technologies installation and configuration.*   Provide support for database instance creation and configuration using command line scripting, Graphical User Interface (GUI) tools and SQL statements.*   Provide support for database storage configuration and management by collaborating on database systems settings.*   Provide support for database network configuration and management through technical discussions with application administrators, storage administrators, database administrators, and network administrators.*   Provide support for database security configuration and management, including accounts, roles and privileges.*   Provide support for database file and SQL configuration, backup and restoration.*   Provide support for database archive log, redo log and redo segment configuration, management and troubleshooting.*   Provide support for performance tuning of database instances to meet internal DISA specifications.*  Job Requirements (Education/Skills/Experience):: * *   Required:* * Active DoD Secret Clearance*  IAT level II or higher (Security + CE or IASE equivalent) *  Five Years relevant experience with SQL Database Administration*  Understanding of and previous experience with ITIL Processes* *   Nice to Have:* * Microsoft SQL Certification*  Experience with ITSM Remedy IT Ticketing system*  Strong analytical and reporting skills*  Good communication skills*  Good documentation and process skills*","https://www.indeed.com/rc/clk?jk=14bdba5b87596088&fccid=4df31e7755888b93&vjs=3","On-site","Part-time","MSIS",0,0,1,0,0,0,0,0,0,0,0,0,0,0,0,0,0,0,0,0,"d45f8a3354b86ef51afdf721a3607bbe"
"11","cloud engineer",2022-08-17,"Sr. Test Engineer","Flex","Salt Lake City, UT","* At Flex, we welcome people of all backgrounds. Our employees thrive here by living our values: we support each other as we strive to find a better way, we move fast with discipline and purpose, and we do the right thing always. Through a respectful, inclusive and collaborative culture, a career at Flex offers the opportunity to make a difference, invest in your career growth and join our purpose - to make great products that create value and improve people’s lives.* * *   Job Summary* * *   To support our extraordinary teams who build great products and contribute to our growth, we’re looking to add a Sr. Test Engineer located in SLC, UT.* * * *   Reporting to the Test Engineering Manager, the Sr. Test Engineer will be responsible for implementing and maintaining cost-effective methods of testing and troubleshooting systems, software, and/or equipment.* * * *   What a typical day looks like:* * *   *     Directs and/or coordinates electronic engineering and/or technical personnel in fabrication and design of testing and test control apparatus and equipment.*   *  *   *     Directs and coordinates electronic engineering activities concerned with development, procurement, installation and calibration of instruments, equipment and control devices required to test, and record test data.*   *  *   *     Interfaces and confers with scientific, engineering and technical personnel to resolve testing problems such as product or system malfunctions, incomplete test data, data interpretation or coding issues.*   *  *   *     Trains and instructs floor support, test technicians and test operators on test hardware and/or software, as well as problem solving techniques.*   *  *   *     Resolves test yield problems by performing analysis of root causes, developing and coordinating corrective action measures and monitoring improvements.*   *  *   *     Determines conditions under which tests are to be conducted and sequences and phases of test operations and perform and support equipment verification and integration in production.*   * * *   The experience we’re looking to add to our team,* * *   *     4 Experience in test engineering in the high technology electronics industry or related area.*   *  *   *     Bachelor’s degree in related field or equivalent experience and training (Computer Engineering, Electrical Engineering, etc.)*   *  *   *     Develops test programs using various languages*   *  *   *     Develops and/or supports diagnostic tests, test plans and procedures.*   *  *   *     Experienced in corrective and preventive actions (CAPA) and writing validation reports (IQ/OQ/PQ).*   *  *   *     Coordinates 3rd party development of functional test development, enhancements, test fixtures.*   *  *   *     Demonstrated attention to detail in a fast-paced, dynamic environment.*   *  *   *     Extensive customer interfacing skills are required. Presenting, meeting with customers, managing escalations, as needed.*   *  *   *     Strong LINUX knowledge*   *  *   *     Analytics skills*   * * *   Here are a few of our preferred experiences:* * *   *     Green belt*   *  *   *     NPI experience*   *  *   *     Familiar with a framework test environment*   * * *   What you’ll receive for the great work you provide:* * *   *     Full range of medical benefits, dental, vision*   *  *   *     Life Insurance*   *  *   *     Matching 401K*   *  *   *     PTO*   *  *   *     Tuition Reimbursement*   *  *   *     Employee discounts at local retailers*   * * *   PF38* * *   #LI-PF1* * * *   Job Category*  Production Engineering* * *   Is Sponsorship Available?*  No*  Flex is an Equal Opportunity Employer and employment selection decisions are based on merit, qualifications, and abilities. We celebrate diversity and do not discriminate based on: age, race, religion, color, sex, national origin, marital status, sexual orientation, gender identity, veteran status, disability, pregnancy status, or any other status protected by law. We're happy to provide reasonable accommodations to those with a disability for assistance in the recruitment process. Please advise us of any accommodations you may need by e-mailing: accessibility@flex.com.*","https://www.indeed.com/rc/clk?jk=1d184637af2118f6&fccid=b4ab9735c58e3972&vjs=3","On-site","Part-time","MSIS",0,0,0,0,0,0,0,0,0,0,0,0,0,0,0,0,0,0,0,0,"afcf7a5ffbf8eb698206780a9a9d3b91"
"12","data integration engineer",2022-08-17,"Sr. Software Engineer .NET","Henry Schein One","American Fork, UT 84003","* Henry Schein One (www.HenryScheinOne) is the global leader in dental management, analytics, communication and marketing software. We deliver innovative dental software and services, combined with expert business coaching, to help connect dental technology so it works as one. When technology connects, more data is shared, more tasks are automated, and more work gets done. And most importantly, dental professionals have more time to focus on providing a quality experience for their patients. In fact, one connected practice management system simplifies each step of the patient experience - from first contact and scheduling, to clinical treatment and billing, to ensuring loyalty and recurring care. * If you are looking for a growing career that makes a difference, come be part of our team today! * JOB OVERVIEW:*  This position is responsible for performing advanced full-stack programming tasks for the maintenance and enhancement of our flagship product. Leverage an exceptional understanding of the business domain and existing frameworks for the success of development projects.*  TOOLS AND TECHNOLOGIES:*  C# (for new development)*   .NET 4.6 & 6.0*   WPF*   C & C++ (for bug fixes)*   WinForms*   JSON*   SQL Databases*  KEY RESPONSIBILITIES: * Design and code complex solutions that meet business requirements on schedule and within budget*   Mentor more junior software engineers in regards to best practices of multiple programming languages with a moderate ability to explain technical concepts in written and verbal forms*   Establish a high level of code quality by writing unit tests, participating in code reviews, reducing cyclomatic complexity, removing code duplication, and debugging software modules*   Assist user documentation and technical support by assembling and providing concise and accurate information in regard to software functionality*   Implement code that follows established standards and demonstrates a basic understanding of inter-process/thread communication, and message queues*   Implement code that demonstrates a good understanding of networking, versioning, database management systems, database design, database access, memory management, modeling, security, concurrency, services, and data warehousing*   Implement code that demonstrates an expert understanding of user interface design patterns, object oriented design, refactoring, design patterns, test automation, and continuous integration/deployment*   Provide task decomposition, documentation and estimates in accordance with a moderate understanding of the Software Development Life Cycle*   Create or modify user interfaces by leveraging a moderate understanding of user experience design*   Communicate to senior management by demonstrating skill in presenting technical concepts*   Attend all meetings necessary for the seamless delivery of the product as part of the Software Development Life Cycle*  QUALIFICATIONS: * Typically 6 to 8 or more years of increasing responsibility in terms of any applicable professional experience.*   Typically a Bachelor's Degree or global equivalent in related discipline. Master's degree or global equivalent a plus. May hold one or more industry certifications.*  Henry Schein, Inc. is an Equal Employment Opportunity Employer and does not discriminate against applicants or employees on the basis of race, color, religion, creed, national origin, ancestry, disability that can be reasonably accommodated without undue hardship, sex, sexual orientation, gender identity, age, citizenship, marital or veteran status, or any other legally protected status.*  * uBOPuEn52C*","https://www.indeed.com/rc/clk?jk=939af22585bfcc68&fccid=24d4106b46dfd580&vjs=3","On-site","Part-time","MSIS",0,0,1,0,0,0,0,0,0,0,0,0,0,0,0,0,0,0,0,0,"02144158d6e783f63e25b9dfe8d88c02"
"13","cloud engineer",2022-08-17,"AWS Cloud Engineer","KTEK RESOURCING LLC","Salt Lake City, UT","Skills: *Java -8* Microservices* Springboot* AWS* AWS Lambda* Kafka* AWS Serverless Key* AWS S3* Dynamo DB* Route 53*Job Type: Full-time*Salary: $140,000.00 - $160,000.00 per year*Benefits:*401(k)* 401(k) matching* Dental insurance* Flexible schedule* Health insurance* Paid time off* Parental leave* Relocation assistance* Vision insurance*Schedule:*8 hour shift*Experience:*microservices: 5 years (Required)* AWS Lambda: 3 years (Preferred)* Spring Boot: 5 years (Preferred)* API Gateway: 2 years (Preferred)* aws dynamo DB: 8 years (Required)*Work Location: Multiple Locations*Speak with the employer+91 +1 832 397 6319","https://www.indeed.com/pagead/clk?mo=r&ad=-6NYlbfkN0A1baW5GuICkPYHmSvzgDek-1Lu4ddH0UJ3PE1JD7bc0DnT7StmJUFaqkyzynuliOtAc0bgMuTcgXKfNKYuk8nOJFWtTYDFFqqdngglX7f2P-I6Z6dBuh6KYFgpb1__qZY0BbUOm6fyFdjngMGELkidYX9bQlLpqxE1fg_jfN6jWio3WSg9P08jdGkHz5kNHlkx6X2o3CXGhhllEe4Snii-zI9vQv2r2j9DvchMNTqe3mIvr--LT785JRlq-0CcIo14uSLP6RLbKhp0I4Qt2UngtumT6tkWWJBIXTssSoCjOLKOHdS0D8dMh4PAUWze-pLzq-k1cZwolNEvEeDD81es1Ziv-928Kgr-PG_NKsvrLOco2uKsiJ3up7axWje6_Jgh9kqA_s6RKL6ErdpqYjCl6wyNEgWmH8f_MxE6I7EcaS0u2kjCjyoHkLkhwoclIsQ3VmtY4FU_bLdjKPqsX7gjD_MLQ9wIn8A6d1EMYBcbZ5q9vDvJSRkbiodo6ijEWR8Or-zrl9m4tQ==&xkcb=SoC3-_M3aV9zmiSRdx0LbzkdCdPP&p=0&fvj=1&vjs=3","On-site","Full-time","MSIS",0,0,0,0,0,0,0,0,0,0,0,0,0,0,0,0,0,0,0,0,"597370d9022e8e8afb7006fdfbdbf3d4"
"14","network security engineer",2022-08-17,"Application Security Engineer","LiveView Technologies","Lindon, UT 84042","* TITLE: Application Security Engineer *  Why LVT: *  LVT (LiveView Technologies) is making the world a safer place and we need your help! Based in Utah, LVT is the world's leader for physical security platforms and data. With our systems in every state and working with Fortune 500 enterprise companies, we're positioned for massive growth in the years to come. While we were founded nearly 20 years ago, we are still innovative and consistently scaling. If you are looking for a market leading organization with untapped potential, look no further than LVT!* *  So about that scalability - we’ve been very intentional about our growth and profitability, which has driven our massive growth trajectory. To keep up with the explosive demand, we need self-motivated, innovative go-getters at every level. At LVT, we provide a fulfilling career that allows you to live your best life at work and at home. We provide the culture to work smart and have fun, while giving you the flexibility needed for yourself and your loved ones.* *  If you are looking for an opportunity with leadership, ownership, accountability, and you're excited about contributing to a high-growth company with a strong foundation where you can make an immediate impact, read on!* *  Role Description *  The application security engineer at LVT is an advocate for secure code development and architectural practices. Engineers in the role develop security policies and standards related to all company development requirements and then evangelize their adoption.* *  Responsibilities * Participate in and support application security reviews and threat modeling, including code review and dynamic testing. *  Own and perform application security vulnerability management. *  Track essential development-based vulnerabilities and manage security releases. *  Support and consult with product and development teams in the area of application security. *  Assist in creation of security training related to secure code development. *  Assist in development of automated security testing to validate that secure coding best practices are being used.* *  Required Skills & Qualifications * Ability to use git. *  Familiarity with common security libraries, security controls, and common security flaws. *  Basic development or scripting experience and skills. PHP, Ruby, and ReactJS are preferred. *  Experience with OWASP, static/dynamic analysis, and common security tools. *  A basic understanding of network and web related protocols (such as TCP/IP, UDP, HTTP, HTTPS, protocols). *  Experience working with developers. *  Excellent and professional communication skills (written and verbal) with an ability to articulate complex topics in a clear and concise manner. *  Experience identifying security issues through code review.*  *  Benefits *  Flexible Time Off, Paid Holidays, 401(K), Equity, Health, Vision, Dental, Voluntary Life Insurance, Wellness Program and best of all working with awesome people - ask about that when you speak with us!* *  HR Policy *  We’re an equal opportunity employer. All applicants will be considered for employment without attention to race, color, religion, sex, sexual orientation, gender identity, national origin, veteran or disability status. All Candidates must pass a drug screening and background check upon employment. Must be authorized to work in the U.S.* *  Commitment to Diversity *  At LiveView Technologies, our employees are authentic and come from all walks of life because the businesses we serve come from nearly any industry you can think of.* *  So we are diverse, innovators, family members and working hard for the “American Dream” that is safe for everyone & anyone. We are traditionally educated as well as from the school of hard knocks. We are people committed to working in a safe, supportive and collaborative environment where all ideas are heard and valued. We don’t merely work here, we build careers here and join a village that embraces love, is accepting of all and is truly inclusive - which is how we unleash the power of diversity. We strive to foster belonging and empowerment creating a relevant and meaningful experience for both employees & customers. As such, we are engaged and proud to be building a safer world for tomorrow.*","https://www.indeed.com/rc/clk?jk=f9af8a64e6530a63&fccid=811b38d5f4770294&vjs=3","On-site","Part-time","MSCM",1,0,0,0,0,0,1,0,0,0,0,0,0,0,0,0,0,0,0,0,"dad3fb957b5aa778148d841a43f057e4"
"15","network security engineer",2022-08-17,"Network Infrastructure Engineer, Global Design and Construct...","Meta","Eagle Mountain, UT 84005","* Meta's Edge & Network Service (ENS) team is actively looking for passionate people to help us tackle the unique set of challenges and opportunities we face, while contributing to our company mission of connecting the world. This global team offers a unique career opportunity to work with all of the latest network technologies and talented engineers solving some of the most complex problems in the industry. This role will support evaluating power and cooling requirements for new network infrastructure to be deployed in our data center environment. We are also seeking someone who will support network infrastructure design standards throughout the data center design, construction, and facility operation.* Network Infrastructure Engineer, Global Design and Construction Responsibilities: * Support all aspects of data center construction and network deployment including new greenfield sites, collocation build outs, and retrofits*   Work with network engineering, data center design, and data center connectivity teams to generate global infrastructure design standards*   Act as a subject matter expert (SME) for the physical network infrastructure deployment and design*   Build and nurture business relationships with key stakeholders, partners, and vendors*   Initiate and lead strategic initiatives driving efficiency, innovation, and standardization of our data centers*   Support network related environmental monitoring and alerting schemas across various power and cooling metrics for use in automated tooling and reporting*   Support design of network rack level power infrastructure in terms of product selection, installation/decom procedures, and power striping standards*   Influence future iterations of data center and network designs to ensure seamless integration of new infrastructure and enable scalability*   Maintain technical reference, process, and training documentation*   Influence development of automation and tooling to drive consistency and efficiency in all aspects of network design, deployment, and operations*   25% of travel required based on project demand* Minimum Qualifications:*  Experience leading cross-functional teams and driving large-scale data center projects*   Organizational, multitasking, prioritization and communication experience*   Knowledge of the data center design, construction, and start up/commissioning processes*   Working knowledge of internet networking technologies (TCP/IP, routing, switching) and optical transport technologies*   Demonstrated knowledge of structured cabling and fiber optic infrastructure including design and installation best practices, industry standards, application and limitations*   Track record of solving problems, setting strategic direction, and executing tactically*   10+ years of work experience with designing and deploying large-scale data center network infrastructure*   Knowledge of data center power and cooling infrastructure design* Preferred Qualifications:*  Expert knowledge of inside/outside plant cable design and dark fiber builds*   Knowledge of data center infrastructure management (DCIM) and physical security systems*   Data center design or relevant telecommunications certifications*   Familiarity with the Linux based systems and experience with scripting and automation (Bash, Python, Perl)*   Experience working on a global team in a matrixed environment with limited supervision*   Knowledge of data center facilities management using building management and automation systems*   Experience leading and managing technical teams*   Knowledge of data center power path including design and installation best practices and industry standards*   Experience working with on-site construction teams and managing contractor and vendor relationships*  Facebook is proud to be an Equal Opportunity and Affirmative Action employer. We do not discriminate based upon race, religion, color, national origin, sex (including pregnancy, childbirth, or related medical conditions), sexual orientation, gender, gender identity, gender expression, transgender status, sexual stereotypes, age, status as a protected veteran, status as an individual with a disability, or other applicable legally protected characteristics. We also consider qualified applicants with criminal histories, consistent with applicable federal, state and local law.Facebook is committed to providing reasonable accommodations for candidates with disabilities in our recruiting process. If you need any assistance or accommodations due to a disability, please let us know at accommodations-ext@fb.com.*","https://www.indeed.com/rc/clk?jk=f8ca593d1a69c60d&fccid=ba07516c418dda52&vjs=3","On-site","Part-time","MSCM",0,1,0,0,0,0,0,0,0,0,0,0,0,0,0,0,0,0,0,0,"cc641708cb73902732c325d541069f23"
"16","business intelligence analyst",2022-08-17,"Data Analyst / Jr Data Scientist","MoneyDolly","Remote in Salt Lake, UT","* Description* *  MoneyDolly is a growth-stage startup transforming the fundraising scene in North America to put more money into the hands of students and teams. Our one-stop app gives students the tools that they need to make their fundraisers a success!* *  This 4-5 billion dollar industry has been severely underrepresented in tech, and the market reception since our launch has been overwhelming. With over 50 years of combined fundraising experience on the executive team, MoneyDolly has found product-market fit and is looking for the team to make it into a reality.* *  We are looking for a part-time data analyst to join our remote team for 5-10 hours per week. We have a high degree of trust with all of our team members, and are looking for someone who thrives in an environment of high autonomy.* *  You might be a good fit if you:* *  Like writing SQL (and lots of it!) to dive head first into our database and answer critical business questions that will shape the direction of our company going forward* *  Enjoy coordinating with our executive team to fully understand the business questions we are trying to answer with our data* *  Enjoy digging into the source of data to ensure the sometimes surprising results that you discover are accurate* *  Enjoy the excitement involved with a growth-phase company* *  Thrive when given a lot of autonomy to meet your goals* *  Qualifications* *  Basic understanding of SQL and a willingness to learn* *  Great communication skills* *  Self-motivated and self-sufficient, with the ability to work independently while coordinating with other team members* *","https://www.indeed.com/rc/clk?jk=7121031ca5ea7af1&fccid=eaa8d0ba1079743e&vjs=3","Remote","Part-time","MSIS",0,0,1,0,0,0,0,0,0,0,0,0,0,0,0,0,0,0,0,0,"5722c0d6e5da6f072ce31befb4cb1cf8"
