"","Search","Date","Title","Company","Location","Description","Link","Work Model","Job_Type","Program","R","Python","SQL","Tableau","PowerBI","Azure","Excel","Talend","SAS","Spark","Qualtrics","Domo","Salesforce","SAP","Hadoop","Qlik","Looker","Zoho","Stata","Snowflake","ID"
"16","data architect",2022-09-02,"Azure Cloud Infrastructure Architect - Vice President","Goldman Sachs","Salt Lake City, UT 84111 (Downtown area)","* What We Do * At Goldman Sachs, our Engineers don’t just make things – we make things possible. Change the world by connecting people and capital with ideas. Solve the most challenging and pressing engineering problems for our clients. Join our engineering teams that build massively scalable software and systems, architect low latency infrastructure solutions, proactively guard against cyber threats, and leverage machine learning alongside financial engineering to continuously turn data into action. Create new businesses, transform finance, and explore a world of opportunity at the speed of markets.* * Engineering, which is comprised of our Technology Division and global strategists groups, is at the critical center of our business, and our dynamic environment requires innovative strategic thinking and immediate, real solutions. Want to push the limit of digital possibilities? Start here.* * BUSINESS UNIT OVERVIEW * The Cloud Enablement team is business unit responsible for enabling the use of public cloud services across the firm. You will be working as part of multi-disciplinary team responsible for researching, architecting and building a cutting-edge platform that enable Goldman Sachs teams to deploy and manage services in public cloud safely and securely. We are at an early stage of modernizing our services around cloud native principles, and you will be directly contributing to platform that programmatically enforces safety, security and compliance of services and enables developers to innovate faster.* How you will fulfill your potential * Contribute to technical architecture, implementation and operational management of Microsoft Azure cloud platform *  Collaborate with other cloud architects to deploy consistent architectural model across all cloud platforms *  Drive Technology Risk reviews and implement security policies for preventive and detective controls *  Participate in various technical and architectural discussions both within the team and across the organization *  Help to communicate and promote best practices for public cloud application development across the firm * Responsibilities : * Designing, building, testing, automating, and supporting the migration of workloads to Microsoft Azure Cloud Infrastructure. *  Producing designs that are scalable, resilient, efficient, secure, and cost-effective *  Leading technical decisions and direction in a collaborative team environment, including architecture, estimation, product planning, user story/requirement creation. *  Implementing modern Continuous Delivery processes for releasing software and infrastructure to production. *  Applying industry best-practices and patterns across infrastructure and application components e.g. security, elasticity, performance. *  Using public cloud platform(s) to solve business problems *  Documentation of solutions (e.g. architecture, configuration and setup) *  Applying automated configuration management, infrastructure provisioning and container orchestration tooling to solve business problems. *  Play a big part in design and implementation in a team-oriented environment. *  Support users in resolving issues by troubleshooting, providing workarounds, or escalating to technology management *  Provide technical and functional guidance and leadership to junior members on a need basis. * RESPONSIBILITIES AND QUALIFICATIONS * Basic Qualifications * Bachelor’s degree or equivalent in computer science engineering or related disciplines. *  Experience migrating workloads to Microsoft Azure *  Experience designing, provisioning, and supporting Azure PaaS and IaaS components (Azure Networks, Compute, Database families, PaaS Services, AI & ML services) *  Demonstrated experience with Infrastructure-as-Code tooling *  Demonstrated experience with CI/CD pipelines *  Exposure to Agile project delivery *  Strong technical ability, willingness to learn and evolve your skills with advances in technology. *  Excellent written and verbal communication skills, including experience speaking to technical and business audiences. *  Ability to understand and effectively debug both new and existing solutions. *  Highly motivated and willing to learn and adapt to new technologies * Preferred Qualifications * Microsoft Azure Solution Architect Certification *  Experience in working with other leading Cloud platforms like Amazon Web Services (AWS), Google Cloud Platform(GCP), Oracle Cloud Infrastructure (OCI). *  Experience in migrating workloads to Azure, AWS, or GCP. *  Experience in building and deploying resources as Infrastructure-as-Code using Azure DevOps, GitHub, Terraform etc. *  Ability to reason about performance, security, and process interactions in complex distributed systems* * ABOUT GOLDMAN SACHS* * At Goldman Sachs, we commit our people, capital and ideas to help our clients, shareholders and the communities we serve to grow. Founded in 1869, we are a leading global investment banking, securities and investment management firm. Headquartered in New York, we maintain offices around the world.* * We believe who you are makes you better at what you do. We're committed to fostering and advancing diversity and inclusion in our own workplace and beyond by ensuring every individual within our firm has a number of opportunities to grow professionally and personally, from our training and development opportunities and firmwide networks to benefits, wellness and personal finance offerings and mindfulness programs. Learn more about our culture, benefits, and people at GS.com/careers.* * We’re committed to finding reasonable accommodations for candidates with special needs or disabilities during our recruiting process. Learn more: https://www.goldmansachs.com/careers/footer/disability-statement.html* * © The Goldman Sachs Group, Inc., 2021. All rights reserved. * Goldman Sachs is an equal employment/affirmative action employer Female/Minority/Disability/Veteran/Sexual Orientation/Gender Identity**","https://www.indeed.com/rc/clk?jk=73d35d53dc4ef48d&fccid=16a97ed26c75bf2d&vjs=3","On-site","Part-time","MSIS",0,0,0,0,0,1,1,0,0,0,0,0,0,0,0,0,0,0,0,0,"b96c79799cddf1a447453aab4be4fa8c"
"17","cloud engineer",2022-09-02,"Senior Software Engineer","Imagine Learning","Hybrid remote in Provo, UT 84605","* *  Great Purpose. Great People.*   At Imagine Learning we ignite learning breakthroughs. It drives everything we do. We innovate together to support educators in creating those special moments when students experience the joy of learning at its best. Imagine Learning serves more than 15 million students and partners with more than half the school districts nationwide.* * * *   Envision Your Experience* * *   As a software engineer, you will work with other software engineers, product designers, product managers, QA engineers, DevOps engineers, and curriculum staff and will:* *  Design and develop full-stack software to add impactful new features for teachers, students, parents, and administrative users*   Develop tools and applications by producing clean, efficient code.*   Utilize data mining and machine learning techniques to discover actionable patterns in collaboration with the data science team*   Write code tests*   Source, anonymize, and prepare data sets for data science*   Collaborate with data scientists, operations engineers, software engineers, QA engineers, and product design team members*   Scale our applications as our user base grows* * *   This is a remote, full-time position based out of your home office. * * Imagine Learning offers competitive total compensation, including incentive opportunities for all regular employees.* *   Share Your Expertise* * *   Experience, education, and qualifications essential for success in this role, include:* *  4+ years of web application engineering experience with Ruby on Rails, SQL, HTML, CSS, JavaScript, and RESTful APIs.*   1+ years proficiency in modern JavaScript frameworks like React, Vue.js, Angular, etc.*   1+ years of experience improving the performance of Ruby on Rails applications with Memcached and background job processing frameworks (Sidekiq, Resque, etc.).*   Bachelor’s Degree in computer science or a related field and extensive experience in web application engineering: designing, programming, securing, testing, reviewing, releasing, and maintaining; or an acceptable combination of education and experience.*   Experience with 3rd party integrations.*   Intrinsically-motivated individual who loves to get things done*   To help ensure the safety of our valued employees, customers, and other business associates, Imagine Learning encourages employees to be fully COVID-19 vaccinated. Employees entering our office locations must be fully vaccinated or have received a negative COVID test result within 24 hours of their visit.* * *   Ignite Your Career*   * * *  We support your unique career journey by providing flexibility, investing in wellbeing, and propelling growth. * * Imagine Learning is a hybrid workplace, with the majority of employees enjoying the opportunity to work from home. Headquartered in Scottsdale, AZ, we also maintain offices in Provo, UT, Austin, TX, Petaluma, CA, and Rock Rapids, IA.*   We offer a comprehensive benefits program to eligible employees, including:*    Multiple health, dental, and vision plans, including medical plans with zero employee premiums *    401k plan with a company match*     Company-paid behavioral health coaching*     15 paid holidays, including a winter shutdown from Christmas Eve through New Year’s Day*     15 days of accrued annual Paid Time Off (PTO) to start*     Paid bonding leave when a new child joins your family *    Paid volunteer hours and annual giving events*   *   Imagine Learning is committed to fostering, cultivating, and preserving a culture of Diversity, Equity, and Inclusion. *  We offer a wide variety of professional development programs, including tuition reimbursement for eligible employees.* * *   Imagine Learning is an Equal Opportunity Employer committed to a diverse workforce, providing equal employment and advancement opportunities to qualified individuals. All qualified applicants will receive consideration for employment without regard to race, color, religion, gender, gender identity or expression, sexual orientation, national origin, genetics, disability, age, veteran status, or any other protected status. Imagine Learning will reasonably accommodate qualified individuals as required by law.* **","https://www.indeed.com/pagead/clk?mo=r&ad=-6NYlbfkN0Bchr_UY39KtSsAjKsJo0AokNYr_kAedn9WnI5WlzggsRMp4ocCeSu2E_MKtxs09_nbp7PguJVsGdIDuLYul50B9aclvF4DKawYjSY--msq7pdjxg1EJSjAG7zpFMTO4iyw28okkFx7HajYaTWHaSSaWWKWgSNh2dKvEfBQVgiByZJ_F0YMdlAMOSzIFPKokK1XF2d1kJb9044lpOmNOpmiqSQDuJtSyZcmLOK34sh1rM4ij-HkREBhNLQmDMxyJEAt5flc3i9ZjquWuQz_vvRLhyl7DuZhXco72pG-vq360WOeUTREmJrgRqAcCTqlXDsMak_keU1yV-mYSIlJt3DG4vWh5PMiJbgC025huAlqqQfiSo22_uOOZzL9UT5vAULp6qqCAntAt2kle_TA492v26aMbEbPhLMjP8FSn6VVtGfbzOOaDdnSjXGC8Gi3l2xnVQKEvWiJM4-OC9_K2TtJS_T0eTeE_I_qeckZtfGobcxN75Upjxbp9xuhjnAc1QEE2z1HNHTijISgq3CKhXr9xV5eMIO7k63oAdoQ0jig0EeZHzsdartVXVpf03oY2RBg6YsrgTXQcDnCqlLMxxQz&xkcb=SoC4-_M3a_Kli-3I2B0IbzkdCdPP&p=2&fvj=0&vjs=3","Hybrid","Full-time","MSIS",0,0,1,0,0,0,0,0,0,0,0,0,0,0,0,0,0,0,0,0,"c6a515735596b46242aa6a0864058937"
"18","data integration engineer",2022-09-02,"Senior Software Engineer","Imagine Learning","Hybrid remote in Provo, UT 84605","* *  Great Purpose. Great People.*   At Imagine Learning we ignite learning breakthroughs. It drives everything we do. We innovate together to support educators in creating those special moments when students experience the joy of learning at its best. Imagine Learning serves more than 15 million students and partners with more than half the school districts nationwide.* * * *   Envision Your Experience* * *   As a software engineer, you will work with other software engineers, product designers, product managers, QA engineers, DevOps engineers, and curriculum staff and will:* *  Design and develop full-stack software to add impactful new features for teachers, students, parents, and administrative users*   Develop tools and applications by producing clean, efficient code.*   Utilize data mining and machine learning techniques to discover actionable patterns in collaboration with the data science team*   Write code tests*   Source, anonymize, and prepare data sets for data science*   Collaborate with data scientists, operations engineers, software engineers, QA engineers, and product design team members*   Scale our applications as our user base grows* * *   This is a remote, full-time position based out of your home office. * * Imagine Learning offers competitive total compensation, including incentive opportunities for all regular employees.* *   Share Your Expertise* * *   Experience, education, and qualifications essential for success in this role, include:* *  4+ years of web application engineering experience with Ruby on Rails, SQL, HTML, CSS, JavaScript, and RESTful APIs.*   1+ years proficiency in modern JavaScript frameworks like React, Vue.js, Angular, etc.*   1+ years of experience improving the performance of Ruby on Rails applications with Memcached and background job processing frameworks (Sidekiq, Resque, etc.).*   Bachelor’s Degree in computer science or a related field and extensive experience in web application engineering: designing, programming, securing, testing, reviewing, releasing, and maintaining; or an acceptable combination of education and experience.*   Experience with 3rd party integrations.*   Intrinsically-motivated individual who loves to get things done*   To help ensure the safety of our valued employees, customers, and other business associates, Imagine Learning encourages employees to be fully COVID-19 vaccinated. Employees entering our office locations must be fully vaccinated or have received a negative COVID test result within 24 hours of their visit.* * *   Ignite Your Career*   * * *  We support your unique career journey by providing flexibility, investing in wellbeing, and propelling growth. * * Imagine Learning is a hybrid workplace, with the majority of employees enjoying the opportunity to work from home. Headquartered in Scottsdale, AZ, we also maintain offices in Provo, UT, Austin, TX, Petaluma, CA, and Rock Rapids, IA.*   We offer a comprehensive benefits program to eligible employees, including:*    Multiple health, dental, and vision plans, including medical plans with zero employee premiums *    401k plan with a company match*     Company-paid behavioral health coaching*     15 paid holidays, including a winter shutdown from Christmas Eve through New Year’s Day*     15 days of accrued annual Paid Time Off (PTO) to start*     Paid bonding leave when a new child joins your family *    Paid volunteer hours and annual giving events*   *   Imagine Learning is committed to fostering, cultivating, and preserving a culture of Diversity, Equity, and Inclusion. *  We offer a wide variety of professional development programs, including tuition reimbursement for eligible employees.* * *   Imagine Learning is an Equal Opportunity Employer committed to a diverse workforce, providing equal employment and advancement opportunities to qualified individuals. All qualified applicants will receive consideration for employment without regard to race, color, religion, gender, gender identity or expression, sexual orientation, national origin, genetics, disability, age, veteran status, or any other protected status. Imagine Learning will reasonably accommodate qualified individuals as required by law.* **","https://www.indeed.com/pagead/clk?mo=r&ad=-6NYlbfkN0Bchr_UY39KtSsAjKsJo0AokNYr_kAedn9WnI5WlzggsRMp4ocCeSu2E_MKtxs09_nbp7PguJVsGdIDuLYul50B9aclvF4DKawYjSY--msq7pdjxg1EJSjAG7zpFMTO4iyw28okkFx7HajYaTWHaSSaWWKWgSNh2dKvEfBQVgiByZJ_F0YMdlAMOSzIFPKokK1XF2d1kJb9044lpOmNOpmi8fU2mHFDxq-jU1W4Mr9xAmeuiJ-hNVEOARke6hLFuxUhA2A8wCK7rbFgvqdiKyS5gsM9xdAIm0AKyf7lj4kVdmb2cnn9DEvtwLYornEduKhxopMvEef4TH_9vMTUQxokV64d9stgX-oTsCUXzXjwwyBuArzx3XLFPpX5V-Uj54lQZQQrcHAOfOso64kCLb_t_TIaDTjmtnPlsKduaPSrbhHfeLzldJWucmX_9kW2S117AprdNW--VCgSUpsGwQq-4nlHpnNHEjoJyFuexOFrza9j0wlr9XvMce_tztbC3f3t9etqFXMaYEf-YgmUrmY39BPrdNVrLyaZJqcbS3bV4MveKoJT3qz_cjWg5n7XmFq3uy640uFP5qsZOxNufQJLwdwKmghsjsk=&xkcb=SoAx-_M3a_K9xaxvdh0KbzkdCdPP&p=3&fvj=0&vjs=3","Hybrid","Full-time","MSIS",0,0,1,0,0,0,0,0,0,0,0,0,0,0,0,0,0,0,0,0,"417da31984e8a5f34769a4a46919dfa2"
"19","data warehouse analyst",2022-09-02,"1968 IT Business Analyst","Infoorigin inc","Salt Lake City, UT","Job Description:*A Business Analyst is the department's key contact and knowledge specialist for agency business units. Work is of a highly diverse and complex nature, characterized by a broad range of activities and frequently changing conditions, situations and problems.*General Duties:*This position will be a team member implementing a Software-as-a-Service (SaaS) electronic health records (EHR) application for the client's Behavioral Services programs and State Hospitals. The position will be responsible for collaborating with business to document business requirements and workflow. To challenge business to think outside the normal process and promote efficiency in the way of doing business. Identify business strengths and opportunities and offer recommendations based on research for areas of improvement. Plan, organize and deliver work sessions for gathering business requirements. Review and edit requirements and business processes, as necessary, based on purchased solution. Collaborate with contractor staff on design, development and defect management. Collaborate with testing staff on test criteria and test plans.*Specific Duties:*Define, analyze and document requirements.* Manage requirements through the development cycle.* Communicate clearly to stakeholders, facilitators and partners.* Use requirements to drive the design, review of test cases, process change requests, and manage a project’s scope, acceptance, installation and deployment.*Program Research:*Information Request Documents* Meetings with Business* Data Governance:* Become informed of the processes, impact on business units of Data Governance and all this entails, and get an idea of what this will look like for KDADS.* Work with contractor staff and the business on Data Governance meetings and plans.*Become familiar with the following aspects of data governance.*Data Quality, Data Architecture, Data Modeling and Design, Data storage and Operations, Data Security* Data Integration and Interoperability* Document and Content Management* Reference and Master Data* Data Warehousing and Business Intelligence* Metadata and assist in identifying high and low-level requirements in each of these areas.*Business analysts typically take the lead role in:*Eliciting requirements* Requirements organization* Translating and simplifying requirements* Requirements management and communication* Requirements analysis* Document as-is and to-be workflows*Knowledge and ability to utilize the current version of the following products:*Microsoft Word, Excel, Visio and basic knowledge of Project Scheduler,* SharePoint* Smart Sheets (nice to have)*Experience required:*Two years of actual Business Analyst experience* A high level of proficiency with MS Visio and Excel* Preferred, but not required: Certified Business Analysis Professional (CBAP), Entry Certificate in Business Analysis (ECBA) Certification or other Business Analysis certification.* Preferred, but not required: Knowledge of Department for Aging and Disability Services (KDADS) business areas.*Education required:*Bachelor’s degree and two years experience with IT related work gathering requirements, requirements management, documenting workflows and facilitation as a Business Analyst. Additional experience in the areas listed above may be substituted for the required education as determined by the hiring manager.*Physical requirements (lifting, repetitive motion, etc.): Typical office setting.*Job Type: Contract*Pay: $14.74 - $57.15 per hour*Schedule:*8 hour shift*Ability to commute/relocate:*Salt Lake City, UT: Reliably commute or planning to relocate before starting work (Required)*Experience:*SQL: 1 year (Required)*Work Location: One location","https://www.indeed.com/company/Infoorigin-Inc/jobs/IT-Business-Analyst-1e7ecffd34f2a33a?fccid=75e3336b78771185&vjs=3","On-site","Part-time","MSIS",0,0,1,0,0,0,1,0,0,0,0,0,0,0,0,0,0,0,0,0,"1eb7e32a8d817b42c33066cb97205c42"
"20","business intelligence analyst",2022-09-02,"1967 IT Project Analyst","Infoorigin inc","Salt Lake City, UT","Job Description:*The position will be responsible for assisting with the coordination and management of a project which will implement a Software-as-a-Service (SaaS) electronic health records (EHR) application for the Kansas Department of Aging and Disability Services (KDADS) Behavioral Services programs and State Hospitals. To ensure the successful execution of this project the project analyst will be required to assist with:*Project schedule monitoring and maintenance* Deliverable reviews and responses* Contract and vendor oversight* Resource coordination* Report writing and reviews* Task management and oversight* Performance monitoring, analysis, and monitoring* Meeting scheduling, monitoring, and documentation; and,* Support and assist with business analysis duties as requested and directed by project manager and business analyst.*Skills required:*Facilitate and support project management efforts utilizing best practice project management methodologies* Demonstrates professionalism when dealing with challenging people and situations* Strong analytical skills with the ability to quickly learn new business and technical processes* Ability to create and maintain project work plans in MS Project (required) and Smartsheets (preferred)* Proven ability to follow general instructions and self-directed execution* Proven ability and desire to solve problems and contribute to implementable solutions* Ability to communicate effectively both verbally and in writing* Create and deliver presentations using Microsoft Project, Microsoft Visio, Word, Excel, etc.* Support groups with consensus decision-making* Create accurate reports, analysis summaries, and other tools to facilitate effective project management* Support the building and ongoing maintenance of team cohesiveness among project team members, both contractors and State staff*Knowledge and ability to utilize the current version of the following products:*Microsoft Word, Excel, Visio, Project, and SharePoint* Smartsheets (preferred, but not required)*Experience required:*Two years of actual IT project management experience: monitoring and reporting project status, preparing schedules, managing budgets, and assisting with the coordination/direction of project teams* A high level of proficiency with MS project* Preferred, but not required: Project management certification: Project Management Professional (PMP) or State of Kansas Project Management Certification.*Education required:*Bachelor’s degree and two years of experience with IT related project management or four years of experience with IT related project management. Additional experience in the areas listed above may be substituted for the required education as determined by the hiring manager.*Physical requirements (lifting, repetitive motion, etc):*Normal office requirements.* Attire for position:* Business Casual.*Job Type: Contract*Pay: $14.74 - $57.15 per hour*Schedule:*8 hour shift*Ability to commute/relocate:*Salt Lake City, UT: Reliably commute or planning to relocate before starting work (Required)*Experience:*Scrum: 1 year (Required)*License/Certification:*PMP (Required)*Work Location: One location","https://www.indeed.com/company/Infoorigin-Inc/jobs/IT-Project-Analyst-e9611cd060c9f1e3?fccid=75e3336b78771185&vjs=3","On-site","Part-time","MSIS",0,0,0,0,0,0,1,0,1,0,0,0,0,0,0,0,0,0,0,0,"2aea663c274b56c5f8eb0f2a3b701736"
