"","Search","Date","Title","Company","Location","Description","Link","Work Model","Job_Type","Program","R","Python","SQL","Tableau","PowerBI","Azure","Excel","Talend","SAS","Spark","Qualtrics","Domo","Salesforce","SAP","Hadoop","Qlik","Looker","Zoho","Stata","Snowflake","ID"
"1","business intelligence analyst",2022-04-30,"Sr Financial Analyst (Finance Business Partner)","A.P. Moller - Maersk","Salt Lake City, UT 84116","* The Finance Business Partner (FBP) position reports to the Head of E-Commerce Logistics (ECL) Finance and supports ECL products/segments by managing existing business and supporting profitable volume growth. The position owns the segment forecasting process, analysis of financial performance, and provides solid business unit support through recommendations and projects to assist in decision-making. The FBP also owns the financial models and analyses related to CAPEX/Lease/M&A decisions.What You’ll Do: * Ensure financial results reflect a true and fair representation of underlying business, thereby bringing attention to issues and driving the organization toward solutions and improvements*  Prepare monthly forecasts and analyses including financial metrics and key performance indicators*  Create monthly variance reports and recommendations for business and finance leadership*  Prepare ad-hoc reports for Senior Management using Excel, PowerPoint, and Hyperion (Essbase)*  Work with operation to setup/streamline reporting infrastructure, manage non-compliant controls, mitigate risks, and support performance management*  Play an integral part in the setting up of accounting and reporting structures, including processes and controls, for new customers and products*  Collaborate closely with various department heads and work on special projects* What You’ll Bring: * Ability to gain and maintain a high level of product knowledge across multiple business segments*  Advanced problem resolution and communication skills*  Strong decision-making and performance abilities under tight deadlines*  Ability to work independently but with strong guidance from Head of Finance*  Capable of working in a fast-paced and oft-changing environment*  Customer-centric mentality, with the ability to anticipate customer needs*  A capacity to learn the supply chain industry (fulfillment, freight, parcel, packaging)* . Requirements:* Financial acumen – must understand business/process impact on financial results*  Financial Analyst/Controller background and relevant work experience*  Advanced Excel skills – basic proficiency is not sufficient*  Ability to analyze data, translate analysis into specific, targeted actions to drive results*  Solid organizational, written communication, oral communication, and presentation skills*  Ability to work independently*  Excellent ability to manage to deadlines* Job Type: Full-time*","https://www.indeed.com/company/Maersk/jobs/Senior-Financial-Analyst-17bebfedba825c4c?fccid=14e7391c55beeb80&vjs=3","On-site","Full-time","MSIS",0,0,0,0,0,0,1,0,0,0,0,0,0,0,0,0,0,0,0,0,"2a2ed3434ab98e84ea5a00ed701ca488"
"2","network security engineer",2022-04-30,"Senior Infrastructure Security Engineer","Angi","Remote in Salt Lake City, UT+1 location","* *  Angi® is transforming the home services industry, creating an environment for homeowners, service professionals and employees to feel right at ""home."" For most home maintenance needs, our platform makes it easier than ever to find a qualified service professional for indoor and outdoor jobs, home renovations (or anything in between!). We are on a mission to become the home for everything home by helping small businesses thrive and providing solutions to financing and booking home jobs with just a few clicks. *   Over the last 25 years we have opened our doors to a network of over 200K service professionals and helped over 150 million homeowners love where they live. We believe home is the most important place on earth and are embarking on a journey to redefine how people care for their homes. Angi is an amazing place to build your dream career, join us—we cannot wait to welcome you home! *  About the Opportunity: *   At Angi, security is tightly woven into product and infrastructure development. We challenge our teams to build systems that are secure-by-default and to protect our users' most sensitive data. You will be joining a team of engineers who will champion security initiatives throughout the organization. You will be building tools to make secure-by-default easy. You will be conducting regular audits/tests to identify risks and prioritizing fixes for the identified risks. You will continue to raise the bar to make our systems secure. *   What you will do: *  Implement security best practices in our cloud and on-premise IT environment following industry standards / recommendations. *   Identify vulnerabilities / missing patches across all physical servers, virtual servers, end user workstations, containers, etc. and ensure they are prioritized for remediation. *   Implement runtime security measures for our container environments. *   Ensure relevant audit and security logs are collected to a central location and exposed to the correct teams for triage, analysis, and incident response. *   Work with auditors and compliance teams to meet required policies and collect required evidence. *   Work with IT / Engineering teams to ensure admin rights are not needed on end user workstations for every day tasks and to ultimately trim down the number of users that have admin rights. *   Ensure all endpoints throughout the organization are configured with security settings that align with industry standards and that they have the relevant security tools (MDM, EDR, etc.) installed. *   Implement zero trust principles throughout the infrastructure that facilitates a BYOD model for certain use cases. *   Enhance incident response playbooks and leverage automation using SOAR products where possible. *   Actively participate in the design and implementation of applications, services, and infrastructure to ensure security and privacy design principles are being followed. *   Actively participate in all facets of the incident response lifecycle *  Who you are: *  You have a BS or an MS in Computer Science, Computer Engineering, Cyber Security, or a related field *   You have 4+ years of experience working on a security team supporting product/engineering functions, cloud infrastructure, and corporate infrastructure development *   You have experience in AWS specifically with one or more of the following AWS services: GuardDuty, Config, WAF, Shield, Macie, CloudTrail, SecurityHub. *   You have in-depth knowledge of security threats, applied cryptography, and risk assessments *   You have software engineering experience and an engineering mindset for building reliable and maintainable security infrastructure to support a large organization with CI/CD software engineering practices *   You have experience working with product development teams to empower them on advancing security initiatives *   You have experience defining and implementing internal practices and controls for PCI and SOX/ITGC information security compliance standards *   Willingness to learn and apply new skills and technologies *   Knowledge of Kubernetes or container technologies preferred *  Compensation & Benefits *  The salary band for this position ranges from $160,000 - $210,000 annually, commensurate with experience and performance. *   Full medical, dental, vision package to fit your needs *   Flexible vacation policy: work hard and take time when you need it *   Pet discount plans & retirement plan with company match (401K) *  #LI-Remote *   #BI-Remote* *","https://www.indeed.com/rc/clk?jk=c05b4136489ff754&fccid=a459150a450820d9&vjs=3","Remote","Part-time","MSCM",1,0,0,0,0,0,0,0,0,0,0,0,0,0,0,0,0,0,0,0,"de30f9387535ca44ca5ebc6dbe980a5c"
"3","data engineer",2022-04-30,"Senior Site Reliability Engineer - Data","Angi","Remote in Salt Lake City, UT","Angi® is transforming the home services industry, creating an environment for homeowners, service professionals and employees to feel right at ""home."" For most home maintenance needs, our platform makes it easier than ever to find a qualified service professional for indoor and outdoor jobs, home renovations (or anything in between!). We are on a mission to become the home for everything home by helping small businesses thrive and providing solutions to financing and booking home jobs with just a few clicks.**Over the last 25 years we have opened our doors to a network of over 200K service professionals and helped over 150 million homeowners love where they live. We believe home is the most important place on earth and are embarking on a journey to redefine how people care for their homes. Angi is an amazing place to build your dream career, join us—we cannot wait to welcome you home!*About the Role**Site Reliability Engineers (SREs) are responsible for keeping all user-facing services and other Angi production systems running smoothly. SREs are a hybrid of operators and software engineers that leverage engineering principles, operational experience, and automation to our environments. You will help shape our infrastructure and build the foundation our team relies on for the rapid, reliable delivery of our product. We'll rely on you to instill best practices for building scalable distributed systems, with a keen focus on observability and fault tolerance. Our stack consists of technologies such as Kubernetes, Java Spring Boot, Oracle, Postgres, Coherence, Redis, Elasticsearch inside a hybrid cloud.**We are looking for experienced Site Reliability Engineers who meet the following criteria**Technical:**Breadth of knowledge across our infrastructure and application stack.Contributes small improvements to all codebase to resolve issues.Experience with container orchestration technologies like Kubernetes, Mesos, or Nomad. (We use Kubernetes.)A track record of leveraging automation whenever and wherever.An appreciation of and enthusiasm for software engineering best practices, such as infrastructure as code, testing, and continuous delivery.Data Engineering/Administration or production infrastructure and operations background.Experience with SQL data stores like Oracle, MSSQL, Maria DB, PostgreSQL, particularly with performance challenges in migrations from on-prem to cloud (RDS, Aurora, etc.)*Execution:**Identifies changes for the product or infrastructure architecture focusing on reliability, performance and availability perspective with a data-driven approach.Proactively work on the efficiency and capacity planning to set clear requirements and reduce the system resources making Angi operate with cost as a discipline.Identify parts of the system that do not scale, provide immediate and long term resolution of these incidents.Identify Service Level Indicators (SLIs) that will align the team to meet the availability and latency objectives.*Collaboration and Communication:**Know a domain really well and permeate that knowledge across the rest of the engineering organization.Perform and run blameless RCAs on incidents and outages and drive to prevent the incident from reoccurring.Show ownership of a major part of the infrastructure.*As an SRE you will:*Be part of an on-call rotation to respond to incidents and provide support for software engineers across Angi initiative teams.*Build visibility into SLIs, SLOs, SLAs, dependency graphs to reduce operational burden or toil.*Drive on instrumentation patterns to alert on symptoms and not on outages leveraging our monitoring stack of Grafana, Prometheus, Elasticsearch.*Use your on-call shift to prevent incidents from occurring.*Run our infrastructure with Terraform and Kubernetes.*Use a data-driven approach to findings, turn into repeatable actions and then into automation.*Improve the deployment process to make it as quick and dependable as possible.*Design, build and maintain core infrastructure pieces that allow Angi to scale to meet its market demand.*Debug production issues across the full stack.*Plan and shape the growth of Angi's ever-evolving infrastructure.*You may be a fit for this role if you:*Think about systems - edge cases, failure modes, behaviors, specific implementations.*Have an understanding of large scale system design, monitoring, and operational practices.*Have strong programming skills - Ruby and/or Go*Have an enthusiastic, go-for-it attitude. When you see something broken, you can't help but fix it.*Have a burning desire for delivering quickly and iterating fast.*Have experience with Nginx, HAProxy, Docker, Kubernetes, Terraform, or similar technologies*Projects you could work on:*Building automation around testing & performance for database services.*Creation of monitoring of critical data services and tools for remediation, failover, and HA.*Migrate legacy SQL databases to modern cloud native implementations, e.g. MSQL  Aurora.*Build tooling to help reduce toil across the engineering organization and the use of large mission critical data transaction services..*Compensation & Benefits:*The salary band for this position ranges from 140K - 200K, plus bonus and equity, commensurate with experience and performance.*Full medical, dental, vision package to fit your needs*Flexible vacation policy; work hard and take time when you need it*Pet discount plans & retirement plan with company match (401K)*The rare opportunity to work with sharp, motivated teammates solving some of the most unique challenges and changing the world*#LI-Remote**#BI-Remote","https://www.indeed.com/rc/clk?jk=1cc6f7e53699240f&fccid=a459150a450820d9&vjs=3","Hybrid","Part-time","MSIS",0,0,1,0,0,0,0,0,0,0,0,0,0,0,0,0,0,0,0,0,"402d2732ad2a63069a6035134bbb4ba5"
"4","cloud engineer",2022-04-30,"Infrastructure Engineer - Cloud","Angi","Remote in Salt Lake City, UT+2 locations","Angi® is transforming the home services industry, creating an environment for homeowners, service professionals and employees to feel right at ""home."" For most home maintenance needs, our platform makes it easier than ever to find a qualified service professional for most indoor and outdoor jobs, home renovations (or anything in between!). We are on a mission to become the home for everything home by helping small businesses thrive and providing solutions to financing and booking home jobs with just a few clicks.**Over the last 25 years we have opened our doors to a network of over 200K service professionals and helped over 150 million homeowners love where they live. We believe home is the most important place on earth and are embarking on a journey to redefine how people care for their homes. Angi is an amazing place to build your dream career, join us—we cannot wait to welcome you home!**We're looking for Engineers with expertise and passion in solving difficult problems in distributed systems, cloud native technologies, and highly available services. At Angi you will be tasked to design, support and scale innovative new services from the ground up. These are exciting times in our space - we are growing fast and working on ambitious new initiatives.**As an Infrastructure Engineer - Cloud , you'll be responsible for:*Working in tandem with Development, DevOps and SRE teams to identify and implement the most optimal cloud-based solutions for our company.*Migrating existing applications from a physical datacenter to Amazon AWS while also participating in the design and build out of new, cloud native, services.*Building and maintaining cloud infrastructure using modern Infrastructure As Code tools and practices.*Ensure application performance, uptime, and scale, maintaining high standards of code quality and thoughtful design.*Managing cloud environments in accordance with company security guidelines.*Trouble-shoot incidents, identify root cause, fix and document problems, and implement preventative measures.*What will make you a great fit:*You work on a team that owns the design, development, and operations for major components of a public Cloud Infrastructures.*Can build and maintain Terraform modules to deploy and manage AWS infrastructure.*Have run publicly facing web services on AWS in production.*Have familiarity with CI/CD tools such as Gitlab CI, especially for managing Infrastructure As Code.*Have familiarity with Kubernetes and containerized workloads, especially EKS*Have experience with scripting and automation tools such as Ansible, Bash and Python*Compensation & Benefits:*The salary band for this position ranges from $130,000-$200,000, commensurate with experience and performance. Compensation may vary based on factors such as cost of living.*This position will be eligible for a competitive year end performance bonus & equity package.*Full medical, dental, vision package to fit your needs*Flexible vacation policy; work hard and take time when you need it*Pet discount plans & retirement plan with company match (401K)*The rare opportunity to work with sharp, motivated teammates solving some of the most unique challenges and changing the world*#LI-Remote**#BI-Remote","https://www.indeed.com/rc/clk?jk=2fec7225b64c6966&fccid=a459150a450820d9&vjs=3","Remote","Part-time","MSIS",0,1,0,0,0,0,0,0,0,0,0,0,0,0,0,0,0,0,0,0,"bfb09b4e4fec6dfe4f89ec2dc0676adf"
"5","network security engineer",2022-04-30,"Sr. System Test Engineer","Apogee Worx LLC","Ogden, UT 84405","* System Test Engineer* Apogee Worx LLC is hiring a System Test Engineer. This position is responsible for the planning, design, and execution of a Developmental Test System for a new avionics weapon system and supporting the Flight Test planning and execution. You will be a primary interface to the customer. In addition, you will get hands-on aircraft experience and expertise.* Apogee Worx LLC is a growing aerospace business delivering leading edge solutions to the military and para-military aviation markets. We are looking for individuals that will thrive in a challenging project-based environment with a charter of providing state of the art capabilities to legacy aircraft.* Responsibilities include: * Avionics test planning, execution, reporting, and integration support*  Technical experience in network, computer hardware and software, interconnection and interfacing technologies*  Collaborate with systems engineers and lab users to ensure the lab meets test requirements*  Perform data analysis against requirements and interfaces for each software build or hardware component*  Interface with systems engineers in support of verification*  Prepare detailed test reports and support formal verification of the system*  Product integration, regression, and verification testing including checkout in system test labs.*  Participating in technical exchange meetings, interfacing with customers (internal/external) and contributing to a broad range of program deliverables.*  Mentoring and leading teams that include journey, junior engineers, and interns* Basic Qualifications: * Bachelor’s degree in Systems, Aeronautical, Electrical, or Mechanical Engineering or related Engineering degree*  Ten years’ experience in combination of aircraft avionics, aircraft hardware, and/or software*  Software and hardware projects including test planning and execution*  Excellent communication, interpersonal skills, and the ability to interface with all levels of employees and management*  Works well in a team environment*  Demonstrated success leading teams/and or organizations to achieve a common goal.*  Knowledge of system integration and test principles and test plan development at any level of build (unit, sub-system, system, etc.).*  Ability to solve problems, analyze test results, drive tasks to completion*  Automated Test experience (development and execution)*  Software and/or Hardware testing experience*  Must be a US Citizen. Must have the ability to obtain a Secret clearance. A current Secret clearance is a plus* Desired skills: * Master’s Degree in Engineering with 7 years’ experience*  Model-Based Systems Engineering (MBSE)*  Project or Program Management experience*  Experience with Client/Server architecture.*  Agile experience*  Current DoD Secret level security clearance* Apogee Worx offers competitive salary and an extensive benefit package including: * 401(k) with 3% company contribution*  Health insurance*  Health savings account*  Dental insurance*  Vision insurance*  Life insurance*  Accident insurance*  Paid time off*  Semi-flexible work hours*  10 Federal paid holidays per year* Job Type: Full-time* Pay: $95,000.00 - $150,000.00 per year* Schedule:* Monday to Friday* Supplemental Pay:* Bonus pay* Application Question(s):* Are you a US Citizen?* Education:* Bachelor's (Required)* Experience:* Avionics System Test: 5 years (Required)* Work Location: One location*","https://www.indeed.com/company/Apogee-Worx-LLC/jobs/Senior-System-Test-Engineer-17209c78fef0d8de?fccid=a898384c5c6730ff&vjs=3","On-site","Full-time","MSCM",0,0,0,0,0,0,1,0,0,0,0,0,0,0,0,0,0,0,0,0,"7ecd3a645510792a5f867b67bc454658"
