"","Search","Date","Title","Company","Location","Description","Link","Work Model","Job_Type","Program","R","Python","SQL","Tableau","PowerBI","Azure","Excel","Talend","SAS","Spark","Qualtrics","Domo","Salesforce","SAP","Hadoop","Qlik","Looker","Zoho","Stata","Snowflake","ID"
"28","data integration engineer",2022-04-30,"Systems Integrations Engineering Manager","LiveView Technologies","Orem, UT 84058","* *  Why LiveView Technologies: *   LiveView Technologies (LVT) is making the world a safer place and we need your help! Based in Orem Utah, LVT is the world's leader in remote security systems orchestration and data analytics. Our hardware and software platform provides unparalleled speed to delivery, no costly infrastructure upgrades and full lifecycle management. With LVT units in every state and three countries, we're positioned for massive growth in both domestic and international markets. We closed out 2021 in record fashion for the 3rd year in a row. LVT is poised to make 2022 another record year!*  *   To learn more about LVT visit our website at: https://www.lvt.com/company/about-us*  *   As a company, we’ve had a strategic and deliberate growth focus. We are a profitable company with a massive growth trajectory. To keep up with explosive demand, we need self-motivated, innovative go-getters in every department. If you want an opportunity for leadership, ownership, and accountability, and you're excited about contributing to a high-growth company that has a strong foundation where you can make an immediate impact, LiveView Technologies is the place for you!*  *   What Will You Do *   The platform we offer our customers is made up of hardware, both internally-developed and off-the-shelf, along with internally-developed software. The individual units consist of any combination of modems, routers, our proprietary Linux-powered edge controller, IP cameras, IP speakers, and a supporting wind or solar power source. Our customers rely on us to ensure that this hardware is capable of performing as expected and kept up to date with the latest security patches. As a Systems Integration Test Engineering Manager, you will lead a team that assists in the definition of internal quality control standards and the maintenance of our reliability programs. You will receive new product samples and perform a complete assessment of capabilities, strengths, and limitations. You will participate in communications with vendors and manufacturers to resolve any issues discovered during our certification process. You will prepare documentation for, and collaborate with many departments; ensuring they can be successful at integrating certified hardware with our platform. In addition to certifying new hardware, you will also be responsible for testing new firmware releases for existing products and maintaining that documentation. As a subject-matter expert in all certified hardware and firmware, you will be a company-wide resource, helping troubleshoot newly discovered issues. As a manager, you will mentor your team members to consistently strive to improve their skills in technical aptitude, relationship building, and business acumen.*  *   What Characteristics Are Valued *   Leadership: You lead by example. Your work ethic, accountability, stewardship, cool nature and professionalism sets the standard for what you expect from your team. You mentor each member of the team through hands-on work, individualized training, and constructive feedback. *   Judgment: You make wise decisions despite ambiguity. You identify root causes and get beyond treating symptoms. You visualize complex scenarios and think strategically before jumping to conclusions. *   Communication: You are concise and articulate in speech and writing. You are open-minded and treat people with respect independent of their status or opinions. You maintain a calm poise in stressful situations. *   Impact: You demonstrate consistently strong performance so your colleagues can rely on you. *   Curiosity: You learn rapidly and eagerly. You seek to understand our strategy, market, customers, and suppliers. *   Innovation: You re-conceptualize issues to discover practical solutions to hard problems. You challenge prevailing assumptions when warranted and suggest better approaches. You create new ideas that prove useful. You keep us nimble by minimizing complexity and finding time to simplify. *   Passion: You inspire others with your thirst for excellence. *   Honesty: You are quick to admit mistakes. *   Selflessness: You are ego-less when searching for the best ideas.*   *   What Skills Are Needed *   Required: Connect network hardware such as modems, routers, and network cameras to a private network and manipulate their configuration via a GUI or CLI. Read API documentation and perform tests to verify functionality and compatibility with our services. Troubleshoot basic electrical issues including the use of a DC bench power supply, a multimeter, and a POE injector. Organize a repository of firmware and configuration files so your coworkers can identify which are approved for deployment. Communicate well via email, telephone, and in person with vendors and coworkers (both technical and non-technical). Maintain internal documentation on testing and configuration procedures. Occasionally lift up to 50 lbs. At least 2 years experience managing and mentoring teams. *   Preferred: Use a packet analyzer such as Wireshark to discover undocumented API commands. Willingness to travel a few times each year to consult during critical installations and meetings with high-level clients. Experience working on a Scrum team. *   Bonus: Automate certification and configuration processes using Python and/or AWS Lambda.*  *   Who Will You Work With *   You will work with third-party manufacturers, collaborating with their Sales Engineers, Software Developers, and Support Staff to ensure new and existing products meet our needs. As a subject-matter expert, you will consult with our internal Software Developers, Technical Support, Mechanical/Electrical Engineers, Assembly, and Sales teams. You will report to the Network Systems*  *  HR Policies and Benefits: *   Employee Stock Option Program, FTO, Standard paid Holidays, health, vision, dental, and voluntary life insurance. We’re an equal opportunity employer. *   All applicants will be considered for employment without attention to race, color, religion, sex, sexual orientation, gender identity, national origin, veteran or disability status. *   All candidates must pass a drug screening and background check upon employment. *   Must be authorized to work in the US* *","https://www.indeed.com/rc/clk?jk=8dc122c6c9b9561f&fccid=811b38d5f4770294&vjs=3","Remote","Part-time","MSIS",1,1,0,0,0,0,1,0,0,0,0,0,0,0,0,0,0,0,0,0,"a92255774cfa1ac686c17de57f6ae2fc"
"29","data analyst",2022-04-30,"Clinical Data Analyst Quality","Lone Peak Hospital","Draper, UT 84020","Description*Introduction*Are you passionate about the patient experience? At HCA Healthcare, we are committed to caring for patients with purpose and integrity. We care like family! Jump-start your career as a(an) Clinical Data Analyst Quality today with Lone Peak Hospital.*Benefits*We are committed to providing our employees with the support they need. At Lone Peak Hospital, we offer eligible colleagues an attractive benefit package that includes medical, wellbeing, dental and vision benefits along with some unique benefits including:*Medical, Dental, Vision, Life Insurance and Flexible Spending*Paid Time Off (PTO) and Personal Leave*401K (100% annual match - 3% to 9% of pay based on years of service)*Academic Assistance and Reimbursements for Tuition and Student Loans*Employee Discounts including Tickets, Retail, Mental Health Apps, Education Apps, Identity Theft Protection etc.*Home, Auto, and Pet Insurance*Employee Stock Purchase Program (ESPP)*Short Term & Long Term Disability coverage*Adoption Assistance*Legal Benefits and lots more!*Learn more about Employee Benefits*Come join our team as a(an) Clinical Data Analyst Quality. We care for our community! Just last year, HCA Healthcare and our colleagues donated $13.8 million dollars to charitable organizations. Apply Today!*Job Summary and Qualifications*As a Clinical Data Analyst you will be responsible for performing clinical data analytics, creating insight for physicians, clinical staff, improvement advisors, and hospital leaders to support performance improvement. We have an amazing team and consider ourselves a family who work hard to support each other and we are looking for someone who feels patient care is as meaningful as we do. In this role:*You will coordinate the activities of national databases to include chart requisition and review.*You will document identification, data collection, and data entry of information for patients.*You will collect data points pertinent to national databases.*You will oversee externally and internally sourced data management, clinical data registries and clinical performance. Maintain an inventory of all required data collection.*You will develop clinical data analytic systems, including design, documentation, and implementation and reporting.*You will utilize knowledge and research in the development and implementation of evidence based initiatives to promote best practices and ensure compliance with regulations and internal standard.*You will oversee and manages all clinical analytics including relevant HCA and local systems*You will apply Pareto charts, driver diagrams, run charts, statistical process control charts, fishbone diagrams, root cause trees to create insight to support rational decision making.*You will communicate PI and quality/safety activities to leadership and QM staff. Updates and reports findings and insights derived therefrom to stakeholders that support an appropriate response to variances.*You will ensure the accuracy and integrity of data abstracted from the medical record abstract.*Qualifications:*Master’s degree in Public Health or other healthcare data analytic intensive master’s program preferred, or currently enrolled and actively pursuing a graduate degree.*1 years of healthcare related experience required.*Quality improvement training and experience preferred.*Basic clerical, statistical, and quality review skills required.*Advanced computer skills with knowledge and proficiency in the Microsoft Office programs particularly Excel required.*Information management skills including flowcharting, data analysis and report preparation.*Lone Peak Hospital is a 32 plus bed hospital on the Lone Peak Medical Campus, which has been built to meet healthcare needs of people in our community. Riding a substantial population jump of 70% over the last 20 years, our community and its residents are ready for our inpatient services that include obstetric care and surgery services. We have earned an “A” rating in Hospital Safety Grades (Leapfrog Group 2019) and 5-Star rating for Spinal Fusion Surgery (Healthgrades 2018-2019).**Lone Peak Hospital is located in the thriving modern-day community of Draper, UT that sits on the south end of Salt Lake Valley that includes pristine cycling, hiking and horseback trails; and close proximity to year-round, outdoor recreational activities like skiing, backpacking, hang gliding, rock climbing, wildlife viewing and fly fishing.**We are part of the HCA Healthcare network - which includes more than 300 affiliate facilities across the country – offering our colleagues the opportunity for travel and relocation. HCA and Lone Peak Hospital are all about caring for people, and that care extends to patients, families and our colleagues.**HCA Healthcare has been recognized as one of the World’s Most Ethical Companies® by the Ethisphere Institute more than ten times. In recent years, HCA Healthcare spent an estimated $3.7 billion in cost for the delivery of charitable care, uninsured discounts, and other uncompensated expenses.**""The great hospitals will always put the patient and the patient's family first, and the really great institutions will provide care with warmth, compassion, and dignity for the individual.""- Dr. Thomas Frist, Sr.*HCA Healthcare Co-Founder*If you are looking for an opportunity that provides satisfaction and personal growth, we encourage you to apply for our Clinical Data Analyst Quality opening. We promptly review all applications. Highly qualified candidates will be contacted for interviews. Unlock the possibilities and apply today!*We are an equal opportunity employer and value diversity at our company. We do not discriminate on the basis of race, religion, color, national origin, gender, sexual orientation, age, marital status, veteran status, or disability status.","https://www.indeed.com/rc/clk?jk=55a924720aef0433&fccid=02f86ed0b946fdc0&vjs=3","On-site","Part-time","MSBA",0,0,0,0,0,0,1,0,0,0,0,0,0,0,0,0,0,0,0,0,"88c39890679e6a1b080eb690877c6e52"
"30","data integration engineer",2022-04-30,"Senior DataOps Engineer","MasterControl","Salt Lake City, UT 84121","* *  About MasterControl:*   MasterControl Inc. is a leading provider of cloud-based quality and compliance software for life sciences and other regulated industries. Our mission is the same as that of our customers to bring life-changing products to more people sooner. The MasterControl Platform helps organizations digitize, automate and connect quality and compliance processes across the regulated product development life cycle. Over 1,000 companies worldwide rely on MasterControl solutions to achieve new levels of operational excellence across product development, clinical trials, regulatory affairs, quality management, supply chain, manufacturing and postmarket surveillance. For more information, visit www.mastercontrol.com.*   Summary*   At MasterControl we are building our next generation data platform that will leverage AI/ML techniques to help redefine how our customers bring lifesaving and lifechanging products to market. To enable this, we need your help building our Data Pipeline, Data Mart, and Data Lake.*   The Senior DataOps Engineer plays a key role in our team's transition towards a fully automated and easy to maintain Data Lake and AI/ML pipeline. This role delivers value by owning the automated provisioning of all needed environments, infrastructure, connectivity and needed integrations, etc.*  Responsibilities*   Provision, maintain, and own our Kubernetes clusters.*    Provision, maintain, and own our Kafka Connect clusters.*    Provision, maintain, and own our Data Lake (Spark cluster, Airflow, Spark Structured Streaming, Kafka).*    Provision, maintain, and own our ML Pipeline. H20, GCP, Hugging Face, etc.*    Automating our integration into our CI/CD pipeline.*    Mentoring the team in good AWS/Cloud/Networking/IAM/Terraform practices.*    Foster collaboration in a team and cross-team setting.*    Contribute to the culture of accountability, productivity, and fun found in our team.*    Support the integration of new products and services, regulatory requirements, tools, technologies, and markets into existing operations.*    Ensure available technology is fully leveraged.*    Other duties as assigned.*   Requirements and Skills*   4-year degree in CS, IT, IS, or equivalent area of technical study or equivalent experience.*    Multiple years of professional experience in an Ops position.*    Experience using AWS, which includes working with services like EC2, EMR, RDS, Athena, IAM, VPC, EKS, Route 53, and S3.*    Experience using GCP.*    Hands-on experience building CI/CD workflows and using scripting languages (one or more languages, e.g., Python, Java, PowerShell).*    Hands-on experience with software deployment and orchestration technologies e.g., CloudFormation, Terraform, Docker, Kubernetes in production environments.*    Experience with Kafka and or other event frameworks. *   Experience with feature flag and various deployment methodologies: Green/Blue, A/B, red/black.*    Familiarity and passion for industry standards and best practices around DevOps and SecDevOps.*    Significant experience with Windows and Linux operating system environments.*    Excellent interpersonal, collaborative, trust-building, conflict-resolution, and writing skills.*    Passionate about creatively solving business problems.*    Effectively prioritize and execute tasks in a high-pressure environment.*    Meet multiple, challenging deadlines while communicating expectations clearly.*    Sense of ownership and pride in your performance and its impact on the company's success.*   Physical Demands and Working Conditions*   Must be able to work well with people.*    Ability to operate a computer and work at a desk for extended periods of time.*    Ability to communicate effectively in writing, in person, over the telephone and in e-mail.*   Why Work Here?*   #WhyWorkAnywhereElse?*   MasterControl is a place where Exceptional Teams come together to do their best work. In fact, hiring Exceptional Teams is a core value of ours. MasterControl employees are surrounded by intelligent, motivated, and collaborative individuals. We like to call it #TheBestTeamOnThePlanet.*   We work hard to develop and challenge our employees' skillsets, recognize their contributions, encourage professional development, and offer a one-of-a-kind culture. This is why we say #WhyWorkAnywhereElse?*   MasterControl could be your next (and last) career move!*   Here are some of the benefits MasterControl employees enjoy:*   Competitive compensation*    100% medical premium coverage (yes, you read that right!)*    401(k) plan with company match*    Generous PTO packages that increase with tenure*    Schedule flexibility*    Fitness clubs (you get paid to have fun and be active!)*    Company parties and employee recognition programs*    Wellness programs (free Fitbit, gym membership and athletic shoe reimbursements, etc.)*    Onsite physician and massage therapist*    Innovation center and gaming rooms at the office*    Dental/vision plans*    Employer paid life insurance policy*    Much, much more!*   Applicants must be currently authorized to work in the United States on a full-time basis.* *","https://www.indeed.com/rc/clk?jk=386402ad51b89bc9&fccid=13488d4436d854ff&vjs=3","On-site","Full-time","MSIS",0,1,0,0,0,0,1,0,0,1,0,0,0,0,0,0,0,0,0,0,"11d462a0215dc5366e3eb6c4257162aa"
"31","data integration engineer",2022-04-30,"Director of DevOps","MasterControl","Salt Lake City, UT 84121","* *  About MasterControl:*   MasterControl Inc. is a leading provider of cloud-based quality and compliance software for life sciences and other regulated industries. Our mission is the same as that of our customers to bring life-changing products to more people sooner. The MasterControl Platform helps organizations digitize, automate and connect quality and compliance processes across the regulated product development life cycle. Over 1,000 companies worldwide rely on MasterControl solutions to achieve new levels of operational excellence across product development, clinical trials, regulatory affairs, quality management, supply chain, manufacturing, and postmarket surveillance. For more information, visit www.mastercontrol.com.*   Summary*   MasterControl is passionate about embracing a customer-first mindset to constantly improve the experience, integration, and adoption of our products to enable our mission of ""Bringing Life-Changing Products to More People Sooner."" This highly visible role requires close collaboration with MasterControl's Engineering, Product, Security, Quality, and Support Leadership to shape the overall enterprise direction, philosophy, and implementation of Development Operations and Global Software as a Service Operations.*   As the Director, Dev and SaaS Ops, you will contribute to the enterprise's technical architecture, product prioritization, scalable automation, capacity planning, adoption of supporting technologies, and other aspects of maintaining world-class cloud-based service objectives. In addition to leading our Internal Platform Team providing best-in-class developer and operations experiences, you will build a SaaS Ops team of Site Reliability Engineers to ensure our infrastructure and service platforms are secure, available, performant leveraging best-in-class tools that improve monitoring and alerting while decreasing lead-time, deployment frequency, failure rate, mean time to discover and recover for software delivery operations*   In this role, you will have a direct impact on our customer's operational success and our ability to deliver more products through cost reduction, vendor management, and system consolidation across the business. You will be an integral contributor providing business leadership support for software engineering, security, technical operations, site reliability, and product teams. Additionally, you will support infrastructure development, runtime environments, and pipeline automation applications to drive the security, scalability, stability, reliability, compliance, and operability of services and security for our customer-first user experiences.*   Responsibilities*   Be a cultural and change leader in the organization. *   Provide mentorship and continue to grow MasterControl's exceptional Internal Platform team. *   Build a world-class SaaS Operations team, attracting, recruiting, and retaining exceptional people. *   Influence and support engineering teams across MasterControl, utilizing a customer-first mindset. *   Manage MasterControl's always-available cloud-based infrastructure and deployment pipelines. *   Define and execute standards for deployments at scale, infrastructure, reliability, and scalability, iterate and optimize for continual improvements. *   Work with Architecture, Engineering, Security, and Business leaders to continually analyze, evaluate and streamline COGs and Operational expenses. *   Champion continuous improvements using Accelerate metrics to systematically drive down detection (MTTD) and mitigation/restoration (MRRT). *   Work with Product Management to establish and maintain clear content authority.*    Coordinate with MasterControl's Quality Team to ensure compliance with adopted GDPR, ISO, HIPPA, and FEDRAMP-Moderate standards.*    Use data from production incidents to drive root cause analysis, facilitate creative solutions and mitigate future occurrences.*   Preferred Qualifications*   Exceptional interpersonal, collaborative, trust-building, conflict-resolution, and writing skills.*    Exemplify servant leadership*    Capability to meet multiple, challenging deadlines while communicating expectations clearly. *   Proficiency in solving business problems in a creative and effective manner.*    Ability to effectively prioritize and execute tasks in high-pressure environments. *   In-depth knowledge of modern DevOps and Site Reliability Standards, Practices, and ToolChains. *   10 years of software development and operations leadership experience focused on cloud-based, micro-service architectures.*    4-year degree or equivalent experience required; advanced degree preferred.*   Physical Demands and Working Conditions*   Ability to operate a computer and work at a desk for extended periods of time.*    Ability to quickly learn technical skills.*    Ability to communicate effectively.*    Some travel might be required.*   Why Work Here?*   #WhyWorkAnywhereElse?*   MasterControl is a place where Exceptional Teams come together to do their best work. In fact, hiring Exceptional Teams is a core value of ours. MasterControl employees are surrounded by intelligent, motivated, and collaborative individuals. We like to call it #TheBestTeamOnThePlanet.*   We work hard to develop and challenge our employees' skillsets, recognize their contributions, encourage professional development, and offer a one-of-a-kind culture. This is why we say #WhyWorkAnywhereElse?*   MasterControl could be your next (and last) career move!*   Here are some of the benefits MasterControl employees enjoy:*   Competitive compensation*    100% medical premium coverage (yes, you read that right!)*    401(k) plan with company match*    Generous PTO packages that increase with tenure*    Schedule flexibility*    Fitness clubs (you get paid to have fun and be active!)*    Company parties and employee recognition programs*    Wellness programs (free Fitbit, gym membership and athletic shoe reimbursements, etc.)*    Onsite physician and massage therapist*    Innovation center and gaming rooms at the office*    Dental/vision plans*    Employer paid life insurance policy*    Much, much more!*   Applicants must be currently authorized to work in the United States on a full-time basis.* *","https://www.indeed.com/rc/clk?jk=aa0df087c0d8e7a0&fccid=13488d4436d854ff&vjs=3","On-site","Full-time","MSIS",0,0,0,0,0,0,1,0,0,0,0,0,0,0,0,0,0,0,0,0,"4b66dbc6a2997b3b7e22804170426e4d"
