"","Search","Date","Title","Company","Location","Description","Link","Work Model","Job_Type","Program","R","Python","SQL","Tableau","PowerBI","Azure","Excel","Talend","SAS","Spark","Qualtrics","Domo","Salesforce","SAP","Hadoop","Qlik","Looker","Zoho","Stata","Snowflake","ID"
"37","network security engineer",2022-04-30,"Azure Architect Leader-Director","PRICE WATERHOUSE COOPERS","Salt Lake City, UT 84111 (Downtown area)","A career in Cloud Architecture will provide you with the opportunity to bring our clients a competitive advantage through delivering architecture solutions, governance and alignment during the delivery process and ensure alignment to the overall project objectives and technology strategy. As part of our Cloud Architecture team, you'll focus on the architecture of data centers, including the design and implementation of network architecture and information storage to optimize innovation and program delivery for our clients.*To really stand out and make us fit for the future in a constantly changing world, each and every one of us at PwC needs to be an authentic and inclusive leader, at all grades/levels and in all lines of service. To help us achieve this we have the PwC Professional; our global leadership development framework. It gives us a single set of expectations across our lines, geographies and career paths, and provides transparency on the skills we need as individuals to be successful and progress in our careers, now and in the future.*As a Director, you'll work as part of a team of problem solvers, helping to solve complex business issues from strategy to execution. PwC Professional skills and responsibilities for this management level include but are not limited to:*Arrange appropriate assignments and experiences to support others' learning and development.*Seek out different ways to use current and relevant technological advances.*Analyse marketplace trends - economical, social, cultural, technological - to identify opportunities and create value propositions.*Deploy methods to keep up with, and stay ahead of, new developments and ideas.*Offer a global perspective in stakeholder discussions and when shaping solutions/recommendations.*Drive and take ownership for developing networks that help deliver what is best for stakeholders.*Proactively manage stakeholders to create positive outcomes for all parties.*Uphold the firm's code of ethics and business conduct.*Job Requirements and Preferences:Basic Qualifications:Minimum Degree Required:*Bachelor DegreeMinimum Years of Experience:*12 year(s)Required Knowledge and Skills:*Demonstrates thought leader-level abilities with, and/or a proven record of success directing efforts*Leading the development of Azure based solutions, including;*Designing resilient and scalable Azure-based architectures, and validating that they adhere to customer technical requirements and leading practices;*Deploying Azure resources with infrastructure as code automation (e.g., Terraform, ARM, PowerShell);*Rolling out cloud automation solutions for managing and maintaining the deployed environments;*Running Project or Client Engagement Leader;*Leading transformational projects centered around Azure Cloud services (from inception to implementation);*Leading the creation and execution of detailed migration, cut-over, or go-live plans;*Managing and evaluating the performance of team members / direct reports;*Coaching Azure engineers / developers in order to help them upskill and succeed in completing their assigned responsibilities;*Managing project operations, including effort estimation, staffing, budget, timelines, deliverables, risks & issues;*Preparing and presenting status reports to multiple stakeholders;*Owning and maintaining strong relationships with customer counterparts and vendors (e.g., Microsoft);*Defining and advocating the Azure architecture vision from a strategic perspective, including interdependencies with internal and external platforms, tools, and systems; and,*Possessing consulting and / or client facing experience.*Preferred Qualifications:Certification(s) Preferred:*Microsoft Certified: Azure Fundamentals*Microsoft Certified: Azure Administrator*Microsoft Certified: Azure Architect*Preferred Knowledge/Skills:*Demonstrates thought leader-level abilities with, and/or a proven record of success directing efforts*Participating in or leading cloud strategy projects (e.g., current state assessment, future state recommendations, initiatives roadmap);*Developing secure and resilient architectures in Azure, with experience in all of the following areas: Azure Cloud IaaS & PaaS services , Identity and access management , Software-defined networking, security, governance, and compliance, Cloud automation and provisioning tools / techniques (ARM, Terraform, and Azure DevOps a plus), Azure native disaster recovery & resilience capabilities;*Leading the migration of on-premises workloads to the cloud, and / or developing cloud-native application architectures as an engineer or solution architect; and,*Possessing working experience with Azure Virtual Desktop / Windows 365, implementing SAP on Azure, multi-cloud or hybrid-cloud deployments, cloud native application development and containers (e.g. Docker, Kubernetes), Site Reliability Engineering .*At PwC, our work model includes three ways of working: virtual, in-person, and flex (a hybrid of in-person and virtual). Visit the following link to learn more: https://pwc.to/ways-we-work.*PwC does not intend to hire experienced or entry level job seekers who will need, now or in the future, PwC sponsorship through the H-1B lottery, except as set forth within the following policy: https://pwc.to/H-1B-Lottery-Policy.*All qualified applicants will receive consideration for employment at PwC without regard to race; creed; color; religion; national origin; sex; age; disability; sexual orientation; gender identity or expression; genetic predisposition or carrier status; veteran, marital, or citizenship status; or any other status protected by law. PwC is proud to be an affirmative action and equal opportunity employer.*For positions based in San Francisco, consideration of qualified candidates with arrest and conviction records will be in a manner consistent with the San Francisco Fair Chance Ordinance.*For positions in Colorado, visit the following link for information related to Colorado's Equal Pay for Equal Work Act: https://pwc.to/coloradoadvisorydirector.","https://www.indeed.com/rc/clk?jk=5202215972157988&fccid=5e964c4afc56b180&vjs=3","Hybrid","Part-time","MSCM",0,0,0,0,0,1,0,0,1,0,0,0,0,1,0,0,0,0,0,0,"79cc176e73b5433f1e073b139e3f837c"
"38","data architect",2022-04-30,"GCP Cloud Engineer - Manager","PRICE WATERHOUSE COOPERS","Remote in Salt Lake City, UT 84111","A career in our Digital and Applications Design practice, within Application and Emerging Technology services, will provide you with a unique opportunity to help our clients identify and prioritise emerging technologies that can help solve their business problems. We help our clients design approaches to integrate new technologies, skills, and processes so they can get the most out of their technology investment and drive business results and innovation. Our team helps organisations align their business and operational requirements through the careful design of digital platforms and applications. You’ll help our clients with application optimisation, strategic integration of custom packaged solutions like Enterprise Resource Planning and Customer Relationship Management, and roadmap development.*To really stand out and make us fit for the future in a constantly changing world, each and every one of us at PwC needs to be a purpose-led and values-driven leader at every level. To help us achieve this we have the PwC Professional; our global leadership development framework. It gives us a single set of expectations across our lines, geographies and career paths, and provides transparency on the skills we need as individuals to be successful and progress in our careers, now and in the future.*As a Manager, you'll work as part of a team of problem solvers, helping to solve complex business issues from strategy to execution. PwC Professional skills and responsibilities for this management level include but are not limited to:*Develop new skills outside of comfort zone.*Act to resolve issues which prevent the team working effectively.*Coach others, recognise their strengths, and encourage them to take ownership of their personal development.*Analyse complex ideas or proposals and build a range of meaningful recommendations.*Use multiple sources of information including broader stakeholder views to develop solutions and recommendations.*Address sub-standard work or work that does not meet firm's/client's expectations.*Use data and insights to inform conclusions and support decision-making.*Develop a point of view on key global trends, and how they impact clients.*Manage a variety of viewpoints to build consensus and create positive outcomes for all parties.*Simplify complex messages, highlighting and summarising key points.*Uphold the firm's code of ethics and business conduct.*We are looking for a GCP Cloud Architect who's passionate about helping customers build applications at scale. Being an experienced technologist with technical depth and breadth, aided with interpersonal skills, you will work with our team of motivated technologists delivering end-to-end solutions. You will help customers transition to the cloud in a high-value migration approach that leverages various design patterns and practices in an agile model.*Job Requirements and Preferences:Basic Qualifications:Minimum Degree Required:*Bachelor DegreeMinimum Years of Experience:*5 year(s)Preferred Qualifications:Certification(s) Preferred:*Google Cloud Professional Cloud Architect certification and/or other Google Cloud certifications*Preferred Knowledge/Skills:*Demonstrates extensive level of ability to, and/or a proven record of success directing efforts in the following areas:*Working knowledge of Cloud platforms and the technologies that make them work. (AWS, Azure, Google Cloud Platform); and,*Working knowledge of IT Service Management and how it is implemented across different operating models. (ITIL, ServiceNow).* Demonstrates extensive level of ability to, and/or a proven record of success directing efforts in the following areas:*Excelling in delivering high-value solutions in dynamic and ambiguous environments;*Leading complex projects by bringing together the right perspectives, identifying roadblocks, and integrating feedback from clients and team members;*Guiding delivery from project scoping to conclusion, while consistently keeping the client’s goals in mind;*Having a passion for developing and growing team members;*Communicating at an executive level;*Serving as both a mentor and advocate for your team and PwC Community;*Excelling in creating and maintaining professional relationships and leverage your professional network to seek new business opportunities;*Approaching new projects with an open mind, learn from your mistakes and ask for help when needed;*Believing empathy for coworkers and customers is key to your success;*Believing in the value created by diverse teams and can adapt to a variety of working styles; and,*Leading development of thought leadership and sales materials to grow the PwC Community, build new client relationships and business opportunities.* Demonstrates extensive level of ability to, and/or a proven record of success directing efforts in one or more of the following areas:*Cloud Platforms (Amazon Web Services (AWS), Azure, GCP);*Cloud Strategy, Design, Architecture and Migration;*DevOps, Automation CI/CI;*AI, Machine Learning, IoT ;*ServiceNow, ITIL, SACM;*COBIT, Remedy, Service Catalogue, CMDB; and,*Incident, Problem and Change Management.*At PwC, our work model includes three ways of working: virtual, in-person, and flex (a hybrid of in-person and virtual). Visit the following link to learn more: https://pwc.to/ways-we-work.*PwC does not intend to hire experienced or entry level job seekers who will need, now or in the future, PwC sponsorship through the H-1B lottery, except as set forth within the following policy: https://pwc.to/H-1B-Lottery-Policy.*All qualified applicants will receive consideration for employment at PwC without regard to race; creed; color; religion; national origin; sex; age; disability; sexual orientation; gender identity or expression; genetic predisposition or carrier status; veteran, marital, or citizenship status; or any other status protected by law. PwC is proud to be an affirmative action and equal opportunity employer.*For positions based in San Francisco, consideration of qualified candidates with arrest and conviction records will be in a manner consistent with the San Francisco Fair Chance Ordinance.*For positions in Colorado, visit the following link for information related to Colorado's Equal Pay for Equal Work Act: https://pwc.to/coloradoadvisorymanager.*#LI-Remote","https://www.indeed.com/rc/clk?jk=7f88f47d66b0d17f&fccid=5e964c4afc56b180&vjs=3","Hybrid","Part-time","MSIS",0,0,0,0,0,1,1,0,0,0,0,0,0,0,0,0,0,0,0,0,"58311036abb9e254d08f047bda972a23"
"39","data architect",2022-04-30,"PwC Technology - Salesforce Senior Developer","PRICE WATERHOUSE COOPERS","Remote in Salt Lake City, UT 84111","A career in Information Technology, within Internal Firm Services, will provide you with the opportunity to support our core business functions by deploying applications that enable our people to work more efficiently and deliver the highest levels of service to our clients. You’ll focus on managing the design and implementation of technology infrastructure within PwC, developing and enhancing both client and internal facing applications within PwC, and providing technology tools that help create a competitive advantage for the Firm to drive strategic business growth. Our System Architecture team helps build customisable specific system solutions that enhance PwC’s system capabilities to appropriately serve all client needs. As part of the team, you’ll use enterprise architecture across application areas to build delivery models that map PwC capabilities to business needs outlined by clients.*To really stand out and make us fit for the future in a constantly changing world, each and every one of us at PwC needs to be a purpose-led and values-driven leader at every level. To help us achieve this we have the PwC Professional; our global leadership development framework. It gives us a single set of expectations across our lines, geographies and career paths, and provides transparency on the skills we need as individuals to be successful and progress in our careers, now and in the future.*As a Senior Manager, you'll work as part of a team of problem solvers, helping to solve complex business issues from strategy to execution. PwC Professional skills and responsibilities for this management level include but are not limited to:*Encourage everyone to have a voice and invite opinion from all, including quieter members of the team.*Deal effectively with ambiguous and unstructured problems and situations.*Initiate open and candid coaching conversations at all levels.*Move easily between big picture thinking and managing relevant detail.*Anticipate stakeholder needs, and develop and discuss potential solutions, even before the stakeholder realises they are required.*Contribute technical knowledge in area of specialism.*Contribute to an environment where people and technology thrive together to accomplish more than they could apart.*Navigate the complexities of cross-border and/or diverse teams and engagements.*Initiate and lead open conversations with teams, clients and stakeholders to build trust.*Uphold the firm's code of ethics and business conduct.*Job Requirements and Preferences:*Basic Qualifications:*Minimum Degree Required:**High School DiplomaMinimum Years of Experience:**6 year(s) of experience serving as a solution architect on Salesforce technologies.Preferred Qualifications:*Degree Preferred:**Bachelor DegreePreferred Fields of Study:**Information Technology, Computer Systems Analysis, Management Information Systems, Computer Applications, Computer Engineering, Computer ProgrammingCertification(s) Preferred:*Salesforce Certified Application Architect*Salesforce Certified System Architect*Any additional Advanced, Designer, Developer, Architect & Consultant Certifications are a plus*Preferred Knowledge/Skills:*Demonstrates intimate abilities and/or a proven record of success in understanding business problems and developing Salesforce technology-enabled solutions that address the needs of large organizations, including the following areas:*Exhibiting experience working with Salesforce customizations using Lightning Platform, Custom Apex, Lightning Components, or Lightning Web Components;*Utilizing experience working in multiple Salesforce orgs and large global projects with thousands of users;*Understanding all phases of applications systems analysis and SDLC development methodologies including Agile, Scrum, iterative, and waterfall, using blended resources;*Effectively working and communicating with Business/Technical Analysts and other Architects on requirements, implementation approaches, solutions, and standards;*Demonstrating ability to assess the impact of new requirements on Salesforce end users across Sales, Service, Marketing, IT, and Operations, including core technologies and processes, and all upstream and downstream connected applications and integrations;*Adapting rapidly to changes and understanding the severity and impact of these changes in order to support and use future technology;*Assessing new technologies, concepts and business models, while demonstrating a history of staying current in emerging technology trends to meet business goals; and,*Advising and influencing leaders on trends that could potentially affect the success of a function or business area.*Demonstrates intimate abilities and/or a proven record of success in performing functional and technical capabilities including the following areas:*Understanding of Salesforce architectural design and application delivery best practices and custom development architecture patterns;*Utilizing Salesforce Custom Development & Solution Architecture experience while implementing custom Apex, trigger frameworks, Lightning Components, Lightning Web Components, Platform Events, Shield Encryption, and Event Monitoring;*Effectively utilizing Salesforce Technological Product Suites (Data Loader, Workbench, IDE tools like Visual Studio Code, Eclipse, etc.);*Creating and demoing working proofs of concept for business requirements using the Salesforce platform;*Understanding third party integration and functionality and impact of these integrations, and ability to document and diagram an end-to-end process;*Collaborating with multidisciplinary teams in resolving complex technical issues, and adhering to applicable application technology guidelines and data privacy;*Utilizing Design Styles, Patterns and Methodologies ( MVC, SOA, Microservice, SPA, MVC/MVP, Event-driven Architecture);*Orchestrating Microservices to create business APIs and REST API design and creation;*Supporting technology and the business to align cloud standards, and maintaining the key Enterprise Architecture deliverables for cloud technology; and,*Providing technical recommendations to senior leaders to assist the decisions on proposed solutions.*Demonstrates intimate abilities and/or a proven record of success as a team leader:*Providing coaching, technical mentoring, guidance, clarification, and feedback to team members;*Arranging and sponsoring appropriate assignments and experiences to help people realise their potential and support their long-term aspirations;*Maintaining quality within a diverse, fast paced environment, while collaborating effectively across teams and multiple projects and initiatives in different phases simultaneously;*Building trusting and influential relationships and engaging with vendors and third parties as appropriate; and,*Promoting a culture of innovation by continuously seeking opportunities for improvement within role, processes, team and the IT organisation as a whole.*At PwC, our work model includes three ways of working: virtual, in-person, and flex (a hybrid of in-person and virtual). Visit the following link to learn more: https://pwc.to/ways-we-work.*PwC does not intend to hire experienced or entry level job seekers who will need, now or in the future, PwC sponsorship through the H-1B lottery, except as set forth within the following policy: https://pwc.to/H-1B-Lottery-Policy.*All qualified applicants will receive consideration for employment at PwC without regard to race; creed; color; religion; national origin; sex; age; disability; sexual orientation; gender identity or expression; genetic predisposition or carrier status; veteran, marital, or citizenship status; or any other status protected by law. PwC is proud to be an affirmative action and equal opportunity employer.*For positions based in San Francisco, consideration of qualified candidates with arrest and conviction records will be in a manner consistent with the San Francisco Fair Chance Ordinance.*For positions in Colorado, visit the following link for information related to Colorado's Equal Pay for Equal Work Act: https://pwc.to/coloradoifsseniormanager.*#LI-Remote","https://www.indeed.com/rc/clk?jk=4b5e785302600921&fccid=5e964c4afc56b180&vjs=3","Hybrid","Part-time","MSIS",0,0,0,0,0,0,0,0,0,0,0,0,1,0,0,0,0,0,0,0,"1d55d22ae6627bdbb699f960ef9ee7da"
