"","Search","Date","Title","Company","Location","Description","Link","Work Model","Job_Type","Program","R","Python","SQL","Tableau","PowerBI","Azure","Excel","Talend","SAS","Spark","Qualtrics","Domo","Salesforce","SAP","Hadoop","Qlik","Looker","Zoho","Stata","Snowflake","ID"
"11","cloud engineer",2022-05-29,"FIELD SENIOR PROJECT ENGINEER / PROJECT MANAGER-COMMERCIAL C...","Integrated Builders Group","Remote in Salt Lake City, UT 84115","* *  INTEGRATED BUILDERS GROUP (IBG) is a comprehensive design-build commercial contractor experiencing tremendous growth across the western states and most recently expanding to Texas. Headquartered in El Dorado Hills, California, IBG has been providing design-build services since 2006. We stand as the essential design-build firm within our niche markets – knowledgeable, passionate, and progressive. Our “Thrilled Client Commitment” means we exceed expectations through strategic guidance, total accountability, and enthusiastic partnership at every stage of our projects.*   *   The IBG team is nimble, accountable, and enjoys the autonomy provided by a tight-knit group of professionals in charge of every aspect of project development, from strategic planning to project commissioning.*   *   Opportunity *  We currently have an immediate opening for a FIELD SENIOR PROJECT ENGINEER / PROJECT MANAGER working remotely to support any one of our Northern CA, Southern CA, Utah, or Texas markets. The ideal candidate will have 5+ years of experience in commercial construction and a bachelor’s degree in Construction Management or Engineering. This role focuses on planning, coordination, and leadership on the project worksite by establishing effective working relationships with on/off-site staff and subcontractors. This person is reliable, organized, has integrity, and values producing quality work; a self-starter who can take ownership and use independent judgment. Above all, this person must have strong ethical standards and be able to fulfill client commitments. *   Job Responsibilities *  You will be held accountable to drive projects from the end of the design process, through construction to commissioning. *   Work from home and field management on the Jobsite, including planning, scheduling, procurement, and supervision of all tiered suppliers and subcontractors *   Quality control of craftsmanship and worksite safety *   Strong plan reading and detail analysis capabilities; able to perform scope breakdown and execute just-in-time workaround plans while under pressure *   Perform Bidding / Bid Analysis / Buyout *   Perform Submittal Management / Tracking / Distribution *   Procurement, including developing detailed subcontract scope of work and persistent tracking to delivery *   RFI / ASI Management *   Document control *   Change event/order reviews and processing *   Develop and maintain project schedule *   Manage project budgets *   Project closeout *   Continual coordination with the project team, i.e., project leadership, superintendents, sub-contractors, suppliers, and clients*   *   Requirements *  A four-year college degree, preferably in Construction Management or Engineering, or equivalent work experience *   Professional level working knowledge of Microsoft Office Suite (Outlook, Word, Excel, MS Project) *   Adept at utilizing Procore project management software or equal *   Effective written and verbal communication skills *   A proven ability to drive projects from design through commissioning.*   *   In addition to offering a highly competitive salary, we also offer health/dental/vision, 401(k), profit sharing, upward mobility, good work-life balance, and a pet-friendly environment. We’re a professional company with a great vibe. For more information on our company, please visit www.integratedbg.com. IBG is an equal opportunity employer.* * *","https://www.indeed.com/rc/clk?jk=4378e986204e0cbc&fccid=e969396fe8dad716&vjs=3","Remote","Part-time","MSIS",1,0,0,0,0,0,1,0,0,0,0,0,0,0,0,0,0,0,0,0,"fca3822930b3ee8f771feeed99fc0b64"
"12","network security engineer",2022-05-29,"Software Engineering Team Lead","Ivanti","Remote in Salt Lake City, UT","Join Our Team**Looking for more than just a job? We like developing our people just as much as we like developing great products and services.*Ivanti is a global leader in IT systems and security management, service management, asset management, and mobility management solutions, and is experiencing significant growth worldwide and has received numerous awards for being a Top Place to Work, as well as many accolades for the products it develops. Our customer focus strategy is driven by the company's core values, including innovation, accountability, teamwork, and trust, it's an exciting time to join Ivanti!**If you're passionate about what you do and are interested in developing solutions that make a difference and in having fun while doing it, Ivanti is the place for you!** What We Do*Empower users to seamlessly and securely connect from any place in the world that offers air, water and… Internet!*Equip organizations with the right tools to configure access, manage and enforce compliance with a holistic view on network, users and usage.*Empower organizations to continue to breathe easy, now with an added sense of invincibility.*Work hard so that you can focus on the things you want to!*Organizational Culture**Ivanti provides a supportive environment for motivated individuals looking to grow their careers and realize high earnings potential. Join a challenging, technology focused environment, earn a competitive salary and benefits package, receive the training you need to stay ahead of the curve, and work in a casual, smart, and fast-paced organization.**The role can be remote, or you can work from one of Ivanti's US offices, the choice is yours.**We are looking for a Software Engineering Team Lead to drive one of our engineering teams in the US as the team works primarily to add features to our Service Manager platform.**What you'll do**Working with a dedicated product owner you'll play a role in translating user stories into deliverables and coordinating the effort of the team to release an overall vision for the features and application. You'll be expected to take on development work within the sprint demonstrating your considerable technical experience.**You'll be a pole bearer for your team by mentoring of the engineers and leading by example. Part of this responsibility is to maintain a high level of code quality by actively inserting yourself into code reviews, facilitating technical discussions and engaging with architects when appropriate. You'll also be expected to meet regularly with your manager to discuss team dynamics and areas for improvement.**You'll be invited to the team lead forum to represent your team and discuss initiatives that will improve the experience for each engineer working on ISM and ultimately improve our engineering group's ability to deliver quality software to our customers.**Core Responsibilities*Technical project management for the features your team are tasked with adding to the application.*Scrum master responsibilities for your team. This involves working with the product owner and leading refinement / planning sessions, so stories are clear and appropriately sized*Ensuring code quality remains high in the team by setting standards to be followed and engaging directly with your team to provide feedback.*Contribute directly to the design and development of solutions to be hosted in the cloud and largely consumed via browser and API interfaces.*Requirements*Minimum 15 years' experience in software engineering or development roles including leadership roles and complex projects where you have led*Minimum 5 years' experience as Senior or higher-level role directly contributing to team success through mentoring*Experience with best practice development principles such as SOLID & OOP design patters*Full stack development experience, preferably with Microsoft technologies using C# to develop scalable enterprise level web applications*An appreciation for and experience of implementing automated testing such as unit tests and integration tests*A deep understanding of the software development process, including Continuous Integration and release strategies**At Ivanti, we are One. One Company formed from many. One people, formed by an environment of mutual respect and trust made up by people working together without regard to race, color, religion, sex, pregnancy (including childbirth, lactation, and related medical conditions), national origin, age, physical and mental disability, marital status, sexual orientation, gender identity, gender expression, genetic information (including characteristics and testing), military and veteran status, and any other characteristic protected by law. As a global company, we believe that diversity and inclusion among our team members is critical to our success and we proactively strive to recruit, develop, and retain the best and brightest people from the most diverse candidate pools we can find all over the world.**External Recruiting Agencies/Vendors: Ivanti Software does not currently engage with external recruiting agencies and will not accept unsolicited resumes from any external agency. Unsolicited resumes submitted by agencies to Ivanti will become the property of Ivanti and may be contacted and engaged with directly. Ivanti maintains a preferred vendor list and only engages with these agencies from time to time. Ivanti has not agreed to pay placement or any other fee to companies who have not been specifically retained to conduct a candidate search**#LI-JH1**#LI-Remote","https://www.indeed.com/rc/clk?jk=a953a33209b9c0a3&fccid=f8cf3f43eec9954b&vjs=3","Remote","Part-time","MSCM",0,0,0,0,0,0,0,0,0,0,0,0,0,0,0,0,0,0,0,0,"57b386d899f1fd501e29f87aa533a66d"
"13","business intelligence analyst",2022-05-29,"VP Sales/CRM Systems and Business Analysis","LifeVantage Corporation","Sandy, UT 84070","* Qualifications* 10+ years of relevant work experience in project management, including, project plans, developing test scenarios and cases, strategies, cost/benefit analysis, timeline, and risk analysis*  7+ Years’ experience in managing business analysis activities and teams*  5+ years in managing Sales/CRM implementations, with extensive experience in managing application development activities*  Deep understanding of CRM systems and process mapping capabilities*  Ability to use both qualitative and quantitative data to influence key stakeholders and make compelling product decisions*  Familiarity and comfort with data, including the ability to use data to analyze and monitor product health and to make hard prioritization decisions*  Deep experience testing at scale, including partnering with data science to build new products*  Have excellent analytical and technical skills. Comfortable operating across cross-functional boundaries that includes both internal business and technology teams, external partners and solution implementation vendors*  Ability to weigh competing priorities, manage tradeoffs and evaluate opportunistic new ideas with stakeholders, driving to consensus while maintaining a clear focus on overarching business priorities*  Excellent at multi-tasking including managing multiple large complex initiatives simultaneously and demonstrate flexibility to accommodate changing priorities*  Strong ability to collaborate across functions and levels seamlessly juggling the priorities of multiple stakeholders*  Prior experience in managing delivery lifecycle phases from idea stage through planning, design, development, testing and rollout phases*  Have excellent Vendor management skills that in the past included both on-shore and off-shore teams and be experienced in preparing, interpreting, strengthening and driving vendor contractual agreements*  Strong executive presence, leadership, and management skills*  Ability to cultivate and maintain positive relationships with business stakeholders*  Ensure clear, confident and collaborative manner when articulating concepts, challenges, complexities in order to drive standards and best practices*  Have effective organization skills including high attention to detail and the ability to implement and influence change*  Biased for action: you make good decisions with incomplete data and are constantly optimizing for learning*  Have excellent interpersonal skills in teamwork, facilitation, negotiation and influence*  Superior communication skills: you communicate clearly and concisely and can tailor your message to your audience*  Ability to work in a highly dynamic, fast-paced environment with aggressive project timelines and continual client delivery*  Ability to learn new concepts and integrate varying inputs, comprehend the intent of a business partner’s needs, and help shape the solution*  Experience with business process modeling and related tools* Responsibilities* This job supports a broad, enterprise-wide view of the business and varying degrees of appreciation for strategy, processes and various platform capabilities, enabling technologies, and governance*  Guides the principles, direction and standards as it relates to the business process solution framework*  Takes a lead role in defining, preparing and modeling current and future state business process flows that can be used in future analysis to extend and mature the business architecture and perform gap analysis*  Conduct interviews and facilitate meetings with business partners to derive and validate business process models and drive operational efficiencies controls and quality*  Serves as a subject matter expert and liaison conveying information needs of the business to IT and data constraints to the business*  Develops and applies a structured business architecture strategy and methodology in relation to the Platforms and Technology based on individual business area needs and strategic direction*  Identify and develop recommendations for business process or workflow issues within the organization*  Continually refreshing, evaluating, and maintaining the current and future state of the Business, artifacts, and related interfaces of the Enterprise Architecture, Business, Information, System, Technology and Security Architecture*  Serves as a mentor to other team members*  Develop and maintain business process flows, value stream maps, and reference architectures for complex processes spanning multiple product areas*  Create conceptual models demonstrating how people, process and technology interoperate within the organization*  Partner with Business Leads to develop and maintain capability roadmaps informed by industry research and business strategy*  Monitor industry architecture trends and determine the benefits of modifying or expanding the framework*  Operational implementation and adoption of new business processes*  Leads and works closely with project/product managers, technical architecture, and the rest of the implementation team to ensure proper delivery of solutions*  Work closely with operational change management team to ensure business process changes are properly understood and documented*  Business process re-engineering driven from business process activities leveraging industry best practices*  Work with internal product/programs to validate business decisions when needed*  Consulting and collaborating with other areas architectural teams that contribute to the Enterprise Business Architecture*  In conjunction with IT leadership, support the marketing and sales teams in developing a multi-year business capability strategy and roadmap for new/changed technology solutions, anticipating potential impacts on business processes, structures and governance*  Represent LifeVantage to outside vendors, suppliers, and business partners*  Owns delivery in our Sales/CRM applications landscape to drive meaningful change for our users*  Collaborates to build personalized experiences to help transform how we interact with customers daily*  Think beyond the bounds of the traditional technology solutions to figure out how we can deliver value* Job Type: Full-time*","https://www.indeed.com/company/LifeVantage-Corporation/jobs/VP-Sales-Crm-System-Business-Analysis-eccb98b0f18aacf9?fccid=a32a883c9913d81a&vjs=3","On-site","Full-time","MSIS",0,0,0,0,0,0,1,0,0,0,0,0,0,0,0,0,0,0,0,0,"81f3d3c027c545a5065a93e06f23317e"
"14","security manager",2022-05-29,"Safety & Security Supervisor - $1000 Bonus! Hiring Event","Marriott's Summit Watch & Marriott's MountainSide","Salt Lake City, UT+6 locations","* *  Safety & Security Supervisor *  Supervise the Loss Prevention Staff. *   Patrol all areas of the property; secure rooms; assist guests with room access. *   Conduct emergency response drills, conduct physical hazard/safety inspections, investigations, interviews, and key control audit. *   Monitor Closed Circuit Televisions and alarm systems. *   Authorize, monitor, and document access to secured areas. *   Assist owners/guests/associates during emergency situations. *   Respond to accidents, contact EMS or administer first aid/CPR as required. *   Gather information and complete reports. *   Maintain confidentiality of reports/documents, release information to authorized individuals. *   Defuse disturbances in accordance with company policies and procedures. *   Resolve safety hazard situations. *   Handle all interruptions and complaints. *   Escort unauthorized persons from the property. *   Ensure compliance with alcoholic beverage control laws. *   Call for assistance using proper code responses. *   Assist management in training, motivating and coaching employees; serve as a role model and first point of contact of the Guarantee of Fair Treatment/Open Door Policy process. *  Requirements: *  Must be able to work a flexible schedule, including complete weekend and holiday availability *   Must have great customer service skills – all of our positions come into contact with guests! *  What does MVW offer? *  Competitive Pay! *   Medical/Dental/Vision/401K opportunities! *   Travel discounts! *   Credit Union Membership! *   Growth and Development Opportunities! *  How to attend *  *   Our nearest large cross streets are 2100 South & 300 West. Bearcat Drive sits at approximately 2300 South just inside the Time Square Business Park. Upon turning off 300 West into the business park, proceed toward the first two-story brick building with the Marriott Vacations Worldwide marquee. You may park in the reserved ‘Visitor’ parking stalls along the north side of the building, or in any non-reserved parking space in the parking lot. *  Trax riders: There is a Trax station at 2100 South near Best Buy. We are about a block away if you head south on 300 West [towards RC Willey]. Cross 300 West at the stoplight where RC Willey is and head toward the Time Square Business Park. We are located in the main two-story building with the Marriott Vacations Worldwide marquee.*  The entrance to the building is on the north side of our building; accessed from the main parking lot (not the street side).*   *  What to prepare *   *  Please bring a copy of your resume *  *  Preferred dress code *   Business casual (dress pants/skirt, button down/blouse, optional tie) *  What is a hiring event? *   Think of it like a job fair, but for one company and more personal. Hiring events are a great way for employers to fill multiple roles quickly. Hiring is a human process, and they would like to meet you to see if you’re a fit!* *","https://www.indeed.com/pagead/clk?mo=r&ad=-6NYlbfkN0Btxs39KmTzjw_u_hUXcyTcLpNeUj18C2Nw5A7DCW0FWNwH-XjtYgXl9yrk4TVCwURL_eLIygFNT2YlvC0GUrmN-D1S0ifm0Xc_EFMp1vpR6Pbvyx6en-PZ8FKbMpNLtcxeoZrW1NtbRIoiaC_ph8Ty7yoqSLUPa0i-FXk0MANzZbdGLrvrBCo8F3jEvF-mJhbFEAGqYFj9LxiqBX5sZKVFQDv88YAOGIH510Zx__qIhrBYdb3tKznNHINFhNz3fiLTeu8ixfaCafESFs9Eiu5IIJdms7Kmr5WMqCEcuFXBDuUstd5drF57EUjOIRZCYWqcm6Ytntp34xhj7891QE9qAvpXIoE8f7eY3wEBHH6kOZ97tK5lvhvfnMj310Otp_f64nNKszgVrrnGhMjlAqKUcA7vfkauLp5cgyCM8GA276xdIIocGpZSTxIjHOgN_HV1zepQOztJ6y2JaFxKGxNkSGaH34LFc8gwX6veitZT_aKCUzgnOjmpQOeXRqekbmIBg8Mf6hqGcNJCt8zKwiWN6V3gPgz6avhR39kZ3ykf8PhlDXgOlCgs7mi4wGB68JdiTsLfi2443fN48ihXYPVIJW3RaoqPxV2kHk0fqibTUPRlTKsNo3xU7BnIOUNXy7aE7VQlmgWJ0j737OzlXOF437kp7IT7zV_GeqQUjh6bdRm6xKYfOuL_6Ifl6Pj7YRQaqJC040BGv3L3VDkZwkqemRezHMXrMMpp4hF3z1hFqCG4o2gm3DGJz8BCfOvtL4Q=&p=0&fvj=0&vjs=3","On-site","Part-time","MSCM",1,0,0,0,0,0,0,0,0,0,0,0,0,0,0,0,0,0,0,0,"afc364a77abebac39662f76513f293e9"
