"","Search","Date","Title","Company","Location","Description","Link","Work Model","Job_Type","Program","R","Python","SQL","Tableau","PowerBI","Azure","Excel","Talend","SAS","Spark","Qualtrics","Domo","Salesforce","SAP","Hadoop","Qlik","Looker","Zoho","Stata","Snowflake","ID"
"1","network security engineer",2022-05-23,"Senior Technical Delivery Manager","DISH","Orem, UT 84058+5 locations","* *  Department Summary*  About Dish *   Our Vision is to change the way the world communicates. Our Mission is to connect people and things.*   We are reimagining the way people watch TV with services like Sling and AirTV. We are redefining the boundaries of communication and connectivity too, with our planned green field 5G cloud native network build out and the Internet of Things. Nothing is out of our reach, and the opportunity to shape the future of entertainment and technology has never been more tangible.*  Job Duties and Responsibilities*  About the position *   Our mission is to build a modern, hybrid cloud enterprise platform for all DISH to consume. Our environment is:*   Complex *   Highly elastic *   Based on some of the latest and greatest cloud native technologies *   Very fast paced *   Your team will be: *  Building the modern platform of the future for Dish leveraging best in class, modern technologies *   Leading the Platform Engineering Center of Excellence *   Driving a customer centric approach to the evolution of our platform *   Continuing our efforts to realize a robust hybrid cloud infrastructure *   Establishing and evolving a best in class engineer experience *   Enabling modern applications to run effectively, with the right level of observability and security based into the platform *   Facilitate iteration planning sessions, daily team stand-ups, grooming sessions, and retros *   Track and report on team work completed, capacity, backlog, velocity, etc. *   Forecast product/feature delivery timelines *   Use metrics and feedback to improve team and organization processes, best practices, performance, and delivery *   Delivering software in an agile environment, continuously *  Skills, Experience and Requirements*   A successful Delivery Manager will have experience with: *  Ability to drive technical initiatives having good grasp of the DevOps, cloud native concepts *   Ability to liaison between engineering teams, stakeholders, technical experts and facilitate technical discussions *   Good understanding of setting up systems in an enterprise especially integration challenges *   Setting up procedural guidelines to establish a successful delivery process *   Proactively remove obstacles to drive momentum and progress. Identify communication gaps, manage issue escalations and provide support to teams balancing competing priorities. *   An emotionally intelligent, strong leader capable of building a high-performance team *   Evaluating consumer feedback and instituting changes as necessary to manage expectations *   Assist with the production of comprehensive project plans and documentation to enable the project to be managed against a clear set of defined deliverables and milestones *   Conduct an evaluation of the project and any follow-on action recommendations as required *   Produce project documentation and create knowledge libraries with the end goal of using this documentation to train and support the end users. *  Basic Requirements: *   A successful Senior Technical Product Owner will have: *  BA/BS in a technical or business discipline (information systems, engineering, computer science, finance, business administration, or accounting) or combination of education and experience *   6+ years of Product Owner, Product Manager, Systems Analyst, Business Analyst, Project Manager or equivalent combination of education and experience *   Demonstrated understanding of and experience using standard SDLC processes and methodologies *   Demonstrated knowledge and proven experience with Agile, DevOps, and Cloud (AWS, GCP, Azure) tools and methodology *   Proven track record of leadership of product accomplishments including successful project launches *   Prior experience in devops, CI/CD pipeline, Jira, ServiceNow, GitLab, Selenium, Docker, Jenkins, Infrastructure Orchestration as code, AWS, GCP, Apigee, Container Orchestration, Hashicorp Stack, etc. *  Technologies in our environment: *   Here are some of the key technologies that make up our environment. While we do not expect you to have a nuanced understanding of each, the more of these you are familiar with the better.*   Core platform services: Linux, Kubernetes, Docker, Rancher, Consul, AWS, Jaeger, gRPC, Istio, Calico, GCP, NGINX, etc *   Programming Languages: Go, Java, Python, React/Node js, typescript, Ruby, etc *   CI/CD & DevOps tools: Gitlab, Jenkins, Artifactory, SonarQube, ArgoCD, Salt Stack, Ansible, Vault, Consul, Terraform, etc *   Automated testing of applications, Continuous Integration (CI), TDD, and/or BDD *   Core Data services: Confluent Stack, Kafka, Couchbase, Cassandra, Rabbit MQ, PostgreSQL, Elasticsearch, Log stash, Kibana, Redis, etc*   #DICE_KTO #LI-KT2 *  Salary Range*   Compensation: $115,500.00/Year - $165,000.00/Year *  Benefits*   From versatile health perks to new career opportunities, check out our benefits on our careers website .*   Candidates need to successfully complete a pre-employment screen, which may include a drug test.* *","https://www.indeed.com/pagead/clk?mo=r&ad=-6NYlbfkN0Abkzm2pa9gzFlFHVN4BWnbH9HeEQ6gVFn_qUaKTz3UT8t17BrVZcibN6lom8pUx4k7BCePg7Rzk5azXWe46VVxgWqp0dBhvPNyw8TcOnKsbmINdatcNgVBPRgxjGXF1CVp3BOVQ7c4hxo7Eg-ilAVet1DXvtmiJQ0AmgLS_h0FfliRJFKDaW9CwbgQLL3iWdcPzeZg-D4NlcigxSTavLu1HuIQ3J1vrjbvf6xBAxSR2I8WUwxydglqQMvz5pJ6e7QP4foaSR0DIbP9EUSkOo4H3QodymDCybVF-BoRoIQs7IhWBGXJJnfDQMgzPS-AXCF50Ioqe0t2ncThv7R1i0dcTWkfALIU5a2Qs0RtE0K7SXOxqhE8VOqSCagk3ICNz1CodqEDTuvFyVDsXiYzLHvqK3TyH4_sVF9Ys7Z4cDxUxRs1jM4giV0f4MaP4Y81zizFlTUH7Qdbuzskk1jDLzlB9q663uww-hKKT6Lb9qkJ_boMiA2EMMaa3V18IimqiF6WXIymDZPSbmKpWW_pyaCEJxgxfFKgBwKsMUE8_N9tNICqS3c0_ERMIVvzIypdZmWbnPL3eN0F-fRhJrach_TD09uurkyIDTk=&p=4&fvj=0&vjs=3","Hybrid","Part-time","MSCM",0,1,1,0,0,1,1,0,0,0,0,0,0,0,0,0,0,0,0,0,"3294e8cba72294ac2cabf32a557c8d02"
"2","cloud engineer",2022-05-23,"Senior Data Platform Engineer","DISH","Orem, UT 84058+5 locations","* *  Department Summary*   DISH is a Fortune 200 company with more than $15 billion in annual revenue that continues to redefine the communications industry. Our legacy is innovation and a willingness to challenge the status quo, including reinventing ourselves. We disrupted the pay-TV industry in the mid-90s with the launch of the DISH satellite TV service, taking on some of the largest U.S. corporations in the process, and grew to be the fourth-largest pay-TV provider. We are doing it again with the first live, internet-delivered TV service - Sling TV - that bucks traditional pay-TV norms and gives consumers a truly new way to access and watch television. Now we are building the nation's first stand-alone could-based open RAN 5G network.*   We are driven by curiosity, pride, adventure, and a desire to win - it's in our DNA. We're looking for people with boundless energy, intelligence, and an overwhelming need to achieve to join our team as we embark on the next chapter of our story.*   Opportunity is here. We are DISH. *  Job Duties and Responsibilities*  About the position *   Our mission is to build a modern, hybrid cloud enterprise platform for all DISH to consume. Our environment is... *  Complex *   Highly elastic *   Based on some of the latest and greatest cloud native technologies *   Very fast paced *   Your team will be... *  Enabling data platform services for our organization to consume - Elastic, Kafka, Cassandra, PostGreSQL, Redis, Kinesis, Big Table, etc *   Driving a customer centric, highly personalized approach to the evolution of our platform *   Continuing our efforts to realize a robust hybrid cloud infrastructure *   Delivering software in an agile environment, continuously *   In order to be successful in this role, you will need to be... *  Highly motivated, driven & hard working *   A true believer in cloud native, hybrid cloud and continuous deployment *   Comfortable with scripting & using a Git repo for code management *   Able to work independently and clearly present results *   Experienced working with CI/CD in the enterprise *  Skills, Experience and Requirements*  Basic Requirements: *   A successful Senior Data Platform Engineer will: *  Be available to work onsite out of our American Fork, UT or Englewood, CO offices *   Have a 4-year college degree in Computer Science / Information Technology, master's degree is preferred or equivalent professional experience *   Have 5+ years of professional enterprise development, operations, DBA, SRE, platform, and/or infrastructure experience *   Have experience building and managing large, highly available enterprise grade platforms *  Technologies in our environment: *   Here are some of the key technologies that make up our environment. While we do not expect you to have a detailed understanding of each, the more of these you are familiar with the better. *  Programming Languages: GoLang, Java, Python, node js, typescript, etc *   CI/CD & DevSecOps tools: Gitlab, Jenkins, Artifactory, SonarQube, ArgoCD, Fortify, Netsparker, white hat, OWASP, Vault, Salt Stack, Terraform, etc *   Automated testing of applications, Continuous Integration (CI), TDD, and/or BDD *   Core Data services: Confluent Stack, Kafka, Couchbase, Cassandra, Rabbit MQ, PostgreSQL, Elasticsearch, Log stash, Kibana, Redis, etc *   Core platform services: Linux, Kubernetes, Docker, Rancher, Consul, AWS, Jaeger, gRPC, Istio, Calico, GCP, NGINX, etc *   Serverless / Function as a service concepts, implementations & patterns *   Web scale, distributed systems*   #LI-EC1 *   #LI-SB1 *   #Dice_KS *   #DICE_KTO *   #LI-KT2 *  Salary Range*   Compensation: $99,360.00/Year - $157,665.00/Year *  Benefits*   From versatile health perks to new career opportunities, check out our benefits on our careers website .*   Candidates need to successfully complete a pre-employment screen, which may include a drug test.* *","https://www.indeed.com/pagead/clk?mo=r&ad=-6NYlbfkN0Abkzm2pa9gzFlFHVN4BWnbH9HeEQ6gVFn_qUaKTz3UT8t17BrVZcibN6lom8pUx4lkgSpHdG44rsY6747rX2FfI0p1iEel4cnuMx9yJn11IviZ3TOFuRCnupZr2Aypyn-1NLZi_HbEYMYU_ns3N2Lf0Wmlv6zpbSbvle0oTdvLkfwINuH73kop_2CtDbIoNFFrkiMRuyRifD_p0P4MeYuniy8bLxbRYLtOldVAIaJfn12tnJ_Zr4YJn4mXx1mPcEWgyDahhXIwhiOKyKfMSh77mtKflaDyke6wzVbNEp76byNs_Cx8CH0httaAjQhjddp60EnyUKLPHbGqltswZ_oTeWbt8PCkIaOhUD2gZXvGcAMTpfQqs-BjwwAsK0JpwrKdH0oUKSuVnAYE_O-FRqJlWF7Nt1LYdO7UfO8f08aqeGvrqfpIj1gKZdY-0sjHzbDBMs16bE9zowrSItjTGDoyiNBXM-TcAJgq4TykUmasBDZgfMX5Wx2hShuRx9tjeQ0iUNJ67D7PAH0DDlWLuqiHZPpMm8u4pPqzOcf1FVz_tLrMyqYNEgsv5tZ5F4ipCPEfT7SmJij9TWoxY_oVDn3n&p=7&fvj=0&vjs=3","Hybrid","Part-time","MSIS",0,1,1,0,0,0,0,0,0,1,0,0,0,0,0,0,0,0,0,0,"486f2f388e72e687cd4eb1ec6b4c64dc"
"3","data integration engineer",2022-05-23,"Senior Data Platform Engineer","DISH","Sandy, UT 84092+5 locations","* *  Department Summary*   DISH is a Fortune 200 company with more than $15 billion in annual revenue that continues to redefine the communications industry. Our legacy is innovation and a willingness to challenge the status quo, including reinventing ourselves. We disrupted the pay-TV industry in the mid-90s with the launch of the DISH satellite TV service, taking on some of the largest U.S. corporations in the process, and grew to be the fourth-largest pay-TV provider. We are doing it again with the first live, internet-delivered TV service - Sling TV - that bucks traditional pay-TV norms and gives consumers a truly new way to access and watch television. Now we are building the nation's first stand-alone could-based open RAN 5G network.*   We are driven by curiosity, pride, adventure, and a desire to win - it's in our DNA. We're looking for people with boundless energy, intelligence, and an overwhelming need to achieve to join our team as we embark on the next chapter of our story.*   Opportunity is here. We are DISH. *  Job Duties and Responsibilities*  About the position *   Our mission is to build a modern, hybrid cloud enterprise platform for all DISH to consume. Our environment is... *  Complex *   Highly elastic *   Based on some of the latest and greatest cloud native technologies *   Very fast paced *   Your team will be... *  Enabling data platform services for our organization to consume - Elastic, Kafka, Cassandra, PostGreSQL, Redis, Kinesis, Big Table, etc *   Driving a customer centric, highly personalized approach to the evolution of our platform *   Continuing our efforts to realize a robust hybrid cloud infrastructure *   Delivering software in an agile environment, continuously *   In order to be successful in this role, you will need to be... *  Highly motivated, driven & hard working *   A true believer in cloud native, hybrid cloud and continuous deployment *   Comfortable with scripting & using a Git repo for code management *   Able to work independently and clearly present results *   Experienced working with CI/CD in the enterprise *  Skills, Experience and Requirements*  Basic Requirements: *   A successful Senior Data Platform Engineer will: *  Be available to work onsite out of our American Fork, UT or Englewood, CO offices *   Have a 4-year college degree in Computer Science / Information Technology, master's degree is preferred or equivalent professional experience *   Have 5+ years of professional enterprise development, operations, DBA, SRE, platform, and/or infrastructure experience *   Have experience building and managing large, highly available enterprise grade platforms *  Technologies in our environment: *   Here are some of the key technologies that make up our environment. While we do not expect you to have a detailed understanding of each, the more of these you are familiar with the better. *  Programming Languages: GoLang, Java, Python, node js, typescript, etc *   CI/CD & DevSecOps tools: Gitlab, Jenkins, Artifactory, SonarQube, ArgoCD, Fortify, Netsparker, white hat, OWASP, Vault, Salt Stack, Terraform, etc *   Automated testing of applications, Continuous Integration (CI), TDD, and/or BDD *   Core Data services: Confluent Stack, Kafka, Couchbase, Cassandra, Rabbit MQ, PostgreSQL, Elasticsearch, Log stash, Kibana, Redis, etc *   Core platform services: Linux, Kubernetes, Docker, Rancher, Consul, AWS, Jaeger, gRPC, Istio, Calico, GCP, NGINX, etc *   Serverless / Function as a service concepts, implementations & patterns *   Web scale, distributed systems*   #LI-EC1 *   #LI-SB1 *   #Dice_KS *   #DICE_KTO *   #LI-KT2 *  Salary Range*   Compensation: $99,360.00/Year - $157,665.00/Year *  Benefits*   From versatile health perks to new career opportunities, check out our benefits on our careers website .*   Candidates need to successfully complete a pre-employment screen, which may include a drug test.* *","https://www.indeed.com/pagead/clk?mo=r&ad=-6NYlbfkN0Abkzm2pa9gzFlFHVN4BWnbH9HeEQ6gVFn_qUaKTz3UT8t17BrVZcibN6lom8pUx4lkgSpHdG44ro6Y_ViSzvNK7gywSh6Wrn0LTVMp2g_dqIqXlYsbySFldwyOdljZH1PEOvxePd1jBIVHWl6vZ7aUKIXBBeU8bjtmhGHry5lXNGcOANanWKUmqbVNWCHUFZuTA8eaSK6aqLZ2igjseAke7npsYXJMRlICwRkCwdgZF7ayH5RiS0No8ztEThHHVZbR_AdEKIjLfFmONf8LXVfOC5uKS_2HXkolDJlH1KiWSRveurbJQmNo8ANVmoistbF9y6bqDsHAtwKR6shKjMpmCVjb7tHPNLNkbxFoU7RUbBdouJuYTJ8buME8oc7_WAl7WfPldz_hS486kSQyHe1mEyV1_nxP8aavuXhWoyofQatIL3iqeKWtylRKzt9z-_cB5Oc0AJkFwqpo8p3mpx5x9Snyya23ZTEMBHYpuutYJ_eYxdWONyCZOKloACc1k5zQEPhfXh6qqgOm5E6pHU_3fcN8H8O8INQ7IrcA3gdpWu5UEq4Y7paW97qbIFavmvy2VbB-kirthDCf6E4WjI-inbjHAj-vPlY=&p=0&fvj=0&vjs=3","Hybrid","Part-time","MSIS",0,1,1,0,0,0,0,0,0,1,0,0,0,0,0,0,0,0,0,0,"a64d3524d0610d48e52472ff0457b85e"
"4","data integration engineer",2022-05-23,"Senior Technical Delivery Manager","DISH","Sandy, UT 84092+5 locations","* *  Department Summary*  About Dish *   Our Vision is to change the way the world communicates. Our Mission is to connect people and things.*   We are reimagining the way people watch TV with services like Sling and AirTV. We are redefining the boundaries of communication and connectivity too, with our planned green field 5G cloud native network build out and the Internet of Things. Nothing is out of our reach, and the opportunity to shape the future of entertainment and technology has never been more tangible.*  Job Duties and Responsibilities*  About the position *   Our mission is to build a modern, hybrid cloud enterprise platform for all DISH to consume. Our environment is:*   Complex *   Highly elastic *   Based on some of the latest and greatest cloud native technologies *   Very fast paced *   Your team will be: *  Building the modern platform of the future for Dish leveraging best in class, modern technologies *   Leading the Platform Engineering Center of Excellence *   Driving a customer centric approach to the evolution of our platform *   Continuing our efforts to realize a robust hybrid cloud infrastructure *   Establishing and evolving a best in class engineer experience *   Enabling modern applications to run effectively, with the right level of observability and security based into the platform *   Facilitate iteration planning sessions, daily team stand-ups, grooming sessions, and retros *   Track and report on team work completed, capacity, backlog, velocity, etc. *   Forecast product/feature delivery timelines *   Use metrics and feedback to improve team and organization processes, best practices, performance, and delivery *   Delivering software in an agile environment, continuously *  Skills, Experience and Requirements*   A successful Delivery Manager will have experience with: *  Ability to drive technical initiatives having good grasp of the DevOps, cloud native concepts *   Ability to liaison between engineering teams, stakeholders, technical experts and facilitate technical discussions *   Good understanding of setting up systems in an enterprise especially integration challenges *   Setting up procedural guidelines to establish a successful delivery process *   Proactively remove obstacles to drive momentum and progress. Identify communication gaps, manage issue escalations and provide support to teams balancing competing priorities. *   An emotionally intelligent, strong leader capable of building a high-performance team *   Evaluating consumer feedback and instituting changes as necessary to manage expectations *   Assist with the production of comprehensive project plans and documentation to enable the project to be managed against a clear set of defined deliverables and milestones *   Conduct an evaluation of the project and any follow-on action recommendations as required *   Produce project documentation and create knowledge libraries with the end goal of using this documentation to train and support the end users. *  Basic Requirements: *   A successful Senior Technical Product Owner will have: *  BA/BS in a technical or business discipline (information systems, engineering, computer science, finance, business administration, or accounting) or combination of education and experience *   6+ years of Product Owner, Product Manager, Systems Analyst, Business Analyst, Project Manager or equivalent combination of education and experience *   Demonstrated understanding of and experience using standard SDLC processes and methodologies *   Demonstrated knowledge and proven experience with Agile, DevOps, and Cloud (AWS, GCP, Azure) tools and methodology *   Proven track record of leadership of product accomplishments including successful project launches *   Prior experience in devops, CI/CD pipeline, Jira, ServiceNow, GitLab, Selenium, Docker, Jenkins, Infrastructure Orchestration as code, AWS, GCP, Apigee, Container Orchestration, Hashicorp Stack, etc. *  Technologies in our environment: *   Here are some of the key technologies that make up our environment. While we do not expect you to have a nuanced understanding of each, the more of these you are familiar with the better.*   Core platform services: Linux, Kubernetes, Docker, Rancher, Consul, AWS, Jaeger, gRPC, Istio, Calico, GCP, NGINX, etc *   Programming Languages: Go, Java, Python, React/Node js, typescript, Ruby, etc *   CI/CD & DevOps tools: Gitlab, Jenkins, Artifactory, SonarQube, ArgoCD, Salt Stack, Ansible, Vault, Consul, Terraform, etc *   Automated testing of applications, Continuous Integration (CI), TDD, and/or BDD *   Core Data services: Confluent Stack, Kafka, Couchbase, Cassandra, Rabbit MQ, PostgreSQL, Elasticsearch, Log stash, Kibana, Redis, etc*   #DICE_KTO #LI-KT2 *  Salary Range*   Compensation: $115,500.00/Year - $165,000.00/Year *  Benefits*   From versatile health perks to new career opportunities, check out our benefits on our careers website .*   Candidates need to successfully complete a pre-employment screen, which may include a drug test.* *","https://www.indeed.com/pagead/clk?mo=r&ad=-6NYlbfkN0Abkzm2pa9gzFlFHVN4BWnbH9HeEQ6gVFn_qUaKTz3UT8t17BrVZcibN6lom8pUx4k7BCePg7Rzk_0l5cpzvNzvvgbcHS2FwQZ-4U5M9o6gMhVX-Oku5SnLlFdpQBCtIMffwaVV62oynD0alUMzQA5RhdBR3c4r5Cv7HBPEIQUVSXZKHYJN7gjOnN0vlefiPd3Px9dywaDjVNXObM8th5yEN2BPmqaqKZfWEddqvg21Dr39JbI_lmn5c0XkGrO16LwC9DNDtwCqwfuU0oORjR_hHOQxpqtEY4gAhytB-NU76k3wuMhGdsJAClEy1RYU4ps46HYWXWemsgPHjztowfzZ1T9G71V2e_fVkOLbL1EnEW-4zgJRwRJyTRSrU7vFRLUlRs9ialya3pGBd2ZQs1_xwfcs-jD4ybZGqYfvhP6ZUpme6Cp_sFZo6yDQ9fNdCuQJhBle1_FlSa2iv-_Hn2KlaaSOcETYrCFWOWZhFqG5I7obOMo7f1uyBmx46ygWUjvgdi7kNoIjCbT_dRKUrQQXfeQ2ATDFHlNIc3525iu7Dv5wqGcSyvov90UrRbT4XiV86vFnAa13Oae8r-Cg1y6JmFL9F1DomwFk2ObVMf87yw==&p=7&fvj=0&vjs=3","Hybrid","Part-time","MSIS",0,1,1,0,0,1,1,0,0,0,0,0,0,0,0,0,0,0,0,0,"f323f17d4f717e129e1018b9bb81d953"
