"","Search","Date","Title","Company","Location","Description","Link","Work Model","Job_Type","Program","R","Python","SQL","Tableau","PowerBI","Azure","Excel","Talend","SAS","Spark","Qualtrics","Domo","Salesforce","SAP","Hadoop","Qlik","Looker","Zoho","Stata","Snowflake","ID"
"1","business intelligence analyst",2022-05-29,"Business Analyst","Adobe","Lehi, UT 84043","* * *  *   *    *     *      *       locations*      *      *        Lehi*      *     *    *   *   *   *    *     *      *       *         time type*       *       *         Full time*       *      *     *    *    *    *     *      *       *         posted on*       *       *         Posted 2 Days Ago*       *      *     *    *    *    *     *      *       *         job requisition id*       *       *         R127254*       *      *     *    *   *  *  *   *    *      Our Company*      Changing the world through digital experiences is what Adobe’s all about. We give everyone—from emerging artists to global brands—everything they need to design and deliver exceptional digital experiences! We’re passionate about empowering people to create beautiful and powerful images, videos, and apps, and transform how companies interact with customers across every screen.*      We’re on a mission to hire the very best and are committed to creating exceptional employee experiences where everyone is respected and has access to equal opportunity. We realize that new ideas can come from everywhere in the organization, and we know the next big idea could be yours!*    *    *    *      The Opportunity*    *    *      The Infrastructure Asset Management team at Adobe is responsible for partnering with internal customers regarding all aspects of supplier management in the Hardware, Colocation, and Telecom spaces leading numerous relationships with providers of critical products and services for Adobe.*    *    *      The Business Analyst will play a pivotal role in ensuring a successful partnership with vendors. The successful candidate will use their relationship, operations, service delivery, and accounting skills to ensure that customer and supplier expectations are being met. They will balance multiple priorities depending on the project, task, and/or issue at hand and will have direct inputs to shape and to improve team processes.*    *    *      This is an individual contributor position and reports to the Senior Manager of the Infrastructure Asset Management team.*    *    *      What You'll Do*    *     Facilitate processing of internal requests of data center hardware, from initial requests through order receipt confirmations.*      Partner with the hardware category lead to ensure timely execution of requests.*      Validate monthly invoices, pass-thru expenses, and true-up’s including service credits, earn backs, ARC/RRC’s.*      Work with vendors to ensure reconciliation of remittances against submitted invoices.*      Track PO funds to ensure invoices are able to be paid in a timely manner, and raise Purchase Requests to replenish funds as needed.*      Work with business owners and finance to accurately reflect costs in forecasts and budgets.*      Participate in business review meetings periodically to ensure all agreed upon tasks are tracked and handled proactively.*      Ensure service level agreements and key performance indicators are established, maintained, and updated to reflect the business requirements.*      Oversee services are delivered in accordance to SLAs and that they are consistent with service & quality outlined in contracts.*      Network across Adobe and build strong relationships with partners to help support their business.*      Ensure compliance with all Adobe mandated Policy requirements.*    *      What You Need to Succeed*    *     Bachelor’s Degree in Business or Technology space.*      Minimum of 3-5 years of experience in technology expense management, sourcing, and/or vendor management preferred.*      Strong organizational skills.*      Familiarity with types of hardware commonly used in data center environments.*      Experience with building and maintaining effective relationships with vendors, customers, peers, supervisors, and internal company resources.*      Strong written and verbal communication skills.*      Ability to be flexible in a fast-paced environment. Self-starter that can independently drive many tasks simultaneously to completion.*      Experience driving desired outcomes with technology vendors.*      Experience ensuring both service and quality levels are adequately maintained.*      Adaptable to constant change, re-shuffling priorities as needed, and experience leading continuous improvement efforts.*      In depth working knowledge of spend management, category strategy development, and procurement essentials.*    *  * *","https://www.indeed.com/rc/clk?jk=0b89ec68bde8893a&fccid=f89deb5a97c7738a&vjs=3","On-site","Part-time","MSIS",0,0,0,0,0,0,0,0,0,0,0,0,0,0,0,0,0,0,0,0,"f38c2095cfdfcba3840bb4dd7b7b169a"
"2","cloud engineer",2022-05-29,"Senior Software Engineer (React)","Angel Studios","Remote in Provo, UT","* *  *   *    Who We Are*   *   *   *     Angel Studios is the home of stories that amplify light. Through its platform, thousands of “Angel” investors choose which titles will be created, funded, and distributed. Angel Studios allows creators and audiences to form passionate communities around their creative projects, making the story behind the story as important as the final project itself. The studios’ first projects—The Chosen and Dry Bar Comedy—have earned billions of views around the world. Learn more at Angel.com*   *   *   *     We’re looking for passionate team members who want to build world-class products that will reshape media over the coming decades. Learn more about:*   *   *     Our North Star*   *   *     Company Strategy*   *   *     Team Principles*   *   *     Join us and be part of stories that matter.*   *   *   *     Role*   *   *     We are looking for a Senior React Engineer who loves building great user experiences to join our team and help build our growing portfolio of products that enable a consumer to enjoy the content that they can co-create with the creators through our platform. In this role, you’ll work with a high-energy, cross-functional team, which will include other developers, product managers, and designers to perfect the viewing and community engagement experience for viewers of TV shows and movies across all of Angel Studios.*   *   *  *   *    You may enjoy working with us if you:*     Are self-driven and highly motivated to deliver top-tier solutions with minimal guidance. You also recognize when you're wrong, learn from your mistakes, and move past them. Enjoy creating beautiful, rich, inviting digital experiences that delight and surprise every person who views your craft by connecting deeply with the way users feel and anticipating their needs. Are curious about the evolution of technology and are constantly seeking to improve your craft by taking advantage of the advances made in the field. Strive to embrace best practices and are always searching for opportunities to continually improve, learn and grow. Enjoy working with people and empowering everyone to do the best work of their life by ensuring they can leverage technology to serve them.*    *   *  *   *    We would love to work with you if:*     You are a Software engineer who has experience crafting high-performance reusable code for UI components and developing rich applications in React You are experienced in the infrastructure needed to make compelling frontend experience such as API development (GraphQL, REST), and frameworks (React, NextJS, Jamstack) You are passionate about careful design & architectural planning that lead to a codebase that is future-proof and maintainable. You enjoy the challenge and opportunity to lead and improve the development experience at Angel Studios by enhancing development tools, test coverage, and code structure. You are proactive and detail-oriented, yet comfortable working in a dynamic environment with tight deadlines and evolving requirements.*    *   *  *   *    Perks at Angel:*     Competitive compensation Stock Option equity package 100% company-paid medical, dental, and vision premiums for employees and dependents (US employees) Health Spending Account (HSA) Life, AD&D, Short, and Long Term Disability Insurance 401(k) investment opportunity Unlimited PTO Paid parental leave Professional development reimbursement Gym reimbursement Remote work opportunities*    *   *  *   *    Angel is an Equal Opportunity Employer:*   *   *   *     We are actively seeking to create a diverse work environment because teams are stronger with different perspectives and experiences.*   *   *     We value a diverse workplace and encourage women, people of color, LGBTQIA individuals, people with disabilities, members of ethnic minorities, foreign-born residents, older members of society, and others from minority groups and diverse backgrounds to apply. We do not discriminate on the basis of race, gender, religion, color, national origin, sexual orientation, age, marital status, veteran status, or disability status. All employees and contractors of Angel are responsible for maintaining a work culture free from discrimination and harassment by treating others with kindness and respect.*   *  * *","https://www.indeed.com/rc/clk?jk=b12cf7e4416c4fa7&fccid=31deb4e9336f4b27&vjs=3","Remote","Part-time","MSIS",0,0,0,0,0,0,0,0,0,0,0,0,0,0,0,0,0,0,0,0,"a2ddbb2fd879ea9198b08d47a96ef446"
"3","network security engineer",2022-05-29,"Linux Technical Account Manager, AMER","Canonical - Jobs","Remote in Salt Lake City, UT","Role Description**Linux Technical Account Managers are key to servicing our enterprise customers and partners, serving as the assigned engineering and technical escalation point, and are typically amongst the most experienced members of our Support Engineering teams.**This role is an opportunity for a technologist with a passion for Linux to drive the success of major customers, leveraging Ubuntu and open source products. If you have an affinity for open source engineering and a passion for technology, then you will enjoy building your career with other some of the best engineers in the industry at Canonical.**No two days are the same in Support Engineering. We engage in interesting problems to solve, constantly pick each other's brains and our minds are always abuzz with ideas for helping our customers to make the most of their Ubuntu systems. We are rapidly expanding and are looking for talented professionals with a passion for working on the next generation of Ubuntu solutions.**Key Responsibilities*Assume direct responsibility and drive exceptional service on assigned accounts.*Gain understanding of our partner's technical infrastructure and environment, hardware, and/or product(s).*Investigate issues reported by customers by doing your own research and involving others across the organisation as necessary.*For assigned accounts manage support escalations and issue prioritization, acting internally as a customer advocate.*Contribute new articles and maintain existing knowledge base articles.*On a rotation basis, be available for on-call support out of office hours.*Ability to travel*Required Skills and Experience*Experience supporting Linux systems.*Experience with Kubernetes, OpenStack, virtualization and other Cloud technologies.*Advanced troubleshooting (up to application layer, including, core dump analysis and kernel dump analysis desirable).*Demonstrable expertise in one or more of the following areas:*Advanced storage (RAID, LVM, SAN, file system tuning, etc.)*Advanced networking (bonding, firewalling, bridging, switching, network file system tuning, etc.)*Clustering, cloud computing (provisioning, monitoring, orchestration, etc.)*Linux integration with other environments (authentication/directory services, network file systems, etc.)*Experience managing customer relationships through consulting engagements, account management, or direct support.*Significant experience with Ubuntu or Debian, able to debug and act as a generalist when necessary.*Excellent verbal and written communication skills in English.Canonical is a growing, international software company that works with the open-source community to deliver Ubuntu - the world's #1 cloud operating system. Our mission is to realize the potential of free software in the lives of people and organisations. Our services are helping businesses worldwide to reduce costs, improve efficiency and enhance security with Ubuntu.**We offer:*Work-from-home*Learning and Development*Competitive Salary*Recognition Rewards*Annual Leave*Priority Pass for travel*Flexible working option*We are proud to foster a workplace free from discrimination. Diversity of experience, perspectives, and background create a better work environment and better products. Whatever your identity we will give your application fair consideration.**#LI-Remote**#LI-ET1**#stack","https://www.indeed.com/rc/clk?jk=5551ba5b3ca110d5&fccid=d40b824c7b625849&vjs=3","Remote","Part-time","MSCM",0,0,0,0,0,0,1,0,0,0,0,0,0,0,0,0,0,0,0,0,"027481048270b3487dada4c3f9fa8336"
"4","data integration engineer",2022-05-29,"Lead iOS Mobile Engineer","Cricut","South Jordan, UT","* *  Company Description*   Together we make. Come make with us.*   Overview*   At Cricut, we believe that we’re all born makers. When we built our first cutting machine, we saw the potential for a simple yet powerful tool to completely transform the way people craft, design, and DIY. Since then, we continue to innovate with new machines, platforms, materials, and tools, but that’s just what we do. As a hardworking worldwide team, we are proud but hungry to create a means for connection and an outlet for unbridled creativity. We are A+ human beings seeking to help others satisfy their creative itch around the world. Join us as we place the power of handmade into the hands of ALL, because we believe that TOGETHER WE MAKE.*  * *  Job Description*   Cricut is looking for a talented Lead iOS Mobile Engineer to help us take our iOS native apps to the next level. The position demands a candidate capable of doing high-quality work against technical and schedule challenges, while following strong software design and process principles. This is a great opportunity to play a key role in a dynamic team, working on cutting edge mobile technology. You are a driver of change and you have yet to meet a technological challenge you cannot resolve. You are dedicated to developing clean code that will help shape the iOS mobile software which thrills our users.*  *   Responsibilities*   Hands-on role where you will be working alongside the team*    Lead technical architecture, coding standards, and other team processes and policies*    Work with PM and UX on story refinement, articulate engineering concerns, and guide technical direction*    Work with cross functional teams on quarterly planning and plan work for the team*    Apply software engineering design patterns to develop well-structured, modular, performant application code*    Run Scrum ceremonies*    Work collaboratively with product manager to drive features and maintain the backlog*    Serve as a technical mentor and know how to delegate tasks to the team*    Perform code reviews, write unit and UI tests, and contribute to architectural planning and refactoring*    Collaborate with API teams on API design*    Drive software releases includes releasing apps to the App Store*  *   Eligibility*   B.S. or M.S. in Computer Science, Software Engineering, or comparable field with 5+ years relevant experience*   * *  Qualifications*   Extensive experience developing iOS mobile native applications in Swift/SwiftUI (experience in The Composable Architecture is a big plus)*    Solid knowledge of iOS UI design principles, best practices, and development life cycle*    Experience with at least one of these design architectures: MVVM, MVC, VIPER, Clean Architecture*    Experience consuming RESTful JSON/XML web services, Open API standard (Swagger)*    Experience in testing high volume applications: unit test, integration test, performance test*    Experience with Git and GitFlow*    Experience with Scrum/Agile methodologies*    Experience in mentoring junior members*    Experience in project management*    A solid grasp of fundamental algorithms, data structures, and design patterns*    Ability to prototype new features and redesign existing ones*    Excellent problem solving, debugging skills, critical thinking, and communication skills*    Ability to effectively articulate technical challenges and solutions*    Aptitude and desire to independently learn new technologies*    Working knowledge of Internationalization*   Preferred Skills*   Experience in working with offshore contractors*    Experience in continuous integration and delivery (e.g., Bitrise, GitHub Actions)*    Experience in Core Animation, Core Graphics, Core Bluetooth*    Experience in automated user interface functional testing*    Experience with iOS performance profiling tools and optimization techniques*    Experience with Google Firebase Analytics and Crashlytics*   Additional Information*   Please attach your resume including links to your portfolio where applicable. If you want to show your super powers in other ways – include that information too. You can be sure that Cricut® is an employer who values individuality, equality and diversity, so tell us what you’re all about. If you are a Maker or a DIY enthusiast, whether you think you are a good one or not, we would love to hear about it when you send us your information!*   At Cricut®, we celebrate inclusion and diversity. Cricut is an equal opportunity employer and makes employment decisions based on merit. Cricut prohibits discrimination based on race, color, religion, sex, sexual identity, gender identity, marital status, veteran status, nationality, citizenship, age, disability, medical condition, pregnancy, or any other unlawful consideration. All your information will be kept confidential according to EEO guidelines. Cricut participates in E-Verify.* *","https://www.indeed.com/rc/clk?jk=1e92071b600a08bc&fccid=52f763e4fcdaf1bd&vjs=3","On-site","Part-time","MSIS",1,0,0,0,0,0,1,0,0,0,0,0,0,0,0,0,0,0,0,0,"0d4a445b72cb0fed6bb462ddf23ef4ab"
"5","data integration engineer",2022-05-29,"Lead Android Mobile Engineer","Cricut","South Jordan, UT","* *  Company Description*   Together we make. Come make with us.*   Overview*   At Cricut, we believe that we’re all born makers. When we built our first cutting machine, we saw the potential for a simple yet powerful tool to completely transform the way people craft, design, and DIY. Since then, we continue to innovate with new machines, platforms, materials, and tools, but that’s just what we do. As a hardworking worldwide team, we are proud but hungry to create a means for connection and an outlet for unbridled creativity. We are A+ human beings seeking to help others satisfy their creative itch around the world. Join us as we place the power of handmade into the hands of ALL, because we believe that TOGETHER WE MAKE.*  * *  Job Description*   Cricut is looking for a talented Lead Android Mobile Engineer to help us take our Android native apps to the next level. The position demands a candidate capable of doing high-quality work against technical and schedule challenges, while following strong software design and process principles. This is a great opportunity to play a key role in a dynamic team, working on cutting edge mobile technology. You are a driver of change and you have yet to meet a technological challenge you cannot resolve. You are dedicated to developing clean code that will help shape the Android mobile software which thrills our users.*  *   Responsibilities*   Hands-on role where you will be working alongside the team*    Lead technical architecture, coding standards, and other team processes and policies*    Work with PM and UX on story refinement, articulate engineering concerns, and guide technical direction*    Work with cross functional teams on quarterly planning and plan work for the team*    Apply software engineering design patterns to develop well-structured, modular, performant application code*    Run Scrum ceremonies*    Work collaboratively with product manager to drive features and maintain the backlog*    Serve as a technical mentor and know how to delegate tasks to the team*    Perform code reviews, write unit and UI tests, and contribute to architectural planning and refactoring*    Collaborate with API teams on API design*    Drive software releases includes releasing apps to Google Play*   Eligibility*   B.S. or M.S. in Computer Science, Software Engineering, or comparable field with 5+ years relevant experience*   * *  Qualifications*   Extensive experience developing Android mobile native applications in Kotlin/Java (Android 9.0 and above)*    Solid knowledge of Android UI design principles, best practices, and development life cycle*    Experience with at least one of these design architectures: MVVM, MVC, VIPER, Clean Architecture*    Expert in UI layouts and creating adaptive layouts for various hardware configurations*    Experience consuming RESTful JSON/XML web services, Open API standard (Swagger)*    Experience in testing high volume applications: unit test, integration test, Espresso Test, performance test*    Experience in dependency injection framework (e.g., Dagger, Hilt)*    Experience with Git and GitFlow*    Experience with Scrum/Agile methodologies*    Experience in mentoring junior members*    Experience in project management*    A solid grasp of fundamental algorithms, data structures, and design patterns*    Ability to prototype new features and redesign existing ones*    Excellent problem solving, debugging skills, critical thinking, and communication skills*    Ability to effectively articulate technical challenges and solutions*    Aptitude and desire to independently learn new technologies*    Working knowledge of Internationalization*   Preferred Skills*   Experience in working with offshore contractors*    Experience in continuous integration and delivery (e.g., Bitrise, GitHub Actions)*    Experience in animation and graphics*    Experience with Jetpack Navigation*    Experience with Android performance profiling tools and optimization techniques*    Experience with Google Firebase Analytics and Crashlytics*    Advanced Gradle experience*    Familiar with Jetpack Compose*   Additional Information*   Please attach your resume including links to your portfolio where applicable. If you want to show your super powers in other ways – include that information too. You can be sure that Cricut® is an employer who values individuality, equality and diversity, so tell us what you’re all about. If you are a Maker or a DIY enthusiast, whether you think you are a good one or not, we would love to hear about it when you send us your information!*   At Cricut®, we celebrate inclusion and diversity. Cricut is an equal opportunity employer and makes employment decisions based on merit. Cricut prohibits discrimination based on race, color, religion, sex, sexual identity, gender identity, marital status, veteran status, nationality, citizenship, age, disability, medical condition, pregnancy, or any other unlawful consideration. All your information will be kept confidential according to EEO guidelines. Cricut participates in E-Verify.* *","https://www.indeed.com/rc/clk?jk=903f48ca633dd14f&fccid=52f763e4fcdaf1bd&vjs=3","On-site","Part-time","MSIS",1,0,0,0,0,0,1,0,0,0,0,0,0,0,0,0,0,0,0,0,"e3c3f54eff90e5ea14658d6e34a17115"
