"","Search","Date","Title","Company","Location","Description","Link","Work Model","Job_Type","Program","R","Python","SQL","Tableau","PowerBI","Azure","Excel","Talend","SAS","Spark","Qualtrics","Domo","Salesforce","SAP","Hadoop","Qlik","Looker","Zoho","Stata","Snowflake","ID"
"23","business intelligence analyst",2022-08-17,"Sales Operations Analyst","Primary Talent Partners","Hybrid remote in Lehi, UT 84043","Primary Talent Partners has a 4-month contract opening for a Sales Operations Analyst to join a multinational software development company for a hybrid position in Lehi, UT.*Pay:  $30/hr - $35/hr*Location:  Lehi, UT*Onsite/Remote:  Hybrid, 50% remote, 50% onsite*Contract Length: 4 months, extensions possible, conversion possible*Summary: *Our company is looking to hire a full-time contractor to join the Customer Solutions team based in Noida-India. We are looking for a Business Graduate with a couple of years of experience as service sales/business analyst with a knowledge of professional service sales & operations. As our company continues to expand our business & strengthen our leading position within the digital experience domain, we are further building our service sales and operational capacity to support this expansion.*Responsibilities: *Identify & communicate relevant service needs* Support sales teams & promote the value of services* Report on status of service operations activity & service pipeline* Build dashboards to provide insights into service program adoption & health* Achieve service targets attach rates & bookings* Establish KPIs & measure new and existing service & operational performance* Operate key service processes within APAC region leading to increased service sales* Identify & implement improvements within service sales & operations* Capture and share feedback on services offerings & operations* Manage service operations to ensure that the status & trend on key metrics are understood & regularly reported.* Manage service sales governance leading to increased compliance and address operational gaps.*Qualifications: *Bachelor's Degree required* Experience working within a technology professional services business* Experience working within service sales and/or sales operations roles* Proficient working with salesforce CRM & Microsoft Excel reporting and working with sales pipeline data* Experience collating, summarizing & presenting data from multiple sources* Experience supporting, preparing and delivering enablement webinars*#PTPStandard*Job Type: Contract*Pay: $30.00 - $35.00 per hour*Schedule:*8 hour shift*Education:*Bachelor's (Preferred)*Experience:*working within a technology professional services business: 1 year (Preferred)* service sales and or sales operations: 1 year (Preferred)* Salesforce CRM: 1 year (Preferred)*Work Location: One location","https://www.indeed.com/pagead/clk?mo=r&ad=-6NYlbfkN0DOCvLQenlXS7fh3AEEtPwhntZQnPW7UfiJ0vyM-Z38ZvlXuLrJoooXVJlodcpC3T-djkqg_HOW6pbzJ0k4rHZl1PIfhYDTIohGztGccyXuyZzwJ9ZFc2SfF_HCCsLchq7PetzNHxQJtt1nPbFgcye7yMECtjeN4NEe9gA4PqW5cgPHlv4fjF-f6Z2raaUKU5sZMCOdTeDjk2VAeWS8pXFFmJHOmneaDN6U9a2LY9wiAdJcKAOEkF4OYjMX6gde3hPbxklm4yQYz5Z3NsUA2kB3wuCIOmsLPy_C_72T63UuRtvpHhr5ix3U0QBj9se9bw3Oeh5FtuXEbzpCVzoRG2BBuFlpZfcf8vqcAfX2I3YS9Lc4nGlEZb9XDNIPEu7SQb7MjQVLPkFh7SACZoHAkACId1s_VAY3nKG0XDuE3U0EewYN-fNKpVgmirHTKEXJjDohaRY-S9130W62ZTYZkC8uev1MYZ_sQQ61p5pE4gyOap0cSx8fr0oDsps5F2lJgL1xN2vbnjf-SpShwmFG_NJCHGsXHLoQKS4=&xkcb=SoBo-_M3aV-Pqrw23p0DbzkdCdPP&p=10&fvj=1&vjs=3","Hybrid","Full-time","MSIS",0,0,0,0,0,0,1,0,0,0,0,0,1,0,0,0,0,0,0,0,"a17659185d0c65a69e61160afc53a02f"
"24","data architect",2022-08-17,"Senior Fullstack Engineer","Recruiting From Scratch","Remote in Salt Lake City, UT 84103+1 location","* *  Who is Recruiting from Scratch: *  Recruiting from Scratch is a premier talent firm that focuses on placing the best product managers, software, and hardware talent at innovative companies. Our team is 100% remote and we work with teams across the United States to help them hire. We work with companies funded by the best investors including Sequoia Capital, Lightspeed Ventures, Tiger Global Management, A16Z, Accel, DFJ, and more. *  If you are a fit, the team will reach out to you about this role or any others that may be a fit for our clients. *  *  About Our Client: *  Our client is scaling at an unprecedented rate. They are a marketplace that connects hourly workers with flexible shifts at warehouses, distribution centers, and event venues. They empower workers to find well-paying shifts—work that is flexible, transparent, meaningful, and available just a few taps away. They provide businesses with a business portal that helps them find the most reliable workers on-demand. By connecting both, they unlock new levels of productivity, earning potential, and avenues for growth. *  They are seeking an experienced & entrepreneurial Senior F ull-stack Engineer to join th e founding team to help build their core suite of products—the React Native worker mobile app, the React/Node.js business web app, and a React/Node.js tools platform for their ops team. You'll partner with their CTO to help make key architectural decisions, iterate on the product roadmap, own product decisions, and architect & build their foundational tech platform. *  *  About You *  Voracious learner. You love diving into new areas and exploring new languages, frameworks, and technologies, and can discuss product with a UX designer one minute and deployment infrastructure with tech leads the next. *   Value clear communication. You recognize the importance of clear communication, documented planning, and transparent, frequent feedback. *   Sweat the small stuff. You have strong opinions on design patterns, IDEs, tabs vs. spaces—you understand that how you do one thing is how you do everything, so you care about the details. *   Deep experience building full-stack web applications. You have designed and built performant, scalable applications, and have expertise in developing APIs, data modeling, & deploying & scaling distributed systems. *  *  You Will *  Architect and lead the development of their React/Typescript web apps and Firebase/Node.js APIs *   Architect & document our tech platform and advise key product & infrastructure decisions *   Implement their CI/CD workflows, using Docker & Github *   Build analytics & monitoring to help understand their user experience & application health *   Contribute in a ton of other ways to a scrappy founding team building the future of flexible light industrial staffing! *  *  You Have *  5+ years experience with Typescript, Javascript, React Native, React, Node.js, Nest.js, and noSQL *   Experience with Firebase & Docker *   Experience building APIs *   Experience working in an early-stage engineering team, working through ambiguity and being a self-starter *   A passion for helping people find meaningful work that works for them *  *  *   Our client's mission is to empower hourly workers and local businesses to unlock their full productivity and earning potential. *   *   Their Values *   Dream BIG - They are on a path to change the world for the better. They create and communicate a bold direction that inspires a life-changing vision. They don’t sacrifice long-term value for short-term results. *   Olympian’s Work Ethic - Changing the world never comes easy. They work harder, longer, and smarter, not just two out of three. They put everything we have on the field. *   Growth Mindset - They confront the toughest challenges head-on and persevere. Sometimes they fail, but they brush themselves off, adapt, learn, and push forward with resilience. *   Customer Obsession - They go the extra mile for their workers and businesses. They remain focused on delivering high-quality products and services that solve these often overlooked communities’ problems. *  *  *  *   THIS ROLE IS LOCATED ONSITE IN AUSTIN, TEXAS OR MIAMI, FLORIDA. *  *  *  *   Benefits: PTO, Healthcare, and more! *  *  *  *   Base Salary: $160,000 - $190,000*  * **","https://www.indeed.com/rc/clk?jk=8774eb3de09f31b6&fccid=09e02654c2f26bbd&vjs=3","Remote","Part-time","MSIS",1,0,1,0,0,0,0,0,0,0,0,0,0,0,0,0,0,0,0,0,"0190d73044a655b155161f162a8dcf4b"
"25","data integration engineer",2022-08-17,"Engineer, Supply Chain and Web Apps","Sephora USA","Salt Lake City, UT 84104","Country / Region : United States *City : Salt Lake City *Business group: Selective Distribution *Contract type: Permanent Job *Function: Information Technology/Information System *Reference No.: 214572 *Date of publication: 2022.08.15 * Position * Engineer, Supply Chain and Web Apps * Profile *Job ID : 214572 *Location Name: Utah Distribution Center *Address: 6075 West 300 South , Salt Lake City , UT 84104 , United States (US) *Job Type: Full Time *Position Type (Regular/Temporary): Regular *Job Function: Information Technology *Is This Position Eligible for Remote? :*Your role at Sephora:* As a Production Engineer, Supply Chain and Web Apps Systems you will work on our Supply Chain Systems & Web Apps in support of our DC network to identify, resolve, and provide root cause resolution to production systems/Issues, fixing small defects, working on continuous improvement projects and testing efforts. Reporting to the Manager of Logistics Production Engineering, you will have opportunity to work on all warehouse management systems, integrations, MHE and home grown Web apps. Take ownership of efforts to transition new applications to the WMS Production Engineering Team, coordinating with respective Development Teams to ensure code, architecture and solution is understood and able to support with in a month of going live. Leverage extensive Logistics end-to-end Operational Process knowledge and automated systems knowledge (Reddwerks WES, Bastian WCS, Dematic WCS, ProShip Parcel Shipping) to quickly resolve complex Logistics business incidents involving integration with JDA/RP, and to coach team members to ensure proper and efficient service restoration Team expert in post go-live support for critical home grown new Web applications, Analytics tools built on latest tech stack of Angular, REACT, Looker and Databricks. Expertise in GUI using Angular JS, Angular 2,4,5,6,8, React, Redux Node JS, ES6 Java Script, HTML, DHTML, CSS, SQL, PL SQL, XML languages Expertise in Web app maintenance OR JDA WMS maintenance is must. *Perform detailed analysis of Logistics business opportunities to design and implement quality and innovative technical solutions, both strategic and tactical *Work with Product and Development teams to understand new business requirements, and ensure designed solutions support established Operational processes and initiatives – provide constructive feedback as required *Leverage expertise to mentor other Engineers on the Logistics Support Team on best methods to quickly and effectively troubleshoot and resolve both system and technical infrastructure issues *Offer expertise to actively participate in Development and Logistics Support Teams code reviews and test solutions to ensure they meet best practice specifications *Make yourself available to provide weekend coverage as required (on rotation), and to travel to other Distribution Centers approximately 3 times per year to train team members *Consistently help teammates overcome obstacles, resolve blockers, and complete work tasks *Demonstrate our Sephora values : Passion, Innovation, Expertise, Balance, Respect, Teamwork, and Initiative *We would love to hear from you if you have... *5-7 years of technical experience in JDA, RedPrairie application development & support of Warehouse Management System (JDA v8.2, RedPrairie) OR *Analysis, development of Object Oriented, Client-Server, WebBased, Distributed and Enterprise Applications with JAVA/J2EE technologies *Ability to mentor, guide and lead Engineers to deliver solutions on time per scope *Ability to lead projects to assume support of new systems/applications *Experience with, and knowledge in some of the following:* Web front building using Angular, REACT, Java, Java Script *Ability to write SQL scripting, Shell scripting, Java scripting for production maintenance. *JDA WMS 8.2 or later version with strong knowledge of WMS Tables & MOCA scripting *Moca development, Data Driven Applications (DDA), WorkForce (Labor Management) Interface, Web Visibility (DLx LENS) *Interfaces with Order Management and Middleware Systems using middleware like KAFKA, Web Methods, TCP/IP Sockets *Experience with reporting using LOOKER is desired. *Possess a working knowledge of DC operational practices and procedures, and a strong understanding of Supply Chain and WMS concepts *Able to work on new technologies rolled out, quickly learn and fix/rootcause. *Possess proven experience working directly and collaboratively with DC Operations, building effecting relationships with personnel at all levels * While at Sephora, you’ll enjoy… *Beauty & Beyond : Every day we reimagine beauty, discover new brands, and influence positive change. Together we inspire our clients, empower people, and help them become the best versions of themselves. We think this is beautiful. *Endless Evolution : You will learn with innovators, artists, and experts in every field. As our business evolves, so will you. Here, you’re empowered to choose your own path, accelerate your growth, and be your best. As part of our family and the LVMH community, your options are endless. *Creativity Unleashed : At Sephora, you’re encouraged to explore, innovate, and have fun while working with diverse clients, teams, and leaders. You won’t just partner with iconic brands; you’ll help build them. We value your curiosity, your drive for success, and the emotional connections you make. Together we’re defining the future of beauty. *Bold Authenticity : Being bold and different has made us a global beauty and retail leader. At Sephora, we celebrate diversity, embrace your unique and winning spirit, and believe that real beauty is being authentically you. You are what sets us apart. *Diversity, Inclusion & Belonging : We pledge to create a beauty community where everyone’s uniqueness is celebrated, respected, and honored. We will drive diversity, equity, and inclusion in all aspects of our business—ensuring that our employees, brand partners, suppliers, and our clients feel a sense of belonging in store, online, and in our workplaces. We believe in demonstrating our values with action! *Meaningful Rewards : Sephora offers comprehensive medical benefits, generous vacation and holiday time off, commuter benefits, an employee discount, free beauty product gifts from brand partners, and so much more. Details about our company benefits can be found at the following link: https://jobs.sephora.com/USA/content/Our-Perks/?locale=enUS . * Sephora is an equal opportunity employer and values diversity at our company . We do not discriminate on the basis of race, religion, color, national origin, ancestry, citizenship, gender, gender identity, sexual orientation, age, marital status, military/veteran status, or disability status. Sephora is committed to working with and providing reasonable accommodation to applicants with physical and mental disabilities. * Sephora will consider for employment all qualified applicants with criminal histories in a manner consistent with applicable law. *#LI-AO1 *COMPANY OVERVIEW:* SEPHORA has been changing the face of prestige cosmetics since its debut in 1970s Paris. Sephora was acquired by luxury group Moët Hennessy Louis Vuitton (LVMH) in 1997 then launched stateside in 1998, and is currently home to 200 world-class brands - including its own private label, SEPHORA COLLECTION. Sephora's curated assortment features more than 14,000 products including makeup, skin care, perfume, hair care, body, professional tools and more. Sephora is the beauty education hub, offering consultations at the Beauty Studio, a variety of complimentary classes, one-on-one service from Personal Beauty Advisors, and exclusive retail technology SKINCARE IQ, COLOR IQ, and FRAGRANCE IQ. Sephora is an international force in beauty, and its award-winning website and ever-growing presence on social-media make it the world's premier digital beauty destination.","https://www.indeed.com/rc/clk?jk=037647fbba5869e0&fccid=6458ba009eede0b6&vjs=3","Remote","Part-time","MSIS",1,0,1,0,0,0,0,0,0,0,0,0,0,0,0,0,1,0,0,0,"2eb5c368e938c1aa9856dff5bd9bbceb"
"26","data architect",2022-08-17,"Information Technology Director II","State of Utah","Salt Lake County, UT","* *  *   Job Description*   *  *  *   The Division of Technology Services (DTS) is looking for a highly motivated, energetic, self-starter to be part of our excellent and entrepreneurial DTS enterprise team. This position is for an IT Director II supporting the Utah Dept of Corrections (UDC) and the Utah Board of Pardons and Parole (BOPP). This position will be a mix of in office (14717 Minuteman Dr., Draper, UT) and Teleworking.The Ideal Candidate: The ideal candidate for this position will have strong analytical abilities coupled with advanced people skills. You should be comfortable diving into large and complex systems and ""figuring it out"", while at the same time working with a variety of executive level stakeholders. The chosen candidate must be able to handle multiple tasks that are often competing for top priority. The candidate must have senior level experience managing teams of at least five direct reports.*    Why join our team? We have great business partners who want to serve Utah citizens efficiently and effectively, while working within the guidance of their federal and state partners. This is an opportunity to make a difference for Utah citizens while being a pivotal part of an exciting IT team. You will receive great health and retirement benefits, such as, generous paid time off so you can spend more time with your family and have a positive work life balance. Click here to view a summary of all the benefits we offer.The Agency: To learn more about The Division of Technology Services check us out Click here. The State's environment is a highly optimized blend of systems responsible for collecting, processing, and distributing millions of data elements every day.*  *   *  *   Example of Duties*   *  *  *   *    Primary Duties:*   *    Work with business partners to add detail and rigor to initial problem statements and/or requirements.*     Supervise IT Managers and Project Managers to create and maintain Offender Tracking Software.*     Produce project documentation necessary to manage a portfolio of projects.*     Provide direct and indirect management to a team of highly talented web developers and systems architects.*     Develop technology road maps for web development.*     Assist in the creation of enterprise wide style guides and development standards.*     Occasionally participate with the team in after-hours support.*     Present website designs to agency executives and end users.*     Conduct focus groups.*     Be part of the Executive Committee for UDC and BOPP Senior Management*     Work in a matrixed team environment handling tasks from both project and support groups.*   *   *  *   Typical Qualifications*   *  *  *   Strong analytical skills with the ability to conceptualize complex and abstract ideas*     Strong IT Management skills and understanding of all aspects of hardware, software, networking, desktop support, and security.*     Track record of progressive responsibility in the management of development teams*   *   *  *   Supplemental Information*   *  *  *   Employment contingent on passing a drug screening and a background check.*     Risks found in the typical office setting, which is adequately lighted, heated and ventilated, e.g., safe use of office equipment, avoiding trips and falls, observing fire regulations, etc.*     Typically, the employee may sit comfortably to perform the work; however, there may be some walking; standing; bending; carrying light items; driving an automobile, etc. Special physical demands are not required to perform the work.*   * **","https://www.indeed.com/rc/clk?jk=17776accacae1eac&fccid=a9dfcf89bb8a97bb&vjs=3","On-site","Part-time","MSIS",0,0,0,0,0,0,1,0,0,0,0,0,0,0,0,0,0,0,0,0,"09da0b4c4d672b4d9ed9addb492a4cda"
"27","data integration engineer",2022-08-17,"IT Analyst II","State of Utah","Hybrid remote in Salt Lake County, UT","* *  *   Job Description*   *  *   Join a world-class team at The Division of Technology Services (DTS) as we partner with the Utah Department of Environmental Quality (DEQ). Use your JavaScript, Python, and Node.JS development skills to help build and maintain applications that help DEQ protect our air, land, and water. This existing position will work with the DTS development team to maintain and build AWS cloud based applications, and Java web-based applications. The successful applicant will work through the development lifecycle as we implement technical requirements, analyze business requirements, design, deploy, and document projects. The chosen candidate should be comfortable working independently, as well as being a leader and consultant as part of project teams. This position may be a hybrid of remote (must reside in Utah) and some in office work as needed, located at: Department of Environmental Quality 195 N 1950 W Salt Lake City, Utah.*   *     This job may be filled at either of the levels listed below. (Rate as listed or in accordance with DHRM Rules for current state employees.)*   *    Information Technology Analyst II, $31.65- $53.80 per hour*     Information Technology Analyst I, $24.80- $42.17 per hour*    The State of Utah has a large variety of careers for people in both rural and urban areas, with all types of experiences and backgrounds who come together for a singular purpose—to work where they live, to serve the residents and businesses as well as the visitors of the State of Utah. Find your next job and grow your career while serving the State you love!*    Why join our team? We have great business partners who want to serve Utah citizens efficiently and effectively, while working within the guidance of their federal and state partners. This is an opportunity to make a difference for Utah citizens while being a pivotal part of an exciting IT team. You will receive great health and retirement benefits, such as, generous paid time off so you can spend more time with your family and have a positive work life balance. Click here to view a summary of all the benefits we offer.The Agency: To learn more about The Division of Technology Services check us out Click here. The State's environment is a highly optimized blend of systems responsible for collecting, processing, and distributing millions of data elements every day.*  *   *  *   Example of Duties*   *  *   Primary Duties:*    Maintain and build AWS cloud based applications*     Java web-based applications*     Work through the development lifecycle as we implement technical requirements*     Analyze business requirements*     Design, deploy, and document projects*   *   *  *   Typical Qualifications*   *  *   Required:*    At least two years of JavaScript or Java application development experience*     Previous employment as a JavaScript or Java based developer*     Knowledge base of cloud hosted applications*     Demonstrated ability with application development*     Demonstrated ability with application debugging and code fixes*     Familiarity with agile methodologies*     Understanding of application development best practices*     Comfortable learning new toolsets and platforms*     Experience providing end user training and support*     Knowledge of principles, theories, and practices of computer science*     Deal with people in a manner which shows sensitivity, tact, and professionalism*     Test software using appropriate methodology and techniques*    Preferred:*    Experience with JavaScript, NodeJS, and React*     Fundamental understanding of Java, MVC framework, Spring, Spring Boot*     Knowledge of serverless application development*     Experience with version control systems(GIT, BitBucket)*     Understanding of database design*     Experience developing and deploying cloud-based applications*     Experience with unit testing (Jest)*     Experience with functional testing (Cypress, Selenium)*     Experience with API integrations (REST, GraphQL)*     Experience with AWS and/or GCP based applications*     Experience with .NET application maintenance and support*   *   *  *   Supplemental Information*   *  *  *   Employment contingent on passing a drug screening and a background check.*     Risks found in the typical office setting, which is adequately lighted, heated and ventilated, e.g., safe use of office equipment, avoiding trips and falls, observing fire regulations, etc.*     Typically, the employee may sit comfortably to perform the work; however, there may be some walking; standing; bending; carrying light items; driving an automobile, etc. Special physical demands are not required to perform the work.*   * **","https://www.indeed.com/rc/clk?jk=96fbdf479a8b669c&fccid=a9dfcf89bb8a97bb&vjs=3","Hybrid","Part-time","MSIS",0,1,0,0,0,0,0,0,0,0,0,0,0,0,0,0,0,0,0,0,"8fed0c63f1820e86f5edb938d4495898"
