"","Search","Date","Title","Company","Location","Description","Link","Work Model","Job_Type","Program","R","Python","SQL","Tableau","PowerBI","Azure","Excel","Talend","SAS","Spark","Qualtrics","Domo","Salesforce","SAP","Hadoop","Qlik","Looker","Zoho","Stata","Snowflake","ID"
"9","network security engineer",2022-05-01,"Sr. Technical Support Engineer","Broadcom","Draper, UT 84020","* Company Description *  Broadcom – Through the combination of industry leaders Broadcom, LSI, Broadcom Corporation, Brocade, CA Technologies and Symantec, the company has the size, scope and engineering talent to lead the industry into the future. Broadcom is focused on technology leadership and category-leading semiconductor and infrastructure software solutions. The company is a global leader in numerous product segments serving the world’s most successful companies. *  Broadcom Software Group (BSG) – The newly created Broadcom Software Group (BSG) oversees Broadcom’s six software divisions, including the Symantec portfolio, as well as software sales, customer support and software operations. *  Symantec – Broadcom acquired and integrated Symantec into its portfolio in 2019. Symantec is a global leader in Endpoint Security, Web Security, Information Security, Email Security, and Privileged Access Management. Symantec solutions are powered by the largest civilian global security intelligence and research network in the world. The Symantec Integrated Cyber Defense (ICD) Platform delivers Endpoint Security, Identity Security, Information Security, and Network Security across on-premises and cloud infrastructures to provide the most complete and effective asset protection in the industry. *  Customer Support – The Customer Support organization delivers the customer support function of the Broadcom Software Group. Our mission is to ensure that customers are successful and get the most value out of our software solutions. We work from many locations around the world, serving the global customer base and providing continuous coverage. *  Job Description *  The Customer Support Engineer in Broadcom is a highly skilled and experienced customer focused technical professional that achieves excellent customer satisfaction and drives product adoption through fulfilling a varying range of roles, based on the company’s business needs and each individual’s strengths, abilities and preferences. *  This job opening is dedicated for supporting products within the Symantec Endpoint Security portfolio – https://www.broadcom.com/products/cyber-security/endpoint. This role is being filled in the Draper, Utah office. Candidates must be able to work in this office full time. *  If you are looking for making an impact, this role offers the opportunity of bringing huge value to some of the world’s greatest organizations. You will be working with some of world’s best cyber security technologies and teaming up with top professionals to deliver outcomes that make a difference. *  The main roles of the job are providing Technical Support (reactive technical support, working with various customers) and Designated Support (account and relationship management, reactive and proactive technical support provided to specific customer accounts). Other activities include working with the product engineering teams, contributing to the support knowledge base, mentoring colleagues, building and delivering trainings, partnering with global peers from within and outside the direct product portfolio to support complex customer implementations, participating in projects and collaborating with the sales and account teams. *  On a regular day you will manage your backlog of cases, handle new cases raised by customers, assist on case escalations, schedule and attend calls with your designated accounts and other customers to progress cases, make use of lab resources to replicate and troubleshoot customer issues. You will collaborate closely with your colleagues and management team, partnering to meet or exceed the team’s performance goals. You will be expected to occasionally cover, in an on-call model, weekends and public holidays. Adaptability and flexibility are key in keeping up with the ever-changing business needs and evolving industry. *  Key Benefits *  Motivating yearly bonus plan correlated with individual and company success * Motivating yearly company stocks allowance plan (not applicable in some countries) * Default sponsored certifications (others may be sponsored on request): * CompTIA Security+ * CompTIA CySA+ * Symantec Certified Specialist (various products) * Other country specific benefits may be provided *  Expectations and Responsibilities *  Fulfil the role of trusted advisor to the company’s customers * Troubleshoot a wide array of technical issues within complex customer environments, apply broad concepts and theories to achieve innovative and effective solutions to complex problems * Provide a leadership role for the work group through knowledge in your area of specialization, determine work priorities based on general direction from managers * Determine methods and procedures on new assignments; determine your own priorities, both tactical and strategic; consult with management on long-range goals * Own your work and the complete customer experience, drive successful outcomes * Demonstrate accountability and sense of urgency based on customer needs * Frequent, empathetic and qualitative communication with all stakeholders (internal and external) * Drive to achieve the timely resolution of cases * Contribute to customer retention, renewal and adoption * Effectively fulfil the associated tasks and attributions of your assigned role/s * Follow case management best practices and effectively apply processes * Responsiveness and availability during working hours * Participation in ensuring regional weekend and holiday coverage * Collaborate with regional and global peers, share knowledge, be a team player * Participate in regional and global projects * Exhibit awareness, initiative, consistency and proactivity * Continually develop your product skill and knowledge * Constantly seek to improve and refine your customer service skills * Contribute to the creation and sharing of knowledge (KCS) *  Experience and Qualifications *  Bachelors and 8+ years of related experience; at this level post-graduate coursework may be desirable or Master’s degree and 6+ years of related experience or PhD and 3+ years of related experience * Knowledge and experience in technical support and customer relationship management * Cyber Security fundamentals knowledge. Recognized Cyber Security certifications are a plus: Security+, CySA+, CASP+, SSCP, CCSP, CISSP, CCNA, CCNP, etc. Prior experience working with enterprise grade cyber security products, such as Symantec Endpoint Security, is a plus * Strong hands-on experience across the following technologies: Active Directory, Domain Name System, DHCP, TCP/IP, Routing, Network Topologies, Windows OS (Client & Server), Virtualization * Working knowledge in any of the following technologies is a plus: Firewall, Proxy, Intrusion Detection/ Intrusion Prevention, PKI, Wireshark, Netmon, Memory Dump Analysis, Process Monitor/Process Explorer, Linux OS, Mac OS, SQL, Cloud and Hybrid environments, IIS, Apache *  Broadcom is proud to be an equal opportunity employer. We will consider qualified applicants without regard to race, color, creed, religion, sex, sexual orientation, gender identity, national origin, citizenship, disability status, medical condition, pregnancy, protected veteran status or any other characteristic protected by federal, state, or local law. We will also consider qualified applicants with arrest and conviction records consistent with local law. *  If you are located outside USA, please be sure to fill out a home address as this will be used for future correspondence.*","https://www.indeed.com/rc/clk?jk=543c0e330426dfbe&fccid=db9705308229f617&vjs=3","Hybrid","Part-time","MSCM",0,0,1,0,0,0,1,0,0,0,0,0,0,0,0,0,0,0,0,0,"af11bc0735c5a3d54d3ab531b33f5c54"
"10","network security engineer",2022-05-01,"Sirius Engineer, Infrastructure Solutions Build Group","CDW","Salt Lake City, UT","* * *  Sirius Computer Solutions is a CDW company. We share common values as a performance-driven, customer-focused culture. CDW is a leading multi-brand provider of information technology solutions to business, government, education and healthcare customers across the globe. *  Position Summary The primary purpose of this position is to process internal and external requests for Build Solutions, best practice designs, Presales Network Engineering assistance and sales cycle processes. This role assists in Pre/Post sales and engineering field teams through Configuration processing, technical assistance, professional services opportunity discoveries and Solution Design expertise. This role works in a quality, professional manner to complete responsibilities on time and accurately, resulting in high customer satisfaction.*   *  Primary Duties & Responsibilities *  Provides regional and team coverage of all configuration requests received company wide. *   Provide best practice design validation, licensing requests, research and product support verification. *   Improves response time, turnaround time and sales-cycle efficiency by fielding non-architectural client conversations and configuration operational workload. *   Performs pre-sales activities in conjunction with Sales Teams in educating clients with Sirius Computer Solutions products. *    Prepares and delivers client presentations *     Provides product demonstration to include implementation/migration planning *     Prepares product deliverable templates/client timetables *     Reviews client hardware configuration to ensure client meets necessary requirements *    *   Performs small to large-scale configuration and solution recommendations based upon customer requirements *   Facilitates order process by responding to technical product inquiries from support staff and field personnel *   Provides guidance to sales force regarding technology updates and/or changes *   Engages with customers for product information and recommendations *   Drive additional professional services and sales opportunities using keen engineering skills and client needs assessments. *   Check available stock levels and sources for build solutions while maintaining solution integrity. *   Client facing, sales driven whiteboarding sessions to solidify client requirements and needs. *   Performs research, problem solving, technical support, and general maintenance of client relationship *   Monitors and reports status of efforts, anticipates, and identifies issues that inhibit the attainment of goals and implements corrective actions *   Supports bill of materials, quotations and technical responses to Request of Quotation (RFQs) & Request for Information (RFIs) and Request for Proposals (RFPs) *   Provides guidance to less experienced technical team members *   Takes a lead role as the team subject matter expert on certain products or solutions *   Develops reusable assets (templates, tools, etc) for the Solution Build practice *   Training/Certifications: Attends training sessions, and obtains industry related certifications as determined by management *  *  Basic Qualifications *  Bachelor’s degree in Computer Science, Management Information Systems, Information Technology, Engineering, Mathematics or a related field *   At least three (3) years of IT experience dealing with infrastructure solutions in a specified Sirius practice (Networking, Converged Infrastructure/Storage, etc), to include at least three (3) years in a presales networking engineer or design associate role or similar. *   An Associate level certification from at least one of the following manufacturers: Cisco, Dell, Brocade, HPE Aruba, Riverbed, F5, Palo Alto, Fortinet, Citrix NetScaler, Juniper, Arista *  Other Required Qualifications *  Demonstrated ability to configure IT infrastructure systems, including components, tools, and related software *   Demonstrated ability to analyze and interpret technical manuals and documentation *   Demonstrated ability to acquire further technical skills *   Demonstrated verbal and written communication skills *   Demonstrated ability to multitask and prioritize workloads *   Demonstrated customer service skills *   Demonstrated ability to investigate problems and utilize problem solving techniques *   Demonstrated ability to establish positive working relationships and work as a team player in a consulting environment *   Demonstrated ability to be resourceful in working with disparate clients and across internal departments to deliver meaningful solutions *   Demonstrated ability to provide guidance and leadership to less experienced technical team members *   Demonstrated ability to develop strong customer relationships and trust to secure future business *   Demonstrated ability to achieve high levels of customer satisfaction *   Demonstrated project scoping experience *  Preferred Qualifications *  Working knowledge of these programs and tools: Salesforce, CCW, CCWr, Netformx, MS Tools Suite, Webex Tools Suite, IRIS and Juniper configuration tool. *   At least one (1) year pre or post sales Field experience *   Must be eager and willing to learn new skills everyday*   *  Data Privacy and Security *  All Sirius employees are responsible to safeguard the information and information systems that they use or handle in the execution of their duties. Employees are obligated to know and perform their duties in accordance with Sirius policies, standards, and procedures related to security and report security violations to the appropriate Sirius authority. *   Participate at hire and annually in the Information Security Awareness training as well as other required training identified by the Human Resources department. Other data privacy and data security related regulatory training may be required based on your role or assignment *  COVID-19 Update: CDW is committed to maintaining a workplace that is free of known hazards and to ensuring the safety, health, and well-being of coworkers and candidates for employment and their families, as well as the community. *  CDW requires all coworkers be fully vaccinated against COVID-19, with the only exceptions being a documented, legally required medical or religious accommodation. Prior to starting with CDW, successful candidates will be required to: (i) be fully vaccinated against COVID-19 and provide CDW with proof of full vaccination; or (ii) apply for and receive a medical or religious-based accommodation to be exempt from the mandatory vaccination policy.* *","https://www.indeed.com/rc/clk?jk=0a7b5afbd43b9fa6&fccid=d9cf78b5cbf8e15d&vjs=3","On-site","Part-time","MSCM",0,0,0,0,0,0,0,0,0,0,0,0,1,0,0,0,0,0,0,0,"70b1512ae8a8cc0d8dfb32d59b76c616"
"11","data analyst",2022-05-01,"Sales Project Analyst","Cornerstone Building Brands","Salt Lake City, UT","* Cornerstone Building Brands is deeply committed to building a workplace and global community where inclusion is not only valued, but prioritized, providing an environment of mutual respect where equal employment opportunities are available to all applicants and team members. *  Cornerstone Building Brands is adding to the team and is looking for two new Sales Project Analysts. The successful candidate(s) will not only be responsible for the master data set of the company but generating reports and correcting any data issues and problems that may arise. Effectively manage projects and support sales team in their efforts to grow sales revenue. Provide pre-sales and post-sales support. Maintain account management functions to achieve business goals *  RESPONSIBILITIES * Compile and analyze data over time to forecast sales trends, review past sales data to determine trends in productivity *  Review & Recommend Stock assortment via SKU rationalization & Inventory Stock to Sales *  Create & manage project tracker with heavy communication *  Present actionable information and insights to team members and management *  Create professional presentations and be able to present *  Gather and analyze data in order to understand problems and address them proactively *  Collaborate with team members and members of other departments *  Assists in designing promotional materials *  Leads informational sessions for staff to explain sales trends and new marketing strategies *  Performs other duties as assigned *  REQUIREMENTS * Education: High School Diploma or equivalent; Bachelor’s degree preferred. * Experience:* Three years proven direct sales experience in the Retail industry. General knowledge of major competitive brands. *  Strong communication skills. *  Experience with sales planning, budgeting, and T&E expense management. *  Understanding Retail Merchandising & Inventory and able to understand consumers point of view. *  Building relationship with customers. * Skills/Abilities:* Able to create Pivot Tables & simple formulas in Excel & able to create PowerPoint presentations. *  Excellent verbal and written communications skills. *  Strong problem solving and negotiation skills. *  Solid time management skills. *  Adept at prioritizing multiple responsibilities. *  Interpersonal and teamwork skills are essential. *  Strong personal motivation & analytical thinker. * Other: Position requires travel (40%+) *  Cornerstone Building Brands is an Equal Opportunity Employer. All qualified applicants will receive consideration for employment without regard to race, color, religion, sex, sexual orientation, gender identity, national origin, or protected veteran status and will not be discriminated against on the basis of disability. You can find the Equal Employment Opportunity Poster here. If you’d like to view a copy of the company’s affirmative action plan or policy statement, please email HRCompliance@cornerstone-bb.com. If you have a disability and you believe that you need a reasonable accommodation in order to search for a job opening or to submit an online application, please e-mail HRCompliance@cornerstone-bb.com. This email is used exclusively to assist disabled job seekers whose disability prevents them from being able to apply online. Only emails received for this purpose will be returned. Messages left for other purposes, such as following up on an application or technical issues not related to a disability, will not receive a response. *  California Consumer Privacy Act (CCPA) of 2018 *  Must be at least 18 years of age to apply. *  Notice of Recruitment Fraud * We have been made aware of multiple scams whereby unauthorized individuals are using Cornerstone Building Brand's name and logo to solicit potential job-seekers for employment. In some cases, job-seekers are being contacted directly, both by phone and e-mail. In other instances, these unauthorized individuals are placing advertisements for fake positions with both legitimate websites and fabricated ones. These individuals are typically promising high-paying jobs with the requirement that the job-seeker send money to pay for things such as visa applications or processing fees. Please be advised that Cornerstone Building Brands will never ask potential job-seekers for any sort of advance payment or bank account information as part of the recruiting or hiring process.*","https://www.indeed.com/rc/clk?jk=aaaa890dcb202591&fccid=661482a3e1184c30&vjs=3","On-site","Part-time","MSBA",0,0,0,0,0,0,1,0,0,0,0,0,0,0,0,0,0,0,0,0,"e0538091afaad265cae36502fa89e54b"
"12","cloud engineer",2022-05-01,"Critical Infrastructure Engineer","DataBank | DataBank Holdings","Bluffdale, UT 84065","DataBank enables the worlds largest enterprises, technology, and content providers to consistently deploy and manage their infrastructure, applications, and data on the right platform, at the right time, in the right place. Our colocation and edge infrastructure footprint consists of 60+ data centers and 20 interconnection hubs in 29 markets, on-ramps to an ecosystem of cloud providers, and a modular edge data center platform with virtually unlimited reach.*DataBank is proud to be an Equal Opportunity Employer. Our work culture at DataBank does not discriminate based on actual or perceived race, creed, color, religion, alienage or national origin, ancestry, citizenship status, age, disability or handicap, sex, marital status, veterans' status, gender, gender identity, gender expression, genetic information, sexual orientation, or any other characteristic protected by applicable federal, state, or local law.*Individuals in this position are responsible for supporting 100% uptime for the Data Center and its customers.*Responsibilities*Drives process and procedure in the organization*Develop and review MOPs and SOPs*Ensures correct and on time implementation of solutions for customer applications, including preparation of space, power, and network*Prepares and presents technical presentations on the facility*Responsible for all technical aspects of facility operations including power and HVAC systems*Monthly reporting and metrics*Provides technical support to insure successful customer integration and implementation of company solutions*Handles all facility issues encountered during day to day operations to ensure 100% uptime for facility operations*Qualifications*Requires 7+ or more years of Facility Operations and management experience in the Data center industry*Excellent verbal and written communications skills*Strong skills in presentation and proposal design*Strong knowledge of general industry networking technologies such as UPS, Generators, and Mechanical systems*Ability to multi task and meet multiple deadlines*Education and Experience: Bachelor's degree from a four-year college or university preferred; or equivalent training, education and experience. Additional Educational Information (if any):*Data Center industry experience preferred.*Supervisory/Managerial Responsibilities:*Strong Supervisory responsibilities needed with this position.*Benefits*Health, Vision, Dental, packages*Short-term and Long-term Disability Insurance*Life Insurance*401k with company match*Paid Time Off and Paid Holidays*Brand: DataBank**Address: 14944 Pony Express Road Bluffdale, UT - 84065**Property Description: 2 - Pony Express Rd - Bluffdale UT**Property Number: 2","https://www.indeed.com/rc/clk?jk=d3244de6675abb9f&fccid=54872acee9502113&vjs=3","On-site","Part-time","MSIS",0,0,0,0,0,0,1,0,0,0,0,0,0,0,0,0,0,0,0,0,"dade3d71ac514fc66f3a5396cca47e5a"
