Search,Date,Title,Company,Location,Description,Link,ID
business intelligence analyst,2022-07-11,Senior Financial Business Analyst,Allied Onesource,"Lindon, UT 84042","** *  *   *    *     *      Senior Financial Business Analyst*      *     *      We are searching for a Senior Financial Business Analyst - someone who works well in a fast-paced setting. In this position, you will provide analysis of financial and business performance, reporting, budgeting, and forecasting of business operations, performance KPIs, headcount, and the financial infrastructure of cost centers. Supports the budgetary planning and forecasting process and provides financial support to key stakeholders. Interacts with key stakeholders by successfully demonstrating the ability to collaborate across functions.*      *     *     *      *       *        Are you looking for a profitable and growing company with a great culture and reputation? *         Are you looking for an opportunity to build global experience? *         Do you thrive off challenges and going above and beyond? *         If so, you are exactly the type of person we are looking for! *        We are searching for a Senior Financial Business Analyst - someone who works well in a fast-paced setting. In this position, you will provide analysis of financial and business performance, reporting, budgeting, and forecasting of business operations, performance KPIs, headcount, and the financial infrastructure of cost centers. Supports the budgetary planning and forecasting process and provides financial support to key stakeholders. Interacts with key stakeholders by successfully demonstrating the ability to collaborate across functions.*        Job Duties & Responsibilities *        Participate in corporate planning, budgeting, forecasting, and annual and long-range planning in support of key operating segment(s), sales channel(s), and/or functional area(s). *         Provides accurate, timely, and actionable financial reporting and key business metrics to business and operating teams gains key insights into trends with meaningful and actionable analyses. *         Contribute to monthly accounting close & reporting process *         Support Finance’s standing goal to continuously improve the quality, efficiency, and value of financial information produced, via financial tools, operational efficiencies, and automation. *         Gathers data to contribute to building financial performance metrics including utilization of resources, efficiency metrics, dashboards, and/or profitability reporting. *         Build thoughtful analyses to drive better investment decisions and optimal resource allocation. *         Assists in managing the budget for the respective area(s) by identifying opportunities to achieve cost savings. Assists in evaluating and determining the best use of budgeted financial resources. *         Provide input and analytical support for business/investment/synergy cases, pricing scenarios, and/or billing. *         Collaborate and communicate on a timely basis with other functional areas within the organization regarding monthly or quarterly forecasts, annual budgets, and other financial trends and developments *        Skills & Requirements *        Minimum of 4 years related professional experience in finance or a related field *         Demonstrated competency in financial and statistical reporting, design, and preparation of financial models required *         Experienced with ERP and ERM systems (e.g., Hyperion, Oracle Financials, OneStream), advanced excel. *         BA/BS in Business, Finance, Economics, or equivalent. Additional experience in lieu of a degree may be considered *         Publicly traded, high-growth technology companies preferred *        Salary: $85,000 - $95,000 *       *      *     *     *     *      Location: Lindon - UT *     *     *      ZIP code: 84042*      *     *      Reference: 110301*      *     *      Secondary Reference: #LI-SH1,INDITTO,AW*     *    *   *  * **",https://www.indeed.com/pagead/clk?mo=r&ad=-6NYlbfkN0CK-8nPx1PXKPyVwi8YM4tCpnZRQ_DYusyN8hYEsp4F2XPfB-QtKAUSL9EmgeoF99jBP-3OpLqyUdCWfxcFKGju5SuBvN6zSwk9NkD41mXydYHmN_PNTnFBFtbFkTnSwJDMiD2r-xDbENcJXQcS4vlkVVICW5HDmHqcVvFCpdZ6zr5J12NqbLIy1VQ16ZwUQNDf4nkj7xPMOiIgyzzFlUWlv9ElIrRJbeidJd4j-BnjcHCegjLo2IhDszu6_pTPVwn7-SC8uz5PxMx35LeCim3oN6F2lFF28Md_EUFpKOWtI64ZEQEkFBFpNe53yBbDipOu5hh5UmVnDuBqZIPEkA_Pvs1yJYO_0moM0JZWTZYC7zeCSS7ImII7KURtFrOKLh6G92rUlh9SPZ9kfbltCjcUQnXWnXYo4SaPhPllfl3QuGyL9MGeSQaLnie0LdFnjlEBvDdX1RBLycMYszDGv6ThfQPEd82veXWSM_Lgf8-MjKkKr2cE9rvdsHXQzq0-KBPzoRo4bq2sWnDC3DP2u830ddhdyEAGbYllBNHsc2sq5mAAsVBk5-BxBWOcgERve4l92aXD4IepdumvXyJMdUJn&xkcb=SoCC-_M3c4BkSQ0y0R0IbzkdCdPP&p=10&fvj=0&vjs=3,2ad309c14a95d77f39bc183003a12e49
security manager,2022-07-11,Security Site Supervisor - Manufacturing Company,Allied Universal,"Salt Lake City, UT 84111 (Central City area)+2 locations","* *  Allied Universal®, North America’s leading security and facility services company, provides rewarding careers that give you a sense of purpose. While working in a dynamic, diverse and inclusive workplace, you will be part of a team that fuels a culture that will reflect in our communities and customers we serve. We offer medical, dental and vision coverage, life insurance, 401K, employee assistance programs, company discounts, perks and more for all full-time positions!* *  Allied Universal Services is seeking the position of a Security Site Supervisor.*  * The Security Site Supervisor will supervise and coordinate the delivery of quality services to an assigned customer. The Security Site Supervisor will act as a liaison between customers, Operation Managers and security officers. They will supervise site staff and provide coaching, recognition and discipline within approved empowerment range.*  * QUALIFICATIONS/REQUIREMENTS:*  Be at least 21 years of age with high school diploma or equivalent*   Possess effective written and oral communication and interpersonal skills with ability to deal with all levels of personnel and the general public in a professional and effective manner*  *   *     Licensing requirements are subject to state and/or local laws and regulations and may be required prior to employment.*   *   As a condition of employment, employee must successfully complete a background investigation and a drug screen in accordance with all federal, state, and local laws*   Display exceptional customer service and communication skills*   Have intermediate computer skills to operate innovative, wireless technology at client specific sites*   Ability to handle crisis situations at the client site, calmly and efficiently*   Capably utilize scheduling and billing software to produce reports (such as Scheduling Activity, Training Detail reports, etc.) that require interpretation and action for effective business management*   Enforce Contract Standards*   Administers site safety programs outlining site-specific hazards for security officers including vehicle / driving safety as appropriate to corporate procedures*   Prepared to participate in unemployment hearings*   Enforces Allied Universal’s policies as outlined in the handbooks and executive memos *  Able to:*    Work in various environments such as cold weather, rain/snow or heat*     Occasionally lift or carry up to 40 pounds*     Climb stairs, ramps, or ladders occasionally during shift*     Stand or walk on various surfaces for long periods of time*   * *   Allied Universal® is an Equal Opportunity Employer. All qualified applicants will receive consideration for employment without regard to race/ethnicity, age, color, religion, sex, sexual orientation, gender identity, national origin, genetic information, disability, protected veteran status or relationship/association with a protected veteran, or any other basis or characteristic protected by law. For more information: www.aus.com* *  * * *  If you have any questions regarding Equal Employment Opportunity, Affirmative Action, Diversity and Inclusion, have difficulty using the online system and require an alternate method to apply, or require an accommodation at any time during the recruitment and/or employment process, please contact our local Human Resources department. To find an office near you, please visit: www.aus.com/offices.* *",https://www.indeed.com/pagead/clk?mo=r&ad=-6NYlbfkN0Bkl6eMu1FM1r07QHNveSMIb5NS-ooqLFrV5tiSRjmHVl6py5KZ0S4DryhV055PNS92sOz1oP_GzaI-BPR3ubfoz0H_GCK1KszR7oqej6W_HhU_5hllHQlapaRsxh6cuJubD_8KF35zgpolXUvsUigdO-_g0q5jAaWuykyb-uqL17xkUQJJt4qtV1I6--rzQu4rY8jvNVigI0z6dMcM5YX_6KIcjWZfFUF3XXyytqlv_Pg6wPTL1s5BTkvV9diFK7F9IU3VQxi1SkIKda6L24lxL_QnOU4KkCCa7vmjAg_ug0SfcHdSM8vNnOj19DEF_4dvP-2__x9odXn-ko61HUiX1L-Bty7oX9M0DAQmNt4_gM9zmo-v5cv0VMbsi0Hx5Cdr64i_0T-Cleq__9zIjogOndCT_IsgYTdebh2HSsrhEFt8ekEw3Iv2&xkcb=SoAf-_M3c4BTDEUy3R0JbzkdCdPP&p=1&fvj=0&vjs=3,a157665052ab4a712672dce19af2bc14
security manager,2022-07-11,Security Site Supervisor - Call Center,Allied Universal,"Midvale, UT 84047","* *  Allied Universal®, North America’s leading security and facility services company, provides rewarding careers that give you a sense of purpose. While working in a dynamic, diverse and inclusive workplace, you will be part of a team that fuels a culture that will reflect in our communities and customers we serve. We offer medical, dental and vision coverage, life insurance, 401K, employee assistance programs, company discounts, perks and more for all full-time positions!* * *   Wages - Paid Weekly - *  $19.00 per hr - and paid training at Minumum Wage* * *   Full Benefits- Uniforms Provided- Training Provided* *  * * * *  For all full-time positions, we offer medical, dental and vision coverage, life insurance, 401K, sick pay (in states where required), employee assistance programs, company discounts, perks and more! We also offer part-time and flexible schedules!* *  * * *  APPLY NOW* *  * * Allied Universal Services is seeking the position of a Security Site Supervisor.*  * The Security Site Supervisor will supervise and coordinate the delivery of quality services to an assigned customer. The Security Site Supervisor will act as a liaison between customers, Operation Managers and security officers. They will supervise site staff and provide coaching, recognition and discipline within approved empowerment range.*  * QUALIFICATIONS/REQUIREMENTS:*  Be at least 21 years of age with high school diploma or equivalent*   Possess effective written and oral communication and interpersonal skills with ability to deal with all levels of personnel and the general public in a professional and effective manner*  *   *     Licensing requirements are subject to state and/or local laws and regulations and may be required prior to employment.*   *   As a condition of employment, employee must successfully complete a background investigation and a drug screen in accordance with all federal, state, and local laws*   Display exceptional customer service and communication skills*   Have intermediate computer skills to operate innovative, wireless technology at client specific sites*   Ability to handle crisis situations at the client site, calmly and efficiently*   Capably utilize scheduling and billing software to produce reports (such as Scheduling Activity, Training Detail reports, etc.) that require interpretation and action for effective business management*   Enforce Contract Standards*   Administers site safety programs outlining site-specific hazards for security officers including vehicle / driving safety as appropriate to corporate procedures*   Prepared to participate in unemployment hearings*   Enforces Allied Universal’s policies as outlined in the handbooks and executive memos *  Able to:*    Work in various environments such as cold weather, rain/snow or heat*     Occasionally lift or carry up to 40 pounds*     Climb stairs, ramps, or ladders occasionally during shift*     Stand or walk on various surfaces for long periods of time*   * *   Allied Universal® is an Equal Opportunity Employer. All qualified applicants will receive consideration for employment without regard to race/ethnicity, age, color, religion, sex, sexual orientation, gender identity, national origin, genetic information, disability, protected veteran status or relationship/association with a protected veteran, or any other basis or characteristic protected by law. For more information: www.aus.com* *  * * *  If you have any questions regarding Equal Employment Opportunity, Affirmative Action, Diversity and Inclusion, have difficulty using the online system and require an alternate method to apply, or require an accommodation at any time during the recruitment and/or employment process, please contact our local Human Resources department. To find an office near you, please visit: www.aus.com/offices.* *",https://www.indeed.com/pagead/clk?mo=r&ad=-6NYlbfkN0Bkl6eMu1FM1r07QHNveSMIb5NS-ooqLFrV5tiSRjmHVl6py5KZ0S4DryhV055PNS92sOz1oP_GzWPi1bQnyQecOGsoJKdRjamyz8aQW6-xGGXJtgy_0oe2S-GJs-SbdXqOylieXMWbgAHn-uXVOGn1nuce-yjfma76q3O5Z3Gwr3XU76MpQHrq85AhpTOKN-16mJ1mLnPd2DEeDzlmey2eGb6HLU7gqXUnyjk4F9TVgsYl9DX3RFDhK1TvHIHeJWluw5YZjfPP_nrUKqczWyTq5Mv5bYFGdTWId6hAbWce3ai-_Iw7WzErafObdLhXdU71FtaX4VV5vpcX1ypaw4_UvDBMi3OiL0mkDzf4YCC1ycjXtr6wyFrpXPVtZS-97Jib2ahZ-8evE6dysatjFYVWTOAn_x9m6Ox38RjljnSEX8xPURg85tPy&xkcb=SoDH-_M3c4BTDE0y3R0KbzkdCdPP&p=2&fvj=0&vjs=3,a157665052ab4a712672dce19af2bc14
security manager,2022-07-11,Security Shift Supervisor - City Creek,Allied Universal,"Salt Lake City, UT 84111 (Central City area)","* *  Allied Universal®, North America’s leading security and facility services company, provides rewarding careers that give you a sense of purpose. While working in a dynamic, diverse and inclusive workplace, you will be part of a team that fuels a culture that will reflect in our communities and customers we serve. We offer medical, dental and vision coverage, life insurance, 401K, employee assistance programs, company discounts, perks and more for all full-time positions!* * *   Wages - Paid Weekly - *  $18.00 per hr - and paid training at Minumum Wage* * *   Full Benefits- Uniforms Provided- Training Provided* *  * * *  For all full-time positions, we offer medical, dental and vision coverage, life insurance, 401K, sick pay (in states where required), employee assistance programs, company discounts, perks and more! We also offer part-time and flexible schedules!* *  * * *  APPLY NOW* *  * * City Creek Center Graveyard Shift Tues - Fri 10 PM - 7:30 AM Schedule Parking Paid by Client Comfortable Fitting Uniforms Licensing Paid by Company if needed.*  * Allied Universal Services is currently searching for a Professional Security Shift Supervisor.*  * The Shift Security Supervisor will supervise and coordinate the delivery of quality services on a specific shift at an assigned customer. The Security Shift Supervisor will act as a liaison between site supervisor, Account Manager/Field Operations Manager and professional security officers. Supervise staff on assigned shift, providing coaching, recognition and discipline within approved empowerment range.*  * Qualifications/Requirements:*  At least 18 years of age*   Possess a high school diploma or equivalent, or 5 years verifiable experience*   Must possess effective written and oral communication and interpersonal skills with ability to deal with all levels of personnel and the general public in a professional and effective manner; must be able to use initiative and independent judgment within established guidelines*   Must be able to frequently prepare written reports and logs in neat, legible handwriting; *  Must be able to read and understand all operating procedures and instructions*  *   *     Licensing requirements are subject to state and/or local laws and regulations and may be required prior to employment.*   *  *   *     Driving Positions: must possess a valid Driver’s License with at least one year of driving experience, a clean driving record (no major violations within last 36 months, no more than 1 accident in last 24 months, no more than one minor moving violation in last 24 months), a minimum level of insurance as required by Company policy, and the ability to safely operate a vehicle required.*   *   As a condition of employment, employee must successfully complete a background investigation and a post-offer/pre-employment drug/alcohol test, may be required to pass Drivers Record check*   Intermediate computer skills to utilize innovative, wireless technology at client specific sites*   Ability to handle both common and crisis situations at the client site, calmly and efficiently*   Display exceptional customer service and communication skills*   Ability to handle crisis situations at the client site, calmly and efficiently*   Able to:*   Work in various environments such as cold weather, rain/snow or heat*    Occasionally lift or carry up to 40 pounds*    Climb stairs, ramps, or ladders occasionally during shift*    Stand or walk on various surfaces for long periods of time*  *   Allied Universal® is an Equal Opportunity Employer. All qualified applicants will receive consideration for employment without regard to race/ethnicity, age, color, religion, sex, sexual orientation, gender identity, national origin, genetic information, disability, protected veteran status or relationship/association with a protected veteran, or any other basis or characteristic protected by law. For more information: www.aus.com* *  * * *  If you have any questions regarding Equal Employment Opportunity, Affirmative Action, Diversity and Inclusion, have difficulty using the online system and require an alternate method to apply, or require an accommodation at any time during the recruitment and/or employment process, please contact our local Human Resources department. To find an office near you, please visit: www.aus.com/offices.* *",https://www.indeed.com/pagead/clk?mo=r&ad=-6NYlbfkN0Bkl6eMu1FM1r07QHNveSMIb5NS-ooqLFrV5tiSRjmHVl6py5KZ0S4DryhV055PNS92sOz1oP_GzXF8CaZ55DSD3JLPONpbz1Ma7NaVwWej4JDIa_z7yUK0TQfad4GQMrT2FSJvbKqoaYcCHLE5ZaJzVXHcWw2LQoO2cEef6KEGEqnWpqK4yNx2rM4Mus9GJ_rQpcbjij0KcX6U8ur3B8Mz-EMcI6Cxidpv4n7B8X5L4AhBpGsx8kx9j1oV3bdoQu4Je3e7Tg_PUfIS9kwJrBgBABr48dnK-4QwoLQRVLKvVgKIJ460GCXlU4v2XzbOcsaDgiIk_clPu15Q7LBaTCRrzq2uPzsEb7XEok3nWutdAB5SA5qzkuwlFhgjjewHCKYZ3GChcDbHbV5MiI4AqBWNY7vxWrXKycYwlWNY5N-sv2yf8nQG58P5&xkcb=SoDu-_M3c4BTDE0y3R0IbzkdCdPP&p=3&fvj=0&vjs=3,a157665052ab4a712672dce19af2bc14
cloud engineer,2022-07-11,Sr. Mechanical Engineer,Always With Detail,"Taylorsville, UT 84123","My Client is looking for a Mechanical Engineer to join their well-established and growing MEP team!*The ideal candidate shall thrive in a smaller MEP firm, and have a minimum of 5-10 years of HVAC and Plumbing system design.*POSITION RESPONSIBILITIES*– Designs mechanical and plumbing systems and performs load calculations*– Supervises and manages small design team for multiple projects, including establishing criteria and standards, reports, and project drawings and specifications*– Collaborates with client, architect, other disciplines, and contractor to provide appropriate, cost-effective, and coordinated solutions*– Attends poject meetings for assigned projects and site visits*– Reviews equipment submittals*– Participates in business development efforts*REQUIREMENTS:*– BSME, required*– P.E. license in Mechanical Engineering preferred*– AutoCAD /Revit design experience*– Bluebeam / Masterworks experience*– Ability to read and interpret architectural, structural, and other discipline documents.*– Construction process and experience a plus*– Ability to prioritize and balance mulitple project workload*– Good communication / interpersonal skills dealing with clients and supervising staff*– Ability to do minimum travel to client sites****COMPENSATION is commensurate with experience. Excellent Medical Benefits. End of year bonus.****Job Type: Full-time*Pay: $75,000.00 - $100,000.00 per year*Benefits:*401(k)* Dental insurance* Health insurance* Paid time off* Vision insurance*Schedule:*Monday to Friday* Overtime*Supplemental Pay:*Bonus pay*Ability to commute/relocate:*Taylorsville, UT 84123: Reliably commute or planning to relocate before starting work (Required)*Application Question(s):*Do you have supervisory experience?*Experience:*HVAC design: 4 years (Required)* Plumbing design: 4 years (Required)*Willingness to travel:*25% (Required)*Work Location: One location",https://www.indeed.com/company/Always-With-Detail/jobs/Senior-Mechanical-Engineer-3404cba504228e72?fccid=ced9042ac36a98c7&vjs=3,02667522762a8f2a1be0c5a6383d9373
