Search,Date,Title,Company,Location,Description,Link,ID
data architect,2022-07-11,Lead Software Architect - Services,Disney,"Salt Lake City, UT 84111 (Downtown area)+1 location","* *  Job Description :*  *   We are a group of Disney technologists who love to work on the latest technology to build new features and improve existing components of Disney's Online Commerce Platform specializing in Ticketing Products. We also take pride in building the next generation of Commerce products for several business units within the Walt Disney Company. Key Products within Commerce include Tickets, Annual Passes, Special Events, Park Reservations, Unified Checkout across many products including Dining and Lodging across Walt Disney World, Disneyland California, and Disneyland Paris* * * *   Responsibilities :*   Collaborate in a constructive manner with team members and technical and non-technical business partners*    Design and implement software features thinking upfront in terms of efficiency, scalability, and stability.*    Lead engineers, providing guidance, feedback, code reviews, and technical mentorship.*    Participate in Brainstorming Phases of Large-Scale Efforts within Commerce and other areas of Disney Parks and Experience Products.*    Lead design reviews with peers and partners to present/decide among available technologies or solutions.*    Participate in full lifecycle of software development.*    Write and test product code.*    Review code providing feedback with style guidelines, testability, and efficiency in mind.*    Help existing documentation.*    Triage production issues: debugging/tracking and resolving them by analyzing the source of the problem.*    Identify areas of improvement in our application ecosystem and patterns of repeated problems proposing solutions that can be applied globally.*    Elaborate and explain execution plans to technical and non-technical audiences.*    Set best practices to improve scalability, performance, and availability based on technical and business considerations*  * * *   Basic Qualifications :*   7+ years' experience in Software Development*    Experience within a fast-paced, software application delivery, and product launch environment*    Technical expertise with:*     Java, JVM internals (Memory management, garbage collection, JIT, etc)*      Web Containers (e.g., Tomcat server)*      Experience developing spring boot-based RESTful microservices*      Experience writing RESTful APIs (API versioning, documentation, and security)*      Docker*      SQL*      Database modeling*      ORM frameworks/specifications (JPA or Hibernate)*      Experience with AWS Suite (Service Management and Deployments, EC2 and ECS Containers, Lambdas, DynamoDB, or MariaDB/MySQL)*      Experience with unit testing best practices*      Source control systems (GitLab/GitHub)*      Experience designing back-end distributed systems for high availability, high throughput, and low latency.*    *    Development Experience with expectation of 50% or more Code Engagement and Detailed Knowledge in areas:*     Messaging Patterns (Queuing vs Pub/Sub)*      HTTP/HTTPS protocol knowledge*      Relational Database knowledge (Primary keys, Indexes, Foreign keys, SQL)*      Basic cryptographic knowledge (symmetric/asymmetric encryption mechanisms)*      Web-based application security mechanisms (OAuth, HMAC)*      Knowledge of RESTful architectural style*      Experience writing API specifications*    *    Experience troubleshooting performance issues*    Hands-on Knowledge on Design Patterns - Great understanding in the following design patterns: Singleton, Factory, Observer, Builder, Adapter, Publisher/Subscriber, Decorator.*    Hands On Knowledge on Data Structures - Using Lists, Sets, Maps, Linked Lists, Queues, Stacks.*    Hands-on Knowledge of Algorithms- solve coding problems on whiteboard, Big O notation, time, and space complexity of the algorithms.*  * * *   Preferred Qualifications :*   7+ years' Experience in Full Stack Development*    Experience engaging in technology platforms supporting complex business engagements and engineering collaborations*  * * *   Required Education :*   Bachelors degree in Computer Science, Computer Engineering, or Related Disciplines, or Equivalent Professional Experience*  * * *   Preferred Education :*   Masters degree in Computer Science, Computer Engineering, or Related Disciplines, or Equivalent Professional Experience*  * * *   #DISNEYTECH #DPEPFLA #LI-JP9* *",https://www.indeed.com/pagead/clk?mo=r&ad=-6NYlbfkN0DAFTyt7pbDCC2JPO79CSdi1dIb81yjczP5qsKcZIxgiRd1qisRd4re16D_VG3-wzUWs9OwoP3tNEoog3PP2G_jmjQvZKxG-l5kWv5ik7mN6fWAKcQOpr5TaV8z-GZCIr-UONSIr1d8e2B11ePikWSoVhfvrZ-s7lecDvtlNat_0-GRWXj2eX62MciXT8anjC3EBY-Ugw4OtxdxvB6-8ZAgxudKLppJMKR_UTWGgXibqrr9hPHflh_47tqkHtCjypf6pyMRBLnPfY8hJoqi_NN8Qx2MfGbJZNo9ZhQ0PtCRWR63h6UfD6uAaa-SWu62PMc5OqFPi5nDTjQyGaaNsZxSbpOhgi5nIyYlGE2RinyKnvm-gaaW5qxhBi_saOCxBSDhlY41M2nvISLFgYi0MmsmZc0hHoQcf0XeBSasRBj31XiqqqJjYQihk9quofpbkho=&xkcb=SoCK-_M3c4BrstA0P70KbzkdCdPP&p=5&fvj=0&vjs=3,b6ef19602a50e59fdf5715120fddad71
cloud engineer,2022-07-11,Senior Software Engineer,Disney,"Salt Lake City, UT 84111 (Downtown area)","* The Senior Software Engineer applies practical knowledge of development and engineering to conceive, develop and test, and implement software fixes, enhancements, components, and/or new software systems and applications of moderate to high complexity. The Senior Software Engineer owns development, and drives development of components through your own' and subordinate engineers' work. The Senior Engineer provides technical guidance and acts as a point of escalation and technical expert. The Senior Software Engineer designs and develops highly scalable software systems and applications.* *  Responsibilities/You Will*  Own the design and development of software fixes, enhancements, components, and/or new software systems and applications.*   Promote development of components through own and subordinate engineers' work.*   Develop technical solutions that meet specifications and that impact future developments.*   Implement assigned component level software development projects and major fixes using new or existing technologies.*   Develop specifications for assigned components, projects or fixes.*   Review or write code.*   Lead programming, testing and debugging of applications or fixes to existing applications.*   Create protocols, documentation and tools for installation and maintenance.*   Participate in setting the architectural direction for software development projects.*   Design specific components for assigned projects, developing specifications for each.*   Design, develop, manage, create and maintain technical components and templates.*   Code against front-end technology stack and lead end-to-end troubleshooting.*   Interacts and coordinates deliverables with other technical groups in the organization.*   Execute assigned component level projects using all technologies*   Design and develop specifications for assigned projects*   Reviews or troubleshoots and performs testing.*   Participate in conceiving and setting the architectural direction for development projects.*   Design the component tasks of assigned projects, developing specifications for each*   Serve as a high level technical resource and ""go-to"" person for less experienced developers, providing technical guidance and oversight.*   Lead team members in problem analysis and issue resolution.*   Recommend improvements to processes, technology, and interfaces that improve the effectiveness of the team.* *  Basic Qualifications/You Will Have*  5+ years of progressively related experience in design, development, and implementation of highly scalable, high-volume software systems and components, client-facing web applications, and major Internet-oriented applications and systems*   Scrum Master Certification*   ITIL Certification*   Significant knowledge/experience in relevant technologies, such as:*   CS Fundamentals*   Development Tools*   Java/JavaScript*   SQL*   XML DTDs*   JSON Messaging*   Database Design*   HTTP Protocol*   Web Services (SOAP & REST)*   HTML/XHTML/DHTML*   CSS*   Ruby, Python, PHP, JSP, ASP or other scripting languages*   Flash and other interactive technologies*   Software Performance Optimization (memory, CPU, scaling, etc...)* *  Required Education*  Bachelor's degree in Computer Science or similar field or related work experience.* *  Flex Type Hybrid* *  #DISNEYTECH*  #DPEPFLA*",https://www.indeed.com/pagead/clk?mo=r&ad=-6NYlbfkN0DAFTyt7pbDCC2JPO79CSdi1dIb81yjczP5qsKcZIxgiRd1qisRd4re16D_VG3-wzUWs9OwoP3tNBPYej88G9c4ONPL59LrLus66DOFSd3JBnmt05R0tLo3MRKq7rkQrHerWWTvVMC5ZzCQzeyN318_cnTQeVerEyB_EFxhSrxQ6pthvgjUdCjKIdlcGGz0JkiVPjm-dzfCiPVMJnVwx5V_ipZkYgWeTGiCO_XJO5SAiiywKbFKGu0rxdbMVaxfMD5OvoLsz-itaqskrQtCIk1djpTPWWA2A509MaLcv8KhMfzvUP0vNE-EJ5gfMoUiD9TF9HnbmX31uUXZYXrWikAY8PoLYIP7Vix6d-JBKH91EPYPByfZlh978lHVNeAeZsEr9qyxUTQmCga0J6Gm0v6wS-WLKnPoZDNkjTtoYaT5OyFoXJrR3HHerGn0E1m8PuM=&xkcb=SoDQ-_M3c4BoXoUy0R0IbzkdCdPP&p=4&fvj=0&vjs=3,02667522762a8f2a1be0c5a6383d9373
security manager,2022-07-11,"Asset Protection Manager, Safety","Disney Parks,Parks, Experiences and Products","Salt Lake City, UT 84111 (Central City area)+1 location","* As a member of the Global Asset Protection & Risk Team, the Manager, Safety is responsible for programs that safeguard the organizations Cast Members, Guests, assets and brand from risk related impacts. Develops and implements safety plans and practices to achieve efficient and effective daily operational controls as well as business interruption restoration to help maintain a safe environment as well as continuity of the revenue stream. Conducts assessments to identify gaps in occupational safety and emergency preparedness plans ensuring adherence to TWDC as well as Federal, State, County guidelines and needs. Develops and tests protection strategies and incident response exercises. Coordinates disaster recovery initiatives and plans with staff and line functions. *  The Manager, Safety should have the ability to combine key technical skills with a firm understanding of how the business works. Demonstrates significant return on investment regarding Health, Safety and general risk mitigation programs. Ability to continuously assess, review and report critical information and key performance indicators with leadership and influence decision makers at the highest level.* Responsibilities : * Responsible for developing and managing safety programs (business continuity, worker’s compensation, general liability, Occupational Safety, etc.) *  Responsible for creating compliance tools to ensure Safety programs are adhered to and maintained in accordance with Corporate Risk Management & Safety compliance requirements.*   Serves as the safety subject matter expert for the business and acts as a liaison between the Global AP/Risk team and Corporate Risk Management and Safety*   Consults on expense and capital projects that require operational safety oversight*   Support Operations and Legal in regulatory requirements and incident management*  Basic Qualifications : * 7+ years of senior safety program leadership or related retail risk management experience*   Proven to be a subject matter expert in risk mitigation contributing to the development of functional strategy*   Business Continuity/DR, CSP or ASP certifications are a plus*   Demonstrated attention to detail with a high degree of accuracy*   Strong people and multi-project management skill set *  Flexibility to adapt to a fast paced and ever-changing environment*   Demonstrate cross-functional collaboration leadership skills*   Ability to support complex problems of strategic importance for the organization.*   Proficient in MS Office Suite*  Additional Information : *  Position is located in Orlando, FL. *  Benefits and Perks: Disney offers a rewards package to help you live your best life. This includes health and savings benefits, educational opportunities and special extras that only Disney can provide. Learn more about our benefits and perks at https://jobs.disneycareers.com/benefits.*  #CPGPJOBS #DPEPFLA*",https://www.indeed.com/pagead/clk?mo=r&ad=-6NYlbfkN0DAFTyt7pbDCC2JPO79CSdi1dIb81yjczP5qsKcZIxgiRd1qisRd4re16D_VG3-wzUWs9OwoP3tNEq0ZYgWR4E6wehrC_ITSv9X9inDwFCp2-W7_Q4IuWb4QE0SyZ8h0aaVo3A6GnxdFSWxStqnY38iRrdBX6FcZJBnZPs6WK_kjBWrtc_OT-EVrJMskQj41VS1tvpyM53a7F0peiYfeIueg68r_EaakU0dmvxtLa2TGrWfMd5aCHPeJ9QvAJ1BUGxPdWcE9r8iOoB48CEVKCaZQMXKF8Df80O7BT_zwnrDWJMuWp5tCMiw03qMOTm7RUXyW-uzYC_62IHq0KJP0ThX74zr-1EQ83a3wktK-_AgaCBwMVe7oCShgG9J3kmJdCi4in67boHztPhajXgke2VnN0sLg9FUaH95no1ZwSsb-RCDG8wArepPNdVVVyu_ACaFgoLRMwe8EA==&xkcb=SoA2-_M3c4BTDEUy3R0LbzkdCdPP&p=0&fvj=0&vjs=3,a157665052ab4a712672dce19af2bc14
business intelligence analyst,2022-07-11,Data Analyst,"Disney Parks,Parks, Experiences and Products","Salt Lake City, UT 84111 (Central City area)","* From toys to apparel, books to games, and much more, Disney Consumer Products, Games and Publishing (CPGP) brings our company's products, through stories and characters, to markets worldwide. With a portfolio of renowned franchises including Disney, Pixar, Marvel, Star Wars, 20CS and National Geographic, our efforts to bring innovative and experiential products, designed to entertain and inspire, is industry-leading and category shaping.*  The Data Analyst role manages data related process management and coordination across Consumer Products line of business. The Data Analyst is trained for using the data, helping ensure that the data is defined and used throughout the system(s). The Data Analyst will be the primary contact for PLM users working in the lines of business, and has an understanding of Data Governance principles and processes. The Data Analyst is charged with stewardship at an enterprise level.* Responsibilities : *  Design*  Participate in identifying and proposing solutions to data quality issues*   Participate in identifying and proposing Data Governance solutions*  Tools*  Use implementation of workflow and other Data Governance tools*   Use quality and performance metric tracking tools*   Use data querying and analysis tools*   Support execution of Data Governance standards through technology*   Conduct the update of data dictionary and maintain metadata*  Data Quality Assessment*  Enforce technical data standards and monitor compliance at the enterprise level*   Ensure that data decisions are communicated and business & technology groups understand impacts of the decisions*   Report data quality metrics*   Complete audits and assess results using the IT Data Steward in the domains*   Support all audit functions (e.g. SOX, sustainability, and traceability*   Consolidate LOB level data quality metrics for use at the Data Governance Organization (DGO)*  Data Quality Continuous Improvement*  Identify process improvement opportunities*   Help implement corrective actions to resolve data quality problems*   Track data quality goals and plans at the enterprise level*   Coordinate the tracking and documentation of all technical documents*  Guidance*  Bring compliance to established standards and metrics*   Communicate and enforce data policies, rules, and standards*   Maintain the processes for Data Governance for the enterprise*   Help create and guide implementation plans for the data policies, rules, and standards*   Help ensure agreement of data quality activities to business and Data Governance strategies*   Provide guidance to project teams around metrics requirements and tracking to monitor data quality efforts*   Able to story-tell and gain support with data.*  Basic Qualifications : * *  BA/BS college degree or its equivalent in relevant area*    5years of experience in data analytics and planning.*    Strong knowledge of Microsoft Excel including pivot tables and formulas.*    Understanding of existing technology architecture*    Understand requirements and impacts on other departments, regions, and downstream systems*  *  Preferred Qualifications: * * *  Experience in a consumer products company or retailer a plus.*    Self-starter with ability to multi-task, adapt quickly, problem solve, learn independently, and complete projects with short timelines*    Experience in a consumer products company or retailer a plus.*    Strong organizational skills and sharp attention to detail.*    Excellent root cause analysis skills*  *  Additional Information : *  Benefits and Perks: Disney offers a rewards package to help you live your best life. This includes health and savings benefits, educational opportunities and special extras that only Disney can provide. Learn more about our benefits and perks at https://jobs.disneycareers.com/benefits.*  This role is located in Orlando, FL*  #CPGPJOBS #DPEPFLA*",https://www.indeed.com/pagead/clk?mo=r&ad=-6NYlbfkN0DAFTyt7pbDCC2JPO79CSdi1dIb81yjczP5qsKcZIxgiRd1qisRd4re16D_VG3-wzUWs9OwoP3tNGBoTH1AhMMZr1yTr5QDZeb9UqjEvcs3sIYm53cFi5ACDDbmMLMRTVQN4szTwkyGWFaZPM47l6fZJeNSU5UgvVSXyjAR0y89div47jZAIzbibX2JyJYwYrSflTn5rn9vnzT5AiR53dM6R2J44L_X7CV5RgbsA6_hczKvnNotySf51d0L4Lo38UIVs1g942QuE2TCkuEtRINgtPoCw9v2PbiqY1zkyDnFlY2THdYBqpHPnEh1I1G8uX0GOJZw40r7qfZQzTM5f3di_7PIA-Vo-VqGfK7-POchEcpzOnu6Ih8GJPlPova4DZIVzvW_-E8SEf_t5giih5AcVmO9ZSlznT_uPq4oFSo51VH9wL3qZzGLxcg7SkATcCFW2XR5Nj9ZeSSH9tCkPcU4BMXv92wbqOs=&xkcb=SoCT-_M3c4BkSW0y0R0KbzkdCdPP&p=0&fvj=0&vjs=3,2ad309c14a95d77f39bc183003a12e49
data analyst,2022-07-11,Data Analyst,"Disney Parks,Parks, Experiences and Products","Salt Lake City, UT 84111 (Central City area)","* From toys to apparel, books to games, and much more, Disney Consumer Products, Games and Publishing (CPGP) brings our company's products, through stories and characters, to markets worldwide. With a portfolio of renowned franchises including Disney, Pixar, Marvel, Star Wars, 20CS and National Geographic, our efforts to bring innovative and experiential products, designed to entertain and inspire, is industry-leading and category shaping.*  The Data Analyst role manages data related process management and coordination across Consumer Products line of business. The Data Analyst is trained for using the data, helping ensure that the data is defined and used throughout the system(s). The Data Analyst will be the primary contact for PLM users working in the lines of business, and has an understanding of Data Governance principles and processes. The Data Analyst is charged with stewardship at an enterprise level.* Responsibilities : *  Design*  Participate in identifying and proposing solutions to data quality issues*   Participate in identifying and proposing Data Governance solutions*  Tools*  Use implementation of workflow and other Data Governance tools*   Use quality and performance metric tracking tools*   Use data querying and analysis tools*   Support execution of Data Governance standards through technology*   Conduct the update of data dictionary and maintain metadata*  Data Quality Assessment*  Enforce technical data standards and monitor compliance at the enterprise level*   Ensure that data decisions are communicated and business & technology groups understand impacts of the decisions*   Report data quality metrics*   Complete audits and assess results using the IT Data Steward in the domains*   Support all audit functions (e.g. SOX, sustainability, and traceability*   Consolidate LOB level data quality metrics for use at the Data Governance Organization (DGO)*  Data Quality Continuous Improvement*  Identify process improvement opportunities*   Help implement corrective actions to resolve data quality problems*   Track data quality goals and plans at the enterprise level*   Coordinate the tracking and documentation of all technical documents*  Guidance*  Bring compliance to established standards and metrics*   Communicate and enforce data policies, rules, and standards*   Maintain the processes for Data Governance for the enterprise*   Help create and guide implementation plans for the data policies, rules, and standards*   Help ensure agreement of data quality activities to business and Data Governance strategies*   Provide guidance to project teams around metrics requirements and tracking to monitor data quality efforts*   Able to story-tell and gain support with data.*  Basic Qualifications : * *  BA/BS college degree or its equivalent in relevant area*    5years of experience in data analytics and planning.*    Strong knowledge of Microsoft Excel including pivot tables and formulas.*    Understanding of existing technology architecture*    Understand requirements and impacts on other departments, regions, and downstream systems*  *  Preferred Qualifications: * * *  Experience in a consumer products company or retailer a plus.*    Self-starter with ability to multi-task, adapt quickly, problem solve, learn independently, and complete projects with short timelines*    Experience in a consumer products company or retailer a plus.*    Strong organizational skills and sharp attention to detail.*    Excellent root cause analysis skills*  *  Additional Information : *  Benefits and Perks: Disney offers a rewards package to help you live your best life. This includes health and savings benefits, educational opportunities and special extras that only Disney can provide. Learn more about our benefits and perks at https://jobs.disneycareers.com/benefits.*  This role is located in Orlando, FL*  #CPGPJOBS #DPEPFLA*",https://www.indeed.com/pagead/clk?mo=r&ad=-6NYlbfkN0DAFTyt7pbDCC2JPO79CSdi1dIb81yjczP5qsKcZIxgiRd1qisRd4re16D_VG3-wzUWs9OwoP3tNGBoTH1AhMMZr1yTr5QDZeb9UqjEvcs3sIYm53cFi5ACDDbmMLMRTVQN4szTwkyGWFaZPM47l6fZJeNSU5UgvVR-hDrjBxUYfjox3ndOkOVotaf3wFH-uJIq40oo3-e2uGe4tJ1FDWPtBUzysAhpPDLqi3dgSk3AVwEuKd70xTAb7iL5c4kOLJW2uo3He2V9YR2G8D7Bo8v0v5lDYHGUm7m07QVuUNt5ZNpGN22I9zkRnIE9GUwomY2SHQnNLLmmnEHSfjorKq2ZZr627yDjNbYMcFZ-XwPNpBl58IrtwxYJd1iM04KDvlGYhCVTuACoy9zC3CHERDKvfEfXpKR-XMbR0VlsoEShrIoedpsaACorJ-qzesVxDQgpj19RtVKpXg==&xkcb=SoAE-_M3c4B-DTQa6p0LbzkdCdPP&p=0&fvj=0&vjs=3,384158716310fc410e78c91d4fb33a19
data analyst,2022-07-11,Digital Marketing Data Analyst,"Disney Parks,Parks, Experiences and Products","Salt Lake City, UT 84111 (Central City area)","* The Customer Engagement Platform (CEP) team is focused on delivering powerful customer experiences across engagement touch points, by applying data and tools to bring marketing to life. The Campaign Delivery team leads consumer data selection for 1:1 marketing campaigns and manages deployment of direct channel tactics. We accomplish these capabilities with partnerships internally within Disney as well with vendors and software/data suppliers. You will report to the CEP Campaign Delivery Manager III. You will work remotely until in person work resumes.* Responsibilities : * Work with Customer Engagement Partners to determine scope, and priority for messaging efforts*   Build and sustain marketing campaigns end-to-end from data selection, to HTML development, data validation, proofing and campaign deployment using Agile methodology*   Communicate technical options/limitations to partners in an understandable way*   Perform technical analysis, level-of-effort estimation, and development of direct channel communications*   Focus on user efficiencies, solving business/customer issues, invent creative solutions, and ensure data accuracy*   Participate in change management process. Improve communication efforts across relevant partners*   Understand customer and internal partner team needs and translate the requirements into user stories and technical requirements for configuration and development in Adobe Campaign*  Basic Qualifications : * 2+ years of direct experience with marketing campaign list selection processes and direct channel campaign deployment*   2+ years of direct experience with multiple programming languages (Snowflake SQL, Java, JavaScript, HTML, CSS, XML)*   Business and data analysis experience, including requirements gathering and data exploration/troubleshooting experience*   Experience with email delivery platforms such as Adobe Campaign Manager or other equivalent campaign management platforms*   Experience applying agile marketing methodologies and processes to break long-term goals into short-term wins which encourage learning and shorten time to market*   An understanding of relational database methodology, structures and querying*   Experience with HTML for email and ability to code templates, revise modular layouts and provide both strategic and technical direction to web developers*  Required Education : * Bachelor's degree or equivalent*  Additional Information : *  Our Benefits: Disney offers a rewards package to help you live your best life. This includes health and savings benefits, educational opportunities and special extras that only Disney can provide. Learn more about our benefits and perks at https://jobs.disneycareers.com/benefits*  #DPEPFLA *  DPEPMarketing*  #LI-MR5*",https://www.indeed.com/pagead/clk?mo=r&ad=-6NYlbfkN0DAFTyt7pbDCC2JPO79CSdi1dIb81yjczP5qsKcZIxgiRd1qisRd4re16D_VG3-wzUWs9OwoP3tNKlLGIn01NB_HeGT35_ECEunE-4Jr2JafNJrxPCZnQCk9cGUTvO_DBBYp-w5DWqhaZ_k9JlKqp42_10jpi6C1ANtQSOineqBca02qBpuOmVnCcGyLJUV7u9gQ1d865nXIWnGDLUMt-ADiOzvwqlc_OKxauISdCcGE18vZXRV6sbsLRQz_0pW9waDfjr3U_LPGYXFgLlH5YeFwOpHMf1vIQgDYVkqtXf9-ajZdzu0cugzdT1WcG1r2lrKa5my8Vc2VsLD7ygxZlrEZQywCUQclnY19AptmWve-JktV7UjFMAoyOSIZMQVKEwFGq8BIOlJLS8OzX4aEAy6SfGWDZPOJ4HZQMtcmo6jMz4uH-GsI-pD7YAULvVFCpi_ToVz_l_SEw==&xkcb=SoBB-_M3c4B-DTwa6p0LbzkdCdPP&p=2&fvj=0&vjs=3,384158716310fc410e78c91d4fb33a19
