Search,Date,Title,Company,Location,Description,Link,ID
cloud engineer,2022-07-11,Senior DevOps Engineer,NRG,"Bluffdale, UT 84065","* At Goal Zero, an NRG owned company; our mission is to empower people with a bright, safe, connected, and sustainable future by delivering smart, portable power solutions designed for everyone, everywhere. As the market leader in portable solar power, Goal Zero solar panels, power stations, and accessories give a new breed of consumers and outdoor enthusiasts the power to go farther, regardless of their gear’s battery life. We invite you to join our adventure.*  We are looking for a highly skilled Senior DevOps Engineer to join our product development team. This role will analyze, enhance, and automate existing software/firmware build systems to improve our developer experience and code quality. We seek individuals with a passion for technology, deep knowledge and demonstrated experience delivering multi-environment CI/CD solutions. The ideal candidate would have experience deploying and managing serverless architectures on AWS, supporting deployments for mobile applications built on React Native (iOS and Android) to TestFlight, Android Beta, App/Play Stores, and/or developing firmware build/deploy solutions using any variety of CI/CD toolsets including Docker, Jenkins, Github Actions, Kubernetes, or similar. We’re a growing team and we advocate creative thinking. You’ll be empowered to influence processes, solutions, and the technology we use. You’ll join the engineering team within our product development group to help us deliver innovative products by creating secure, reliable, and scalable DevOps solutions.* *  Essential Duties & Responsibilities: Core duties and responsibilities include the following. Other duties may be assigned.* *  Work with Software/Firmware Engineers to gather requirements to optimize development processes*   Develop flexible solutions and documentation to improve the programmer experience*   Integrate development processes that enable the development teams to deliver style-consistent, linted, formatted, analyzed, and peer reviewed code*   Create build-automation pipelines for multiple platforms, environments, and target types*   Implement secure and trusted automated code deployment solutions*   Deliver tools for reporting on and monitoring deployed systems & analyzing existing application data*   Take ownership of our software/firmware release catalog across all environments and targets* *  Required Knowledge, Skills, and Abilities:* *  2+ years proven experience delivering scalable multi-environment applications on AWS or similar*   Deep knowledge of existing CI/CD toolsets and methodologies (Docker, Jenkins, Kubernetes, etc.)*   Proven experience supporting complex production applications and infrastructures*   Have a service-oriented mindset to deliver a great developer experience*   Strong script development skills in any preferred common DevOps language (ruby, python, bash, javascript)*   Experience with CI/CD solutions for GNU make, C/C++, embedded environments a huge plus*   Demonstrated understanding of full stack software environments and how they’re deployed*   Bachelor’s degree in Computer Science/Information Technology or related technical field*   Contribute to our positive team culture of innovation and delivering premium products* *  Physical Requirements/Working Conditions:* *  Open office environment – Primary*   Evening and weekend work as job duties demand, especially in collaborating and syncing up with overseas partners*   Domestic and International Travel up to 10% may be required*   Occasionally requires lifting up to 50lbs as appropriate to perform duties and responsibilities* *  Additional Details and Benefits:* *  We aren’t just a company but a team of passionate people who live life to the fullest, with a shared desire to help others do the same. We’re mountain bikers, skiers, and climbers, world travelers and weekend warriors, technology mavens and creatives, moms, dads, soccer coaches, volunteers, and everything in between. We rely on our products to power the things that matter most in our own lives and are proud to stand behind them.* *  Benefits include: Medical, Dental, and Vision Insurance, 401K Plan, Employee Stock Purchase Plan, Parental Leave, Tuition Reimbursement, and more.* *  Goal Zero is committed to a drug and alcohol-free workplace. To the extent permitted by law and any applicable collective bargaining agreement, employees are subject to periodic random drug testing, and post-accident and reasonable suspicion drug and alcohol testing. EOE AA M/F/Protected Veteran Status/Disability EEO is the Law Poster (The poster can be found at http://www.eeoc.gov/employers/upload/poster_screen_reader_optimized.pdf)* *  Level, Title, and/or Salary may be adjusted based on the applicant's experience or skills. Official description on file with Human Resources.**",https://www.indeed.com/rc/clk?jk=5bb2ffc9dcf3a879&fccid=ba62ec521e3e5609&vjs=3,02667522762a8f2a1be0c5a6383d9373
cybersecurity manager,2022-07-11,Cybersecurity Project Manager – Secret Clearance,OM Group Inc.,"Remote in Ogden, UT","** *  Cybersecurity Project Manager – Secret Clearance*   OM Group is a fast-growing Microsoft Azure and AWS Partner delivering full-stack cloud services for Federal & DoD clients. We are building a Data Center Sustainment and Modernization Center of Excellence (DCM-CoE) to continue and evolve on-prem/cloud/hybrid application hosting platforms, automate application onboarding processes, modernize compute and storage architecture design, improve system and infrastructure cybersecurity posture, and implement strong quality and configuration management practices. We are looking for an experienced Cybersecurity Manager to coordinate support tasks for all related Cybersecurity efforts including, but not limited to, RMF, Cyber Security Readiness, software testing, and vulnerability management. This position is based in Ogden, UT. This position can be worked remotely.* *  * * *  Primary Responsibilities:*  * The CPM will be required to track and plan all Cyber Security Readiness Efforts, and develop and execute action plans for completing projects related to the enterprise’s cybersecurity priorities *  Responsible for setting direction, establishing plans, and managing the team’s cybersecurity resources and operations. *  Lead technical delivery of projects/programs and high-performance IT teams by establishing direction, aligning people, motivating, and inspiring team members to deliver end-to-end cybersecurity solutions. *  Responsible for the technical and operational planning, design maintenance, and improvement of the security posture for the enterprise, and program information systems. *  Responsible for maintaining up-to-date awareness of current and future trends, threats, and vulnerabilities to existing and new technologies. *  Coordinate RMF authorization to maintain eMASS artifacts according to the continuous monitoring strategy *  Coordinate software testing efforts as it relates to the data center’s software baseline requirements by RMF. *  Provide IAVM and STIG compliance reports to government assessing officials *  Coordinate and assign vulnerability and compliance scanning tickets with appropriate personnel and meet customer RMF artifact requirements and coordinate tickets related to cybersecurity from assignment to completion *  Ensures decisions and milestones align with master plans, schedules, and cybersecurity requirements. * Collaborates with Project/Program Managers and maintains a continual focus on improving the end-user experience and customer satisfaction. * * *  Requirements:*  * Active DoD Secret Clearance *  Bachelor's degree in Cybersecurity or Computer Science or equivalent is required. *  10+ years of relevant IT experience. *  PMP Certification *  CISSP * Has solid knowledge of DoD IT security requirements, including layered security and defense in-depth strategies, cloud security and FedRAMP control mapping and compliance reviews, and vulnerability assessment (host-based and network-based) including RMF, STIG Management Experience, Information Assurance Vulnerability Management (IAVM), creating SSP/POA&Ms *  Bachelor's degree in Cybersecurity or Computer Science or equivalent is required. *  10+ years of relevant IT experience. *  PMP Certification * Ability to think strategically about business, product, and technical challenges. *  Excellent written and other communications skills *  Must be a U.S. Citizen *  Active DoD Clearance *  Experience in DevSecOps processes and tools – preferred * *  OM Group solves complex government IT mission challenges via digital transformation initiatives, including Cloud Migration, IT Modernization, Robotic Process Automation, Agile DevSecOps, and Enterprise Systems Integration. Our Research and Development Team thinks steps ahead for our clients by delivering practical innovations to solve pressing needs. We bring a deep understanding of DoD network and environments, anchored by modern, lean, commercial best practices rooted in CMMI DEV/SVC L3, ISO 9001, and ISO 27001 standards. 8a/WOSB. OM Group ranks #643 on the 2020 Inc 5000 Fastest-Growing Companies List and #3 on the 2020 Washington Technology Fast 50.* *",https://www.indeed.com/rc/clk?jk=43d61e5dfd77a9ba&fccid=b7dc0a32cb270ce7&vjs=3,3ad16127ae5609b18dd2053d680d3e1d
network security engineer,2022-07-11,Senior Network Engineer - Secret Clearance,OM Group Inc.,"Remote in Ogden, UT","* *  *   *    Senior Network Engineer - Secret Clearance*   *    *   *    OM Group, Inc. is a fast-growing Microsoft Azure and AWS Partner delivering full-stack cloud services for Federal & DoD clients. We are building a Data Center Sustainment and Modernization Center of Excellence (DCM-CoE) to continue and evolve on-prem/cloud/hybrid application hosting platforms, automate application onboarding processes, modernize compute and storage architecture design, improve system and infrastructure cybersecurity posture, and implement strong quality and configuration management practices. This position is in Ogden, UT. Remote work may be possible for this position*   *  *   *  *  *  *   *    Primary Responsibilities:*    *   *  *   *     Responsible for designing, installing, testing, implementing, and maintaining complex on-premise, hybrid, or commercial systems.*     *    *     Ability to translate requirements into end-to-end designs for systems that involve multiple interfaces and supporting data repositories leading the planning and designing of an organization's systems infrastructure. Ensure the accuracy and effectiveness of the system meet business/customers' requirements.*     *   * * *  *   *     Monitor the performance of systems and suggests improvements.*     *    *     Verify and review system related documents/reports including installation procedures.*     *   *  *  *   *    Requirements:*    *   *  *   *     Active DoD Secret Security clearance*     *   * * *  *   *     MA/MS*     *    *     10 Years of Experience*     *    *     Security + CE or other IAT Level 1 Certification*     *    *     CompTIA Network +*     *    *     Skill Level: Senior*     *   * * * *  *   OM Group solves complex government IT mission challenges via digital transformation initiatives, including Cloud Migration, IT Modernization, Robotic Process Automation, Agile DevSecOps, and Enterprise Systems Integration. Our Research and Development Team thinks steps ahead for our clients by delivering practical innovations to solve pressing needs. We bring a deep understanding of DoD network and environments, anchored by modern, lean, commercial best practices rooted in CMMI DEV/SVC L3, ISO 9001, and ISO 27001 standards. 8a/WOSB. OM Group ranks #643 on the 2020 Inc 5000 Fastest-Growing Companies List and #3 on the 2020 Washington Technology Fast 50.*  * **",https://www.indeed.com/rc/clk?jk=cc352e2cc6541e8d&fccid=b7dc0a32cb270ce7&vjs=3,77067711be7ebda01b02e603dec1e16a
network security engineer,2022-07-11,Infrastructure Engineer – Secret Clearance,OM Group Inc.,"Remote in Ogden, UT","* *  Infrastructure Engineer – Secret Clearance*  * * *  OM Group is a fast-growing Microsoft Azure and AWS Partner delivering full-stack cloud services for Federal & DoD clients. We are building a Data Center Sustainment and Modernization Center of Excellence (DCM-CoE) to continue and evolve on-prem/cloud/hybrid application hosting platforms, automate application onboarding processes, and modernize compute and storage architecture design, improve system and infrastructure cybersecurity posture and implement strong quality and configuration management practices. This position is in Ogden, UT. This position can be worked remotely.*  * * *  Responsibilities*  * Deploy and manage complex networks in various cloud platforms *  Spearhead automated and repeatable deployment processes *  Be ready for troubleshooting anywhere, whether it’s inside a client application or on one of 20 Docker containers running on a cloud instance *  Be committed to high-quality engineering principles while still meeting development milestones *  Work lockstep with the development team to meet engineering milestones with your focus on deployment automation, stability, and fast troubleshooting *  Participate in the full Agile development process including brainstorming user stories and planning sprints * *  Position Requirements*  * Active DoD Secret Clearance *  Bachelor's degree in Computer Science or equivalent *  2 - 10+ years of relevant IT experience. *  Must be a U.S. Citizen to obtain and maintain DoD security clearance *  Excellent written and other communications skills *  Experience with deploying and scaling out SaaS/Cloud applications on cloud service providers (preferably Amazon Web Services or Google Cloud Platform) *  Experience with Docker and understanding of evolving container management platforms like Kubernetes*  * *  OM Group solves complex government IT mission challenges via digital transformation initiatives, including Cloud Migration, IT Modernization, Robotic Process Automation, Agile DevSecOps, and Enterprise Systems Integration. Our Research and Development Team thinks steps ahead for our clients by delivering practical innovations to solve pressing needs. We bring a deep understanding of DoD network and environments, anchored by modern, lean, commercial best practices rooted in CMMI DEV/SVC L3, ISO 9001, and ISO 27001 standards. 8a/WOSB. OM Group ranks #643 on the 2020 Inc 5000 Fastest-Growing Companies List and #3 on the 2020 Washington Technology Fast 50.* *",https://www.indeed.com/rc/clk?jk=2167f8ba1f05e4bd&fccid=b7dc0a32cb270ce7&vjs=3,77067711be7ebda01b02e603dec1e16a
network security engineer,2022-07-11,Storage Engineer – Secret Clearance,OM Group Inc.,"Ogden, UT","* *  *   *    Storage *    Engineer –*     Secret Clearance*     OM Group, Inc. is a fast-growing Microsoft Azure and AWS Partner delivering full-stack cloud services for Federal & DoD clients. We are building a Data Center Sustainment and Modernization Center of Excellence (DCM-CoE) to continue and evolve on-prem/cloud/hybrid application hosting platforms, automate application onboarding processes, modernize compute and storage architecture design, improve system and infrastructure cybersecurity posture, and implement strong quality and configuration management practices. We are looking for an experienced Storage Engineer to join our team. This position is in Ogden, UT.*   *  *   *  *  *  *   *    Primary Responsibilities:*    *   *  *   *     Design, develop, implement, deploy, and support the organization's storage system infrastructure, including enterprise storage related hardware, software, and networking.*     *    *     Perform installation, monitoring, testing, configuration, migration, maintenance and troubleshooting of Data Center storage technology.*     *   * * *  *   *     Participate in Disaster Recovery planning and exercises and perform backup, migration, and recovery of data.*     *    *     Manage storage related problems or escalated tickets and out of cycle requests from system owners.*     *    *     Determine best course of action for meeting business needs and provide expertise to stakeholders on how to best use systems/infrastructure capabilities.*     *    *     Participate in capacity planning, design and implementation of technical project management related to Data Center storage systems.*     *    *     Drive and implement process and automation improvements and make updates to storage system related documentation.*     *   * * *  *   *     Perform on-call activities as needed for the environment and technologies.*     *    *     Perform end-user support.*     *   *  *  *   *    Requirements:*    *   *  *   *     Active DoD Secret Security clearance*     *   * * *  *   *     BA/BS*     *    *     5+ Years of Experience*     *    *     Security + CE*     *    *     NetApp Certified Data Administrator or CCNP—Data Center or equivalent*     *    *     Skill Level: Intermediate*     *   * * * *  *   OM Group solves complex government IT mission challenges via digital transformation initiatives, including Cloud Migration, IT Modernization, Robotic Process Automation, Agile DevSecOps, and Enterprise Systems Integration. Our Research and Development Team thinks steps ahead for our clients by delivering practical innovations to solve pressing needs. We bring a deep understanding of DoD network and environments, anchored by modern, lean, commercial best practices rooted in CMMI DEV/SVC L3, ISO 9001, and ISO 27001 standards. 8a/WOSB. OM Group ranks #643 on the 2020 Inc 5000 Fastest-Growing Companies List and #3 on the 2020 Washington Technology Fast 50.*  * *",https://www.indeed.com/rc/clk?jk=03cabb4194cfe162&fccid=b7dc0a32cb270ce7&vjs=3,77067711be7ebda01b02e603dec1e16a
network security engineer,2022-07-11,ELK/SIEM Systems Engineer– Secret Clearance,OM Group Inc.,"Ogden, UT+1 location","* *  *   *    ELK/SIEM (Systems Engineer) – Secret Clearance*     OM Group, Inc. is a fast-growing Microsoft Azure and AWS Partner delivering full-stack cloud services for Federal & DoD clients. We are building a Data Center Sustainment and Modernization Center of Excellence (DCM-CoE) to continue and evolve on-prem/cloud/hybrid application hosting platforms, automate application onboarding processes, modernize compute and storage architecture design, improve system and infrastructure cybersecurity posture, and implement strong quality and configuration management practices. We are looking for an experienced ELK/SIEM engineer to join our team. This position is in Ogden, UT.*   *  *   *  *  *  *   *    Primary Responsibilities:*    *   *  *   *     Design, develop, configure, support, and maintain the organization's SIEM systems infrastructure, including the implementation and design of hardware and software.*     *    *     Make updates to system related installation documentation.*     *   * * *  *   *     Perform end-user support.*     *    *     Perform traditional requirements analysis and decomposition, assist with architecture refinement and work closely with the development and test teams in the creation of features, user stories, test plans, and procedures to ensure end-to-end traceability.*     *    *     Develop security-focused content for SIEM, including threat detection logic and operational dashboards.*     *    *     Analyze and identify potential threats as well as develop and document an action/mitigation plan.*     *   * * * *  *   *    Requirements:*    *   *  *   *     Active DoD Secret Security clearance*     *    *     BA/BS*     *    *     5+ Years of Experience*     *    *     Security + CE*     *   * * *  *   *     Elastic Certified Engineer*     *    *     Skill Level: Intermediate*     *   *  *  *   *    OM Group solves complex government IT mission challenges via digital transformation initiatives, including Cloud Migration, IT Modernization, Robotic Process Automation, Agile DevSecOps, and Enterprise Systems Integration. Our Research and Development Team thinks steps ahead for our clients by delivering practical innovations to solve pressing needs. We bring a deep understanding of DoD network and environments, anchored by modern, lean, commercial best practices rooted in CMMI DEV/SVC L3, ISO 9001, and ISO 27001 standards. 8a/WOSB. OM Group ranks #643 on the 2020 Inc 5000 Fastest-Growing Companies List and #3 on the 2020 Washington Technology Fast 50.*   *  * *",https://www.indeed.com/rc/clk?jk=b0245649bdb368f1&fccid=b7dc0a32cb270ce7&vjs=3,77067711be7ebda01b02e603dec1e16a
network security engineer,2022-07-11,Windows Systems Admin – Secret Clearance,OM Group Inc.,"Ogden, UT","* *  *   *    Windows Systems Admin (Systems Engineer) – Secret Clearance*     OM Group, Inc. is a fast-growing Microsoft Azure and AWS Partner delivering full-stack cloud services for Federal & DoD clients. We are building a Data Center Sustainment and Modernization Center of Excellence (DCM-CoE) to continue and evolve on-prem/cloud/hybrid application hosting platforms, automate application on-boarding processes, modernize compute and storage architecture design, improve system and infrastructure cybersecurity posture, and implement strong quality and configuration management practices. We are looking for an experienced Windows System Administrator to join our team. This position is in Ogden, UT.*   *  *   *  *  *  *   *    Primary Responsibilities will include:*    *   *  *   *     Provision, install, configure, patch, upgrade, and manage virtual and physical Microsoft Windows-based systems and servers*     *    *     Install and configure customer applications in the Microsoft Windows environment*     *   * * *  *   *     Install, configure, upgrade, and manage Windows based Hypervisors for virtualization*     *    *     Manage data security, configure user access, and maintain the stability of the system*     *    *     Perform security remediation, based on scans and logs, and conduct standard maintenance such as firewall configuration, and performance tuning*     *    *     Assess the stability, security, and scalability of installed Windows systems and discuss system and server upgrades with IT managers and customers*     *    *     Troubleshoot and provide technical support for staff and back-end system users*     *   * * *  *   *     Review system error logs and user-reported errors*     *    *     Make updates to system related installation documentation*     *    *     Perform end-user support*     *   *  *  *   *    Requirements:*    *   * * *  *   *     Active DoD Secret Security clearance*     *    *     BA/BS*     *    *     5+ Years of Experience*     *    *     Security + CE*     *    *     Microsoft Certified Windows Server Administrator*     *   * * *  *   *     Skill Level: Intermediate*     *   *  *  *   *    OM Group solves complex government IT mission challenges via digital transformation initiatives, including Cloud Migration, IT Modernization, Robotic Process Automation, Agile DevSecOps, and Enterprise Systems Integration. Our Research and Development Team thinks steps ahead for our clients by delivering practical innovations to solve pressing needs. We bring a deep understanding of DoD network and environments, anchored by modern, lean, commercial best practices rooted in CMMI DEV/SVC L3, ISO 9001, and ISO 27001 standards. 8a/WOSB. OM Group ranks #643 on the 2020 Inc 5000 Fastest-Growing Companies List and #3 on the 2020 Washington Technology Fast 50.*   *  * **",https://www.indeed.com/rc/clk?jk=7e75a1122f10f726&fccid=b7dc0a32cb270ce7&vjs=3,77067711be7ebda01b02e603dec1e16a
